Número de concesión|Tipo de documento|Número de solicitud|Fecha de presentación|Fecha de concesión|Clasificación CIP|Título|Resumen|Inventor(es)|Titular
283921|Patente|PA/a/2006/006414|05/06/2006|11/02/2011|<i>C10G11/00</i> <b>(2006-01)</b>; <i>C10G11/02</i> <b>(2006-01)</b>|REDUCCION DE AZUFRE EN GASOLINA USANDO COMPUESTOS TIPO HIDROTALCITA.|La presente invención describe nuevos métodos para reducir el sulfuro en gasolina con aditivos compuestos tipo hidrocalcita, compuestos tipo hidrocalcita calcinada, y/o soluciones de solución de óxido de metal mezclado. De manera opcional, los aditivos también pueden contener uno o más oxidantes metálicos y/o soportes. La invención también se dirige hacia métodos para reducir el sulfuro en gasolina que incluye el contacto con un desintegrador catalítico de materias primas con un compuesto de óxido de metal mezclado que contiene magnesio y aluminio y que tiene un patrón de difracción de rayos X mostrando una reflexión al menos en dos posiciones de pico teta en aproximadamente 43 grados y aproximadamente 62 grados, en donde la proporc8ión de magnesio y aluminio en el compuesto es de 1:1 a cerca de 10:1.|ALBERT A. VIERHEILIG; BRUCE KEENER; 330 Washington Avenue, 31405, Savannah, Georgia, E.U.A.|INTERCAT, INC.; 104 Union Avenue, 08736., Manasquan, New Jersey, E.U.A.|
283922|Patente|MX/a/2007/013698|01/11/2007|11/02/2011|<i>C07C253/34</i> <b>(2006-01)</b>; <i>C07C255/24</i> <b>(2006-01)</b>; <i>C07C255/25</i> <b>(2006-01)</b>|METODO PARA AISLAR METILGLICINANITRILO-N, N-DIACETONITRILOS DE UNA MEZCLA CRUDA ACUOSA.|La invención se relaciona con un proceso para aislar metilglicinanitrilo-N,N-diacetonitrilo (MGDN) de una emulsión acuosa que comprende MGDN y tiene un contenido de MGDN de 3-50% en peso en un cristalizador, que comprende los pasos: (a) la emulsión acuosa, empezando de una temperatura superior al punto de solidificación, se enfría a una temperatura inferior al punto de solidificación, el régimen de enfriamiento promediado sobre el tiempo no excediendo 5 K/h, hasta que substancialmente la totalidad del MGDN emulsionado se ha solidificado, (b) la suspensión acuosa resultante se enfría adicionalmente y/o concentra, y el régimen de enfriamiento puede ser mayor que en el paso (a). (Figura 2).|ALFRED OFTRING; KATRIN FRIESE; MATTHIAS RAULS; BERND JUDAT; Im Röhrich 49, 67098, Bad Dürkheim, ALEMANIA|BASF AKTIENGESELLSCHAFT.*; Carl-Bosch-Strasse 38, 67056, Ludwigshafen, ALEMANIA|
283923|Patente|PA/a/2006/008711|02/08/2006|11/02/2011|<i>B60T7/12</i> <b>(2006-01)</b>; <i>G06F17/00</i> <b>(2006-01)</b>; <i>G05D1/00</i> <b>(2006-01)</b>|ESTABILIZACION DE VELOCIDAD DE MOTOR QUE USA CONTROL DE REGIMEN DE COMBUSTIBLE.|Se imparte estabilidad de velocidad en vacío a un motor de encendido por compresión procesando valores de dato para velocidad real de motor y la velocidad deseada de motor para proporcionar un verlo de dato para error de velocidad de motor; procesar (22) el valor de dato para error de velocidad de motor de conformidad con un algoritmo de regulador para proporcionar un valor de dato para un régimen de combustible en masa para aprovisionamiento de combustible en masa para aprovisionamiento de combustible regulado del motor; c) procesar (24) el valor de dato para régimen de combustible en masa para aprovisionamiento de combustible regulado del motor y el valor de dato para velocidad real de motor para proporcionar un valor de dato para una cantidad de combustible que se va a inyectar hacia un cilindro de motor durante una carrera subsecuente de un pistón dentro del cilindro; y d) inyectar (30) esa cantidad de combustible hacia el cilindro durante esa carrera.|KEVIN BISHOP; WALTER P. GORCZOWSKI; SURESH L. SATYAVOLU; 7 South 520 Donwood Trails Dr., 60540, Naperville, Illinois, E.U.A.|INTERNATIONAL ENGINE INTELLECTUAL PROPERTY COMPANY, LLC*; 4201 Winfield Road, 60555, Warrenville, Illinois, E.U.A.|
283924|Patente|MX/a/2009/001858|19/02/2009|11/02/2011|<i>H04N7/088</i> <b>(2006-01)</b>; <i>G11B20/12</i> <b>(2006-01)</b>|DISPOSITIVO DE MULTIPLEXION/SEPARACION DE DATOS.|Para generar un encabezado del sistema incluido en una corriente de programa extendida de MPEG-2 Systems, cuando la ID de corriente básica es una ID extendida y la información de tamaño de memoria interna básica indica cero bytes, se genera y registra la información de tamaño de memoria extendida. La información de tamaño de memoria interna extendida se requiere para reproducir corrientes elementales multiplexadas con el uso del par de la ID extendida y una ID de corriente extendida, y se expresa por 24 bits totales incluyendo la ID extendida, bit marcador y la ID de corriente extendida, y 24 bits totales incluyendo la ID extendida, el bit marcador, información a escala relacionadas con memoria interna extendida, e información relacionada con el tamaño de memoria interna extendida.|SHINICHIRO KOTO; TOMOO YAMAKAGE; c/o Intellectual Property Division, Toshiba Corporation, 1-1, Shibaura 1-chome, 105-8001, Minato-ku, Tokyo, JAPON|KABUSHIKI KAISHA TOSHIBA; 1-1, Shibaura 1-chome, 105-8001, Minato-ku, Tokyo, JAPON|
283925|Patente|MX/a/2008/009115|16/07/2008|11/02/2011|<i>C08K9/04</i> <b>(2006-01)</b>; <i>C08G77/04</i> <b>(2006-01)</b>; <i>C08K3/34</i> (2006-01); <i>C08L83/04</i> (2006-01)|NANOCOMPUESTO INORGANICO-ORGANICO.|La presente invención se refiere a las composiciones de nanocompuesto mejoradas y métodos para hacer y usar lo mismo. Esta invención también se refiere al uso de estos nanocompuestos inorgánicos-orgánicos en composiciones, por ejemplo, revestimientos, selladores, yeso, adhesivos y como aditivos para composiciones que contienen polímero sólido.|DAVID A. WILLIAMS; VIKRAM KUMAR; EDWARD J. NESAKUMAR; INDUMATHI RAMAKRISHNAN; 26 Castleberry Drive, 12831, Ganesvoort, NY, E.U.A.|MOMENTIVE PERFORMANCE MATERIALS INC.*; 187 Danbury Road, 06897, Wilton, Connecticut, E.U.A.|
283926|Patente|PA/a/2001/010392|15/10/2001|11/02/2011|<i>C07K14/115</i> <b>(2006-01)</b>; <i>C07K14/135</i> <b>(2006-01)</b>; <i>C12N15/00</i> <b>(2006-01)</b>; <i>C12N7/04</i> <b>(2006-01)</b>|PRODUCCION DE VACUNAS DE VIRUS CON ARN DE HEBRA NEGATIVA ATENUADOS A PARTIR DE SECUENCIAS DE NUCLEOTIDOS CLONADAS.|La presente invención se refiere a los virus con ARN de hebra negativa atenuados, recombinantes, para su uso como vacunas, se producen a partir de una o más moléculas de polinucleótido aislado codificadoras de los virus. Un genoma o antigenoma recombinante del virus sujeto es modificado para codificar una mutación dentro de una proteína recombinante del virus en una o más posiciones de aminoácidos correspondientes a un sitio de una mutación atenuadora en un virus heterólogo con ARN de hebra negativa mutante. Así, una mutación atenuadora similar, como se identifica en el virus heterólogo con ARN de hebra negativa, es incorporada en un sitio correspondiente dentro del virus recombinante para conferir un fenotipo atenuado en el virus recombinante. La mutación atenuadora incorporada en el virus recombinante puede ser idéntica o conservadora con relación a la mutación atenuadora identificada en el virus mutante heterólogo. Mediante la transferencia de mutaciones dentro de los virus con ARN de hebra negativa recombinantes, de esta manera, se producen virus para vacuna candidatos para obtener una respuesta inmune deseada contra un virus sujeto en un huésped susceptible de infección mediante el mismo.|COLLINS, PETER, L.; MURPHY, BRIAN, R.; DURBIN, ANNA, P.; SKIADOPOULOS, MARIO, H.; 12304 Village Square #401, 20852., Rockville, Maryland, E.U.A.|THE GOVERNMENT OF THE UNITED STATES OF AMERICA, REPRESENTADO POR THE DEPARTMENT OF HEALTH AND HUMAN SERVICES; 6011 Executive Boulevard, Suite 325, 20852-3804, Rockville, Maryland, E.U.A.|
283927|Patente|MX/a/2007/004469|13/04/2007|11/02/2011|<i>A23G9/32</i> <b>(2006-01)</b>; <i>A23G9/38</i> <b>(2006-01)</b>|PRODUCTO DE CONFITERIA CONGELADO, BAJO EN GRASA.|La presente invención se refiere a un producto de confitería congelado, con leche, con bajo contenido de grasa, que tiene 3 % o menos de grasa, tal producto comprende una proteína de estructuración del hielo (ISP).|NIGEL MALCOLM LINDNER; PATRICIA JILL QUAIL; ALLAN SIDNEY BRAMLEY; IAN LACY; Unilever R&D Colworth, Sharnbrook, MK44 1LQ, Bedford, Bedfordshire, REINO UNIDO|UNILEVER N.V.; Weena 455, NL-3013, AL Rotterdam, PAISES BAJOS|
283928|Patente|MX/a/2008/001484|30/01/2008|11/02/2011|<i>H04N5/45</i> <b>(2011-01)</b>|APARATO PARA PROPORCIONAR PANTALLAS MULTIPLES Y METODO PARA CONFIGURAR DINAMICAMENTE PANTALLAS MULTIPLES.|Se describe un aparato y método para proporcionar pantallas múltiples. El aparato incluye un módulo de interconexión usuario/aplicación que recibe un modo de provisión de servicio PiP, y un módulo de salida que muestra un componente de video de un servicio sobre una pantalla principal si el modo que proporciona el servicio PiP es un primer modo y mostrando un video de fondo o el componente de video del servicio sobre la pantalla PiP si el modo de provisión del servicio PiP está en un segundo modo.|KWANG-KEE LEE; GLENN A. ADAMS; JONG-HO LEE; UN-GYO JUNG; 201-1702 Ssangyong Apt., Garak 2-dong, 138-747, Songpa-gu, Seoul, REPUBLICA DE COREA|SAMSUNG ELECTRONICS CO., LTD.*; 416, Maetan-dong, Yeongtong-gu, 442-742, Suwon-si, Gyeonggi-do, REPUBLICA DE COREA|
283929|Patente|PA/a/2006/004149|12/04/2006|11/02/2011|<i>B23K26/08</i> <b>(2006-01)</b>; <i>F21V7/22</i> <b>(2006-01)</b>|APARATO PARA MORDENTAR MULTIPLES SUPERFICIES DE REFLECTOR DE LUMINARIA.|Se describe un aparato para mordentar múltiples superficies de un reflector de luminaria revestido con polvo hidroformado. El sistema incluye un láser, una o más cabezas de exploración de alta velocidad, una estación de marcado con láser y un dispositivo de transporte. El sistema coloca un reflector en alineamiento óptico con las cabezas de exploración para permitir mordentado permanente de su superficie.|THOMAS V. DAILY; 21 Rice Street, 02445, Brookline, Massachusetts, E.U.A.|GENLYTE THOMAS GROUP LLC; 10350 Ormsby Park Place, Suite 601, 40223, Louisville, Kentucky, E.U.A.|
283930|Patente|MX/a/2008/004386|02/04/2008|11/02/2011|<i>F21V29/02</i> <b>(2006-01)</b>|SISTEMA DE LUMINARIA CON EFECTO TERMICO DE CHIMENEA.|Un sistema de luminaria tiene un pasaje amplio alargado que utiliza un efecto térmico de chimenea. El efecto térmico de chimenea dentro del pasaje amplio hace circular aire para retirar calor generado de los componentes eléctricos del sistema. El disipar calor al pasaje amplio desde los componentes eléctricos puede aumentar la expectativa de vida útil de la lámpara y la salida de la misma. Los componentes eléctricos del sistema están totalmente sellados y aislados del pasaje amplio, resultan en un sello hermético permanente al aire, polvo y agua. El sello permanente puede reducir al mínimo el daño a los componentes eléctricos del sistema así como evita la acumulación de humedad y polvo dentro de estos componentes sellados.|CHRIS BOISSEVAIN; 230 Hillsedge Road, 78676, Wimberley, Texas, E.U.A.|GENLYTE THOMAS GROUP LLC; 10350 Ormsby Park Place, Suite 601, 40223, Louisville, Kentucky, E.U.A.|
283931|Patente|MX/a/2007/005676|13/01/1999|11/02/2011|<i>A61K39/295</i> <b>(2006-01)</b>; <i>C12N15/45</i> <b>(2006-01)</b>|FORMULA DE VACUNA POLINUCLEOTIDICA, PARICULARMENTE PARA EL TRATAMIENTO DE PATOLOGIA RESPIRATORIA DE BOVINOS.|La presente invención se refiere a la fórmula de la vacuna contra la patología o enfermedad respiratoria de los bovinos, que comprende al menos tres valencias de vacuna polinucleotídica, que comprende cada una un plásmido integrante, de manera para expresar in vivo en las células huésped, un gen de una valencia de patógeno respiratorio bovino, siendo elegidas estas valencias del grupo que consiste de virus del herpes bovino, virus respiratorio sincitial bovino, virus de la enfermedad de las mucosas y el virus de la parainfluenza del tipo 3, los plásmidos que comprende, para cada valencia, uno o varios de los genes elegidos del grupo que consiste de gB y gD para el virus del herpes bovino, F y G para el virus respiratorio sincitial bovino, E2, C + E1 + E2 y E1 + E2 para el virus de la enfermedad de las mucosas, HN y F para el virus de la parainfluenza del tipo 3.|JEAN-CHRISTOPHE AUDONNET; ANNABELLE BOUCHARDON; MICHEL RIVIERE; PHILIPPE BAUDU; 119 rue de Créqui, 69006, Lyon, FRANCIA|MERIAL.*; 17, rue Bourgelat, 69002, Lyon, , FRANCIA|
283932|Patente|MX/a/2007/015283|04/12/2007|11/02/2011|<i>C07D471/04</i> <b>(2006-01)</b>; <i>A61K31/435</i> <b>(2006-01)</b>; <i>A61P3/00</i> <b>(2006-01)</b>|IMIDIAZO Y TRIAZOLOPIRIDINAS COMO INHIBIDORES DE 11-BETA HIDROXIESTEROIDE DESHIDROGENASA TIPO I.|La presente invención se refiere a nuevos compuestos los cuales son inhibidores de 11-beta-hidroxiesteroide deshidrogenasa tipo I. Los inhibidores de 11-beta-hidroxiesteroide deshidrogenasa tipo I son útiles en el tratamiento, prevención, o retraso de la progresión de enfermedades que requieren terapia con inhibidor de 11-beta-hidroxiesteroide deshidrogenasa tipo I. Estos nuevos compuestos tienen la estructura: W-L-Z (I) o estereoisómeros o profármacos o sales farmacéuticamente aceptables de los mismos, en donde W, L y Z se definieron en la presente.|LAWRENCE G. HAMANN; JAMES J. LI; HAIXIA WANG; 7 Whitney Street, 01536, North Grafton, Massachusetts, E.U.A.|BRISTOL-MYERS SQUIBB COMPANY.*; Route 206 and Province Road, 08543-4000, Princeton, New Jersey, E.U.A.|
283933|Patente|MX/a/2007/002713|06/03/2007|11/02/2011|<i>A61K31/00</i> <b>(2006-01)</b>; <i>A61K31/65</i> <b>(2006-01)</b>; <i>A61K45/06</i> <b>(2006-01)</b>; <i>A61P1/00</i> <b>(2006-01)</b>; <i>A61P11/00</i> <b>(2006-01)</b>; <i>A61P13/00</i> <b>(2006-01)</b>; <i>A61P17/00</i> <b>(2006-01)</b>; <i>A61P25/06</i> <b>(2006-01)</b>; <i>A61P29/00</i> <b>(2006-01)</b>; <i>A61P3/00</i> <b>(2006-01)</b>; <i>A61P37/00</i> <b>(2006-01)</b>; <i>A61P5/00</i> <b>(2006-01)</b>; <i>A61P9/00</i> <b>(2006-01)</b>|USO DE LAS (HALOBENCILOXI) BENCILAMINO-PROPANAMIDAS PARA LA FABRICACIÓN DE MEDICAMENTOS ACTIVOS COMO MODULADORES SELECTIVOS DE LOS CANALES DE SODIO Y/O CALCIO.|La invención se refiere al uso de las (R ) - 2 - [(halobenciloxi) bencilamino]- propanamidas y las sales farmacéuticamente aceptables de las mismas, para la fabricación de medicamentos, que son selectivamente activos como modulares de los canales de sodio y/o calcio, y por lo tanto útiles en la prevención, alivio y curación de una amplia gama de patológicas, incluyendo, dolor, migraña, enfermedades periféricas, enfermedades cardiovasculares, procesos inflamatorios que afectan todos los sistemas corporales, trastornos que afectan la piel y tejidos relacionados, trastornos del sistema respiratorio, trastornos de los sistemas inmune y endocrino, trastornos gastrointestinales, urogenitales, metabólicos y apopléjicos, donde los mecanismos anteriores han sido descritos como poseedores de un papel patológico.|ELENA BARBANTI; PATRICIA SALVATI; RUGGERO FARIELLO; CARLA CACCIA; FLORIAN THALER; Via Dei Platani, 6, 20093, Cologno Monzese (MI), ITALIA|NEWRON PHARMACEUTICALS S.P.A.*; Via Ariosto 21, I-20091, Bresso, ITALIA|
283934|Patente|PA/a/2003/002719|28/03/2003|10/02/2011|<i>A61F2/06</i> <b>(2006-01)</b>; <i>A61F2/02</i> <b>(2006-01)</b>|METODO Y DISPOSITIVO DE CONTROL DE FLUJO DE FLUIDOS CORPORALES.|Un aparato que se puede implantar y un método para controlar el flujo de fluidos dentro un cuerpo hospedero; se provee un elemento constrictor (112) para reducir el flujo de fluidos dentro de un canal corporal (V) cuando está en una posición cerrada, y para permitir el flujo de fluidos cuando está en una posición abierta; además, existe un mecanismo de control para controlar el movimiento del elemento constrictor (112) entre las posiciones abierta y cerrada.|SAYET, PETER, H.; SUTHERLAND, LLOYD, A.; POLITANO, VICTOR;  4051 N. Ocean Boulevard, Col. Apt. 219, 33308., Fort Lauderdale, Florida, E.U.A.|PRECISION MEDICAL DEVICES, INC.; P.O. Box 480191, 33348., Fort Lauderdale, Florida, E.U.A.|
283935|Patente|MX/a/2010/006974|21/06/2010|10/02/2011|<i>B29B15/12</i> <b>(2006-01)</b>; <i>B29B9/14</i> <b>(2006-01)</b>; <i>C03C25/26</i> <b>(2006-01)</b>|PROCEDIMIENTO PARA PRODUCIR COMPOSICIONES TERMOPLASTICAS REFORZADAS CON FIBRA DE VIDRIO LARGA.|La invención se refiere a un procedimiento para producir una composición de polímero termoplástico reforzado con fibra de vidrio larga, que comprende los pasos subsiguientes de a) desenrollar de un paquete por lo menos una hebra de filamentos múltiples de vidrio continua que contiene cuando mucho 2% en masa de una composición encolante; b) aplicar de 0.5 a 20% en masa de un agente para impregnación a dicha por lo menos una hebra de filamentos múltiples de vidrio continua para formar una hebra de filamentos múltiples continua impregnada; y c) aplicar un forro de polímero termoplástico alrededor de la fibra de filamentos múltiples continua impregnada para formar una hebra de filamentos múltiples continua forrada, en el cual el agente para impregnación es no volátil, tiene un punto de fusión de por lo menos 20°C por debajo del punto de fusión de la matriz termoplástica, tiene una viscosidad de 2.5 a 100 cS a la temperatura de aplicación, y es compatible con el polímero termoplástico que se va a reforzar. Este procedimiento permite el manejo y desenrollado de paquetes sin que se presenten problemas, no se presenta atascamiento del equipo utilizado, permite producción estable y constante y buena reproducibilidad durante el paso de forrado, y da como resultado productos termoplásticos reforzados con fibra de vidrio larga que se pueden configurar como artículos que tienen buenas propiedades mecánicas y apariencia de superficie de alta calidad.|MARIA SOLIMAN; RAMON HUBERTUS ANNA MARIA MEIJERS; JOSEPH PAULUS HUBERTUS BOYENS; JOHANNES HENRICUS THEODORUS DAALMANS; C/o Sabic Corporate Patent Group, Urmonderbaan 22, 6167, RD Geleen, PAISES BAJOS|SAUDI BASIC INDUSTRIES CORPORATION.*; C/o Sabic Corporate Patent Group, Urmonderbaan 22, 6167, RD Geleen, PAISES BAJOS|
283936|Patente|MX/a/2007/004521|13/04/2007|10/02/2011|<i>D01D5/084</i> <b>(2006-01)</b>; <i>D01D5/12</i> <b>(2006-01)</b>; <i>D01F6/04</i> <b>(2006-01)</b>|PROCESO PARA ELABORAR UN PRODUCTO SIMILAR A UN MONOFILAMENTO.|La invención concierne a un proceso para elaborar un producto similar a monofilamento a partir de un precursor que contiene al menos una hebra de fibras elaboradas a partir de polietileno de masa molecular ultra-alta, que comprende: a) exponer al precursor a una temperatura en el intervalo del punto de fusión del polietileno por un tiempo suficiente para fundir al menos parcialmente las fibras adyacentes y b) estiramiento simultáneamente el precursor, en donde el precursor es mecánicamente comprimido durante la fusión. El producto similar a monofilamento elaborado así tiene una apariencia superficial superficie más lisa, y resistencia mejorada a la abrasión, por ejemplo una tendencia reducida al amontonamiento durante el uso como línea para pescar, que los productos similares conocidos, lo que lo hace más adecuado para uso como línea para pesca y los similares. La invención también concierne a un producto similar a monofilamento obtenible por medio de dicho proceso, y a productos de uso final y semi-terminados que comprendan dicho producto monofilamento.|CHRISTIAAN HENRI PETER DIRKS; JOSHEP ARNOLD PAUL MARIA SIMMELINK; Bautshoefstraat 13, B-3650, Dilsen, BELGICA|DSM IP ASSETS B.V.*; Het Overloon 1, NL-6411, TE Heerlen, PAISES BAJOS|
283937|Patente|MX/a/2007/000568|15/01/2007|10/02/2011|<i>A61K47/48</i> <b>(2006-01)</b>; <i>A61P35/00</i> <b>(2006-01)</b>|CONJUGADOS DE UNA FRACCION GM-CSF Y UN POLIMERO.|La presente invención se refiere a conjugados de una fracción de GC-CSF y uno o más polímeros solubles en agua. Generalmente, el polímero soluble en agua es poli(etileno glicol) o un derivativo suyo. También se proveen composiciones que comprenden conjugados, métodos para elaborar los conjugados, y métodos para administrar a un paciente las composiciones que contienen los conjugados.|MARY J. BOSSARD; PING ZHANG; 120 Kelvingrove Drive, 35758, Madison, Alabama, E.U.A.|NEKTAR THERAPEUTICS; 201 Industrial Road, 94070, San Carlos, California, E.U.A.|
283938|Patente|MX/a/2007/001637|09/02/2007|10/02/2011|<i>G07F9/02</i> <b>(2006-01)</b>; <i>G07F5/18</i> <b>(2006-01)</b>|APARATO Y METODO PARA CONTROL DE MAQUINA DE ABASTECIMIENTO.|Con el objeto de controlar el estado y la operación de un ensamble de máquina de abastecimiento que comprende uno o más módulos o sub-ensambles, al menos uno de los módulos o sub-ensambles se abastece con un rótulo electrónico y la máquina se abastece con un dispositivo controlador del rótulo para interactuar con el rótulo, leyendo, escribiendo, y transmitiendo datos de información en o a través del rótulo y operando la máquina de abastecimiento de acuerdo con la información reunida del rótulo o rótulos.|LUCA DOGLIONI MAJER; Via dei Cristoforis, 14/16, I-22010, Carate Urio, ITALIA|TUTTOESPRESSO S.P.A.; Via Trieste, 49, I-21042, Caronno Pertusella, Varese, ITALIA|
283939|Patente|MX/a/2009/007939|24/07/2009|10/02/2011|<i>G06F9/30</i> <b>(2006-01)</b>; <i>G06F7/57</i> <b>(2006-01)</b>; <i>G06F9/38</i> <b>(2006-01)</b>|USO DE SISTEMA DE RENOMBRAMIENTO DE REGISTROS PARA ENVIAR EN AVANCE LOS RESULTADOS INTERMEDIOS ENTRE LAS INSTRUCCIONES CONSTITUYENTES DE UNA INSTRUCCION EXPANDIDA.|Los resultados intermedios se pasan entre las instrucciones constituyentes de una instrucción expandida utilizando recursos de renombramiento de registros y lógica de control. Una primera instrucción constituyente genera resultados intermedios y se le asigna un PRN en una tabla de renombramiento de instrucciones constituyentes, y escribe los resultados intermedios en el registro físico identificado. Una segunda instrucción constituyente realiza una consulta en la tabla de renombramiento de instrucciones constituyentes y lee los resultados intermedios del registro físico. La lógica de renombramiento de instrucciones constituyentes rastrea las instrucciones constituyentes en todo el trayecto de datos, y elimina el registro de la tabla de renornbramiento de instrucciones constituyentes y regresa el PRN a una lista libre cuando la segunda instrucción constituyente ha leído los resultados intermedios.|JAMES NORRIS DIEFFENDERFER; THOMAS ANDREW SARTORIUS; RODNEY WAYNE SMITH; MICHAEL SCOTT MCILVAINE; NATHAN SAMUEL NUNAMAKER; 5775 Morehouse Drive, 92121, San Diego, California, E.U.A.|QUALCOMM INCORPORATED.*; 5775 Morehouse Drive, 92121-1714, San Diego, California, E.U.A.|
283940|Patente|MX/a/2009/002517|06/03/2009|10/02/2011|<i>H02J13/00</i> <b>(2006-01)</b>; <i>H05B37/02</i> <b>(2006-01)</b>|PROCEDIMIENTO PARA DIRECCIONAR COMPONENTES DE RADIOFRECUENCIA REMOTAMENTE UBICADOS DE UN SISTEMA DE CONTROL.|La presente invención proporciona un método para asignar una dirección de dispositivo única a un dispositivo de control remotamente ubicado en un sistema de control de iluminación inalámbrico que tiene una pluralidad de dispositivos de control; cada uno de los dispositivos de control opera para que se acople a una fuente de potencia y para que se le asigne una dirección de dispositivo única; el método primero comprende, ciclar potencia a los dispositivos de control remotamente ubicados, es decir, interrumpir y restaurar la potencia a los dispositivos de control; el dispositivo de control transmite inalárnbricamente una señal que de forma única identifica al dispositivo de control dentro de una cantidad de tiempo predeterminada después de ciclar la potencia; se genera una lista de dispositivos de control no direccionados que recientemente han sido ciclados en potencia; a cada uno de los dispositivos de control en la lista se le asigna y transmite entonces una dirección de dispositivo única.|JUSTIN MIERTA; LAWRENCE R. CARMEN; BRIAN MICHAEL COURTNEY; BENJAMIN A. JOHNSON; DANIEL CURTIS RANERI; 3129 Elm Drive, 18103, Allentown, Pennsylvania, E.U.A.|LUTRON ELECTRONICS CO., INC.*; 7200 Suter Road, 18036-1299, Coopersburg, Pennsylvania, E.U.A.|
283941|Patente|MX/a/2008/007806|16/06/2008|10/02/2011|<i>F21V9/04</i> <b>(2006-01)</b>; <i>G02B5/08</i> <b>(2006-01)</b>|ESPEJOS DE PLATA AVANZADOS RESISTENTES A LA LUZ ULTRAVIOLETA PARA SU UTILIZACIÒN EN REFLECTORES SOLARES.|Una construcción de espejo de plata que mantiene un alto porcentaje de reflexión hemisférica a través de UV y el espectro visible cuando se utiliza en reflectores solares, que comprende: a) una capa adhesiva sensible a la presión colocada bajo un recubrimiento de plata; b) una película polimérica dispuesta sobre el recubrimiento de plata; c) una capa de adhesivo colocada sobre la película polimérica; e d) una película de acrílico de filtración de UV dispuesta sobre la capa de adhesivo.|GARY J. JORGENSEN; RANDY GEE; 13662 Douglas Ranch Drive, 80470, Pine, Colorado, E.U.A.|ALLIANCE FOR SUSTAINABLE ENERGY, LLC; 1617 Cole Boulevard, Lakewood, 80401, Colorado, E.U.A.|
