Número de concesión|Tipo de documento|Número de solicitud|Fecha de presentación|Fecha de concesión|Clasificación CIP|Título|Resumen|Inventor(es)|Titular
283730|Patente|MX/a/2010/000070|07/01/2010|08/02/2011|<i>B03D1/01</i> <b>(2006-01)</b>; <i>B03D101/06</i> <b>(2006-01)</b>; <i>B03D103/06</i> <b>(2006-01)</b>; <i>B03D103/08</i> <b>(2006-01)</b>; <i>B03D103/10</i> <b>(2006-01)</b>; <i>C02F1/24</i> <b>(2006-01)</b>; <i>C08G12/06</i> <b>(2006-01)</b>; <i>C08G12/12</i> <b>(2006-01)</b>|RESINAS DE AMINA-ALDEHIDO MODIFICADAS Y USOS DE LAS MISMAS EN PROCESOS DE SEPARACION.|La presente invención se refiere a resinas modificadas para eliminar una amplia variedad de sólidos y/o especies iónicas de los líquidos en los que se encuentran suspendidos y/o disueltos. Estas resinas modificadas son especialmente útiles como depresores en la flotación por espuma para el beneficio de muchos tipos de materiales (por ejemplo, menas de minerales o metales), incluido el beneficio de carbón impuro que comprende impurezas de arcilla, así como en la separación alquitrán valioso de contaminantes sólidos tales como la arena. Las resinas modificadas son útiles también para tratar suspensiones líquidas acuosas para facilitar la eliminación de partículas sólidas, así como también la extracción de iones metálicos en la purificación del agua. Las resinas modificadas comprenden una resina base que se modifica con un agente de acoplamiento, que es altamente selectivo para unirse a contaminantes sólidos y especialmente a materiales silíceos tales como la arena o la arcilla.|KURT GABRIELSON; LISA M. ARTHUR; JOHN B. HINES; CARL R. WHITE; JAMES T. WRIGHT; MICHAEL COUSIN; 23 Howell Street, NE, 30312, Atlanta, Georgia, E.U.A.|GEORGIA-PACIFIC CHEMICALS LLC; 133 Peachtree Street, N.E., 30303, Atlanta, Georgia, E.U.A.|
283731|Patente|MX/a/2008/000431|09/01/2008|08/02/2011|<i>C07D401/12</i> <b>(2006-01)</b>; <i>A61P1/04</i> <b>(2006-01)</b>|METODO PARA PREPARAR ESOMEPRAZOL Y SALES DEL MISMO.|El esomeprazol óptimamente puro y su sal se pueden preparar simplemente disolviendo S-(-)-binol, una base débil y la forma racémica del omeprazol en una mezcla de un solvente orgánico compatible con agua y agua a una temperatura alta, enfriando la solución mezclada para cristalizar el complejo de inclusión de esomeprazol y S-(-)-binol y eliminado el radical S-(-)-binol a partir del complejo de inclusión cristalizado.|TAE HEE HA; KWEE-HYUN SUH; HAN KYONG KIM; JAE CHUL LEE; CHANG HEE PARK; WON JEONG KIM; HEE SOOK OH; Sinnamusil 512-1504, #964-5, Yeongtong-dong, Yeongtong-gu, 443-727, Suwon-si, Gyeonggi-do, REPUBLICA DE COREA|HANMI PHARM, CO., LTD.*; #893-5, Hajeo-ri, Paltan-myeon, 445-910, Hwaseong-gun, Kyungki-do, REPUBLICA DE COREA|
283732|Patente|PA/a/2004/006743|12/07/2004|08/02/2011|<i>A23G1/00</i> <b>(2006-01)</b>; <i>A23G1/56</i> <b>(2006-01)</b>; <i>A23G3/34</i> <b>(2006-01)</b>|MÉTODOS PARA REDUCIR LA AGLOMERACIÓN DE ALIMENTOS GRANULADOS.|La presente invención se refiere a la reducción de aglomeración entre partículas de alimento granulado combinando uno o más alimentos granulados (1) con uno o más agentes (2) de flujo novedosos que no impactan adversamente al alimento granulado o, alternativamente, un producto alimenticio producido del mismo. La invención facilita el transporte, almacenamiento, y procesamiento de alimentos granulados. (1): (f.i.Azúcar) (2): (polvo de cocoa, harina de maní o mezclas de los mismos).|DOUGLAS M. MANNING; JUSTIN E. COMES; 1804 Blacklatch Lane, 17057, Middletown, Pennsylvania, E.U.A.|MARS, INCORPORATED.; 6885 Elm Street, 22101-3883, Malean, Virginia, E.U.A.|
283733|Patente|PA/a/2002/012235|10/12/2002|04/02/2011|<i>C04B7/36</i> <b>(2006-01)</b>; <i>C04B7/00</i> <b>(2006-01)</b>; <i>C04B7/44</i> <b>(2006-01)</b>|CLINKER Y CEMENTO BLANCO CON ALTO CONTENIDO DE AZUFRE PROVENIENTE DEL COQUE DE PETROLEO CON ALTO CONTENIDO DE AZUFRE, USADO COMO COMBUSTIBLE.|La presente invención se relaciona con una familia de composiciones de clínker blanco con alto contenido de azufre proveniente del coque de petróleo con alto contenido de azufre usado como combustible, y que además presenta bajo consumo energético y rápido fraguado, que contiene las cantidades de las fases del clínker en por ciento peso siguientes: 3CaO.SiO2 (C3S): 40 a 75, 2CaO.SiO2 (C2S): 10 a 35, 3CaO.Al2O3 (C3A): 0 a 15, CaO.SO3 (CŠ): 0 a 10, 4CaO.3Al2O3. SO3 (C4A3Š): 2 a 15, 11CaO. 7Al2O3. CaF2 (C11A7. CaF2): 0 a 5, %CaF2Total: 0.3 a 1.5 medido como CaF2, %Fe2O3: 0 a 0.5, y un contenido de SO3 de entre 1.5 y 5% en peso obtenido por medio de la calcinación de una mezcla cruda que contiene CaO, SiO2, Al2O3 y CaF2, usando como combustible coque de petróleo con un contenido de azufre mayor al 5%, a temperaturas de entre 1200 a 1350°C, sin la adición de ningún aditivo que contenga SO3, en la mezcla cruda.|LOPEZ, GONZALEZ, WALTTER; CASTILLO, LINTON, CARLOS ENRIQUE; EGUIA, MARQUEZ, GRACIELA; Mision la Paz #6223, Col. Mision Cumbres, 64348, Monterrey, Nuevo León, MEXICO|CEMEX RESEARCH GROUP AG; Römerstrasse 13, 2555 Brügg bei Biel, Suiza, , SUIZA|
283734|Patente|MX/a/2007/015613|07/12/2007|08/02/2011|<i>C12N1/12</i> <b>(2006-01)</b>; <i>C12M1/00</i> <b>(2006-01)</b>; <i>C12M1/04</i> <b>(2006-01)</b>; <i>C12N1/20</i> <b>(2006-01)</b>; <i>C12P1/00</i> <b>(2006-01)</b>|PROCESO HIBRIDO CONTINUO-POR LOTES PARA LA PRODUCCION DE ACEITE Y OTROS PRODUCTOS UTILES DE MICROBIOS FOTOSINTETICOS.|La presente invención se refiere a un proceso para cultivar microbios fotosintéticos que comprende Sistemas Cerrados para cultivo continuo y Sistemas Abiertos para cultivo por lotes, en el cual (a) el Área de Sistema Cerrado ocupa no más del 20% del Área de Terreno Total de la instalación de cultivo; (b) cultivos por lotes en los Sistemas Abiertos se inician con un inoculo de los Sistemas Cerrados conteniendo una biomasa celular de no menos del 5% de la capacidad portadora de dicho Sistema Abierto; (c) la tasa de duplicado de dicho microbio fotosintético no es menor que una vez cada 16 horas; y (d) el tiempo de residencia del cultivo por lotes en dicho Sistema Abierto no es más de un periodo de 5 días.|MARK EDWARD HUNTLEY; DONALD G. REDALJE; 73-4617 Koloko Halia Place, 96740, Kailuakona, Hawaii, E.U.A.|HR BIOPETROLEUM, INC.*; 73-4617 Kaloko Halia Place, 96740, Kailua-Kona, Hawaii, E.U.A.|
283735|Patente|MX/a/2008/001612|01/02/2008|08/02/2011|<i>A61K31/69</i> <b>(2006-01)</b>; <i>C07F5/02</i> <b>(2006-01)</b>|METODOS PARA PREPARAR ACIDOS BORONICOS HETEROCICLICOS Y DERIVADOS DE LOS MISMOS.|En el contexto para sintetizar compuestos del ácido borónico heterocíclico, una metodología sintética convergente es particularmente eficiente para preparar boropirrolidinas y derivados de boropirrolidinas.|DAVID ALAN CAMPBELL; DAVID T. WINN; 13318 Seagrove Street, 92130, San Diego, California, E.U.A.|PHENOMIX CORPORATION.*; 5871 Oberlin Drive, Suite 200, 92121, San Diego, California, E.U.A.|
283736|Patente|MX/a/2009/003131|23/03/2009|08/02/2011|<i>B01D53/047</i> <b>(2006-01)</b>; <i>C01B3/56</i> <b>(2006-01)</b>|PROCESO Y APARATO PARA RECUPERACION DE DIOXIDO DE CARBONO.|La presente invención se refiere generalmente a procesos y aparatos de adsorción de oscilación de presión de vacío (VPSA) para recuperar el dióxido de carbono que tiene una pureza de aproximadamente >90% molar de las corrientes que contienen por lo menos dióxido de carbono e hidrógeno (por ejemplo, gas de síntesis). La alimentación a la unidad de VPSA de CO2 puede ser a presión por encima de ambiente. La unidad de VPSA de CO2 produce tres corrientes, una corriente enriquecida en H2, una corriente carente de H2, y una corriente de producto de CO2. Cuando la unidad de VPSA de CO2 está instalada entre un reactor de SMR/cambio y una unidad de PSA de H2, se espera que la recuperación de hidrógeno sea aumentada extrayendo el CO2, de tal modo aumenta la presión parcial del hidrógeno en la alimentación de PSA de H2. La corriente de la unidad de VPSA de CO2, usada normalmente como combustible, se recicla como alimentación para aumentar la recuperación de CO2. El CO2 recuperado se puede aumentar, secuestrar o utilizar adicionalmente en aplicaciones tales como recuperación mejorada de aceite.|RAVI KUMAR; 153 Wedgewood Drive, 14221, Williamsville, New York, E.U.A.|PRAXAIR TECHNOLOGY, INC.*; 39 Old Ridgebury Road, 06810-5113, Danbury, Connecticut, E.U.A.|
283737|Patente|MX/a/2008/005763|02/05/2008|08/02/2011|<i>A01N25/10</i> <b>(2006-01)</b>|COMPOSICIONES Y METODOS PARA EXTERMINAR CELULAS|La presente invención se refiere a un método de generación de un cambio en un proceso celular de una célula objetivo. El método comprende poner en contacto la célula objetivo con un tampón sólido, para alterar un valor de pH intracelular en al menos una porción de la célula, por lo cual se genera el cambio en un proceso celular de una célula objetivo de un organismo multicelular. El método puede ser utilizado para exterminar las células ya sea eucarióticas o procarióticas. También se describen composiciones farmacéuticas y dispositivos.|SHMUEL BUKSHPAN; GLEB ZILBERSTEIN; 2/1 Simtat Shimshon, 47340, Ramat Ha-Sharon, ISRAEL|OPLON B.V.*; 2 Martinus Nijhofflaan, 2624 Es Delft, Holanda, Holanda, , PAISES BAJOS|
283738|Patente|PA/a/2006/001355|02/02/2006|08/02/2011|<i>A61K39/145</i> <b>(2006-01)</b>; <i>C12N15/09</i> <b>(2006-01)</b>; <i>C12N15/63</i> <b>(2006-01)</b>; <i>C12N7/00</i> <b>(2006-01)</b>|VIRUS H3 DE LA INFLUENZA A EQUINA.|La presente invención se refiere a un virus de influenza H3 aislado caracterizado porque comprende un segmento de gen con las secuencias para una HA que tiene la SEC ID NO: 1 o una HA que tiene por lo menos 98% de identidad de secuencia de aminoácidos con la SEC ID NO: 1, HA la cual no tiene una valina en la posición 78 o una asparagina en la posición 159.|CHRISTOPHER W. OLSEN; GABRIELE A. LANDOLT; ALEXANDER I. KARASIN; 7422 Sawmill Road, 53717, Madison, Wisconsin, E.U.A.|WISCONSIN ALUMNI RESEARCH FOUNDATION.*; 614 North Walnut Street, 53707, Madison, Wisconsin, E.U.A.|
283739|Patente|MX/a/2008/007150|04/06/2008|08/02/2011|<i>C07C209/28</i> <b>(2006-01)</b>; <i>A01N45/02</i> <b>(2006-01)</b>; <i>C07C211/31</i> <b>(2006-01)</b>|PROCESO PARA LA PREPARACION DE AMINAS.|La presente invención se refiere a un nuevo proceso para preparación del compuesto de la fórmula general (I), en donde R1 y R2 son independientemente H o alquilo de C1-6, el cual comprende tratar con un agente reductor ya sea un compuesto de la fórmula general (II), en donde R1 R2 tienen los significados dados para el compuesto de la fórmula (I), R3 es H o alquilo de C1-4 y Ph es fenilo, o un compuesto de la fórmula general (III), en donde R1, R2, R3 y Ph tienen los significados dados para el compuesto de la fórmula (II), el agente reductor es efectivo para escindir la porción bencilo Ph-CH(R3)- de la porción bencilamino PhCH(R3)NH- en el compuesto de la fórmula (II) o en el compuesto de la fórmula (III) para dejar un grupo amino y, además en el caso del compuesto de la fórmula (III), para reducir tanto el enlace doble 2,3 como el enlace doble que une la porción R1R2C a la posición 9 del anillo de benzonorborneno a enlaces sencillos. También se refiere a procesos para la preparación de los compuestos (II) y (III) y sus precursores y a los compuestos (II) y (III) por si mismos y algunos de sus precursores, los cuales son nuevos compuestos. Los compuestos (I) son útiles para la preparación de varias benzonorbornen-5-il-amidas de ácido heterociclil-carboxílico fungicidas.|HANS TOBLER; HARALD WALTER; MARTIN ZELLER; FANNY GIORDANO; CAMILLA CORSI; JOSEF EHRENFREUND; Syngenta Crop Protection AG, CH-4058, Schwarzwaldallee 215, Basel, SUIZA|SYNGENTA PARTICIPATIONS AG; Schwarzwaldallee 215, CH-4058, Basel, SUIZA|
283740|Patente|PA/a/2005/005177|13/05/2005|08/02/2011|<i>C05B7/00</i> <b>(2006-01)</b>; <i>C05G3/00</i> <b>(2006-01)</b>|PROCESO PARA LA MANUFACTURA DE FERTILIZANTES DE FOSFATO DE AMONIO QUE CONTIENEN AZUFRE.|La invención se relaciona con un proceso para la manufactura de fertilizantes que contienen azufre, que comprende las etapas de: (a) mezclar amoniaco, ácido fosfórico y agua en una unidad de reactor para obtener una mezcla de fosfato de amonio; (b) introducir la mezcla obtenida en la etapa (a) en una unidad granuladora para obtener gránulos, en donde una fase líquida que comprende azufre elemental se pone en contacto con amoniaco, ácido fosfórico y agua en la unidad de reactor en la etapa (a) o se introduce en la unidad granuladora en la etapa (b). La invención se relaciona adicionalmente con fertilizantes de fosfato de amonio que contienen azufre, con el uso de estos fertilizantes que contienen azufre para promover el crecimiento de productos agrícolas y con los productos agrícolas obtenidos en esta forma.|KENNETH WILLIAM KEENAN; WILLIAM PATRICK KENNEDY; 400-4th Avenue S.W., T2P 2H5, Calgary, Alberta, CANADA|SHELL INTERNATIONALE RESEARCH MAATSCHAPPIJ B.V.; Carel van Bylandtlaan 30, NL-2596, HR The Hague., , PAISES BAJOS|
283741|Patente|MX/a/2008/009504|24/07/2008|08/02/2011|<i>A23G9/48</i> <b>(2006-01)</b>; <i>A23G3/00</i> <b>(2006-01)</b>; <i>A23G9/04</i> <b>(2006-01)</b>; <i>A23G9/32</i> <b>(2006-01)</b>; <i>A23L1/00</i> <b>(2006-01)</b>|COMPOSICION PARA RECUBRIMIENTO, PROCESO DE RECUBRIMIENTO Y PRODUCTO DE CONFITERIA RECUBIERTO CONGELADO.|La presente invención se refiere a un producto de confitería congelado que comprende un núcleo y un recubrimiento, en donde el recubrimiento comprende 17 hasta 50 % (p/p) de sacáridos y polisacáridos; 0.017 hasta 12.5 % (p/p) de endulzantes seleccionados del grupo que consiste de fructuosa, sucrosa, dextrosa, endulzantes artificiales y cualquier mezcla de los mismos; y 50 hasta 83 % de agua; en donde el peso molecular promedio de los sacáridos y polisacáridos está entre 476 y 9000.|LOYD WIX; Unilever R&D Colworth, MK44 1LQ, Sharnbrook, Bedfordshire, REINO UNIDO|UNILEVER N.V.; Weena 455, 3013, AL Rotterdam, PAISES BAJOS|
283742|Patente|PA/a/2004/009683|04/10/2004|08/02/2011|<i>A01K67/027</i> <b>(2006-01)</b>; <i>A61K38/00</i> <b>(2006-01)</b>; <i>A61K39/395</i> <b>(2006-01)</b>; <i>A61K45/00</i> <b>(2006-01)</b>|METODOS PARA EL TRATAMIENTO DE CONDICIONES RELACIONADAS A TWEAK.|La presente invención se refiere a los métodos y agentes para el tratamiento de condiciones relacionadas a TWEAK, incluyendo condiciones cardiacas, hepáticas, renales, pulmonares, adiposas, esqueléticas, musculares, neuronales óseas, y del cartílago. La invención proporciona los métodos para identificar los agonistas o antagonistas de TWEAK para el tratamiento de condiciones relacionadas a TWEAK. Adicionalmente, la invención proporciona los animales transgénicos que expresan un ADN exógeno que codifica para un polipéptido de TWEAK, o fragmentos, análogos o muteínas del mismo, y métodos para utilizar tales animales para identificar los agonistas o antagonistas de TWEAK. La invención proporciona además los métodos para diagnosticar una enfermedad basada en la expresión de TWEAK. La invención también proporciona los métodos para afectar la diferenciación celular de las células progenitoras utilizando los polipéptidos, agonistas o antagonistas de TWEAK.|LINDA BURKLY; ANIELA JAKUBOWSKI; TIMOTHY ZHENG; KYUNGMIN HAHM; 34 Winthrop Street, 02465, West Newton, Massachusetts, E.U.A.|BIOGEN IDEC MA INC.; 14 Cambridge Center, 02142, Cambridge, Massachusetts, E.U.A.|
283743|Patente|PA/a/2006/013240|14/11/2006|08/02/2011|<i>A61K39/395</i> <b>(2006-01)</b>; <i>A61P35/00</i> <b>(2006-01)</b>; <i>C07K16/00</i> <b>(2006-01)</b>|TERAPIA ADYUVANTE MEJORADA DE TUMORES QUE EXPRESAN G250.|La presente invención se refiere a un método para el tratamiento de tumores que expresan el antígeno G250, en particular carcinoma de células claras renales, que comprende la administración de anticuerpos específicos del antígeno G250 a pacientes de alto riesgo diagnosticados con enfermedad no metastática.|SVEN WARNAAR; OLAF WILHELM; Van Beuningen laan 20, NL-2334, CC Leiden, PAISES BAJOS|WILEX AG; Grillparzerstrasse 10, Munich, 81675, Alemania, , ALEMANIA|
283744|Patente|MX/a/2008/003489|12/03/2008|08/02/2011|<i>C07D209/10</i> <b>(2006-01)</b>; <i>A61K31/404</i> <b>(2006-01)</b>; <i>A61K31/47</i> <b>(2006-01)</b>; <i>C07D215/58</i> <b>(2006-01)</b>; <i>C07D223/16</i> <b>(2006-01)</b>; <i>C07D403/12</i> <b>(2006-01)</b>; <i>C07D413/12</i> <b>(2006-01)</b>|NUEVOS DERIVADOS HETEROBICICLICOS UTILES COMO INHIBIDORES DE CARNITIN PALMITOIL TRANSFERASA.|Esta invención se refiere a nuevos derivados heterobicíclicos de la fórmula (I) (ver fórmula (I)) en donde R1, R2, R3, R4, R5, R6, R7, A, X e Y tienen los significados definidos en la descripción y en las reivindicaciones, así como a sales y ésteres fisiológicamente aceptables de los mismos. Estos compuestos inhiben la L-CPT1 y pueden utilizarse como medicamentos.|JEAN ACKERMANN; PATRIZIO MATTEI; ODILE CHOMIENNE; KONRAD BLEICHER; SIMONA MARIA CECCARELLI; TANJA SCHULZ-GASCH; Im Gloegglihof 16, CH-4125, Riehen, SUIZA|F. HOFFMANN-LA ROCHE AG.*; 124 Grenzacherstrasse, CH-4070, Basilea, SUIZA|
283745|Patente|MX/a/2010/004270|19/04/2010|08/02/2011|<i>C02F1/28</i> <b>(2006-01)</b>; <i>B01D15/00</i> <b>(2006-01)</b>; <i>B01J20/26</i> <b>(2006-01)</b>; <i>C01B21/16</i> <b>(2006-01)</b>; <i>C02F9/00</i> <b>(2006-01)</b>; <i>C08G85/00</i> <b>(2006-01)</b>; <i>C08L39/06</i> <b>(2006-01)</b>; <i>C08L79/06</i> <b>(2006-01)</b>|METODO PARA ELIMINAR COMPUESTOS DE HIDRAZINA.|La presente invención se refiere a métodos para eliminar compuestos de hidrazina de soluciones. La soluciones que contienen compuestos de hidrazina se contactan con polivinilpirrolidona entrecruzada.|KIU-SEUNG LEE; 10941 Lansdowne Court, 23113-1364, Midlothian, Virginia, E.U.A.|E.I. DU PONT DE NEMOURS AND COMPANY. *; 1007 Market Street, 19898, Wilmington, Delaware, E.U.A.|
283746|Patente|MX/a/2009/000918|23/01/2009|08/02/2011|<i>C07K14/52</i> <b>(2006-01)</b>; <i>C07K14/43</i> <b>(2006-01)</b>|DERIVADOS DE CITOCINA.|La invención se refiere a un polipéptido que comprende una porción N-terminal y una porción C-terminal, en donde la porción N-terminal comprende la secuencia de firma QGP[P o L] y la secuencia de aminoácidos de la porción C-terminal es al menos 70% idéntica a la SEQ ID No.: 1, y los usos de la misma.|OLIVER HARTLEY; Department of Structural Biology, and Bioinformatics, Centre Médical Universitaire, 1 rue Michel Servet, CH-1211, Genève 4, SUIZA|MINTAKA FOUNDATION FOR MEDICAL RESEARCH; 14 Chemin des Aulx, Col. Plan-les- Ouates, Suiza, CH-1228, , SUIZA|
283747|Patente|MX/a/2010/002471|03/03/2010|08/02/2011|<i>C09K5/04</i> <b>(2006-01)</b>; <i>A62D1/00</i> <b>(2006-01)</b>; <i>C07B63/04</i> <b>(2006-01)</b>; <i>C08J9/14</i> <b>(2006-01)</b>; <i>C09K3/30</i> <b>(2006-01)</b>; <i>C11D7/50</i> <b>(2006-01)</b>|COMPOSICIONES AZEOTROPICAS Y SIMILARES A AZEOTROPOS DE E-1,1,1,4,4,5,5,5-OCTAFLUORO-2-PENTENO.|La presente invención describe composiciones azeotrópicas o similares a azeótropos. Las composiciones azeotrópicas o similares a azeótropos son mezclas de E-1, 1,1,4,4,5,5, 5-octafluoro-2-penteno con formiato de metilo, n-pentano, 2-metilbutano, 1,1,1,3,3- pentafluorobutano, trans-1, 2-dicloroetileno, 1,1,1,3,3- pentafluoropropano, dimetoximetano, ciclopentano o Z-1, 1,1,4,4,4- hexafluoro-2-buteno. También se describe un proceso para preparar una espuma termoplástica o termoestable usando las composiciones azeotrópicas o similares a azeótropos como agentes de soplado. También se describe un proceso para producir refrigeración usando las composiciones azeotrópicas o similares a azeótropos. También se describe un proceso para usar las composiciones azeotrópicas o similares a azeótropos como solventes. También se describe un proceso para producir un producto aerosol usando las composiciones azeotrópicas o similares a azeótropos como propulsores. También se describe un proceso para usar las composiciones azeotrápicas o similares a azeótropos como medios de transferencia de calor. También se describe un proceso para extinguir o eliminar el fuego usando las composiciones azeotrópicas o similares a azeótropos. También se describe un proceso para usar las composiciones azeotrópicas o similares a azeótropos como dieléctricos. También se describe un proceso para la separación de un compuesto guímico de una mezcla de dos o más compuestos químicos usando las composiciones azeotrópicas o similares a azeátropos.|MARK L. ROBIN; 107 Saint Andrews Court, 19709, Middletown, Delaware, E.U.A.|E.I. DUPONT DE NEMOURS AND COMPANY; 1007 Market Street, 19898, Wilmington, Delaware, E.U.A.|
283748|Patente|PA/a/2006/003031|16/03/2006|08/02/2011|<i>C07K16/00</i> <b>(2006-01)</b>; <i>A61K39/395</i> <b>(2006-01)</b>; <i>C12N1/19</i> <b>(2006-01)</b>; <i>C12N1/21</i> <b>(2006-01)</b>; <i>C12N15/00</i> <b>(2006-01)</b>; <i>C12N15/63</i> <b>(2006-01)</b>|ALTERACION DE LA PATOLOGIA DE UNA CELULA B USANDO ANTIGENOS DERIVADOS AUTOMATICAMENTE EN CONJUNTO CON UN AGENTE CITORREDUCTOR DE UNION ESPECIFICA.|La presente invención se refiere a un método para tratar enfermedades malignas relacionadas con las células B, un método para preparar composiciones para tratar enfermedades malignas relacionadas con las células B, donde la administración de una agente citorreductor de unión específica es seguida por inmunización con una proteína Id antóloga. Los dos tratamientos pueden ser secuénciales, donde la administración del agente citorreductor de unión específica es efectuada antes de la administración de la proteína Id antóloga y la administración del agente citorreductor de unión específica y la inmunización con una proteína Id antóloga puede ocurrir en un curso de tiempo superpuesto.|DANIEL P. GOLD; 2244 El Amigo, 92014, Del Mar, California, E.U.A.|MMRGLOBAL, INC.; 4401 Wilshire Boulevard, 2nd Floor, Los Angeles, 90010, California, E.U.A.|
283749|Patente|MX/a/2008/008984|11/07/2008|08/02/2011|<i>C07D401/04</i> <b>(2006-01)</b>; <i>A61K31/496</i> <b>(2006-01)</b>; <i>A61K31/506</i> <b>(2006-01)</b>; <i>A61K31/5377</i> <b>(2006-01)</b>; <i>A61P35/00</i> <b>(2006-01)</b>; <i>C07D401/14</i> <b>(2006-01)</b>; <i>C07D403/04</i> <b>(2006-01)</b>; <i>C07D403/14</i> <b>(2006-01)</b>; <i>C07D409/04</i> <b>(2006-01)</b>; <i>C07D413/14</i> <b>(2006-01)</b>|CIS-4,5-BIARIL-2-HETEROCICLICO-IMIDAZOLINAS COMO INHIBIDORES DE LA MDM2.|Se proporcionan compuestos de la fórmula I (ver fórmula (I)) en la que R, V1, V2 y el anillo A tienen los significados definidos en la descripción. Los compuestos poseen actividad anticancerígena.|STEPHEN EVAN WEBBER; NADER FOTOUHI; BINH THANH VU; GREGORY JAY HALEY; KALUS B. SIMONSEN; 3531 Millikin Avenue , 92122, San Diego, California, E.U.A.|F. HOFFMANN-LA ROCHE AG.*; 124 Grenzacherstrasse, CH-4070, Basilea, SUIZA|
283750|Patente|PA/a/2006/011029|26/09/2006|08/02/2011|<i>A61K38/27</i> <b>(2006-01)</b>; <i>A61K47/02</i> <b>(2006-01)</b>; <i>A61K47/10</i> <b>(2006-01)</b>; <i>A61K47/12</i> <b>(2006-01)</b>; <i>A61P5/02</i> <b>(2006-01)</b>|FORMULACION LIQUIDA DE HORMONA DEL CRECIMIENTO.|La invención se relaciona con una formulación líquida que comprende una hormona del crecimiento o una sustancia la cual estimula la liberación o potencia en actividad de hGH endógena; un polietileno-polipropilenglicol; un amortiguador citrato/fosfato, una sal de metal alcalino y una sal de metal alcalinotérreo o una pseudosal de metal alcalinotérreo, y un procedimiento para la preparación de la misma.|TUDOR ARVINTE; KARINE LUET KLEIBER; Tiefweg 50, CH-4125, Riehen, SUIZA|ARES TRADING S.A.; Zone Industrielle de I'Ouriettaz, CH-1170, Aubonne, SUIZA|
