Número de concesión|Tipo de documento|Número de solicitud|Fecha de presentación|Fecha de concesión|Clasificación CIP|Título|Resumen|Inventor(es)|Titular
284113|Patente|MX/a/2008/001801|05/02/2008|17/02/2011|<i>B60J5/06</i> <b>(2006-01)</b>; <i>C25D17/00</i> <b>(2006-01)</b>; <i>C25D17/08</i> <b>(2006-01)</b>; <i>C25D7/06</i> <b>(2006-01)</b>|DISPOSITIVO PARA RECOGER Y SOSTENER UNA PLURALIDAD DE SUSTRATOS Y UN DISPOSITIVO DE GALVANOPLASTIA.|Para poder tratar celdas solares 26 en un aparato de electro plateado 30 se puede insertar en una aparato en forma de rejilla o de bandeja o charola 11. Así son sujetados de esta forma mecánicamente y en contacto eléctrico que realiza vía los contactos 24. En lugar de celdas individuales solares 26, los aparatos de sujeción 11 se mueven con varias de las celdas solares insertadas 26 a través del aparato de electro plateado 30 para tratamiento. El contacto eléctrico en este caso se hace con las celdas solares 26 mediante los contactos 24 y las piezas del marco 12, 14, en una sección de proyección en ángulo 16 junto con las tiras del borde 17 del levador. Los rodillos de contacto 42 yacen en las tiras de borde y se conectan a una fuente energía eléctrica.|CHRISTIAN SCHMID; Zeppelinstrasse 18, 72250, Freudenstadt, ALEMANIA|GEBR. SCHMID GMBH & CO.; Robert-Bosch-Strasse 32-34, 72250, Freudenstadt, ALEMANIA|
284114|Patente|PA/a/2006/003523|29/03/2006|17/02/2011|<i>C10G45/08</i> <b>(2006-01)</b>; <i>B01J23/88</i> <b>(2006-01)</b>; <i>B01J23/882</i> <b>(2006-01)</b>; <i>B01J23/883</i> <b>(2006-01)</b>; <i>B01J23/888</i> <b>(2006-01)</b>; <i>B01J23/94</i> <b>(2006-01)</b>; <i>B01J37/02</i> <b>(2006-01)</b>; <i>B01J38/60</i> <b>(2006-01)</b>; <i>B01J38/62</i> <b>(2006-01)</b>|PROCESO PARA ACTIVAR UN CATALIZADOR DE HIDROTRATAMIENTO.|La invención se refiere a un proceso para activar un catalizador de hidrotratamiento que comprende un óxido de metal del Grupo VIB y un óxido de metal del Grupo VIII, proceso que comprende poner en contacto el catalizador con un ácido y un aditivo orgánico que tiene un punto de ebullición en el intervalo de 80-500ºC y una solubilidad en agua de al menos 5 gramos por litro (20ºC, presión atmosférica), opcionalmente seguido por secado bajo condiciones tal que al menos 50 % del aditivo se mantenga en el catalizador. El catalizador de hidrotratamiento puede ser un catalizador reciente de hidrotratamiento o un catalizador usado de hidrotratamiento que se ha regenerado.|TOSHIYUKI ADO; TETSURO KAMO; NAOHIRO NISHIMOTO; MARCEL ADRIAAN JANSEN; FRANCISCUS WILHELMUS VAN HOUTERT; 17-4 Isouracho, 792-0002, Niihama-shi, Ehime Pref., JAPON|ALBEMARLE NETHERLANDS B.V.; NIPPON KETJEN CO., LTD.; Stationsplein 4, NL-3818, LE Amersfoort, PAISES BAJOS|
284115|Patente|PA/a/2005/007096|28/06/2005|17/02/2011|<i>G11B20/18</i> <b>(2006-01)</b>; <i>G11B27/32</i> <b>(2006-01)</b>; <i>G11B7/0037</i> <b>(2006-01)</b>|METODO Y UNIDAD DE DISCO PARA EL CONTROL DE DEFECTO DE MEDIO DE GRABACION, Y MEDIO DE GRABACION DE DEFECTO CONTROLADO.|La presente invención se refiere a un método y unidad de disco para control de defecto de medio de grabación, y un medio de grabación de defecto controlado. El método de control de defecto incluye: escribir la primera información de estado que especifica que un ciclo de actualización de una estructura de control de defecto temporal (TDMS) se abre cuando la actualización de la TDMS comienza, la TDMS contiene información con respecto al control de defecto temporal; actualizar la TDMS cuando los datos se escribe o leen del medio de almacenamiento de información; y escribir la segunda información de estado que especifica que el ciclo de actualización de la TDMS se cierra, cuando la actualización de la TDMS se completa.|JUNG-WAN KO; SUNG-HEE HWANG; 315-401 Cheongmyung Maeul 3-Danji, Daewoo Apt. 956-2, Yeongtong-dong, Yeongtong-gu, 443-737, Suwon-Si, Gyeonggi-Do, REPUBLICA DE COREA|SAMSUNG ELECTRONICS CO., LTD.*; 416, Maetan-dong, Yeongtong-gu, 442-742, Suwon-si, Gyeonggi-do, REPUBLICA DE COREA|
284116|Patente|MX/a/2007/009724|28/09/2006|17/02/2011|<i>G06F21/00</i> <b>(2006-01)</b>|SISTEMA DE DETECCION DE CONTENIDOS NO AUTORIZADOS.|La carga de procesamiento en un dispositivo de ejecución para llevar a cabo una reproducción es alta durante la reproducción de contenidos toda vez que el dispositivo de ejecución lleva a cabo la verificación de la validez de los contenidos en paralelo con la reproducción de los contenidos, y por lo tanto el dispositivo de ejecución tiene que ser equipado con un procesador altamente eficiente. La presente invención reduce la carga de procesamiento implicada en la verificación al usar, para la verificación, sólo un número predeterminado de unidades encriptadas seleccionadas aleatoriamente de varias unidades encriptadas que constituyen contenidos encriptados grabados en el DVD. Además, la presente invención es capaz de mejorar la precisión de detección de contenidos no autorizados hasta cierto punto al seleccionar aleatoriamente un número predeterminado de unidades encriptadas cada vez que se lleva a cabo la verificación.|MASAYA YAMAMOTO; KAORU MURASE.*; TOSHIHISA NAKANO; KAORU YOKOTA.*; MASAYA MIYAZAKI; MOTOJI OHMORI; YUICHI FUTA; MASAO NONAKA; SENICHI ONODA; Matsushita Electric Industrial Co., Ltd., 1006, Oaza Kadoma, 571-8501, Kadoma-shi, Osaka, JAPON|PANASONIC CORPORATION; 1006, Oaza Kadoma, 571-8501, Kadoma-shi, Osaka, JAPON|
284117|Patente|MX/a/2007/008951|25/07/2007|17/02/2011|<i>B01L9/00</i> <b>(2006-01)</b>|SUJETADOR DE RECOLECCION DE EVIDENCIA PARA AUTOMATIZACION DE MUESTRAS.|Se proporciona un dispositivo y método para asegurar un absorbente de recolección de espécimen biológico original dentro de un sujetador para permitir el uso del absorbente dentro de dispositivos de análisis de espécimen automáticos y para permitir continuación de una cadena de custodia.|JANGBIR S. SHANGHA; 6508 West 125th Place, 66209, Overland Park, Kansas, E.U.A.|THE BODE TECHNOLOGY GROUP, INC.; 10430 Furnace Road, Ste. 107, 22079, Lorton, Virginia, E.U.A.|
284118|Patente|MX/a/2008/001417|29/01/2008|17/02/2011|<i>H04N5/44</i> <b>(2011-01)</b>|APARATO PARA PROPORCIONAR PANTALLAS MULTIPLES Y METODO PARA CONFIGURAR DINAMICAMENTE PANTALLAS MULTIPLES.|Se describe un aparato para proporcionar múltiples pantallas y un método para configurar dinámicamente múltiples pantallas. El aparato para la provisión de múltiples pantallas incluye un módulo de procesamiento de señales digitales que recibe información de video, información de audio, o información de datos, y restaura un servicio con base en la información de video, la información de audio o la información de datos, un módulo de procesamiento de servicio que genera una pluralidad de pantallas lógicas y una pantalla de superposición para visualizar el servicio restaurado, y un módulo de salida que mapea la pluralidad de pantallas lógicas generadas por el módulo de procesamiento de servicio a diferentes sitios sobre una pantalla de visualización, y permite que la pantalla de superposición se superponga a la pantalla de visualización.|KWANG-KEE LEE; GLENN A. ADAMS; JONG-HO LEE; UN-GYO JUNG; 201-1702 Ssangyong Apt., Garak 2-dong, 138-747, Songpa-gu, Seoul, REPUBLICA DE COREA|SAMSUNG ELECTRONICS CO., LTD.*; 416, Maetan-dong, Yeongtong-gu, 442-742, Suwon-si, Gyeonggi-do, REPUBLICA DE COREA|
284119|Patente|MX/a/2008/001419|29/01/2008|17/02/2011|<i>H04N5/44</i> <b>(2011-01)</b>|APARATO PARA PROPORCIONAR PANTALLAS MULTIPLES Y METODO PARA CONFIGURAR DINAMICAMENTE PANTALLAS MULTIPLES.|Se describe un aparato para proporcionar pantallas múltiples y un método para configurar dinámicamente pantallas múltiples. El aparato para proporcionar pantallas múltiples incluye un módulo de procesamiento de servicio que genera los servicios de visualización de pantallas lógicas y una pantalla de visualización, e intercambia los servicios entre las pantallas lógicas, y un módulo de salida que mapea las pantallas lógicas a sitios arbitrarios sobre la pantalla de visualización.|KWANG-KEE LEE; GLENN A. ADAMS; JONG-HO LEE; UN-GYO JUNG; 201-1702 Ssangyong Apt., Garak 2-dong, 138-747, Songpa-gu, Seoul, REPUBLICA DE COREA|SAMSUNG ELECTRONICS CO., LTD.*; 416, Maetan-dong, Yeongtong-gu, 442-742, Suwon-si, Gyeonggi-do, REPUBLICA DE COREA|
284120|Patente|MX/a/2008/001481|30/01/2008|17/02/2011|<i>H04N5/44</i> <b>(2011-01)</b>|APARATO PARA PROPORCIONAR PANTALLAS MULTIPLES Y METODO PARA CONFIGURAR DINAMICAMENTE PANTALLAS MULTIPLES.|Se proporciona un aparato para proporcionar pantallas múltiples y un método para configurar dinámicamente las pantallas múltiples. El aparato para proporcionar pantallas múltiples utiliza banderas incluidas en paquetes transferidos con el fin de configurar dinámicamente pantallas múltiples que constituyen una pluralidad de contenidos sobre un dispositivo de visualización física, y un método para configurar dinámicamente pantallas múltiples. El aparato para proporcionar pantallas múltiples incluye un módulo de procesamiento de señales digitales, que determina si una aplicación incluida en la información de datos puede o no ser ejecutada sobre una pantalla con base en la información de datos recibida, y un módulo operacional que opera la aplicación sobre la pantalla, con base en el resultado de la determinación.|KWANG-KEE LEE; GLENN A. ADAMS; JONG-HO LEE; UN-GYO JUNG; 201-1702 Ssangyong Apt., Garak 2-dong, 138-747, Songpa-gu, Seoul, REPUBLICA DE COREA|SAMSUNG ELECTRONICS CO., LTD.*; 416, Maetan-dong, Yeongtong-gu, 442-742, Suwon-si, Gyeonggi-do, REPUBLICA DE COREA|
284121|Patente|MX/a/2007/005257|02/05/2007|17/02/2011|<i>B60Q1/00</i> <b>(2006-01)</b>|GRUPO DE MONTAJE CON CIERRE LIBERABLE.|Un grupo de montaje para la colocación en forma liberable de un miembro de luz trasera en un miembro de carrocería de un vehículo. El grupo de montaje comprende un miembro de cierre. El miembro de cierre incluye una porción de montaje de forma de manguito adaptada para que sea fijada en el miembro de soporte, y una primera porción de inmovilización unida en forma integral con la porción de montaje. La primera porción de inmovilización es adaptada para embragar a presión una segunda porción de inmovilización en forma acoplada del miembro estructural para su retención. El grupo de montaje además comprende un pasador de liberación que puede deslizarse en dirección axial en la porción de montaje del miembro de cierre. El pasador de liberación tiene una porción de eje que sobresale en dirección axial a partir de la porción de montaje de forma de manguito y es adaptada para que se desplazada en dirección axial para la liberación de las dos porciones de inmovilización que están siendo embragadas a presión.|HANS-JOACHIM DEMBOWSKY; HANS-ULLRICH FIGGE; MARTIN JODELEIT; Ricarda-Huch-Ring 80, D-21035, Hamburg, ALEMANIA|BÖLLHOFF VERBINDUNGSTECHNIK GMBH; Archimedesstrasse 1-4, D-33649, Bielefeld, ALEMANIA|
284122|Patente|MX/a/2008/003018|03/03/2008|17/02/2011|<i>B41J2/175</i> <b>(2006-01)</b>|BARRA DE TINTA DE INMOVILIZACION MULTIPOSICION.|Esta descripción se relaciona, de manera general con impresoras de chorro de tinta de cambio de fase, las barras de tinta sólida usadas en esas impresoras de chorro de tinta, y el aparato de carga y alimentación para alimentar las barras de tinta sólida dentro de esas impresoras de chorro de tinta.|ERNEST ISRAEL ESPLIN; MICHAEL ALAN FAIRCHILD; 19105 Rock Creek Road, 97378, Sheridan, Oregon, E.U.A.|XEROX CORPORATION.*; 800 Long Ridge Road, 06904-1600, Stamford, Connecticut, E.U.A.|
284123|Patente|MX/a/2008/003017|03/03/2008|17/02/2011|<i>B41J2/17</i> <b>(2006-01)</b>; <i>B41J2/01</i> <b>(2006-01)</b>; <i>B41J2/175</i> <b>(2006-01)</b>|IDENTIFICACION Y RECONOCIMIENTO DIGITAL DE BARRA DE TINTA SOLIDA.|Esta descripción se relaciona de manera general con impresoras de chorro de tinta de cambio de fase, las barras de tinta sólida usadas en esas impresoras de chorro de tinta, y el aparato de carga y alimentación para alimentar la barra de tinta sólida dentro de esas impresoras de chorro de tinta.|BRENT RODNEY JONES; MICHAEL ALAN FAIRCHILD; FREDERICK T. MATTERN; 14566 S.W. Bell Road, 97140, Sherwood, Oregon, E.U.A.|XEROX CORPORATION.*; 800 Long Ridge Road, 06904-1600, Stamford, Connecticut, E.U.A.|
284124|Patente|PA/a/2004/012734|15/12/2004|17/02/2011|<i>B01D35/30</i> <b>(2006-01)</b>; <i>A47J27/21</i> <b>(2006-01)</b>|APARATO DE TRATAMIENTO DE AGUA.|La presente invención se refiere a un aparato de tratamiento de agua, de manera más particular, a cartuchos de tratamiento de agua doméstica o para el hogar.|VINCENT JOSEPH GARVEY; VERNON JAMES DONNELLY; Leataoibh, Meadow Field Road, Bradda, IM9 6PH, Port Erin, Isle of Man, REINO UNIDO|STRIX LIMITED; Forrest House, IM9 2RG, Ronaldsway, Isle of Man, REINO UNIDO|
284125|Patente|MX/a/2007/014117|09/11/2007|17/02/2011|<i>C07D333/40</i> <b>(2006-01)</b>; <i>A61K31/381</i> <b>(2006-01)</b>; <i>A61P31/12</i> <b>(2006-01)</b>; <i>C07D409/12</i> <b>(2006-01)</b>; <i>C07D413/12</i> <b>(2006-01)</b>|COMPUESTOS Y METODOS PARA EL TRATAMIENTO O PREVENCION DE INFECCIONES DE FLAVIVIRUS.|Compuestos representados por la fórmula (I): o sales y solvatos farmacéuticamente aceptables de los mismos, en donde R1, X, Y, Y1 y Z son como se definen en la presente, son útiles para tratar infecciones virales por flaviviridae. La infección viral es el virus de Hepatitis C (HCV), virus de diarrea viral bovino (BVDV), virus de cólera de cerdo, virus de fiebre de dengue, virus de encefalitis Japonesa o virus de fiebre amarilla.|LAVAL CHAN CHUN KONG; RÉAL DENIS; CARL POISSON; SANJOY KUMAR DAS; IRINA MOTORINA; RABINDRA REJ; CONSTANTIN G. YANNOPOULOS; 275 Armand-Frappier, H7V 4A7, Laval, Québec, CANADA|VIROCHEM PHARMA INC.; 275 Armand-Frappier, H7V 4A7, Laval, Québec, CANADA|
284126|Patente|MX/a/2009/009453|04/09/2009|16/02/2011|<i>A61L15/18</i> <b>(2006-01)</b>; <i>A61L15/22</i> <b>(2006-01)</b>; <i>A61L15/44</i> <b>(2006-01)</b>|AGENTES HEMOSTATICOS, BASADOS EN ARCILLA, Y DISPOSITIVOS PARA SU ENTREGA.|Un dispositivo hemostático para promover la coagulación de la sangre, incluye un substrato de gasa, un material de arcilla, dispuesto sobre el substrato de gasa, y también un poliol, tal como el glicerol, o similar, dispuesto sobre el substrato de gasa, para unir el material de arcilla. Cuando el dispositivo se usa para tratar una herida que sangra, al menos una porción del material de arcilla entra en contacto con la sangre que emana de la herida, para causar su coagulación. Una venda que puede aplicarse a una herida que sangra, para promover la coagulación de la sangre, incluye un substrato flexible y un substrato de gasa montad sobre el anterior. El substrato de gasa incluye un material de arcilla y un poliol. Una esponja hemostática también incluye un substrato de gasa y una dispersión del material hemostático y un poliol sobre una primera superficie del substrato.|LO, DENNY; HUEY, RAYMOND; BURNS, DANIEL J.; GIACOMO BASADONNA; FRANCIS X. HURSEY; 516 Wheeler Farms Road, 06477, Orange, Connecticut, E.U.A.|Z-MEDICA CORPORATION; 4 Fairfield Boulevard, 06492, Wallingford, Connecticut, E.U.A.|
284127|Patente|MX/a/2009/002614|10/03/2009|16/02/2011|<i>C09K8/02</i> <b>(2006-01)</b>|FLUIDOS DE PERFORACION DE BAJA REOLOGIA CON VELOCIDAD DE PENETRACION INCREMENTADA.|Se describe un método para incrementar la velocidad de penetración durante la perforación, en comparación con la perforación con un fluido de perforación de referencia, que comprende un agente densificante de barita grado API y que tiene un hundimiento, velocidad de asentamiento, densidad, velocidad de flujo y caída de presión dados a través de un barreno, que comprende: hacer circular un fluido de perforación que comprende un fluido base y un agente densificante micronizado a través del barreno; en donde el fluido de perforación esta caracterizado por tener una densidad equivalente; una velocidad de asentamiento equivalente o más baja y un hundimiento equivalente o más bajo que el fluido de referencia; en donde la circulación es a una velocidad de flujo más baja que la velocidad de flujo del fluido de perforación de referencia y en donde la circulación da como resultado una caída de presión equivalente o más baja a través del barreno.|JARROD MASSAM; DOUG OAKLEY; ANDREW BRADBURY; 15 Balmoral Road, AB10 6AL, Scotland, REINO UNIDO|M-I LLC; 5950 North Course Drive, 77072, Houston, Texas, E.U.A.|
284128|Patente|PA/a/2001/009746|27/09/2001|16/02/2011|<i>C08F265/00</i> <b>(2006-01)</b>; <i>C08F265/04</i> <b>(2006-01)</b>; <i>C08F265/06</i> <b>(2006-01)</b>|PROCESOS PARA MODIFICAR QUIMICAMENTE LA SUPERFICIE DE LAS PARTICULAS POLIMERICAS DE EMULSION.|Se proporciona un procesos para modificar químicamente la superficie de una partícula de polímero de emulsión que incluye proporcionar un polímero de emulsión acuosa, un monómero en un nivel de al menos 0.5% por peso en base a pesos del polímero de emulsión y un compuesto químico modificador de superficie capaz de enlazarse con el monómero, bajo condiciones en donde no existe polimerización sustancial del monómero, y reducir entonces el nivel del monómero por al menos 50%.|ROBERT MITCHELL BLANKENSHIP; 914 St. Claire Lane, 19438, Harleysville, , E.U.A.|ROHM AND HAAS COMPANY; 100 Independence Mall West, 19106-2399, Philadelphia, Pennsylvania, E.U.A.|
284129|Patente|MX/a/2007/007163|14/06/2007|16/02/2011|<i>A61M5/50</i> <b>(2006-01)</b>; <i>A61M5/315</i> <b>(2006-01)</b>|CONJUNTO DE JERINGA QUE TIENE UN MECANISMO INHABILITADOR.|Un conjunto de jeringa que tiene un mecanismo in-habilitador pasivo que incluye un cilindro (21) y un conjunto de vástago de émbolo (43). El conjunto de vástago de émbolo incluye un vástago de émbolo y un tapón (81) conectado por un elemento de bloqueo (71). El número de carreras de émbolo de jeringa antes de que se limite el tapón en el cilindro (21) haciendo que el conjunto de jeringa sea inhabilitado se determina por el número de retenes (89) en el vástago de émbolo y tapón que enganchen en el mecanismo de bloqueo. Al terminar el final de la carera de inyección, cualquier intento de retirar el cilindro de vástago de émbolo del cilindro hará que el elemento de bloqueo enganche el cilindro y atrape el tapón en el cilindro evitando uso adicional de la jeringa.|BARERE, AARON; 1027 Park Avenue, Hoboken, 07030, Hoboken, New Jersey, E.U.A.|BECTON, DICKINSON AND COMPANY.*; 1 Becton Drive, 07417, Franklin Lakes, New Jersey, E.U.A.|
284130|Patente|MX/a/2008/012324|26/09/2008|16/02/2011|<i>H04S1/00</i> <b>(2006-01)</b>; <i>H04S3/00</i> <b>(2006-01)</b>|METODO MEJORADO PARA LA MODULACION DE SEÑALES EN LA RECONSTRUCCION DE AUDIO MULTICANAL.|Un canal de salida reconstruido, reconstruido con un reconstructor multicanal usando por lo menos un canal convertido a la baja derivado a partir de la conversión a la baja de una variedad de canales originales y usando una representación del parámetro que incluye la información adicional sobre una estructura fina de tiempo de un canal original puede ser generada utilizando un generador para generar un componente de señal directa y un componente de señal difusa en base al canal convertido a la baja usado. Sólo el componente de señal directa se modifica tal que la estructura fina de tiempo del canal de salida reconstruido se ajusta a una estructura fina de tiempo deseada, indicada por medio de la información adicional sobre la estructura fina de tiempo transmitida.|DISCH, SASCHA; LINZMEIER, KARSTEN; HERRE, JÜRGEN; POPP, HARALD; Turnstrasse 7, 90763, Fürth, ALEMANIA|FRAUNHOFER-GESELLSCHAFT ZUR FÖERDERUNG DER ANGEWANDTEN FORSCHUNG E.V.; Hansastrasse 27c, 80686, Munich, ALEMANIA|
284131|Patente|MX/a/2009/006957|25/06/2009|16/02/2011|<i>G01S1/24</i> <b>(2006-01)</b>; <i>G01S3/02</i> <b>(2006-01)</b>; <i>G01S5/14</i> <b>(2006-01)</b>|GEOLOCALIZACION ITERATIVA Y PORTATIL DE EMISORES DE RADIOFRECUENCIA.|Geolocalización iterativa de un emisor de RF estacionario por medio del uso de TDOA, puede incluir el uso de un único sensor de geolocalización portátil (por ejemplo, TDOA), un par de sensores de geolocalización portátiles y tres o más sensores de geolocalización portátiles. Añadiendo sensores de geolocalización portátiles al proceso iterativo se reducen las restricciones sobre las señales a ser localizadas y se proporciona una reducción en el número de iteraciones requerido para conseguir una precisión mejorada en la localización.|LEFEVER, RONALD, S.; ANDERSON, ROBERT, J.; BULL, JEFFREY, F.; 100 Aspen Court, 18914, Chalfont, Pennsylvania, E.U.A.|TRUEPOSITION, INC.*; 1000 Chesterbrook Blvd., 3rd Floor, 19312, Berwyn, Pennsylvania, E.U.A.|
284132|Patente|MX/a/2009/004642|29/04/2009|16/02/2011|<i>A61F13/00</i> <b>(2006-01)</b>; <i>A61L15/16</i> <b>(2006-01)</b>|AGENTES HEMOSTATICOS A BASE DE ARCILLA Y DISPOSITIVOS PARA EL SUMINISTRO DE LOS MISMOS.|Un dispositivo para promover la coagulación de la sangre comprende un material de arcilla en forma de partículas y un receptáculo para contener el material de arcilla. Al menos una porción del receptáculo se define por una malla. Otro dispositivo comprende un sustrato de gasa y un material de arcilla dispuesto sobre el sustrato de gasa. Otro dispositivo es un vendaje que comprende un sustrato, una malla instalada sobre el sustrato y partículas de un material de arcilla retenidas en la malla. Una esponja hemostática comprende un sustrato, un material hemostático dispuesto sobre una primera superficie del sustrato y un agente de liberación dispuesto sobre una segunda superficie del sustrato. El agente de liberación se dispone sobre la superficie del sustrato en contacto con la herida. Cuando se trata una herida sangrante, la aplicación de la esponja hemostática ocasiona que al menos una porción del material hemostático entre en contacto con la sangre a través del agente de liberación y a través del sustrato.|LO, DENNY; HUEY, RAYMOND; BURNS, DANIEL J.; 516 Wheeler Farms Road, 06477, Orange, Connecticut, E.U.A.|Z-MEDICA CORPORATION; 4 Fairfield Boulevard, 06492, Wallingford, Connecticut, E.U.A.|
284133|Patente|MX/a/2008/005017|17/04/2008|17/02/2011|<i>H04B1/04</i> <b>(2006-01)</b>; <i>H01Q11/12</i> <b>(2006-01)</b>; <i>H04B1/38</i> <b>(2006-01)</b>; <i>H04M1/00</i> <b>(2006-01)</b>|METODO Y APARATO PARA RECTIFICACION DE ALTA EFICIENCIA PARA DIVERSAS CARGAS.|Un aparato para convertir energía, incluye cuando menos una red de acoplamiento de impedancia que recibe una señal eléctrica. El aparato incluye al menos un convertidor de CA a CD en comunicación con la red de acoplamiento de impedancia. También se describe un método para energizar una carga y un aparato para convertir energía y modalidades adicionales de un aparato para convertir energía.|GREENE, CHARLES, E.; HARRIST, DANIEL, W.; 10115 Frankstown Road, 15235, Pittsburgh, Pennsylvania, E.U.A.|POWERCAST CORPORATION; 114 North Saint Clair Street, P. O. Box 601, 15658, Ligonier, Pennsylvania, E.U.A.|
284134|Patente|MX/a/2008/013472|20/10/2008|17/02/2011|<i>B03C3/41</i> <b>(2006-01)</b>; <i>B03C3/34</i> <b>(2006-01)</b>; <i>B03C3/40</i> <b>(2006-01)</b>|ELEMENTO DE CORONA SOLAR CON TOMA DE TIERRA.|Un elemento de corona de tierra (334) para uso en un pre-ionizador (330) de un precipitador electrostático es provisto de acuerdo a una cobertura de la invención. El elemento de corona de tierra (334) incluye un cuerpo substancialmente alargado (1401) que incluye un extremo próximo (1403) y primera y segunda proyecciones (607) formado en el extremo próximo (1402) y el extremo distante (1403). La primer y segunda proyecciones (607) son adaptados para retener la placa de corona en el precipitador electrostático.|REYNOLDS, CHARLES, W.; KIERN, BRUCE, M.; LAMB, DENNIS, T.; PATERSON, CHRISTOPER, M.; 15 Scott Station Cove, 39560, Long Beach, Mississippi, E.U.A.|ORECK HOLDINGS, LLC.*; 1720 Carey Avenue, 82001, Cheyenne, Wyoming, E.U.A.|
284135|Patente|MX/a/2008/014809|21/11/2008|18/02/2011|<i>A61K31/555</i> <b>(2006-01)</b>; <i>C07D275/04</i> <b>(2006-01)</b>; <i>C07F3/06</i> <b>(2006-01)</b>|1,2-BENZISOTIAZOLIN-3-ONA INMOVILIZADA.|La presente invención proporciona complejos de 1,2-tiazolin-3-ona inmovilizada/óxido de zinc (BIT/ZnO), antimicrobianos, novedosos, útiles como agentes antimicrobianos debido a su resistencia a ser lixiviados del sustrato al cual se encuentran unidos. La presente invención también está dirigida a métodos para preparar los complejos de BIT/ZnO con complejos de BIT/ZnO preparados por los métodos novedosos, con métodos para usar los complejos de BIT/ZnO para inhibir el crecimiento microbiano o reducir el nivel de bacterias en la superficie del sustrato, y con sustratos protegidos contra el ataque microbiano al ser tratados con los complejos de BIT/ZnO. La presente invención está dirigida además a composiciones que comprenden 1,2-tiazolin-3-ona la cual ha sido inmovilizada con óxido de zinc.|WOLFGANG LINDNER; 1480 Route 46 Parsipanny, 07054, New Jersey, E.U.A.|TROY TECHNOLOGY CORPORATION, INC.*; Suite 415, 200 West Ninth Street Plaza, 19801, Wilmington, Delaware, E.U.A.|
