Número de concesión|Tipo de documento|Número de solicitud|Fecha de presentación|Fecha de concesión|Clasificación CIP|Título|Resumen|Inventor(es)|Titular
307466|Patente|MX/a/2012/002433|24/02/2012|19/02/2013|<i>H01R13/66</i> <b>(2006-01)</b>|CONECTORES ELECTRICOS CON COMPENSACION DE INTERFERENCIA.|Un conector (100) eléctrico que incluye conductores (118) de empalme configurados para acoplarse con los contactos (146) de adaptador seleccionados de un adaptador (145) modular. El conector (100) incluye un circuito (132) impreso que interconecta los conductores (118) de empalme con los contactos (143) terminales. El circuito impreso incluye primera y segunda hileras (230, 232) de protección de las vías (139) conductoras que están ubicadas entre las porciones (204, 206) de extremo del circuito impreso y están conectadas eléctricamente con los conductores (118) de empalme. La primera y segunda hileras (230, 232) de protección se extienden a lo largo del primer y segundo ejes (240, 242) de hilera, respectivamente, que se extienden esencialmente paralelos entre sí. El circuito (132) impreso también incluye vías (141) terminales externas que se conectan eléctricamente con los contactos (143) terminales. Cada porción (204, 206) de extremo tiene vías (141) terminales en la misma, las cuales están distribuidas en una dirección a lo largo del primer y segundo ejes (240, 242) de hilera. El circuito (132) impreso también incluye un par de vías (151) protegidas ubicadas entre la primera y segunda hileras (230, 232) de protección y a lo largo de un par (244) de par central que se extiende esencialmente paralelo al primer y al segundo ejes (240, 242) de hilera.|PAUL JOHN PEPE; STEVEN RICHARD BOPP; 1812 Kilrush Road, 27012, Clemmons, North Caroline, E.U.A.|TYCO ELECTRONICS CORPORATION.*; 1050 Westlakes Drive, 19312, Berwyn, Pennsylvania, E.U.A.|
307467|Patente|PA/a/2006/001991|01/02/2006|22/12/2012|<i>G07F7/00</i> <b>(2006-01)</b>|MÁQUINA EXPENDEDORA AUTOMÁTICA CON AMBIENTE CONTROLADO DE PAQUETES DE TORTILLAS CALIENTES DE UN KG. Y MEDIO KG.|La presente invención se refiere a una máquina expendedora de paquetes de tortilla que comprende; un gabinete cilíndrico abierto en su sección frontal, dicho gabinete define en su interior una sección superior separada de una sección inferior por medio de una pared transversal; una puerta frontal que cubre la sección abierta de dicho gabinete, dicha puerta comprende una cámara de servicio; una puerta aislante dispuesta entre la sección abierta del gabinete y la puerta frontal, en donde dicha puerta aislante comprende una sección de ventana con una puerta retráctil, dicha sección de ventana dispuesta coincidente con la cámara de servicio de la puerta frontal; un mecanismo expendedor de tortillas que comprende, un contenedor cilíndrico para almacenar la pluralidad de paquetes de tortilla, un mecanismo expulsor de paquetes y una banda móvil, dicho contenedor define un extremo superior unido giratoriamente a la sección superior del gabinete, un conductor circular concéntrico y un extremo superior de suministro, el mecanismo expulsor de paquetes es unido a la sección superior y estando adaptado para empujar un paquete de tortillas en el contenedor hasta el conducto circular del mismo, en donde la banda móvil es dispuesta bajo el extremo de suministro del cilindro contenedor para recibir los paquetes empujados y a su vez suministrarlos a la cámara de servicio a través de la sección de ventana de la puerta aislante; un dispositivo generador de calor dispuesto en la sección inferior del gabinete para suministrar calor a la sección superior y mantener una temperatura programada por un termostato dispuesto en dicha sección superior, dicho calor es suministrado a través de un conducto dispuesto en la pared transversal de dicho gabinete, dicho conducto comprende una puerta retráctil, un sistema de control dispuesto en la puerta frontal que comprende, un validador de monedas que al ser accionado envía una señal a un microcontrolador, este a su vez activa un panel de botones de selección de opciones, para activar un reproductor digital parlante y/o para activar el mecanismo expendedor de tortillas.|NORBERTO CAMARENA TINAJERO; Inf. Farallon del Obispo, Edif. 6, Int. 2002, Col. Farallon, 39690, Acapulco de Juarez, Guerrero, MEXICO|NORBERTO CAMARENA TINAJERO; Inf. Farallon del Obispo, Edif. 6, Int. 2002, Col. Farallon, 39690, Acapulco de Juarez, Guerrero, MEXICO|
307468|Patente|MX/a/2009/006991|26/06/2009|25/01/2013|<i>C02F1/52</i> <b>(2006-01)</b>; <i>C02F1/58</i> <b>(2006-01)</b>; <i>C02F5/02</i> <b>(2006-01)</b>; <i>C02F9/02</i> <b>(2006-01)</b>|APARATO Y PROCESO PARA EL ACONDICIONAMIENTO DE AGUA|Procesos de acondicionamiento y equipo para remover dureza del agua circulada en un sistema. Un corriente lateral es conducido a un reactor y de regreso. Un atenuante es agregado al agua en circulación, en algunas modalidades en un corriente lateral saliendo de la cámara de reacción, formando complejos solubles de metal con iones del tipo que causan incrustaciones. Un acondicionador es agregado en el agua de la corriente lateral el cual rompe los complejos solubles de metal ion atenuante y precipita y acumula los iones metálicos liberados como un sólido para su acumulación y liberación. En algunas modalidades, se agrega un polímero, una mezcla de inhibidor de corrosión y/o pre-mezclada con la atenuante y y un generador de cloro remueve el cloruro de sodio del atenuante de la corriente lateral y produce gas cloro, gas hidrogeno e hidróxido de sodio para su uso en el proceso o para su eliminación|SAMUEL OWENS; Baldwin Blvd. #4891, 78406, CORPUS CHRISTI, Texas, E.U.A.|SAMUEL OWENS; Baldwin Blvd. #4891, 78406, CORPUS CHRISTI, Texas, E.U.A.|
307469|Patente|MX/a/2011/003659|12/03/2001|05/12/2012|<i>H04N5/445</i> <b>(2011-01)</b>; <i>H04N5/765</i> <b>(2006-01)</b>|GUIA DE PROGRAMACION ELECTRONICA CON ALMACENAMIENTO DIGITAL.|Se provee un sistema de guía de programación televisiva interactiva con almacenamiento digital. La guía de programación proporciona a los usuarios la capacidad de almacenar información asociada con programas grabados, en un directorio situado en el dispositivo de almacenamiento digital, proveyendo de ese modo un fácil acceso a la información sobre los programas. La guía de programación puede suministrar también una biblioteca de medios global para indicar los programas almacenados en los medios de almacenamiento removibles utilizados con la guía de programación. La guía puede permitir también al usuario administrar y mantener una biblioteca de medios del usuario para hacer lo mismo. Los datos no dependientes del tiempo asociados con los programas grabados pueden ser almacenados en una manera tal que permita al usuario interactuar con los datos al ser reproducidos, como si el programa estuviera siendo emitido originalmente. La guía cie programación permite también al usuario definir "superprogramas" para la reproducción de una secuencia de programas o segmentos de programas almacenados.|EDWARD B. KNUDSON; DAVID M. BEREZOWSKI; JOEL G. HASSELL; L. JOE HEDGES; MICHAEL D. ELLIS; 8246 Yarrow Court, 80005, Arvada, Colorado, E.U.A.|UNITED VIDEO PROPERTIES, INC.*; South Lewis Avenue 7140, 74136, Tulsa, Oklahoma, E.U.A.|
307470|Patente|MX/a/2010/003011|18/03/2010|28/01/2013|<i>E03D13/00</i> <b>(2006-01)</b>|ACCESORIO DE ORINAL MULTIUSOS.|La presente invención se refiere a un aparato para saneamiento, desodorización y prevención de salpicaduras de fluidos vertidos en un orinal en un usuario, que comprende: un recipiente permeable a los fluidos adaptado para suspenderse en el orinal para absorber los fluidos vertidos en el orinal, en donde el recipiente permeable a los fluidos se adapta para liberar los fluidos absorbidos en un desagüe del orinal; el recipiente permeable a los fluidos se subdivide en una pluralidad de compartimientos de forma fija orientados en una de una dirección predefinida, en donde los compartimientos están orientados en una de una dirección horizontal y una dirección vertical con respecto a un eje longitudinal del recipiente permeable a los fluidos; material particulado incrustado dentro de los compartimientos para saneamiento, desodorización y prevención de salpicaduras de los fluidos vertidos en el orinal; y una pluralidad de sujetadores adaptados para sujetar el recipiente permeable a los fluidos al orinal; mediante el cual el recipiente permeable a los fluidos sanea, desodoriza, y evita las salpicaduras de los fluidos en el usuario.|JAVIER FERNANDO RUEDAS; 20671 E Peach Blossom Rd, 91789, Walnut, California, E.U.A.|JAVIER FERNANDO RUEDAS; 20671 E Peach Blossom Rd, 91789, Walnut, California, E.U.A.|
307471|Patente|MX/a/2010/013328|03/12/2010|19/02/2013|<i>H04J3/06</i> <b>(2006-01)</b>; <i>G10L19/00</i> <b>(2013-01)</b>; <i>H04L25/49</i> (2006-01); <i>H04L7/04</i> <b>(2006-01)</b>|SISTEMA Y METODO DE UN MODEM DENTRO DE BANDA PARA COMUNICACIONES DE DATOS A TRAVES DE REDES DIGITALES DE COMUNICACION INALAMBRICA.|Se proporciona un sistema para transmitir información a través de un códec de voz (dentro de banda) tal como el encontrado en una red de comunicación inalámbrica. Un modulador transforma los datos en una señal similar a ruido espectralmente con base en el mapeo de un pulso configurado a posiciones predeterminadas dentro de una trama de modulación, y la señal se codifica eficientemente mediante un códec de voz. Una secuencia de sincronización proporciona la temporización de la trama de modulación en el receptor y se detecta con base en el análisis de un patrón de picos de correlación. Un protocolo de solicitud/respuesta proporciona una - transferencia de datos confiable utilizando redundancia de mensajes, retransmisión, y/o modos de modulación robusta que dependen de las condiciones del canal de comunicaciones.|GEORG FRANK; CHRISTIAN SGRAJA; MARC W. WERNER; CHRISTIAN PIETSCH; CHRISTOPH A. JOETTEN; PENGJUN HUANG; ETHAN R. DUNI; EUGENE J. BAIK; 5775 Morehouse Drive, 92121, San Diego, California, E.U.A.|QUALCOMM INCORPORATED.*; 5775 Morehouse Drive, 92121-1714, San Diego, California, E.U.A.|
307472|Patente|MX/a/2009/009815|14/09/2009|19/02/2013|<i>B23K35/02</i> <b>(2006-01)</b>; <i>B23K35/28</i> <b>(2006-01)</b>; <i>B23K35/36</i> <b>(2006-01)</b>; <i>C22C1/10</i> <b>(2006-01)</b>; <i>C22C21/02</i> <b>(2006-01)</b>; <i>C22C32/00</i> <b>(2006-01)</b>; <i>C23C4/04</i> <b>(2006-01)</b>|UNA PIEZA DE SOLDADURA FUERTE, UN METODO PARA ELABORAR UNA PIEZA DE SOLDADURA FUERTE, Y UN METODO DE SOLDADURA FUERTE Y COMPONENTES HECHOS A PARTIR DE DICHA PIEZA DE SOLDADURA FUERTE.|La invención se refiere a una pieza de soldadura fuerte auto-fundente; la pieza comprende un material compuesto que comprende al menos un material inorgánico distribuido en un metal o matriz de aleación de metal, el material inorgánico forma un flujo durante la soldadura fuerte para promover la formación de una unión metálica térmicamente inducida; la matriz puede ser una aleación de soldadura fuerte de aluminio silicio y el material inorgánico puede ser un flujo de fluoroaluminato de potasio; la pieza es hecha mediante formación por rociado.|ANDREW JOSEF WIDAWSKI OGILVY; DOUGLAS KENNETH HAWKSWORTH; ELISABETH ABOM; Tan-Y-Grag Cottages, SA12 9YG, Cwmafan, Port Talbot, REINO UNIDO|SANDVIK OSPREY LIMITED.*; SAPA HEAT TRANSFER AB; Red Jacket Works, SA11 1NJ, Millands, Neath, REINO UNIDO|
307473|Patente|MX/a/2010/001628|10/02/2010|19/02/2013|<i>A61K45/06</i> <b>(2006-01)</b>; <i>A01N43/04</i> <b>(2006-01)</b>; <i>A61K31/70</i> <b>(2006-01)</b>; <i>A61P35/00</i> <b>(2006-01)</b>|NUEVAS FORMAS DE ESTER METILICO DE CDDO.|Un compuesto triterpenoide, 2-ciano-3, 12-dioxolean-1,9(11)-dien-28-oato de metilo (ester metílico de CDDQ), tiene una forma sólida vítrea no cristalina y una forma cristalina no hidratada que se puede preparar, por ejemplo, a partir de una solución metanólica saturada. La forma vítrea despliega una mejorada biodisponibilidad respecto de la forma cristalina no hidratada. Cada forma del éster metílico de CDDD es un candidato superior para usar, típicamente en forma de dosis sólida, para el tratamiento de una, variedad de estados patológicos, en general asociados con inflamación.|JOHN WALLING; STEPHAN D. PARENT; ROBERT M. KRAL; DAVID T. JONAITIS; 6908 Parkridge Boulevard #130, 75063, Irving, Texas, E.U.A.|REATA PHARMACEUTICALS, INC.; 2801 Gateway Drive, Suite 150, 75063-2648, Irving, Texas, E.U.A.|
307474|Patente|MX/a/2008/005714|30/04/2008|19/02/2013|<i>D21H21/16</i> <b>(2006-01)</b>; <i>D21H17/07</i> (2006-01); <i>D21H17/28</i> (2006-01); <i>D21H17/36</i> (2006-01); <i>D21H17/45</i> (2006-01); <i>D21H19/44</i> (2006-01); <i>D21H21/18</i> <b>(2006-01)</b>; <i>D21H21/30</i> (2006-01)|UN SUBSTRATO PARA PAPEL QUE TIENE DENSIDAD DE IMPRESION MEJORADA.|La presente invención se relaciona con una composición de apresto que, cuando es aplicada a un sustrato de papel, crea un sustrato, adecuado preferiblemente para la impresión por chorro de tinta, con una densidad de impresión mejorada, claridad de impresión, HST bajo, y/o tiempo de secado de imagen, el sustrato tiene preferiblemente una mayor brillantez así como una impresión color a color reducida. Además la presente invención se relaciona con un método para reducir el HST de un sustrato de papel aplicando la composición de apresto a al menos una superficie del mismo. Además, la solicitud se relaciona con métodos para hacer y usar la composición de apresto, así como con métodos para hacer y usar el papel que contiene la composición de apresto.|YAN C. HUANG; JAY C. SONG; MICHAEL F. KOENING; SEN YANG; KAPIL M. SINGH; DAVID B. SHELMIDINE; 7 Yale Drive, 10930, Highland Mills, NY, E.U.A.|INTERNATIONAL PAPER COMPANY.*; 6400 Poplar Avenue, 38197, Memphis, TN, E.U.A.|
307475|Patente|MX/a/2011/011936|10/11/2011|20/02/2013|<i>D21H19/66</i> <b>(2006-01)</b>; <i>B41M5/50</i> <b>(2006-01)</b>|CAPA RECEPTORA DE TINTA QUE TIENE UN HUECO.|La presente invención se refiere a un documento de seguridad (7) para producir documentos valiosos, que comprende un sustrato (8) que tiene un elemento de seguridad ópticamente variable (2), el cual puede ser detectado cuando se observa al menos un primer lado del sustrato, y una capa receptora de tinta (6), la cual está arreglada al menos en el primer lado del sustrato, en donde la capa receptora de tinta tiene un primer espesor de capa en una primera área del sustrato situada fuera del área del elemento de seguridad ópticamente variable y un hueco o un espesor de capa reducido comparado con el primer espesor de capa en una segunda área del sustrato (3) en la cual el elemento de seguridad ópticamente variable está arreglado.|RALF LIEBLER; MARKUS KROMBHOLZ; Miesbacher Strasse 29F, 83727, Schliersee, ALEMANIA|GIESECKE & DEVRIENT GMBH.*; Prinzregentenstrasse 159, 81677, München, ALEMANIA|
307476|Patente|MX/a/2011/003083|22/03/2011|20/02/2013|<i>H04W4/14</i> <b>(2009-01)</b>|METODO Y APARATO PARA COMUNICAR SERVICIO DE MENSAJES CORTOS Y MENSAJES DE SERVICIO SUPLEMENTARIO.|Se describen un método y un aparato para permitir el servicio de mensajes cortos (SMS) y servicios suplementarios (SS) en una red evolución a largo plazo (LTE) vía la administración de movilidad del sistema de paquetes evolucionado (EPS) (EMM) sobre el plano de control LTE. En una modalidad, es usado el portador de radio de señalización (SRB) de conexión de control de recursos de radio (RRC) para el transporte de SMS y SS sobre el plano de control LTE entre una unidad de transmisión/recepción inalámbrica (WTRU) y una entidad de administración de movilidad (MME) Se definen interfaces y primitivos EMM para acciones hacia entidades de SMS y SS para permitir los servicios de SMS y SS en LTE vía los medios de plano del control LTE. También son descritos formatos de mensaje para transporte de mensajes SMS y SS para enviar mensajes SMS y SS dentro de mensajes de transporte del estrato sin acceso (NAS) del enlace ascendente (UL) y de transporte NAS del enlace descendente (DL) EMM.|ULISES OLVERA-HERNANDEZ; PETER S. WANG; SHANKAR SOMASUNDARAM; BEHROUZ AGHILI; 2 Rolland Laniel, H9J 4A5, Kirkland, Québec, CANADA|INTERDIGITAL PATENT HOLDINGS, INC.; 200 Bellevue Parkway, Suite 300, Wilmington, 19809, Delaware, E.U.A.|
307477|Patente|MX/a/2010/010102|14/09/2010|20/02/2013|<i>H04W4/22</i> <b>(2009-01)</b>|METODO Y APARATO PARA EL SUMINISTRO DE MENSAJES DE ADVERTENCIA PUBLICOS.|Un método y aparato para que una unidad de transmisión recepción inalámbrica (WTRU) reciba una notificación de situación de emergencia. El método y aparato incluye que la WTRU reciba un mensaje de paginación con una notificación de situación de emergencia y que la WTRU reciba información de programación en un bloque de información de sistema.|JUAN CARLOS ZUNIGA; ULISES OLVERA-HERNÁNDEZ; MOHAMMED SAMMOUR; RAJAT P. MUKHERJEE; SHANKAR SOMASUNDARAM; 955 Rue Gohier Ville St. Laurent, H4L 3J4, Montreal, QC, CANADA|INTERDIGITAL PATENT HOLDINGS, INC.; 200 Bellevue Parkway, Suite 300, Wilmington, 19809, Delaware, E.U.A.|
307478|Patente|MX/a/2010/003340|26/03/2010|20/02/2013|<i>H04L1/00</i> <b>(2006-01)</b>|METODO Y APARATO PARA SELECCIONAR EL TAMAÑO DE LA UNIDAD DE DATOS DE PROTOCOLO DE CONTROL DE RADIOENLACE.|Se usa un método y aparato para crear las PDU de RLC por adelantado de la selección de E-TFC para la PDU de MAC que incluirá esta o estás PDU de RLC. El aparato se puede configurar para pre-generar las PDU de RLC para la transmisión en un TTI posterior. Este planteamiento evita el gran requerimiento de procesamiento pico debido a la estricta restricción de retraso si cualquier PDU de RLC se va a incluir en una PDU de MAC que se haya creado después de la determinación del tamaño de esta PDU de MAC, es decir, después de la selección de E-TFC. El método y aparato mantienen una correspondencia aproximada entre el tamaño de una PDU de RLC y el tamaño de la PDU de MAC que se incluye. El mantenimiento de esta correspondencia aproximada asegura que permanezca baja la proporción de error de las PDU de RLC debido a los errores residuales de HARQ. Este planteamiento se puede designar como "semi-radioconsciente" o "radio-consciente con retraso".|STEPHEN E. TERRY; VINCENT ROY; PAUL MARINIER; DIANA PANI; 15 Summit Avenue, 11768, Northport, New York, E.U.A.|INTERDIGITAL PATENT HOLDINGS, INC.; 200 Bellevue Parkway, Suite 300, Wilmington, 19809, Delaware, E.U.A.|
307479|Patente|MX/a/2010/003595|31/03/2010|20/02/2013|<i>H04L1/18</i> <b>(2006-01)</b>|METODO Y APARATO PARA DESCARTAR PCDP.|Se describen un método y un aparato para descartar una unidad de datos de servicio (SDU) de protocolo de convergencia de paquete de datos (PDCP). Un estrato de PDCP fija un sincronizador y descarta una SDU de PDCP a la expiración del sincronizador. El sincronizador podrá fijarse al recibir la SDU de PDCP de un estrato superior o al suscribir la SDU de PDCP a un estrato inferior para transmisión. El sincronizador y el sincronizador de descarte de control de enlace a radio (RLC) podrán estar coordinados. De manera alternativa, el estrato de PDCP podrá descartar la SDU de PDCP con base a una notificación de un estrato de RLC o con base a un reporte de estado de PDCP.|STEPHEN E. TERRY; MOHAMMED SAMMOUR; 15 Summit Avenue, 11768, Northport, New York, E.U.A.|INTERDIGITAL PATENT HOLDINGS, INC.; 200 Bellevue Parkway, Suite 300, Wilmington, 19809, Delaware, E.U.A.|
307480|Patente|MX/a/2012/000306|26/09/2006|20/02/2013|<i>B01J2/04</i> <b>(2006-01)</b>; <i>B29B9/00</i> <b>(2006-01)</b>; <i>C05C1/00</i> <b>(2006-01)</b>; <i>C05C1/02</i> <b>(2006-01)</b>; <i>C05C11/00</i> <b>(2006-01)</b>; <i>C05C3/00</i> <b>(2006-01)</b>; <i>C05C5/00</i> <b>(2006-01)</b>; <i>C05G3/00</i> <b>(2006-01)</b>|METODO DE GLOBULACION.|Un método para globulación que comprende los pasos de: proporcionar un primer componente fundido, mezclar cuando menos un segundo componente con el primer componente fundido, hacer reaccionar los componentes para formar una mezcla adelgazable por corte; y someter a globulación la mezcla adelgazable por corte, en donde la globulación comprende agitar mecánicamente en la cabeza de globulación para adelgazar por corte la mezcla adelgazable por corte suficientemente para permitir la globulación. El método inventivo se puede utilizar para producir producto fertilizante que comprende nitrato de sulfato de amonio.|JAMES A. KWEEDER; KEITH D. COCHRAN; TIMOTHY G. HOLT; ARTHUR RAY SHIRLEY JR.; 2835 Pine Meadow Circle, 23831, Chester, VA, E.U.A.|HONEYWELL INTERNATIONAL INC.; 101 Columbia Road, 07962, Morristown, New Jersey, E.U.A.|
307481|Patente|MX/a/2009/011188|16/10/2009|20/02/2013|<i>B29B11/14</i> <b>(2006-01)</b>; <i>B29C49/06</i> (2006-01); <i>B29C49/12</i> (2006-01); <i>B29C49/22</i> (2006-01)|BASE DE PREFORMA Y METODO PARA PRODUCIR UNA BASE DE RECIPIENTE DE MULTIPLES CAPAS RESISTENTE A DESLAMINACION Y FISURA.|Preforma moldeada (60) para moldear por soplado un recipiente de plástico para aplicaciones presurizadas, la preforma que tiene una base con una pared de múltiples capas para formar una base de recipiente, con asientos, de múltiples capas, resistente a deslaminación y fisura. La región que forma la base de la preforma tiene una porción de tapa terminal con una pared interior no esférica, que incluye una sección central aplanada unida por secciones arqueadas de esquina a una sección exterior en general cilíndrica. Las secciones de pared interior proporcionan un perfil de espesor variable de tapa terminal que mejora la orientación en porciones seleccionadas de la base de recipiente con asientos para desempeño mejorado y/o aligeramiento de peso de la base de recipiente.|TAPAN Y. PATEL; 27 Hibiscus Way, 03062, Nashua, New Hampshire, E.U.A.|GRAHAM PACKAGING COMPANY, L.P.; 2401 Pleasant Valley Road, 17402, York, Pennsylvania, E.U.A.|
307482|Patente|MX/a/2008/013003|08/10/2008|20/02/2013|<i>A61M5/32</i> <b>(2006-01)</b>|APARATO CON REVESTIMIENTO DE SEGURIDAD Y ESTRUCTURA DE MONTAJE PARA USO CON DISPOSITIVOS DE AGUJA MEDICA.|La presente invención se refiere a un aparato con revestimiento de seguridad que incluye un revestimiento de seguridad y estructura de montaje para montar el revestimiento de seguridad a una aguja médica. El revestimiento de seguridad incluye un segmento distante, un segmento próximo y un miembro de retención. El segmento distante se asegura de manera pivotante al segmento próximo y el segmento próximo se asegura de manera pivotante al miembro de retención. El miembro de retención incluye una abertura para recibir una nariz de un dispositivo de aguja médica, por ejemplo, un dispositivo de colección de sangre. En una modalidad, un collar de retención se proporciona el cual se dimensiona para ser ajustado por apriete alrededor de la nariz del dispositivo de aguja médica para asegurar el revestimiento de seguridad al dispositivo de aguja médica. Alternativamente, la estructura de montaje se forma directamente en el miembro de retención para asegurar el revestimiento de seguridad al dispositivo de aguja médica.|EUGENE E. WEILBACHER; F. MARK FERGUSON; 16488 Dapple Gray Court, 63005, Chesterfield, Missouri, E.U.A.|TYCO HEALTHCARE GROUP LP; 15 Hampshire Street, 02048., Mansfield, Massachusetts, E.U.A.|
307483|Patente|MX/a/2011/012180|15/11/2011|20/02/2013|<i>B32B27/30</i> <b>(2006-01)</b>; <i>B32B27/08</i> <b>(2006-01)</b>; <i>H01L31/042</i> <b>(2006-01)</b>|LAMINA TRANSPARENTE DE BARRERA RESISTENTE A LA INTEMPERIE, PRODUCCION DE LA MISMA POR MEDIO DE LAMINACION, LAMINACION POR EXTURSION O RECUBRIMIENTO POR EXTURSION.|La invención se relaciona con una lámina de barrera, en donde una composición de barrera (5) que consiste de dos láminas portadoras (3) cada una de las cuales contiene una barrera inorgánica (4) (SiOx o AlOx), se combina por laminación o recubrimiento por extrusión con una capa protectora resistente a la intemperie (1), en donde se utiliza un agente de unión como una capa de adhesivo (2).|EKKEHARD BEER; CLAUDIUS NEUMANN; FLORIAN SCHWAGER; GHIRMAY SEYOUM; Adolfsecker Weg 15, 65307, Bad Schwalbach, ALEMANIA|EVONIK RÖHM GMBH; Kirschenallee, 64293, Darmstadt, ALEMANIA|
307484|Patente|MX/a/2009/012166|10/11/2009|20/02/2013|<i>D04B1/14</i> <b>(2006-01)</b>; <i>D04B1/26</i> <b>(2006-01)</b>|TELAS TRICOTADAS Y MEDIAS HECHAS A PARTIR DE ESTAS INCORPORANDO FIBRAS DISCONTINUAS DE NILON CON ALTA RESISTENCIA A LA TRACCION.|La presente invención se refiere a telas tricotadas y medias elaboradas a partir de estas, y a un proceso para producir tales artículos. Las telas son construidas a partir de hilos mezclados que contienen al menos 30% en peso de nilón con alta resistencia a la tracción, el cual imparte resistencia a la abrasión, y al menos una fibra complementaria, la cual es elegida para conferir un atributo deseable específico. Ejemplar es la tela construida a partir del hilo mezclado que contiene fibra discontinua de nilón con alta resistencia a la tracción y fibra discontinua de poliéster, la tela es particularmente útil para la fabricación de medias que demuestran durabilidad mejorada y manejo de humedad.|GREGORY P. WEEKS; JOHN R. HAIGH; MICHAEL PROFIT; 108 Cameron Drive, 19707, Hockessin, Delaware, E.U.A.|INVISTA TECHNOLOGIES S.A.R.L.; Zweigniederlassung St. Gallen, Pestalozzistrasse 2, 9000, St. Gallen, SUIZA|
