Número de concesión|Tipo de documento|Número de solicitud|Fecha de presentación|Fecha de concesión|Clasificación CIP|Título|Resumen|Inventor(es)|Titular
306527|Patente|MX/a/2009/005559|26/05/2009|08/01/2013|<i>A61F13/15</i> <b>(2006-01)</b>; <i>A61F13/20</i> <b>(2006-01)</b>; <i>A61F13/511</i> <b>(2006-01)</b>; <i>A61F13/53</i> <b>(2006-01)</b>|ARTICULOS ABSORBENTES DESECHABLES QUE TIENEN UNA SEÑAL DE DISEÑO INTERIOR.|El artículo absorbente desechable que comprende una señal de diseño interior que indica absorbencia y un núcleo absorbente que incluye una primera y una segunda capas absorbentes, la primera capa absorbente que incluye un primer sustrato y la segunda capa absorbente que incluye un segundo sustrato, las primera y segunda capas, que además incluyen material polimérico particulado absorbente depositado en el primer y segundo sustratos y el material termoplástico que cubre el material polimérico particulado absorbente en el primer y segundo sustratos respectivos, la primera y segunda capas absorbentes combinadas junto con, por lo menos, una porción del material termoplástico de la primera capa absorbente entra en contacto, por lo menos, una porción del material termoplástico de la segunda capa absorbente, el material polimérico particulado absorbente se coloca entre el primer y segundo sustratos en un área de material polimérico particulado absorbente, y el material polimérico particulado absorbente es distribuido, prácticamente, de forma continua a través del área de material polimérico particulado absorbente.|BRUNO JOHANNES EHRNSPERGER.*; MATTIAS SCHMIDT.*; PETER DZIEZOK.; KATHLEEN MARIE LAWSON; ALIZHA VICTORIA RICE; HARALD HERMANN HUNDORF; HOLGER BERUNA; HORST BLESSING; CHRISTOFER FUCHS; MARK JOHN CIESKO; Berliner Strasse 14, 65824, Schwalbach, Hessen, ALEMANIA|THE PROCTER & GAMBLE COMPANY.*; One Procter & Gamble Plaza, 45202, Cincinnati, Ohio, E.U.A.|
306528|Patente|MX/a/2009/007421|09/07/2009|08/01/2013|<i>A61F13/15</i> <b>(2006-01)</b>|NUCLEO ABSORBENTE QUE TIENE ESTRUCTURA MEJORADA.|Un núcleo absorbente para artículos absorbentes desechables, particularmente, para la absorción de flujo menstrual o sangre.|GIOVANNI CARLUCCI; ALESSANDRO GAGLIARDINI.*; Via Fieramosca 118, I-66100, Chieti, ITALIA|THE PROCTER & GAMBLE COMPANY.*; One Procter & Gamble Plaza, 45202, Cincinnati, Ohio, E.U.A.|
306529|Patente|MX/a/2009/013295|04/12/2009|08/01/2013|<i>A45D19/00</i> <b>(2006-01)</b>|ESTUCHE Y METODO PARA APLICACIONES DE TRATAMIENTO PARA EL CABELLO.|La presente invención se refiere a un estuche para el tratamiento del cabello que comprende: a. una o más composiciones para tratar el cabello envasadas individualmente; b. uno o más dispositivos de aplicación de tratamiento para el cabello; en donde al menos un dispositivo de aplicación de tratamiento para el cabello comprende una placa inferior donde la composición para tratar el cabello puede suministrarse y una placa superior que puede colocarse en una relación yuxtapuesta a la porción inferior, y en donde cada una de las placas inferior y superior comprende una superficie interna y externa y en donde las placas inferior y superior están articuladas de forma que cuando la placa superior se lleva a una relación yuxtapuesta a la placa inferior, las superficies internas están en una relación opuesta; y c. al menos un medio de suministro para suministrar dos cantidades predeterminadas de una o más composiciones para tratar el cabello envasadas individualmente a uno o más dispositivos de aplicación de tratamiento para el cabello; y en donde al menos dos cantidades predeterminadas comprenden una primera cantidad predeterminada y una segunda cantidad predeterminada de composición para tratar el cabello, y en donde la primera cantidad predeterminada de composición para tratar el cabello es suministrada al dispositivo de aplicación de tratamiento para el cabello antes de suministrar la segunda cantidad predeterminada de composición para tratar el cabello, caracterizado porque la placa inferior comprende una cavidad para acomodar la composición para tratar el cabello.|ROBERT WAYNE GLENN, JR.; PAUL JAMES SMITH; 7930 Royal Fern Court, 45044, Liberty Township, Ohio, E.U.A.|THE PROCTER & GAMBLE COMPANY.*; One Procter & Gamble Plaza, 45202, Cincinnati, Ohio, E.U.A.|
306530|Patente|MX/a/2009/002420|04/03/2009|08/01/2013|<i>A45D20/22</i> <b>(2006-01)</b>; <i>A45D19/16</i> (2006-01); <i>A45D20/42</i> (2006-01)|METODO Y DISPOSITIVO PARA EL TRATAMIENTO CON VAPOR DEL CUERO CABELLUDO.|El dispositivo 3.2 con un mecanismo de apagado automático y una cubierta de vapor 4 para el tratamiento con vapor del cuero cabelludo 1 de una persona 2. Un sensor 7 para el grabado de los índices de emisión de amoniaco Vx1...Vxn se coloca dentro de la cubierta de vapor 4. El sensor de amoniaco 7 se conecta con una unidad de medición 8 para la medición de índices de emisión de amoniaco Vx1...Vxn, en donde la unidad de medición 8 se conecta con una unidad de control 6. El dispositivo 3.2 o, respectivamente, la cubierta de vapor 4 tiene una unidad de extracción 5 que se controla por la unidad de control 6 y extrae el aire del ambiente en la proximidad de una región frontal (A) (superior) o una región ocular/nasal (B) de la persona (2). Al inicio del tratamiento con vapor to, la unidad de de extracción 5 se activa, automáticamente, por la unidad de control 6. Por convergencia con o por la falta de un Índice de emisión de amoniaco predeterminado 1 la unidad de extracción 5 se desactiva automáticamente. Preferentemente, un ventilador eléctrico 10 que es fácil de controlar (en función encendido/apagado y rendimiento del ventilador) y es muy rentable (Fig. 5), se utiliza como unidad de extracción 5, la cual puede colocarse de manera compacta dentro o sobre la cubierta de vapor 4.|ROBERT KUECHLER; PETER SCHEUNERT; Langener Str. 11, 64546, Moerfelden-Walldorf, ALEMANIA|THE PROCTER & GAMBLE COMPANY.*; One Procter & Gamble Plaza, 45202, Cincinnati, Ohio, E.U.A.|
306531|Patente|MX/a/2009/007840|22/07/2009|08/01/2013|<i>A61F13/15</i> <b>(2006-01)</b>|PAÑAL QUE TIENE PANELES QUE SE ESTIRAN EN LA CADERA.|Un artículo absorbente desechable incluye una estructura y una unidad absorbente en combinación con un elemento de soporte que se extiende circunferencialmente alrededor de la cintura del usuario. El elemento de soporte incluye paneles que se estiran en la cadera. La estructura incluye un lienzo inferior impermeable al agua que se puede doblar hacia adentro en dirección lateral por sus dos bordes laterales y formar aletas laterales opuestas. Cada aleta lateral está unida a la superficie interior de la estructura adyacente a sus bordes extremos. A cada aleta lateral se une un miembro elástico de fruncido que se extiende en dirección longitudinal, adyacente a su borde proximal. La estructura puede incluir material de trama extensible. La unidad absorbente puede unirse a la estructura conforme a un patrón cruciforme para dejar que las porciones de la estructura no unidas se extiendan lateralmente. Las líneas de desgarre quebradizo y/o las líneas de ubicación del desgarre pueden estar formadas para que sea más fácil quitar el artículo del cuerpo del usuario.|GARY DEAN LAVON; KEVIN MICHAEL SMITH; 7071 Darcie Drive, 45011, Liberty Township, Ohio, E.U.A.|THE PROCTER & GAMBLE COMPANY.*; One Procter & Gamble Plaza, 45202, Cincinnati, Ohio, E.U.A.|
306532|Patente|MX/a/2010/012130|05/11/2010|08/01/2013|<i>A61F13/15</i> <b>(2006-01)</b>|ARTICULO ABSORBENTE CON REGIONES COLOREADAS.|Un artículo absorbente que tiene regiones coloreadas. El artículo absorbente tiene, por lo menos, tres regiones coloreadas. Las regiones coloreadas están separadas entre sí. Cada región coloreada tiene un eje mayor. El eje mayor de cada región coloreada converge hacia una región focal común en la línea central longitudinal del artículo absorbente. El propósito de las regiones coloreadas configuradas según se describe en la presente es crear la impresión visual de profundidad, por ejemplo, que el artículo absorbente es lo suficientemente grueso para ofrecer un rendimiento de absorción excelente. Los diseñadores pueden proporcionar una alta capacidad absorbente al emplear materiales absorbentes avanzados que son delgados, pero que pueden absorber una gran cantidad de fluidos. Al crear la impresión visual de profundidad, los diseñadores de artículos absorbentes pueden proporcionar a los consumidores artículos absorbentes que usen menos material esto, por consiguiente, será más económico, mientras aún parezcan gruesos.|NAOMI RUTH NELSON; 1623 Pullan Avenue, 45223, Cincinnati, Ohio, E.U.A.|THE PROCTER & GAMBLE COMPANY.*; One Procter & Gamble Plaza, 45202, Cincinnati, Ohio, E.U.A.|
306533|Patente|MX/a/2011/009624|13/09/2011|08/01/2013|<i>D21F3/02</i> <b>(2006-01)</b>; <i>D21F11/00</i> <b>(2006-01)</b>; <i>D21F5/18</i> <b>(2006-01)</b>; <i>D21F9/00</i> <b>(2006-01)</b>|MAQUINA PAPELERA PARA EL SECADO POR AIRE PASANTE QUE EMPLEA UNA BANDA DE TRANSFERENCIA IMPERMEABLE.|Se describe una máquina papelera (10) para fabricar papel secado con aire pasante sin crepar, que tiene una sección de formación (20), una sección de prensado (30) y una sección de secado (50). La trama de papel está presionada entre dos miembros de prensa (31, 32) mientras está encerrada entre un fieltro prensa (33) y una banda de transferencia (35) que tiene depresiones microscópicas distribuidas de manera no uniforme en su superficie. La trama sigue la banda de transferencia (35) desde la prensa a un punto de transferencia en el que la trama se transfiere mediante un dispositivo de transferencia por succión (38) a un tejido estructurante (37). La trama se seca luego con un secador por aire pasante (52).|ROBERT STANLEY AMPULSKI; 5674 Red Oak Drive, 45014, Fairfield, Ohio, E.U.A.|THE PROCTER & GAMBLE COMPANY.*; One Procter & Gamble Plaza, 45202, Cincinnati, Ohio, E.U.A.|
306534|Patente|MX/a/2012/001588|22/10/2007|08/01/2013|<i>A61K39/145</i> <b>(2006-01)</b>; <i>C07K14/11</i> <b>(2006-01)</b>; <i>C12N15/44</i> <b>(2006-01)</b>|MATERIALES Y METODOS PARA EL CONTROL DE ENFERMEDADES RESPIRATORIAS EN CANINOS.|La presente invención pertenece a virus de la influenza aislados que son capaces de infectar a cánidos, y de causar enfermedad respiratoria en el cánido; la presente invención pertenece también a composiciones y métodos para inducir una respuesta inmune contra un virus de la influenza de la presente invención; la presente invención pertenece también a composiciones y métodos para identificar un virus de la invención, y para diagnosticar infección de un animal con un virus de la invención.|CRAWFORD, PATTI, C.; GIBBS, PAUL, J.; DUBOVI, EDWARD, J.; DONIS, RUBEN, O.; KATZ, JACQUELINE; COX, NANCY, J.; KLIMOV, ALEXANDER I.; CASTLEMAN, WILLIAM L.; 210 NW 79th Drive, 32607, Gainesville, Florida, E.U.A.|UNIVERSITY OF FLORIDA RESEARCH FOUNDATION, INC.; CORNELL RESEARCH FOUNDATION, INC.*; THE GOVERNMENT OF THE UNITED STATES OF AMERICA AS REPRESENTED BY THE SECRETARY OF THE DEPARTMENT OF HEALTH AND HUMAN SERVICES, CENTERS FOR DISEASE CONTROL AND PREVENTION; 223 Grinter Hall, 32611, Gainesville, Florida, E.U.A.|
306535|Patente|MX/a/2009/010006|18/09/2009|09/01/2013|<i>D04H3/03</i> <b>(2012-01)</b>; <i>D01D5/098</i> <b>(2006-01)</b>; <i>D04H3/16</i> <b>(2006-01)</b>|METODO Y APARATO PARA LA DISPERSION DE MANOJO DE FIBRA MEJORADO CON UNA UNIDAD DE JALADO DE FIBRA DIVERGENTE.|Un método y el aparato asociado para extrudir con derretir una tela no tejida incluyen el proporcionar una pluralidad de fibras desde un dispositivo de extrusión. Las fibras son llevadas a través de una parte de perfil divergente de la unidad de jalado de fibras (FDU) que hace que las fibras se esparzan y se expandan en la dirección de la máquina dentro de la unidad de jalado de fibras. Las fibras son entonces llevadas a través de una cámara de difusión divergente espaciada desde la salida de la unidad de jalado de fibras para reducir la velocidad de las fibras y además esparcir las fibras en la dirección de la máquina. Las fibras pueden ser sometidas a una carga electrostática aplicada en cualquiera a la cámara de difusión o la unidad de jalado de fibras. Desde la salida de la cámara de difusión, las fibras son colocadas sobre una superficie formadora como una tela no tejida.|DETLEF FREY; DOUGLAS J. HULSLANDER; ERIC E. LENNON; JOERG HENDRIX; JOHN H. CONRAD; Schlehenweg 5, 53859, Niederkassel, ALEMANIA|KIMBERLY-CLARK WORLDWIDE, INCORPORATED; REIFENHAUSER GMBH & CO. KG MASCHINENFABRIK; 401 North Lake Street, 54956, Neenah, Wisconsin, E.U.A.|
306536|Patente|MX/a/2011/005535|25/05/2011|09/01/2013|<i>B01J19/08</i> <b>(2006-01)</b>; <i>B82B3/00</i> <b>(2006-01)</b>; <i>C09K3/18</i> <b>(2006-01)</b>|MATERIALES DE ALTA REPELENCIA MEDIANTE NANOTOPOGRAFIA Y TRATAMIENTO POSTERIOR.|Se proporciona un método para hacer un material de alta repelencia. En una incorporación el método incluye los pasos de proporcionar un material polimérico que tiene una superficie externa incluyendo una nanotopografia de tipo de partícula, el decapado de la superficie externa con un tratamiento de alta energía; y el depósito del fluoroquimico en la superficie externa decapada mediante un proceso de fluorinacion de plasma.|ROGER B. QUINCY III; ALI YAHIAOUI.*; 5520 Tallantworth Trail, 30040, Cumming, Georgia, E.U.A.|KIMBERLY-CLARK WORLDWIDE, INCORPORATED; 401 North Lake Street, 54956, Neenah, Wisconsin, E.U.A.|
306537|Patente|MX/a/2011/007017|29/06/2011|09/01/2013|<i>A61F13/42</i> <b>(2006-01)</b>; <i>A61F13/44</i> <b>(2006-01)</b>; <i>A61F13/53</i> <b>(2006-01)</b>|SISTEMAS DE DETECCIÓN REMOTA PARA ARTÍCULOS ABSORBENTES.|Están descritos los sistemas de emisión de señales que indican un cambio en un artículo absorbente, tal como la presencia de un fluido del cuerpo. Los varios sistemas de emisión de señales diferentes descritos no incluyen ningunos elementos conductores contenidos sobre el interior del artículo como se requirió en el pasado. En vez de esto, los cambios son vigilados desde la cubierta exterior del artículo. En una incorporación, por ejemplo, las zonas conductoras son formadas directamente en la cubierta exterior para formar el sistema de emisión de señales. Alternativamente, un sensor puede ser montado en la cubierta exterior del artículo para vigilar los cambios dentro del artículo. El sensor puede comprender, por ejemplo, un sensor de temperatura, un sensor de conductividad, un sensor óptico, un sensor de vibración y un sensor de humedad, un sensor de expansión material, un sensor químico o similares.|ANDREW MARK LONG.*; SHIRLEE ANN WEBER.*; JASON C. COHEN; CHUCK R. TOMSOVIC; XUEDONG SONG; THOMAS MICHAEL ALES; SHAWN JEFFERY SULLIVAN; DAVIS-DANG H. HNAN; 1120 Grassy Plains Drive, 54956, Neenah, Wisconsin, E.U.A.|KIMBERLY-CLARK WORLDWIDE, INC.*; 2300 Winchester Road, 54956, Neenah, Wisconsin, E.U.A.|
306538|Patente|MX/a/2011/010599|07/10/2011|09/01/2013|<i>A61K8/89</i> <b>(2006-01)</b>; <i>A47K10/00</i> <b>(2006-01)</b>; <i>A61K8/02</i> <b>(2006-01)</b>; <i>A61Q19/00</i> <b>(2006-01)</b>; <i>C11D17/04</i> <b>(2006-01)</b>|PAÑOS LIMPIADORES HUMEDOS QUE TIENEN UNA COMPOSICION LIMPIADORA LIQUIDA CON UN COMPONENTE EN CONTRA DE LA ADHESION.|La presente descripción generalmente se refiere a paños limpiadores húmedos teniendo composiciones limpiadoras líquidas que incluyen un componente en contra de la adhesión que reduce la adhesión de hoja a hoja, que mejora la altura de la pila, que aumenta la flexibilidad y que mantiene la resistencia en el paño limpiador húmedo. Las composiciones limpiadoras líquidas incluyen un organopolisiloxano que tiene la siguiente estructura: (I) en donde p + q = 0 a 2,000, R1 es independientemente seleccionado del grupo de hidrocarburo monovalente o del grupo de hidroxilo, y R2 y R3 son seleccionados independientemente de un grupo de hidrocarburo monovalente, de un grupo de hidroxilo, de un grupo de hidrocarburo monovalente funcional en amina, de un grupo de hidrocarburo monovalente funcional en poliéter, de un grupo de hidrocarburo monovalente funcional en cuaternario, y de un grupo de hidrocarburo monovalente funcional en polianfolito.|DAVE ALLEN SOERENS; COREY THOMAS CUNNINGHAM; TROY MICHAEL RUNGE; NATHAN JOHN VOGEL; CHRISTOPHER JAMES UECKER; WILLIAM CLAYTON BUNYARD; TIMOTHY JAMES VAN HIMBERGEN; ELIZABETH ORIEL BRADLEY; STEVEN MICHAEL HURLEY; 280 Muttart Road, 54956, Neenah, Wisconsin, E.U.A.|KIMBERLY-CLARK WORLDWIDE, INCORPORATED; 401 North Lake Street, 54956, Neenah, Wisconsin, E.U.A.|
306539|Patente|MX/a/2009/013928|17/12/2009|09/01/2013|<i>G01C21/00</i> <b>(2006-01)</b>; <i>H04B1/40</i> <b>(2006-01)</b>|APARATO INALÁMBRICO|Si se juzga que la información de audio va a ser transmitida cuando se transmite la información de posición por una unidad de control, un dispositivo de radio de un lado de la estación móvil inserta la información de posición en un paquete vacío de información de audio que se va a transmitir por la unidad de control y provoca que una unidad de comunicación de radio transmita el paquete a un dispositivo de radio de un lado de la estación base. Entonces, es posible llevar a cabo la dirección exacta de la posición aún cuando esté presente una comunicación de audio.|YOSHIAKI NUMAI; 6-4-32, Ohnodai, 229-0011, Sagamihara-shi, Kanagawa, JAPON|KABUSHIKI KAISHA KENWOOD; 2967-3 Ishikawa-machi, 192-8525, Hachiouji-shi, Tokio, JAPON|
306540|Patente|MX/a/2010/000119|07/01/2010|09/01/2013|<i>H01Q1/38</i> <b>(2006-01)</b>; <i>E05B65/20</i> <b>(2006-01)</b>; <i>H01R9/05</i> <b>(2006-01)</b>|SISTEMA DE ANTENA PARA APLICACION AUTOMOTRIZ A CONTROL REMOTO.|Un sistema de antena para aplicaciones de control remoto que incluye un módulo de comunicaciones, un tablero de circuito impreso que incluye un conjunto de antena dispuesto en el mismo, y un cable de frecuencia de radio que tiene un primer extremo de conexión y un segundo extremo de conexión. El primer extremo de conexión puede estar acoplado al módulo de comunicaciones y el segundo extremo de conexión puede estar acoplado al tablero de circuito impreso. El segundo extremo de conexión incluye un conductor central para comunicar señales y un escudo coaxial que rodea al conductor central. Una porción del conductor central puede extenderse desde el escudo coaxial y tener un doblez de substancialmente 90 grados arriba de un punto de conexión del tablero de circuito impreso y conductor central.|STEVEN STEANE; VICTOR RABINOVICH; 7 Moon Light Lane, L4C 8J9, Richmond Hill, Ontario, CANADA|FLEXTRONICS AUTOMOTIVE INC.; 365 Passmore Avenue, M1V 4B3, Scarborough, Ontario, CANADA|
306541|Patente|MX/a/2011/002969|18/03/2011|09/01/2013|<i>H02M7/483</i> <b>(2007-01)</b>; <i>H02J9/06</i> <b>(2006-01)</b>|DISPOSITIVO DE CONVERSION DE ENERGIA.|La presente invención se refiere a un convertidor de energía (100) que se proporciona con un inversor (4) para suministrar una carga con energía convirtiendo la energía de corriente directa en energía de corriente alterna; un convertidor (3) para suministrar al inversor (4) con energía convirtiendo la energía de corriente alterna suministrada de un suministro de energía de corriente alterna (1) en energía de corriente directa; un convertidor de voltaje de corriente directa (7) el cual convierte un valor de voltaje de la energía almacenada en un acumulador (8) y suministra al inversor (4) con la energía de corriente directa desde el acumulador (8) cuando el suministro de energía del suministro de energía de corriente alterna (1) es anormal; y un filtro (5), el cual incluye un reactor y un capacitor, y remueve el armónico generado por el inversor (4) El inversor (4) incluye un circuito de tres niveles compuesto de un brazo (4UA) y un conmutador de AC (4UB).|MASAHIRO KINOSHITA; YUSHIN YAMAMOTO; TATSUAKI AMBOH; KAZUHIDE EDUARDO SATO; Toshiba Mitsubishi-Electric Industrial Systems, Corporation, 13-16, Mita 3-chome, 108-0073, Minato-ku, Tokyo, JAPON|TOSHIBA MITSUBISHI-ELECTRIC INDUSTRIAL SYSTEMS CORPORATION.*; 13-16, Mita 3-chome, 108-0073, Minato-ku, Tokyo, JAPON|
306542|Patente|MX/a/2009/003633|03/04/2009|09/01/2013|<i>C21C7/00</i> <b>(2006-01)</b>; <i>B21F1/02</i> <b>(2006-01)</b>|PROCEDIMIENTO E INSTALACION PARA LA INTRODUCCION DE UN HILO FORRADO EN UN BAÑO DE METAL FUNDIDO.|El procedimiento de introducción del hilo forrado (2) en un baño (3) de metal fundido consiste en extraer el hilo forrado de una bobina (9) principalmente desde el núcleo de la bobina, y en arrastrar en desplazamiento hasta el baño (3) de metal, una parte del recorrido del hilo forrado que es realizada en un tubo de guía (13), donde el extremo distal (32) está a una altura determinada (H) de la superficie PP' del baño (3) de metal. El hilo forrado (2) es arrastrado y sometido a una operación de enderezamiento, en las condiciones que no alteran prácticamente su sección sensiblemente circular, y que permiten su introducción y su penetración en la profundidad del baño siguiendo una dirección vertical. La instalación (1) incluye los medios de arrastre (12) del hilo forrado, desde una bobina (9) en la cual la extracción del hilo se realiza desde el núcleo de la bobina, un tubo de guía (13) del hilo forrado (2) donde el extremo distal (32) está a un altura determinada (H) de la superficie del baño (3), y porque tiene una dirección vertical y los medios de enderezamiento (12) del hilo forrado (2) colocados antes de su entrada en el tubo de guía (13), adaptados par darle al hilo forrado (2) una dirección rectilínea sin alteración de su sección circular. De preferencia, los medios de enderezamiento están constituidos de una pluralidad de juegos de dos rodillos de presión, el contacto entre el hilo forrado y cada rodillo de presión se realiza siguiendo una superficie de contacto o siguiendo al menos dos líneas de contacto.|ANDRÉ POULALION; Résidence les Clos des Carmes - 52 rue de Lille, 59300, Valenciennes, FRANCIA|AFFIVAL; 70 rue de I'Abbaye, 59730, Solesmes, FRANCIA|
306543|Patente|MX/a/2009/010882|08/10/2009|09/01/2013|<i>A47K3/02</i> <b>(2006-01)</b>; <i>A47K3/024</i> <b>(2006-01)</b>|ENSAMBLE DE BAÑERA RECONFIGURABLE.|La presente invención se refiere a una bañera para bañar a los infantes o a los niños. La bañera incluye un receptáculo para contener agua y para recibir a un infante. La bañera también incluye una inserción o un miembro de colocación selectivamente removible que puede utilizarse para cambiar el área del baño dentro de la bañera. Cuando el miembro de colocación se bloquea con la bañera, el miembro de colocación define dos posiciones de sentado de infante separadas dentro de la bañera. El miembro de colocación es removible de la bañera para permitir que se utilice el receptáculo completo.|DANIEL DIGNITTI; JOHN L. JONES, JR.; JULIETTE WELCH; 237 Maple Ave., 14075, Hamburg, New York, E.U.A.|MATTEL, INC.*; 333 Continental Blvd., 90245-5012, El Segundo, California, E.U.A.|
306544|Patente|MX/a/2009/005311|19/05/2009|09/01/2013|<i>A61M39/10</i> <b>(2006-01)</b>|CONECTOR DE VALVULA PARA LINEAS MEDICAS.|Un conector de válvula para líneas de infusión médica que incluye un cuerpo tubular externo (1) con un extremo de entrada (4) y un extremo de salida (10), una espiga hueca interna (2) y un miembro de sellado intermedio (3) con una pre-ranura (38) y un elemento hueco elástico formado con miembros de sellado (47, 48) en contacto con la espiga hueca (2) y con un medio de empuje elástico que tiende a mantener la cabeza elástica (35) en una condición de cierre. Un miembro anular (55) que rodea el elemento hueco elástico (36) y se desliza axialmente dentro del cuerpo tubular debido al movimiento de la cabeza elástica entre la condición de cierre y la condición de apertura del conector.|GIANNI GUALA; Strada Villa Zanetti, 28/18, I-10133, Torino, ITALIA|INDUSTRIE BORLA S.P.A.*; Via G. Di Vittorio, 7bis, I-10024, Moncalieri (Torino), ITALIA|
306545|Patente|MX/a/2010/004320|20/04/2010|09/01/2013|<i>B62D53/06</i> <b>(2006-01)</b>|ENSAMBLE DE PIVOTE DE DIRECCION GIRATORIO DE ENGANCHE DE QUINTA RUEDA.|La presente invención se refiere a un ensamble de pivote de dirección, caracterizado porque comprende: un alojamiento que tiene un hueco localizado en el mismo; un miembro de collar operativamente acoplado al miembro de alojamiento; y un pivote de dirección de pieza individual integral que tiene al menos una porción localizada dentro del hueco del alojamiento, en donde el alojamiento y el collar cooperan para asegurar giratoriamente el pivote de dirección dentro del hueco del alojamiento, y en donde el pivote de dirección proporciona un soporte giratorio único para el pivote de dirección con respecto al alojamiento y al collar para la rotación libre del pivote de dirección con respecto al alojamiento subsecuente al ensamble del collar con el alojamiento.|GERALD W. HUNGERINK; RANDY L. SCHUTT.*; STEVEN C. DUPAY.*; RICHARD T. POLANIC.*; DANIEL R. DYKSTRA; ERIC M. TERPSMA; JUSTIN D. KEATLEY; JASON D.C. HOWE; 4682 Beech Street, 49423, Holland, Michigan, E.U.A.|SAF-HOLLAND, INC.; 467 Ottawa Avenue, 49422-2099, Holland, Michigan, E.U.A.|
