Número de concesión|Tipo de documento|Número de solicitud|Fecha de presentación|Fecha de concesión|Clasificación CIP|Título|Resumen|Inventor(es)|Titular
Gaceta: Patentes, Registros de Modelos de Utilidad y de Diseños Industriales Volúmen: Febrero de 2013
307137|Patente|MX/a/2011/000139|11/12/2000|01/02/2013|<i>A61K31/00</i> <b>(2006-01)</b>; <i>A61K31/565</i> <b>(2006-01)</b>; <i>A61P19/10</i> <b>(2006-01)</b>|USOS MEDICOS DE UN MODULADOR DE RECEPTOR DE ESTROGENO SELECTIVO EN COMBINACION CON PRECURSORES DE ESTEROIDES SEXUALES.|(ver fórmula (I)) Métodos novedosos para el tratamiento médico y/o inhibición del desarrollo de osteoporosis, cáncer de mama, hiperlipidemia o aterosclerosis en animales de sangre caliente susceptibles, incluyendo humanos, que implican la administración de modulador del receptor de estrógeno selectivo, particularmente compuestos que tienen la estructura general (I) y una cantidad de un precursor de esteroide sexual seleccionado del grupo que consiste de deshidroepiandrosterona, sulfato de deshidroepiandrosterona, y andros-5-en-3ß,17ß-diol y compuestos convertidos in vivo a uno de los precursores anteriores. Se describe la administración adicional de disfosfonatos en combinación con modular del receptor de estrógeno selectivo y/o un precursor de esteroide sexual para el tratamiento médico y/o inhibición del desarrollo de osteoporosis. También se describen composiciones farmacéuticas para liberar los ingredientes activos y equipos útiles para la invención.|FERNAND LABRIE; 2989 De La Promenade, G1W 2J5, Ste-Foy, Quebec, CANADA|ENDORECHERCHE, INC.; 2989 De La Promenade, G1W 2J5, Ste-Foy, Québec, CANADA|
307138|Patente|MX/a/2008/001317|28/01/2008|01/02/2013|<i>A61K31/734</i> <b>(2006-01)</b>; <i>A61K9/16</i> <b>(2006-01)</b>; <i>A61K9/20</i> <b>(2006-01)</b>; <i>A61K9/50</i> <b>(2006-01)</b>|COMPOSICIONES EN FORMA DE PARTICULAS QUE COMPRENDEN ALGINATO Y/O ACIDO ALGINICO.|Una composición en forma de partículas ingerible comprende: a. un alginato y/o ácido algínico; b. un bicarbonato y/o carbonato; c. Un ácido orgánico; y d. un aglomerante, que es un compuesto tal como un poliol de bajo peso molecular, el cual permite a la composición en forma de partículas fluir aunque sustancialmente no libere partículas finas en el aire. Las composiciones en forma de partículas resultantes tienen características de flujo, supresión de polvo, propiedades organolépticas y estabilidad excelentes. Son muy adecuadas para administración directo en la boca de un paciente, e ingestión para aliviar condiciones esofágicas y gástricas.|IAN GORDON JOLLIFFE; OLAV GASEROD; CHARLES TRAFFORD; ROLF MYRVOLD; C/O Reckitt Benckiser Healthcare (UK) Limited, HU8 7DS, Dansom Lane, Hull, REINO UNIDO|RECKITT BENCKISER HEALTHCARE (UK) LIMITED; 103-105 Bath Road, SL1 3UH, Slough, Berkshire, REINO UNIDO|
307139|Patente|MX/a/2010/004477|23/04/2010|01/02/2013|<i>F01D11/00</i> <b>(2006-01)</b>|MONTAJE DE PALETA DE TURBINA Y BANDA DE SELLO.|La presente invención se refiere a un montaje de paleta de turbina, en particular para una turbina de gas, que comprende un disco (1) con un eje de rotación (6), paletas de turbina (22) cada paleta de turbina (22) tiene un ala (7), una raíz de paleta (11) y una plataforma (14) entre el ala (7) y la raíz de la paleta (11) mediante la cual se puede fijar al disco (1) , placas de aseguramiento (9) y bandas de sello dobladas (10); caracterizado porque las paletas de turbina (22) están dispuestas adyacentes una a la otra sobre el disco (1), de tal manera que los espacios están presentes entre las plataformas (14) de las paletas de turbina adyacentes (22) y las cavidades de raíz (8) están presentes entre las porciones de las raíces (11) de las paletas de turbina adyacentes (22) y en donde las paletas de turbina (22) se aseguran axialmente al disco (1) por medio de placas de aseguramiento (9); en donde las bandas de sello (10) están dispuestas en los espacios entre las plataformas (14) de las paletas de turbinas vecinas (22) para sellar el espacio y sobresalir axialmente sobre la raíz de la paleta (11) y sobre la placa de aseguramiento (9).|RENE JAMES WEBB; PETER LAKE; 6 Normanton Road, NG24 2SX, Newark, Notts, REINO UNIDO|SIEMENS AKTIENGESELLSCHAFT.*; Wittelsbacherplatz 2, 80333, München, ALEMANIA|
307140|Patente|MX/a/2011/000273|07/01/2011|01/02/2013|<i>C07C233/18</i> <b>(2006-01)</b>; <i>A61K31/165</i> <b>(2006-01)</b>; <i>A61K31/17</i> <b>(2006-01)</b>; <i>A61K31/232</i> <b>(2006-01)</b>; <i>A61K31/235</i> <b>(2006-01)</b>; <i>C07C233/49</i> <b>(2006-01)</b>; <i>C07C233/55</i> <b>(2006-01)</b>; <i>C07C235/60</i> <b>(2006-01)</b>; <i>C07C237/22</i> <b>(2006-01)</b>; <i>C07C271/28</i> <b>(2006-01)</b>; <i>C07C275/42</i> <b>(2006-01)</b>; <i>C07C69/587</i> <b>(2006-01)</b>; <i>C07C69/90</i> <b>(2006-01)</b>; <i>C07C69/94</i> <b>(2006-01)</b>; <i>C07D295/192</i> <b>(2006-01)</b>|SALICILATOS ACETILADOS CON ACIDOS GRASOS Y SUS USOS.|La invención se relaciona con Derivados de Salicilatos Acetilados con Ácidos Grasos; con composiciones que comprenden una cantidad efectiva de un Derivado de Salicilato Acetilado con Ácidos Grasos; y con métodos para tratar o prevenir un trastorno inflamatorio que comprende la administración de una cantidad efectiva de un Derivado de Salicilato Acetilado con Ácidos Grasos.|MICHAEL R. JIROUSEK; JEAN E. BEMIS.; JILL C. MILNE; JESSE J. SMITH; 350 Third St. #2204, 02142, Cambridge, Massachusetts, E.U.A.|CATABASIS PHARMACEUTICALS, INC.; 19 Blackstone Street, 02139, Cambridge, Massachusetts, E.U.A.|
307141|Patente|MX/a/2010/007894|16/07/2010|01/02/2013|<i>G06F17/00</i> <b>(2006-01)</b>|SISTEMA DE IDENTIFICACION E INVENTARIO DE VENTA.|Se describe un sistema de identificación de venta interactiva para identificar un objeto de venta basándose en características conocidas o identificadas del objeto maestro, en donde el sistema utiliza una interfaz de usuario gráfico que tiene una pantalla de visualización de computadora para desplegar una pluralidad de campos de entrada relacionados con un objeto de venta y un dispositivo de entrada para seleccionar variables basándose en una inspección física de un objeto maestro conocido que tiene características conocidas o identificables. La interfaz de usuario gráfica se conecta de manera electrónica a una base de datos la cual identifica un objeto de venta específico equivalente al objeto maestro por comparación de las variables de objeto de venta. Los sistemas incluyen una pluralidad de compartimientos para contener los objetos de venta basándose en las variables de objeto de venta y un identificador para identificar el compartimiento que tiene el objeto de venta.|MICHAEL BASS; MICHAEL CHIPCHAK; WILLIAM MUTCH; JAMIE PELTZ; RICHARD RYAI; KEVIN SHEPHARD; 1752 Lakesedge Trail, 44023, Chagrin Falls, Ohio, E.U.A.|HY-KO PRODUCTS COMPANY; 60 Meadow Lane, 44067, Northfield, Ohio, E.U.A.|
307142|Patente|MX/a/2010/002983|18/03/2010|01/02/2013|<i>F16D48/02</i> <b>(2006-01)</b>|ELEMENTO HIDRAULICO.|La presente invención se refiere a un elemento hidráulico (18), en particular para arreglo en una línea de presión (3) entre un cilindro maestro (2) y un cilindro esclavo (4) de un accionamiento de embrague hidráulico (1) , con un alojamiento (19) , el cual tiene una conexión hidráulica (30) del lado del cilindro maestro y una conexión hidráulica (20) del lado del cilindro eslavo y el cual recibe un arreglo de válvula (36), el cual tiene dos cuerpos de válvula (37, 38), los cuales están montados de una manera flotante en el alojamiento (19) y pueden desplazarse en elación uno con el otro contra la tuerza de un resorte (51), el arreglo de válvula (36) comprende un cuerpo de válvula externo (37) y un cuerpo de válvula interno (38), el cuerpo de válvula externo (37) comprende una base de válvula en forma de copa (39) en la cual una sección tubular (44) del cuerpo de válvula interno (38) está montada de una forma desplazable, caracterizado porque la base de válvula (39) y la sección tubular (44) tienen en cada caso al menos un orificio de conexión (48, 49), dichos orificios de conexión pueden colocarse de forma traslapada entre sí como una función de la posición relativa de los cuerpos de válvula (37,38).|THOMAS RAMMHOFER; JAN GRABENSTÄTTER; Waldfeldstrasse 24, 77880, Sasbach, ALEMANIA|SCHAEFFLER TECHNOLOGIES AG & CO. KG.*; Industriestr. 1-3, 91074, Herzogenaurach, ALEMANIA|
307143|Patente|MX/a/2010/010847|01/10/2010|01/02/2013|<i>H04W16/14</i> <b>(2009-01)</b>; <i>H04W88/06</i> <b>(2009-01)</b>; <i>H04W88/10</i> <b>(2009-01)</b>|SISTEMAS Y METODOS PARA DEFINIR CANALES DE CONTROL UTILIZANDO BLOQUES DE RECURSOS RESERVADOS.|Se describen sistemas y metodologías que facilitan la definición de nuevos canales de control en redes inalámbricas de legado; los recursos de datos de control para nuevos sistemas pueden ser definidos sobre recursos reservados para comunicaciones de datos generales en la especificación de red inalámbrica de legado; en este aspecto, los dispositivos de legado pueden seguir siendo soportados por dispositivos que implementan recursos de nuevos datos de control, y los recursos de nuevos datos de control pueden evitar la interferencia sustancial que típicamente es mostrada sobre recursos de señal de referencia y/o control de legado mediante la utilización, mas bien, de recursos de datos generales; además, los nuevos dispositivos de sistema pueden evitar la programación de recursos de comunicación de datos sobre los nuevos recursos de control para crear un segmento de control global sustancialmente no interferido; los datos de control pueden ser transmitidos sobre el segmento utilizando tecnologías basadas en radiobaliza, esquemas de reutilización y/o similar.|AVNEESH AGRAWAL; JUAN MONTOJO; AAMOD D. KHANDEKAR; 5775 Morehouse Drive, 92121-1714, San Diego, California, E.U.A.|QUALCOMM INCORPORATED.*; 5775 Morehouse Drive, 92121-1714, San Diego, California, E.U.A.|
307144|Patente|MX/a/2009/001746|16/02/2009|01/02/2013|<i>H04W84/00</i> <b>(2009-01)</b>; <i>G06Q10/00</i> (2012-01); <i>G06Q20/00</i> (2012-01); <i>G06Q30/00</i> (2012-01); <i>H04B5/00</i> <b>(2006-01)</b>; <i>H04M11/00</i> <b>(2006-01)</b>|SISTEMA Y METODO PARA TRANSACCIONES INALAMBRICAS.|Un sistema y método para utilizar un dispositivo inalámbrico de consumidor (142) en transacciones al por menor utiliza un dispositivo de comunicación fijo (120) que funciona como una estación base para el dispositivo inalámbrico del consumidor (142); el dispositivo de comunicación fijo (120) tiene una zona de cobertura limitada; cuando un dispositivo inalámbrico del consumidor (142) entra a la zona de cobertura del dispositivo de comunicación fijo (120), el dispositivo inalámbrico del consumidor (142) selecciona el dispositivo de comunicación fijo (120) como la estación base preferida e inicia un registro con esa estación base; el dispositivo inalámbrico del consumidor (142) es únicamente identificado con datos ID transmitidos por el dispositivo inalámbrico del consumidor (142) al dispositivo de comunicación fijo (120);: la identificación única es utilizada subsecuentemente en el proceso de terminación de una transacción.|ROBERT G. JR. MECHALEY; 2300 Carillon Point, , Col. Kirkland,, 98033, Washington,, E.U.A.|MOBILESPHERE HOLDINGS LLC; 2300 Carillon Point, Kirkland, 98033, Washington, E.U.A.|
307145|Patente|MX/a/2011/008274|05/08/2011|01/02/2013|<i>B02C18/10</i> <b>(2006-01)</b>; <i>B02C17/16</i> <b>(2006-01)</b>; <i>B02C18/06</i> <b>(2006-01)</b>; <i>B02C18/16</i> <b>(2006-01)</b>; <i>B02C18/18</i> <b>(2006-01)</b>; <i>B02C18/22</i> <b>(2006-01)</b>; <i>B02C21/00</i> <b>(2006-01)</b>; <i>B02C25/00</i> <b>(2006-01)</b>; <i>C12C7/01</i> <b>(2006-01)</b>; <i>C12C7/04</i> <b>(2006-01)</b>; <i>C12C7/06</i> <b>(2006-01)</b>; <i>C12C7/14</i> <b>(2006-01)</b>|METODO DE PREPARACION DE UN EXTRACTO LIQUIDO DE GRANOS DE CEREALES Y EQUIPO ADECUADO PARA USO EN EL MISMO.|La presente invención proporciona un método continuo de preparar un extracto líquido de granos de cereal por trituración de los granos de cereal a una velocidad de al menos 100 kg de granos de cereal seco por hora y extracción de los granos de cereal triturados con un líquido, dicho método que comprende: -combinar continuamente granos de cereal con un líquido; -desintegrar continuamente las partículas de granos contenidas en el líquido por colisión libre de las partículas de granos suspendidas con una o más cuchillas rotatorias, produciendo así una suspensión molida;- transferir continuamente al menos una parte de la suspensión molida, opcionalmente después de tratamiento adicional, a un dispositivo de separación para separación en granos agotados y extracto líquido; en donde la una o más cuchillas rotatorias son rotadas a una velocidad periférica de al menos 10 m/s; la energía mecánica total transferida a la suspensión molida por la una o más cuchillas rotatorias está en el intervalo de 5 a 1000 kJ por kg de granos de cereal seco; y la distancia entre un extremo de la una o más cuchillas rotatorias y el eje de rotación está en el intervalo de 2 a 25 cm. La invención también proporciona un sistema que comprende un equipo de molienda y un dispositivo de separación adecuado para uso en el método anteriormente mencionado. El método y sistema de la presente ofrecen varias ventajas, que incluyen ahorro de capital de inversión y mantenimiento, tiempos de molienda cortos y diseño higiénico.|HENDRIKUS MULDER; CORNELIS VAN RIJN; Prinses Irenelaan 20, NL-1911, HW Uitgeest, PAISES BAJOS|HEINEKEN SUPPLY CHAIN B.V.; Burgemeester Smeetsweg 1, NL-2382, PH Zoeterwoude, PAISES BAJOS|
307146|Patente|MX/a/2011/010677|10/10/2011|01/02/2013|<i>C23F11/04</i> <b>(2006-01)</b>; <i>C09K8/54</i> <b>(2006-01)</b>; <i>C09K8/74</i> <b>(2006-01)</b>; <i>C23F11/10</i> <b>(2006-01)</b>; <i>C23F11/14</i> <b>(2006-01)</b>; <i>C23F11/16</i> <b>(2006-01)</b>|COMPOSICIONES INHIBIDORAS DE CORROSION QUE COMPRENDEN EL PRODUCTO DE REACCION FORMADO A PARTIR DE UN ALDEHIDO CON UNA ESTRUCTURA DE ANILLO TIOL Y/O AMINA FUNCIONALIZADA Y METODOS ASOCIADOS.|La presente invención se refiere a métodos y composiciones que incluyen un método que comprende poner en contacto una superficie de metal con un fluido acídico que comprende un inhibidor de corrosión que comprende un producto de reacción formado de una reacción directa o indirecta de un aldehído con una estructura de anillo tiol y/o amina funcionalizada. Una composición proporcionada incluye un fluido de tratamiento acídico que comprende un fluido de base acuosa, y ácido, y un inhibidor de corrosión que comprende un producto de reacción formado de una reacción directa o indirecta de un aldehído con una estructura de anillo tiol y/o amina funcionalizada.|JIM L. LANE; JUANITA, M. CASSIDY; CHAD, E. KISER; 511 N. 11Th Street, 73533, Duncan, Oklahoma, E.U.A.|HALLIBURTON ENERGY SERVICES, INC.*; 10200 Bellaire Boulevard, 77072, Houston, Texas, E.U.A.|
307147|Patente|MX/a/2011/006571|17/06/2011|01/02/2013|<i>C08F10/02</i> <b>(2006-01)</b>; <i>C08F10/00</i> <b>(2006-01)</b>; <i>C08F4/6592</i> <b>(2006-01)</b>|PROCESO PARA PRODUCIR POLIMEROS DE DISTRIBUCION DE PESO MOLECULAR MAS AMPLIA CON UNA DISTRIBUCION DE COMONOMERO INVERSA Y NIVELES BAJOS DE RAMIFICACIONES DE CADENA LARGA.|La presente invención proporciona un proceso de polimerización que se lleva a cabo por el contacto de un monómero de olefina y al menos un comonómero de olefina en presencia de hidrógeno y una composición de catalizador a base de metaloceno También se proporcionan los polímeros producidos desde el proceso de polimerización, y estos polímeros tienen una distribución comonomérica inversa, bajos niveles de ramificaciones de cadena larga y una relación de Mw/Mn de aproximadamente 3 a aproximadamente 6|DAVID C. ROHLFING; PAUL J. DESLAURIERS; CHUNG CHING TSO; QING YANG; TONY R. CRAIN; RANDALL S. MUNINGER; JEFFREY S. FODOR; MAX P. MCDANIEL; JERRY T. LANIER; JOEL L. MARTIN; 1208 SE Melmart Drive, 74006, Bartlesville, Oklahoma, E.U.A.|CHEVRON PHILLIPS CHEMICAL COMPANY LP.*; 10001 Six Pines Drive, 77380, The Woodlands, Texas, E.U.A.|
307148|Patente|MX/a/2011/010878|14/10/2011|01/02/2013|<i>H04W84/08</i> <b>(2009-01)</b>|METODO PARA INICIAR UNA COMUNICACION MIENTRAS SE PARTICIPA EN OTRA COMUNICACION.|Dentro de un sistema de comunicación de radiofrecuencia de dos vías, una repetidora transmite una identidad de un canal de descanso cuando transmite durante una llamada de comunicación activa en un canal diferente al canal de descanso; una unidad de abonado que se comunica dentro de la comunicación activa, recibe la identidad del canal de descanso, abandona la comunicación activa, e inicia una nueva comunicación en el canal de descanso.|DAVID G. WIATROWSKI; THOMAS B. BOHN; SATYANARAYAN R. PANPALIYA; DIPENDRA M. CHOWDHARY; 740 Anne Street, 60098, Woodstock, Illinois, E.U.A.|MOTOROLA SOLUTIONS, INC.; 1303 East Algonquin Road, 60196, Schaumburg, Illinois, E.U.A.|
307149|Patente|PA/a/2005/009868|14/09/2005|01/02/2013|<i>C07C2/08</i> <b>(2006-01)</b>; <i>B08B9/00</i> <b>(2006-01)</b>|PROCESO PARA PREVENIR O ELIMINAR LA CORROSION DE LA DESCOMPOSICION DE CATALIZADORES OLEFINICOS QUE CONTIENEN HALUROS.|Se proporciona un proceso para inhibir o limitar la descomposición de sistemas catalizadores de oligomerización que contienen haluros, durante la recuperación de un producto de oligomerización. El proceso incluye la desactivación de un sistema catalizador de oligomerización presente en una corriente efluente del reactor de oligomerización de olefinas por contacto con un alcohol bajo condiciones que minimizan el potencial de descomposición del sistema catalizador desactivado. Dichas condiciones incluyen la minimización del contenido de agua del agente de desactivación y la concentración del agente de desactivación.|BRUCE E. KREISCHER; WARREN M. EWERT; RONALD D. KNUDSEN; 20443 Crimson Oak Trail, 77346, Kingwood, Texas, E.U.A.|CHEVRON PHILLIPS CHEMICAL COMPANY; 10001 Six Pines Drive, 77380, The Woodlands, Texas, E.U.A.|
307150|Patente|MX/a/2011/006565|17/06/2011|01/02/2013|<i>H02J7/00</i> <b>(2006-01)</b>; <i>H01M10/46</i> <b>(2006-01)</b>|DISPOSITIVO DE CARGA SIN CONTACTO DE TIPO RESONANTE.|El dispositivo de carga sin contacto de tipo resonante incluye una alimentación de energía de alta frecuencia, una bobina resonante del lado primario, una bobina resonante del lado secundario, un cargador, una batería secundaria y una unidad de control de paro. La bobina resonante del lado primario recibe la energía de alta frecuencia suministrada por la alimentación de energía de alta frecuencia. La bobina resonante del lado secundario está ubicada en forma separada de la bobina resonante del lado primario de manera que no están en contacto. La bobina resonante del lado secundario recibe la energía de la bobina resonante del lado primario por la resonancia magnética entre la bobina resonante del lado primario y la bobina resonante del lado secundario. El cargador recibe la energía de alta frecuencia suministrada por la bobina resonante del lado secundario. La batería secundaria está conectada al cargador. La unidad de control de paro detiene el suministro de energía de alta frecuencia antes que al cargador cuando el proceso de carga va a ser detenido.|KAZUYOSHI TAKADA; SADANORI SUZUKI; KENICHI NAKATA; SHIMPEI SAKODA; YUKIHIRO YAMAMOTO; SHINJI ICHIKAWA; c/o Kabushiki Kaisha Toyota Jidoshokki, 2-1, Toyota-Cho, 448-8671, Kariya-Shi, Aichi-Ken, JAPON|TOYOTA JIDOSHA KABUSHIKI KAISHA; 1, Toyota-Cho, 471-8571, Toyota-Shi, Aichi-Ken, JAPON|
307151|Patente|MX/a/2008/011583|10/09/2008|01/02/2013|<i>A47F1/04</i> <b>(2006-01)</b>|EXHIBIDOR MULTICOMPONENTE Y SISTEMAS DE MERCANCIA.|Un divisor multicomponente que incluye un primer componente divisor y un mecanismo de conexión para un segundo componente divisor. El segundo componente divisor se conecta al primer componente divisor cuando el primer componente divisor está conectado a una base. El segundo componente divisor se extiende por encima del primer componente divisor, extendiendo por lo tanto la altura total del divisor. La base y divisor multicomponente pueden ser usados en lugares donde exista espacio limitado entre anaqueles, como un anaquel en un congelador o exhibidor refrigerado, o en cualquier aplicación donde pueda preferirse un divisor más alto, pero no puede ser instalado.|STEPHEN N. HARDY; 383 Barbara Circle, 44281, Wadsworth, Ohio, E.U.A.|RTC INDUSTRIES INC.; 2800 Golf Road, 60008, Rolling Meadows, Illinois, E.U.A.|
307152|Patente|PA/a/2006/001099|27/01/2006|31/01/2012|<i>C07D413/14</i> <b>(2006-01)</b>; <i>A61K31/505</i> <b>(2006-01)</b>; <i>A61P37/00</i> <b>(2006-01)</b>; <i>C07D413/12</i> <b>(2006-01)</b>; <i>C07D417/12</i> <b>(2006-01)</b>|METODO DE TRATAMIENTO O PREVENCION DE ENFERMEDADES AUTOINMUNES CON COMPUESTOS 2,4-PIRIMIDINDIAMINA.|La presente invención se refiere a métodos de tratamiento o prevención de enfermedades autoinmunes con los compuestos 2,4-pirimidindiamina, así como también a métodos de tratamiento, prevención o mejoramiento de síntomas asociados con tales enfermedades. Ejemplos, específicos de enfermedades autoinmunes que pueden ser tratadas o prevenidas con los compuestos incluyen, artritis reumatoide y/o sus síntomas asociados, lupus eritematoso sistémico y/o sus síntomas asociados y esclerosis múltiple y/o sus síntomas asociados.|HUI LI; RAJINDER SINGH; ANKUSH ARGADE; JEFFREY CLOUGH; SOMASEKHAR BHAMIDIPATI; CATHERINE SYLVAIN; DAVID CARROLL; HOLGER KEIM; 832 Hillman Avenue, 94002, Belmont, California, E.U.A.|RIGEL PHARMACEUTICALS, INC.; 1180 Veterans Boulevard, 94080, South San Francisco, California, E.U.A.|
307153|Patente|MX/a/2008/011328|04/09/2008|01/02/2013|<i>B23P19/00</i> <b>(2006-01)</b>|APARATO PARA INSERCION DE TERMINAL.|La presente invención describe proporcionar un aparato de inserción de terminal para insertar una terminal en una cámara de recepción de terminal sin golpear una superficie interior de la cámara de recepción de terminal. Un aparato de inserción de terminal incluye una unidad de soporte de alojamiento, una unidad de inserción, y un dispositivo de control. La unidad de soporte de alojamiento sujeta un alojamiento de conector y es móvil en una dirección horizontal y una dirección vertical. La unidad de inserción inserta una terminal unida con un cable eléctrico en una cámara de recepción de terminal del alojamiento de conector. El dispositivo de control controla un porción de soporte de la unidad de movimiento para hacer oscilar un soporte de alojamiento por una distancia de movimiento después de una porción de extremo de la terminal es insertada en la cámara de recepción de terminal con el propósito de que la terminal pueda ser insertado sin golpear una superficie interior de la cámara de recepción de terminal.|HIROSHI FURUYA; KAZUHIKO SUGIMURA; co Yazaki Parts Co., Ltd., 206-1, Nunohikihara, 421-0407, Makinohara-shi, Shizuoka, JAPON|YAZAKI CORPORATION.*; 4-28, Mita 1-chome, 108-8333, Minato-ku, Tokio, JAPON|
307154|Patente|MX/a/2010/004640|28/04/2010|01/02/2013|<i>D21F1/00</i> <b>(2006-01)</b>|METODO Y DISPOSITIVO PARA PRODUCCION DE MALLAS HELICOIDALES.|La invención se relaciona con un método y un dispositivo para la producción de mallas (12) helicoidales mediante arrollado de alambres (2) producidas de plástico en espirales (5) individuales, las cuales son insertadas la una en la otra en forma solapada en dirección transversal en una superficie (10) de trabajo y que son unidas, paralelas entre sí, mediante alambres (11) pasadores para formar mallas permeables. Con la finalidad de lograr el objetivo de ofrecer un método y un dispositivo que permite producir bandas de mallas de espirales y alambres pasadores con pocos costes de personal, energía e inversión (costo de equipo), y una cantidad baja de desperdicios y con gran precisión y reproducibilidad con poco consumo de tiempo, la invención propone que las espirales (5) sean depositadas en dispositivos (4) de arrollado mediante unos dispositivos (9) de acoplamiento desplazables una junto a la otra en la superficie (10) de trabajo después del arrollado y que sean acopladas en la superficie (10) de trabajo referida mediante un desplazamiento transversal y conectadas entre sí mediante alambres (11) pasadores.|WOLFGANG BACHMANN; MARCEL JULIEN; PASCAL JULIEN; Am Feldrand 7, 64853, Otzberg, ALEMANIA|NOVA BAUSYSTEME GMBH; Wilhelm-Beer-Weg 42, 60599, Frankfurt am Main, ALEMANIA|
307155|Patente|MX/a/2009/014181|21/12/2009|01/02/2013|<i>A61K31/4748</i> <b>(2006-01)</b>; <i>A61K31/485</i> <b>(2006-01)</b>; <i>A61P25/00</i> <b>(2006-01)</b>; <i>A61P25/18</i> <b>(2006-01)</b>; <i>C07D489/08</i> (2006-01)|REMEDIO O PREVENTIVO PARA SINDROME DE DISFUNCION DE INTEGRACION.|La presente invención apunta a proporcionar un agente terapéutico o profiláctico para esquizofrenia, el cual agente terapéutico o profiláctico puede tratar síntomas especialmente positivos de esquizofrenia y no ocasiona procesamiento de información perjudicial relacionado con deficiencias cognitivas o similares ,lo cual es un síntoma de esquizofrenia esto es, un agente terapéutico o profiláctico para esquizofrenia comprendiendo como un ingrediente efectivo un compuesto teniendo un esqueleto de morfinanano especifico representado por el compuesto 1 siguiente a una sal de adición de acido farmacéuticamente aceptable del mismo fue previsto.|SATORU YOSHIKAWA; HIDENORI MOCHIZUKI; 10-1, Tebiro 6-Chome, 248-8555, Kamakura-Shi, Kanagawa, JAPON|TORAY INDUSTRIES, INC.; 1-1, Nihonbashi Muromachi 2-chome, 103-8666, Chuo-ku, Tokyo, JAPON|
