Número de concesión|Tipo de documento|Número de solicitud|Fecha de presentación|Fecha de concesión|Clasificación CIP|Título|Resumen|Inventor(es)|Titular
339733|Patente|MX/a/2012/015254|19/12/2012|08/06/2016|<i>A23L29/212</i> <b>(2016-01)</b>; <i>A23L33/125</i> <b>(2016-01)</b>; <i>A23L7/122</i> <b>(2016-01)</b>|RECUBRIMIENTOS DE AZUCAR REDUCIDOS EN SACAROSA PARA CEREALES, Y METODOS DE PREPARACION.|La presente invención se refiere a recubrimientos de azúcar mejorados para productos alimenticios tópicamente pre-endulzados que son reducidos en azúcar ya sea en forma de un jarabe o en forma de un recubrimiento seco. La forma de jarabe es útil como un producto intermedio en la preparación de productos alimenticios pre-endulzados. En forma seca, las presentes formulaciones pueden ser una parte componente de un producto alimenticio compuesto especialmente en forma de un recubrimiento tópico o relleno. La presente invención es particularmente adecuada para la preparación de cereales pre-endulzados listos para comerse. Las formulaciones de recubrimiento comprenden menos de 70% de sacarosa, jarabe de maíz y 1 a 20% de almidón integrado no hidratado y preferiblemente alrededor de 5 a 10% de sales minerales insolubles, cada uno con un tamaño de partícula de aproximadamente 50 micras.|DANIEL R. GREEN [US]; CHRISTOPHER J. BARRETT [US]; PATRICK C. DREESE [US]; CHRISTINE M. NOWAKOWSKI [US]; FERN A. PANDA [US]; SCOTT K. WHITMAN [US]; VICTOR T. HUANG [US]; Minnetonka, Minnesota, 55306, US|GENERAL MILLS, INC.* [US]; Minneapolis, Minnesota, 55440, US|
339734|Patente|MX/a/2013/007259|21/06/2013|07/06/2016|<i>A61C17/34</i> <b>(2006-01)</b>|IMPLEMENTO PARA CUIDADO ORAL.|Un cepillo de dientes que gira alrededor de un eje longitudinal. En un aspecto, la invención puede ser un cepillo de dientes que comprende: una cabeza; un mango que se extiende a lo largo de un eje longitudinal y que tiene una superficie de base plana; un dispositivo vibrador mecánico operativamente conectado a una fuente de energía, el dispositivo vibrador mecánico que comprende una excéntrica impartiendo movimiento a la cabeza cuando se activa; y en donde la superficie de base plana está orientada relativa al eje longitudinal del mango de manera que el cepillo de dientes puede posicionarse en una orientación vertical de auto-soporte sobre una superficie plana horizontal, y en donde cuando el cepillo, de dientes se posiciona en la orientación vertical de auto-soporte y el dispositivo vibrador mecánico se activa, el cepillo de dientes gira alrededor del eje longitudinal mientras se mantiene la orientación vertical de. Auto-soporte.|EDUARDO JIMENEZ [US]; Manalapan, New Jersey, 07725, US|COLGATE-PALMOLIVE COMPANY [US]; New York, New York, 10022, US|
339735|Patente|MX/a/2013/005354|13/05/2013|07/06/2016|<i>A61M29/04</i> <b>(2006-01)</b>; <i>A61F13/20</i> <b>(2006-01)</b>; <i>A61F6/06</i> <b>(2006-01)</b>; <i>A61M3/00</i> <b>(2006-01)</b>; <i>A61M31/00</i> <b>(2006-01)</b>; <i>A61M37/00</i> <b>(2006-01)</b>|DISPOSITIVOS INTRAVAGINALES PARA EL SUMINISTRO CONTROLADO DE LUBRICANTES.|La presente tecnología proporciona dispositivos intravaginales diseñados para entregar lubricantes a la vagina por un período sostenido de tiempo. Los dispositivos intravaginales incluyen un primer segmento que comprende una superficie exterior y un lumen que contiene un lubricante, en donde el primer segmento está configurado para entregar los contenidos del lumen a la superficie exterior, y el primer segmento comprende un polímero seleccionado del grupo que consiste de un elastómero hidrofílico semi-permeable y un elastómero hidrofóbico. El lubricante puede ser un lubricante acuoso. La presente tecnología proporciona además un dispositivo intravaginal que incluye un primer segmento sólido que incluye un elastómero hidrofílico semi-permeable, una superficie exterior y un lubricante acuoso, en donde el primer segmento está configurado para entregar el lubricante acuoso a la superficie exterior.|PATRICK F. KISER [US]; Salt Lake City, Utah, 84102, US|THE UNIVERSITY OF UTAH RESEARCH FOUNDATION [US]; Salt Lake City, Utah, 84108, US|
339736|Patente|MX/a/2012/009026|03/08/2012|07/06/2016|<i>C01B11/02</i> <b>(2006-01)</b>|SISTEMA Y METODO PARA GENERAR DIOXIDO DE CLORO.|Algunos sistemas para generar dióxido de cloro incluyen una composición generadora de dióxido de cloro que comprende una sal de clorito alcalina, ácido, celulosa, un superabsorbente, y opcionalmente un surfactante. Los sistemas dados a conocer en este documento son capaces de generar gas de dióxido de cloro, solución de dióxido de cloro, y solución de dióxido de cloro con surfactantes. Algunos sistemas para generar dióxido de cloro incluyen un depósito que contiene una composición generadora de dióxido de cloro. El depósito incluye por lo menos una región porosa que se coloca en el exterior del depósito en comunicación fluida con un interior del depósito. La región porosa, que en algunas modalidades, se realiza como una malla, se caracteriza por un tamaño en el intervalo de aproximadamente malla 20 a aproximadamente malla 325.|JOHN APPADURAI THANGARAJ [US]; Edison, New Jersey, 08820, US|SIPKA INC.* [US]; Edison, New Jersey, 08820, US|
339737|Patente|MX/a/2012/003355|21/03/2012|07/06/2016|<i>B32B27/08</i> <b>(2006-01)</b>; <i>B29C45/14</i> <b>(2006-01)</b>; <i>B29C45/16</i> <b>(2006-01)</b>; <i>B32B27/18</i> <b>(2006-01)</b>; <i>B32B27/36</i> (2006-01); <i>B32B7/02</i> <b>(2006-01)</b>|SISTEMAS COMBINADOS MULTICOMPONENTE MOLDEADOS POR INYECCION CON COMPORTAMIENTO MEJORADO ANTE EL FUEGO.|Mediante la presente invención, se ponen a disposición sistemas combinados multicomponente total o parcialmente moldeados por inyección con comportamiento mejorado ante el fuego y un procedimiento para su fabricación.|HAHN, RÜDIGER [DE]; SCHWECKE, CONSTANTIN [DE]; MÜLLER, ANDREAS [DE]; FRANSSEN, HANS [NL]; Burscheid, 51399, DE|BAYER MATERIALSCIENCE AG [DE]; Leverkusen, Leverkusen, 51368, DE|
339738|Patente|MX/a/2014/012484|16/10/2014|07/06/2016|<i>C08F2/22</i> <b>(2006-01)</b>; <i>C08L55/02</i> <b>(2006-01)</b>; <i>C08L69/00</i> <b>(2006-01)</b>|COMPOSICIONES DE ABS QUE TIENEN UNA SUPERFICIE MEJORADA TRAS SU ALMACENAMIENTO EN UN AMBIENTE CALIDO Y HUMEDO.|La invención se refiere a composiciones poliméricas que contienen A) de 0 a 98 partes en peso, con respecto a la suma de A y B, de un polímero termoplástico o una mezcla de varios polímeros termoplásticos distintos de B; y B) de 2 a 100 partes en peso, con respecto a la suma de A y B, de B1) al menos un polímero de injerto producido en un procedimiento de polimerización en emulsión, B2) opcionalmente, al menos un polímero de injerto producido en un procedimiento de polimerización en masa, polimerización en suspensión o polimerización en solución, B3) opcionalmente, al menos un (co)polímero de vinilo exento de caucho; y C) de 0 a 30 partes en peso de al menos un aditivo polimérico convencional, siendo la suma de las partes en peso de A y B igual a 100. La invención se caracteriza porque (i) la composición contiene al menos una sal inorgánica constituida por un catión seleccionado del grupo que comprende metales alcalinos, metales alcalinotérreos y aluminio, y un anión seleccionado del grupo constituido por cloruro, sulfato, nitrato, fosfato, acetato y formiato a una concentración de 100 a 5.000mglkg con respecto a la composición; y (ii) dicha sal de la composición se proporciona exclusivamente en forma disuelta o en forma de inclusiones amorfas o cristalinas que tienen un tamaño inferior a 60 µm. Las composiciones poliméricas develadas se caracterizan por una superficie mejorada tras su almacenamiento en un ambiente cálido y húmedo, y son adecuadas, en particular, para la producción de artículos moldeados o piezas moldeadas que tienen requisitos de superficie de Clase A y un acabado de alto brillo, tras someterse opcionalmente, parcial o totalmente, a una etapa de tratamiento superficial adicional, por ejemplo, pintado, moldeo por inserción de película, metalización por deposición al vacío o electrodeposición.|WENZ, ECKHARD [DE]; THIEM, HANS-JÜRGEN [DE]; SEIDEL, ANDREAS [DE]; KLANKERS, HANS-JÜRGEN [DE]; MANNEL, BIRGIT [DE]; HOBEIKA, SVEN [DE]; HERMSDORFER, INGMAR [DE]; Köln, 50937, DE|BAYER MATERIALSCIENCE AG [DE]; Leverkusen, Leverkusen, 51368, DE|
339739|Patente|MX/a/2013/001937|18/02/2013|07/06/2016|<i>A01N43/653</i> <b>(2006-01)</b>; <i>A01N43/40</i> <b>(2006-01)</b>; <i>A01N43/713</i> <b>(2006-01)</b>; <i>C07D249/14</i> <b>(2006-01)</b>; <i>C07D257/06</i> <b>(2006-01)</b>; <i>C07D401/12</i> <b>(2006-01)</b>|N-(TETRAZOL-5-IL)-Y N-(TRIAZOL-5-IL)ARILCARBOXAMIDAS Y SU USO COMO HERBICIDAS.|Se describen N-(tetrazol-5-il)- y N-(triazol-5-iI)arilcarboxamidas de la fórmula (I) como herbicidas. (Ver Formula) En esta fórmula (I), X, Y, Z y R representan radicales tales como hidrógeno, radicales orgánicos tales como alquilo y otros radicales tales como halógeno. A y B representan N y CY.|WILLMS, LOTHAR [DE]; VAN ALMSICK, ANDREAS [DE]; AHRENS, HARTMUT [DE]; HEINEMANN, INES [DE]; ROSINGER, CHIRSTOPHER HUGH [GB]; HÄUSER-HAHN, ISOLDE [DE]; GATZWEILER, ELMAR [DE]; KÖHN, ARNIM [DE]; BRAUN, RALF [DE]; DÖRNER-RIEPING, SIMON [DE]; Hofheim, 65719, DE|BAYER INTELLECTUAL PROPERTY GMBH [DE]; Monheim, 40789, DE|
339740|Patente|MX/a/2013/013314|14/11/2013|07/06/2016|<i>A61M5/50</i> <b>(2006-01)</b>; <i>A61M5/20</i> <b>(2006-01)</b>|DISPOSITIVO PARA INYECCION.|Se describe un dispositivo para inyección (100) que consiste en una base (104), un cuerpo deslizante (116) conectado de manera deslizable a la base (104), una aguja con doble extremo (120) fijada al cuerpo deslizante (116), un miembro de empuje (124) para empujar hacia el lado proximal el cuerpo deslizante (116) con respecto a la base (104) y para retraer la aguja (120) hacia el dispositivo (100) después de la activación del dispositivo (100), un cartucho de medicamento (128) para contener un medicamento, conectado de manera deslizable al cuerpo deslizante (116) y un tapón (132) colocado de manera deslizable dentro del cartucho de medicamento (128) La base (104) tiene un extremo proximal (108) y una superficie (164) ubicada en un extremo distal (112) de ésta para hacer contacto con la piel de un usuario. La base (104) tiene un primer mecanismo de enclavamiento. El cuerpo deslizante (116) tiene una característica de enclavamiento y un segundo mecanismo de enclavamiento. El segundo mecanismo de enclavamiento boquea el cartucho de medicamento (128) respecto al cuerpo deslizante (116) cuando termina el desplazamiento del cartucho de medicamento (128) respecto al cuerpo deslizante (116). El primer mecanismo de enclavamiento y la característica de enclavamiento interaccionan para bloquear el miembro deslizante (116) respecto a la base luego de la retracción de la aguja (120) hacia el dispositivo (100).|RICHARD CRONENBERG [US]; Mahwah, NJ, 07430, US|BECTON, DICKINSON AND COMPANY [US]; Franklin Lakes, New Jersey, 07417-1880, US|
339741|Patente|MX/a/2015/000010|07/01/2015|07/06/2016|<i>H04H20/28</i> <b>(2008-01)</b>; <i>H04H20/95</i> <b>(2008-01)</b>; <i>H04N21/2362</i> <b>(2011-01)</b>; <i>H04N21/434</i> <b>(2011-01)</b>; <i>H04N21/6336</i> <b>(2011-01)</b>; <i>H04N21/6373</i> <b>(2011-01)</b>; <i>H04N7/015</i> <b>(2006-01)</b>; <i>H04N7/08</i> <b>(2006-01)</b>|APARATO DE TRANSMISION/RECEPCION DE SEÑALES Y METODO DE TRANSMISION/RECEPCION DE SEÑALES.|La presente invención se refiere a un aparato de transmisión/recepción de señales y a un método de transmisión/recepción de señales. De acuerdo con una modalidad de la presente invención se proporciona un método de transmisión de señales, el método que comprende: una etapa (S110) de codificar los datos de video de ultra alta definición (UHD); una etapa (S120) de codificar la información de señalización que incluye la información sobre el servicio de radiodifusión de UHD basado en los datos de video de UHD codificados y la información capaz de ser señalizada con las características de los datos de video de UHD codificados; y una etapa (S130) de multiplexar los datos de video de UHD codificados y la información de señalización, y transmitir los datos multiplexados.|SOOJIN HWANG [KR]; JEEHYUN CHOE [KR]; JONGYEUL SUH [KR]; Seocho-gu, Seul, 137-724, KR|LG ELECTRONICS INC. [KR]; Yeongdeungpo-gu, Seul, 150-721, KR|
339742|Patente|MX/a/2012/012956|07/11/2012|07/06/2016|<i>A61M15/00</i> <b>(2006-01)</b>|CONTADORES DE DOSIS PARA INHALADORES, INHALADORES Y FLECHAS DE LOS MISMOS.|Un inhalador de dosis medida manualmente operado (12) incluye una cámara de contador de dosis (66) que incluye una cinta de despliegue de dosis (112) impulsada por una rueda de trinquete (94) que es impulsada a su vez por un trinquete de actuador (80), accionado por movimiento de una lata (20); costillas de dos escalones (144, 146) que se proveen para evitar la oscilación de la lata (20); un agujero de drenaje (194) que se provee para evitar empañamiento de una ventana de despliegue (118); y superficies de fricción (132, 134) que se proveen sobre una flecha (108) de un carrete de abastecimiento de cinta (110) para para evitar el deslizamiento de la cinta; un regulador de rotación que se provee para el carrete de abastecimiento y que comprende una superficie de enganche en de tipo onda (300) con concavidades (302) que enganchan contra elementos de control (128, 130) en forma de prolongaciones sobre bifurcaciones elásticas de un pasador de división (108) permitiendo así el desenrollamiento incremental del carrete de abastecimiento resistiendo sin embargo la rotación excesiva si el inhalador se cae sobre una superficie dura.|JEFFREY A. KARG.* [US]; DECLAN WALSH [IE]; DAN BUCK [IE]; ROBERT CHARLES USCHOLD [US]; JAN GEERT HAZENBERG [IE]; FENLON DEREK [IE]; SIMON KAAR [IE]; PAUL CLANCY [IE]; Hopkinton, MA, 01748, US|TEVA PHARMACEUTICALS IRELAND [IE]; IVAX PHARMACEUTICALS IRELAND [IE]; NORTON (WATERFORD) LIMITED [IE]; Industrial Park, Waterford, IE|
339743|Patente|MX/a/2015/005226|24/04/2015|07/06/2016|<i>F01M11/00</i> <b>(2006-01)</b>|CARTER DE ACEITE PARA MOTOR DE COMBUSTION INTERNA.|El cárter (10) de aceite para contener aceite de motor se configura a fin de estar dividido en el cárter (13) de aceite superior metálico y el cárter (14) de aceite inferior de resina sintética. El cárter (13) de aceite superior y el cárter (14) de aceite inferior se proveen respectivamente con la viga (25) y la costilla (24), que se extienden en la dirección frontal-trasera del vehículo. Se provoca que la viga (25) y la costilla (24) miren la una hacia la otra con la separación (26) provista entre las mismas. Cuando la fuerza externa que puede deformar el cárter (14) de aceite inferior en la dirección frontal-trasera del vehículo actúa sobre e) cárter (14) de aceite inferior debido a la interferencia del mismo con bordillos o similares, la viga (25) y la costilla (24) entran en contacto entre sí y previenen que el cárter (14) de aceite inferior se deforme en la dirección frontal-trasera del vehículo.|ARATA TAGUCHI [JP]; Atsugi-shi, Kanagawa, 243-0123, JP|NISSAN MOTOR CO., LTD. [JP]; Yokohama-shi, Kanagawa, 221-0023, JP|
339744|Patente|MX/a/2014/006522|30/05/2014|08/06/2016|<i>C08G18/77</i> <b>(2006-01)</b>; <i>C08G18/28</i> <b>(2006-01)</b>; <i>C08G18/48</i> <b>(2006-01)</b>; <i>C08J9/00</i> <b>(2006-01)</b>|ESPUMAS DE POLIURETANO FLEXIBLES, VISCOELASTICAS, LAVABLES.|La presente invención se refiere a un proceso para producir espumas de poliuretano flexibles, viscoelásticas que tienen un valor de flujo de aire de al menos 1 dm3/s, que consisten en (a) poliisocianato mezclado con (b) compuestos poliméricos que tienen grupos reactivos con isocianato, (c) como una opción agentes prolongadores de cadena y/o reticuladores, (d) como una opción compuestos que tienen un grupo reactivo con isocianato con un índice de hidroxilo de 100 hasta 500 mg de KOH/g, (e) catalizador, (f) agentes de soplado, y también como opción (g) la adición de agentes para formar una mezcla de reacción y convertirla en espuma de poliuretano flexible, en donde los compuestos poliméricos que tienen grupos reactivos con isocianato (b) contienen (b1) de 10 a 40% en peso de al menos un óxido de polialquileno que tiene un índice de hidroxilo de 90 hasta 300 mg de KOH/g, con base en una molécula iniciadora de 3 a 6-funcional y una fracción de óxido de propileno, con base en el contenido de óxido de alquileno, desde 80 hasta 100% en peso, (b2) 5 a 20% en peso de al menos un óxido de polialquileno que tenga un índice de hidroxilo de 10 a 60 mg KOH/g, con base en una molécula iniciadora de 2 a 4-funcional y una fracción de óxido de propileno, con base en el contenido de óxido de alquileno de 80 a 100% en peso, (b3) 10 a 50% en peso de al menos un óxido de polialquileno que tenga un índice de hidroxilo de 10 a 55 mg KOH/g, con base en una molécula iniciadora 2 a 4-funcional y una fracción de óxido de etileno, con base en el contenido de óxido de alquileno, de 70 a 100% en peso, y (b4) 0 a 20% en peso de al menos un óxido de polialquileno que tenga un índice de hidroxilo de 50 a 200 mg KOH/g, con base en una molécula iniciadora 2-funcional y una fracción de óxido de etileno, con base en el contenido de óxido de etileno, de 80 a 100% en peso, y en donde la fracción de los compuestos b1) a b4), con base en el peso total de los compuestos poliméricos que tienen grupos reactivos con isocianato (b) es al menos 80% en peso. La presente invención además se refiere a una espuma de poliuretano viscoelástica que tiene un valor de flujo de aire de al menos 1 dm3/s, la cual puede obtenerse por un proceso como este, y al uso de tal espuma de poliuretano para colchones y cojines.|MARC MARTIN [LU]; HEINZ-DIETER LUTTER [DE]; JENS VARDING [DE]; ANSGAR FRERICKS [DE]; EDMUND STADLER [DE]; Lemförde, 49448, DE|BASF SE [DE]; Ludwigshafen, 67056, DE|
339745|Patente|MX/a/2015/001229|27/01/2015|08/06/2016|<i>G08G1/16</i> <b>(2006-01)</b>; <i>B60R21/00</i> <b>(2006-01)</b>; <i>G06K9/46</i> <b>(2006-01)</b>; <i>H04N7/18</i> (2006-01)|DISPOSITIVO DE DETECCION DE OBJETOS TRIDIMENSIONALES, METODO DE DETECCION DE OBJETOS TRIDIMENSIONALES.|La presente invención se provee con: una cámara (10) para capturar la parte trasera de un vehículo; unidades (33, 37) de detección de objetos tridimensionales para detectar un objeto tridimensional presente en las áreas (A1, A2) de detección del lado izquierdo y derecho con base en la información de imagen; una unidad (34) de evaluación de objetos tridimensionales para evaluar el objeto tridimensional detectado como otro vehículo (VX) cuando la velocidad de viaje del objeto tridimensional yace en un rango de establecimiento prestablecido; una unidad (41) de detección del estado de lluvia para detectar un estado de lluvia que incluye casos de lluvia y casos en los cuales se forma una película de agua en una superficie de la carretera debido a la lluvia; y un controlador (39) para proporcionar como salida un comando de control para estrechar el rango de establecimiento para las velocidades de viaje utilizado para evaluar si el objeto tridimensional es el otro vehículo (VX) cuando se ha detectado el estado de lluvia.|YASUHISA HAYAKAWA [JP]; OSAMU FUKATA [JP]; YUKINORI NISHIDA [JP]; DAISUKE OIKI [JP]; Atsugi-shi, Kanagawa, 243-0123, JP|NISSAN MOTOR CO., LTD. [JP]; Yokohama-shi, Kanagawa, 221-0023, JP|
339746|Patente|MX/a/2011/007849|25/07/2011|08/06/2016|<i>A61K31/593</i> <b>(2006-01)</b>; <i>A61K38/18</i> <b>(2006-01)</b>; <i>A61K38/19</i> <b>(2006-01)</b>; <i>A61K45/06</i> <b>(2006-01)</b>; <i>A61P35/00</i> <b>(2006-01)</b>; <i>A61P7/04</i> <b>(2006-01)</b>; <i>A61P7/06</i> <b>(2006-01)</b>|VITAMINA D3 Y ANÁLOGOS DE LA MISMA PARA ALIVIAR EFECTOS SECUNDARIOS ASOCIADOS CON LA QUIMIOTERAPIA.|La presente descripción se refiere al uso de compuestos de vitamina D, tales como vitamina D3, o análogos y/o metabolitos de la misma, para modular progenitores de médula ósea y células estromales antes de la administración de agentes antineoplásticos. Los métodos de la presente descripción pueden disminuir la mielosupresión incrementando la disponibilidad de progenitores de células madre pluripotentes y pueden usarse en combinación con terapia normal (v.gr., factor estimulador de granulocitos) para incrementar la proliferación de células mieloides y/o mejorar su movilización de la médula ósea, disminuyendo así la dosis y administración de factores de estimulación de colonias (CSF) así como el tiempo de recuperación después de la quimioterapia.|JOHN PATRICK MCCOOK [US]; NIVEN RAJIN NARAIN [GF]; JOAQUIN J. JIMENEZ [US]; Miami, FL, 33144, US|BERG LLC [US]; Nashville, Tennessee, 37210, US|
339747|Patente|MX/a/2014/014451|06/06/2013|08/06/2016|<i>G06T11/60</i> <b>(2006-01)</b>; <i>G06F17/40</i> <b>(2006-01)</b>|SISTEMAS Y METODOS PARA PROCESAMIENTO DE IMAGENES CON DETECCION DEL BORDE Y CARACTERISTICA DE AJUSTE.|La presente invención se refiere a un método para crear productos de la imagen que incluye las siguientes etapas. Los datos de la imagen y los datos de la posición que corresponden a los datos de la imagen son capturados y procesados para crear imágenes geo-referenciadas. Los procedimientos de detección del borde son efectuados sobre las imágenes geo-referenciadas para identificar los bordes y las imágenes detectadas en el borde, geo-referenciadas. Las imágenes detectadas en el borde, geo-referenciadas, son guardadas en una base de datos. También se proporciona una interfaz con el usuario para observar e interactuar con la imagen geo-referenciada de tal modo que el usuario pueda seleccionar consistentemente los mismos Puntos de Interés entre las interacciones múltiples y los usuarios múltiples.|STEVE ADAMS [US]; FRANK D. GIUFFRIDA [US]; YANDONG WANG [US]; Rush, New York, 14573, US|PICTOMETRY INTERNATIONAL CORP. [US]; Rochester, New York, 14623-4260, US|
339748|Patente|MX/a/2015/006921|01/06/2015|08/06/2016|<i>G01F1/84</i> <b>(2006-01)</b>|CUBIERTA MEJORADA PARA MEDIDOR DE VIBRACION.|Una cubierta (330) para un medidor de vibración (300) es proporcionada. La cubierta (330) incluye un primer panel (331a) definido al menos por un primer borde (333) y un segundo borde (334). La cubierta (330) también incluye una o más indentaciones (332) formadas en el primer panel (331a). Una o más de las indentaciones (332) incluyen al menos una porción que se extiende del primer borde (333) al segundo borde (334). Las frecuencias resonantes de la cubierta pueden ser incrementadas y separadas de las frecuencias pretendidas de impulsión de los conductos de fluido (306A, 306B).|XIANG FENG [CN]; MUYUAN LIU [CN]; YANG YE [CN]; MATTHEW T. CRISFIELD [US]; Nanjing, Jiangsu, 2100000, CN|MICRO MOTION, INC. [US]; Boulder, Colorado, 80301, US|
339749|Patente|MX/a/2013/014197|03/12/2013|08/06/2016|<i>F01N1/08</i> <b>(2006-01)</b>; <i>F01N1/10</i> <b>(2006-01)</b>; <i>F01N13/18</i> <b>(2010-01)</b>|SILENCIADOR Y METODO PARA PRODUCIR EL MISMO.|La invención se refiere a un silenciador (1) para una instalación de gas de escape de un motor de combustión interna, particularmente de un vehículo motorizado. El silenciador comprende un alojamiento (2), con una coraza circunferencial (3) cerrada en la dirección periférica (5) y con una base de extremo (6) en cada uno de dos extremos longitudinales que están espaciados entre sí en una dirección axial (4), y un inserto de silenciador (15) que está dispuesto en el alojamiento (2) y tiene al menos una tubería de entrada (8) para gas de escape y al menos una tubería de salida (10) para gas de escape, la coraza (3) está segmentada en la dirección periférica (5) y tiene al menos un segmento de coraza (11, 12) que comprende al menos una abertura (7, 9) dentro de la cual se inserta una de las tuberías (8, 10) desde el interior. Puede obtenerse una estructura compacta por medio de la coraza segmentada (3) que tiene al menos una segmento de coraza de entrada (11) y un segmento de coraza de salida (12), por el segmento de coraza de entrada (11) que tiene al menos una abertura de entrada (7) dentro de la cual se inserta tal tubería de entrada (8) desde el interior, y mediante el segmento de coraza de salida (12) que tiene al menos una abertura de salida (9) dentro de la cual se inserta una tubería de salida (10) desde el interior.|JOACHIM ANDRE [DE]; NORBERT SCHUG [DE]; Elm-Sprengen, 66773, DE|EBERSPÄCHER EXHAUST TECHNOLOGY GMBH & CO. KG [DE]; Neunkirchen, 66539, DE|
