Número de concesión|Tipo de documento|Número de solicitud|Fecha de presentación|Fecha de concesión|Clasificación CIP|Título|Resumen|Inventor(es)|Titular
Gaceta: Patentes, Registros de Modelos de Utilidad y de Diseños Industriales Volúmen: Junio
339572|Patente|MX/a/2009/012860|27/11/2009|18/05/2016|<i>C01D5/10</i> <b>(2006-01)</b>; <i>C01F11/46</i> <b>(2006-01)</b>|MATERIALES COMPUESTOS DE MATRIZ POLIMERICA CON REFORZANTES DE DIFERENTES MORFOLOGIAS Y SUS PROCEDIMIENTOS DE SINTESIS.|El sulfato de bario, utilizado como reforzante, puede presentar morfologías tales como fibras, aglomerados esféricos o en forma de dona, las cuales dependen del proceso de síntesis utilizado. La enorme relación área/volumen de estos reforzantes hacen que el uso de pequeñas cantidades en matrices poliméricas sea suficiente para originar un material radiopaco y presente propiedades mecánicas similares o ligeramente superiores al polímero sin reforzar. Los materiales compuestos así obtenidos se pueden utilizar de manera destacada como biomateriales para fabricar catéteres, corazones artificiales, así como en la industria textil y de pigmentos.|OCTAVIO MANERO BRITO [MX]; ANTONIO SÁNCHEZ SOLÍS [MX]; ISSIS CLAUDETTE ROMERO IBARRA [MX]; COYOACAN, Distrito Federal, 04700, MX|UNIVERSIDAD NACIONAL AUTÓNOMA DE MÉXICO [MX]; COYOACAN, Distrito Federal, 04510, MX|
339573|Patente|MX/a/2012/014792|14/12/2012|31/05/2016|<i>B44C1/17</i> <b>(2006-01)</b>; <i>B41M5/382</i> <b>(2006-01)</b>; <i>B41M5/40</i> <b>(2006-01)</b>; <i>B44F1/10</i> <b>(2006-01)</b>|METODO PARA DECORAR SUPERFICIES.|La invención se refiere a un método y a una cinta de transferencia para decorar superficies, en particular, para decorar empaques o embalajes externos. Se proporciona una cinta de transferencia que consiste e4n una película portadora en forma de cinta (11), una capa decorativa (13) y una capa de liberación (12) la cual está acomodada entre la capa decorativa (¡#) y la película portadora. La capa decorativa (13) tiene una multiplicidad de elementos decorativos, homogéneos, ópticamente variables que se arreglan en las primeras regiones superficiales, las cuales están separadas entre sí y se apartan entre sí en la dirección longitudinal de la cinta de transferencia. La capa de decorativa (13) tiene las segundas regiones superficiales las cuales están separadas entre sí y se apartan entre sí en la dirección longitudinal de la cinta de transferencia y en la cual la capa decorativa (13) tiene una o más capas que se pueden individualizar para proporcionar en cada caso diferentes marcajes ópticos legibles con máquina. En cada caso una primera región superficial o una región parcial de una primera región superficial y una región superficial o una región parcial de una segunda región superficial de la capa decorativa (13) son transferidas sobre una superficie que va a ser decorada. La una o más capas que pueden ser individualizadas de la segunda región superficial respectiva se individualizan antes o durante la transferencia, con el resultado que, además de uno de los elementos decorativos ópticamente variables, un marcaje óptico, legible con máquina, individualizado, se transfiere desde la cinta de transferencia sobre la superficie que va a ser decorada.|LUDWIG BREHM [DE]; NORBERT LUTZ [DE]; WALTER KURZ [DE]; HANS PETER BEZOLD [DE]; Rückersdorf, 90607, DE|LEONHARD KURZ STIFTUNG & CO. KG [DE]; Fürth, 90763, DE|
339574|Patente|MX/a/2014/006518|30/05/2014|31/05/2016|<i>H04W72/08</i> <b>(2009-01)</b>; <i>H04W16/14</i> <b>(2009-01)</b>|UTILIZACION EFICIENTE DEL ESPECTRO CON SUBTRAMAS CASI EN BLANCO.|Se describen los sistemas y métodos para proporcionar utilización eficiente del espectro en una red celular de comunicaciones que aplica Subtramas casi en blanco (Subtramas casi en blanco o vacías, ABS). En general, la red consiste en un nodo de acceso que aplica las ABS en el enlace descendente. En una modalidad, el nodo de acceso identifica los UE (equipos de usuario) para los cuales han de programarse las transmisiones para el enlace ascendente utilizando un esquema de programación que no requiere información de control para cada subtrama. El nodo de acceso entonces alinea en el tiempo instantes de programación de los UE y las subtramas en el enlace ascendente que corresponden con al menos algunas de las ABS del enlace descendente. En otra modalidad, el nodo de acceso identifica los UE para los cuales las transmisiones tienen que ser programadas para el enlace descendente utilizando un esquema de programación que no requiere información de control para cada subtrama. El nodo de acceso entonces alinea en el tiempo instantes de programación de los UE para el enlace descendente y al menos una subserie de las ABS en el enlace descendente.|JAWAD MANSSOUR [LB]; KONSTANTINOS DIMOU [GR]; Gangnam-gu, Seúl, 135878, KR|TELEFONAKTIEBOLAGET L M ERICSSON (PUBL) [SE]; Stockholm, SE-164 83, SE|
339575|Patente|MX/a/2013/009951|28/08/2013|31/05/2016|<i>H01Q13/16</i> <b>(2006-01)</b>; <i>H01Q13/20</i> <b>(2006-01)</b>; <i>H01Q13/22</i> <b>(2006-01)</b>; <i>H01Q21/00</i> <b>(2006-01)</b>; <i>H01Q21/29</i> <b>(2006-01)</b>|UNA DISPOSICION DE ANTENA.|Se divulga una disposición 30 de antena que comprende un cable 31 con fugas. El cable 31 con fugas incluye las subsecciones 32, 33, 34 y cada subsección exhibe una dirección longitudinal de extensión L32, L33, L34 y un patrón de radiación. Las direcciones longitudinales de las subsecciones adyacentes están orientadas en diferentes direcciones para crear un patrón de radiación predeterminado mediante la superposición del patrón de radiación de cada subsección. Adicionalmente, se describe un método para crear un patrón de radiación predeterminado de tal disposición 30 de antena.|HENRIK ASPLUND [SE]; JONAS MEDBO [SE]; Stockholm, S-117 34, SE|TELEFONAKTIEBOLAGET L M ERICSSON (PUBL) [SE]; Stockholm, S-164 83, SE|
339576|Patente|MX/a/2014/010113|22/08/2014|31/05/2016|<i>H04N19/61</i> <b>(2014-01)</b>; <i>H04N19/00</i> <b>(2014-01)</b>; <i>H04N19/124</i> <b>(2014-01)</b>; <i>H04N19/51</i> <b>(2014-01)</b>|DISPOSITIVO Y METODO DE PROCESAMIENTO DE IMAGENES.|La presente descripción pertenece a un dispositivo y método de procesamiento de imágenes que permiten la reducción de un incremento en la cantidad de codificación para una lista de escalado. Este dispositivo de procesamiento de imágenes establece el coeficiente colocado en el encabezado de una matriz de cuantificación al agregar, al coeficiente colocado en el encabezado de la matriz de cuantificación, un coeficiente de diferencia de remplazo el cual es la diferencia entre el coeficiente colocado en el encabezado de la matriz de cuantificación, y el coeficiente de remplazo que se utiliza cuando se remplaza el coeficiente colocado en el encabezado de la matriz de cuantificación. La matriz de cuantificación la cual se ha establecido, se convierte ascendentemente, y una matriz de cuantificación convertida ascendentemente en la cual el coeficiente colocado en el encabezado de la matriz de cuantificación convertida ascendentemente se ha remplazado por un coeficiente de remplazo se utiliza para la cuantificación inversa de los datos cuantificados. La presente descripción puede aplicarse a dispositivos de procesamiento de imágenes.|JUNICHI TANAKA [JP]; YOSHITAKA MORIGAMI [JP]; Minato-ku, Tokio, 108-0075, JP|SONY CORPORATION [JP]; Minato-ku, Tokio, 108-0075, JP|
339577|Patente|MX/a/2014/013186|29/10/2012|31/05/2016|<i>H04W72/04</i> <b>(2009-01)</b>; <i>H04L5/00</i> <b>(2006-01)</b>; <i>H04W16/00</i> <b>(2009-01)</b>; <i>H04W72/08</i> <b>(2009-01)</b>; <i>H04W72/10</i> <b>(2009-01)</b>; <i>H04W74/08</i> <b>(2009-01)</b>; <i>H04W88/08</i> (2009-01)|METODO, ESTACION BASE, TERMINAL Y SISTEMA DE COMUNICACION PARA ACTUALIZAR EL PORTADOR DE COMPONENTES.|Se proporcionan un método, una estación base, una terminal y un sistema de comunicación para actualizar los portadores de componentes. En donde, se adquiere la información del estatus de la terminal, la estación base y/o el portador de componentes; se determina si la información del estatus concuerda con la condición predeterminada; un viejo portador de componentes se remplaza por un nuevo portador de componentes, o un nuevo portador de componentes se agrega en el caso que se reúna la condición predeterminada. Con las modalidades de la presente invención, se actualiza más efectivamente el portador de componentes que utilizaría la terminal.|YUXIN WEI [CN]; Haidian District, Beijing, 100190, CN|SONY CORPORATION [JP]; Minato-ku, Tokio, 108-0075, JP|
339578|Patente|MX/a/2014/010580|04/09/2014|01/06/2016|<i>G21C17/00</i> <b>(2006-01)</b>; <i>G21D3/00</i> <b>(2006-01)</b>; <i>G21D3/04</i> <b>(2006-01)</b>|PROCEDIMIENTOS DE PROTECCION DE REACTORES NUCLEARES CONTRA LA INESTABILIDAD TERMICA HIDRAULICA/NEUTRONICA DEL NUCLEO.|La invención se refiere a procedimientos de protección de un núcleo de reactor nuclear, tal como un núcleo de reactor de agua en ebullición, del daño al combustible y al recubrimiento debido a la inestabilidad térmica hidráulica en condiciones de flujo de potencia operativa ampliadas y, en particular, cuando se aplica un aumento de potencia ampliado. Los procedimientos emplean metodologías existentes de estabilidad licenciadas y cambios menores incorporados, por ejemplo, en el sistema de maniobra basado en el Monitor de Intervalo de Potencia Media (APRM) para impedir la operación en el interior de la región vulnerable de estabilidad del mapa de potencia/flujo. El sistema de maniobra basado en APRM se modifica para establecer la línea de Scram (parada súbita) de flujo orientado APRM cuando el flujo de núcleo es inferior a un flujo de núcleo predeterminado para evitar que el núcleo entre en una región inestable de operación.|BLAISDELL, JOHN A. [US]; CHU, EDWARD M. [US]; ROTANDER, CAMILLA S. [SE]; KUMAR, GURIKAR V. [US]; Suffield, CT, 06078, US|WESTINGHOUSE ELECTRIC COMPANY LLC [US]; Cranberry Township, PA, 16066, US|
339579|Patente|MX/a/2015/004823|16/04/2015|01/06/2016|<i>G21C19/02</i> <b>(2006-01)</b>; <i>G21C21/00</i> <b>(2006-01)</b>|REPARACION DEL APILAMIENTO DEL DIFUSOR DE UNA BOMBA DE CHORRO.|Un procedimiento de reparación de una junta de deslizamiento en un conjunto de bomba de chorro entre una mezcladora de entrada y un difusor, tiendo el difusor una abertura que recibe la mezcladora de entrada con una determinada separación entre un diámetro exterior de la mezcladora de entrada y un diámetro interior de la abertura en el difusor formando un anillo cuya separación es un producto de fabricación y desgaste por vibración. El procedimiento comprende las etapas de acceder por vía remota al anillo y de estrechar una dimensión radial del anillo.|KAYLOR, STEPHEN J. [US]; LUM, RODNEY [US]; GOLDEN, DANIEL W. [US]; DUBAY, JAMES M. [US]; SMOUSE, JEFFREY A. [US]; WILTON, WENDELL BLANE [US]; Los Gatos, California, 95032, US|WESTINGHOUSE ELECTRIC COMPANY LLC [US]; Cranberry Township, Pennsylvania, 16066, US|
339580|Patente|MX/a/2011/005882|03/06/2011|01/06/2016|<i>B65H75/10</i> <b>(2006-01)</b>; <i>A47K10/16</i> <b>(2006-01)</b>|NUCLEO QUE SOPORTA UN CARRETE DE PAPEL.|La invención se refiere a un núcleo propuesto para soportar un carrete de papel, particularmente papel higiénico, formándose el núcleo devanando al menos un velo de guata de celulosa. El núcleo se caracteriza en que se forma devanando al menos un velo guata de celulosa que tiene al menos 0.51 g de material soluble en agua por gramo de guata de celulosa, el material soluble en agua está diseñado para hacer el velo de guata de celulosa más rígido y más fácil de desintegrar. Configurada de esta manera, la invención es capaz de proporcionar un núcleo que tiene tanto ajuste de resistencia mecánica para el propósito propuesto y es más fácil de desintegran que un núcleo hecho de cartón de manera que se puede desechar directamente en la taza del sanitario sin el riesgo de bloquear la tubería de deshechos.|PIERRE PROBST [FR]; RÉMY RUPPEL [FR]; FRÉDÉRIC ROESCH [FR]; NICOLAS WEISANG [FR]; Colmar, 68000, FR|GEORGIA-PACIFIC FRANCE [FR]; Kunheim, 68320, FR|
339581|Patente|MX/a/2012/003386|21/03/2012|01/06/2016|<i>C11D3/386</i> <b>(2006-01)</b>; <i>C12N15/09</i> <b>(2006-01)</b>; <i>C12N9/54</i> <b>(2006-01)</b>|VARIANTES DE SUBTILASA.|La presente invención se refiere a una variante de subtilisina 309 con SEQ ID NO. 1, caracterizada porque comprende las sustituciones 9R, 15T, 68 A, 218D y 245R, en donde la variante comprende además por lo menos una de las siguientes modificaciones: 61{D,E}, 62 {D,E}, 76 {D,E}, *97aG, 98{G, S}, 99G, 101G,120{V, Q,D}, 131{T,S},137H, 194P, 228V, 230V,261D, en donde las variantes tienen capacidades mejoradas de remoción de huevo tal como la remoción mejorada de yema de huevo hervida de superficies y en donde las posiciones corresponden a las posiciones del polipéptido maduro de SEQ ID NO:2 [BPN´].|LARS BEIER [DK]; JÜRGEN CARSTEN FRANZ KNÖTZEL [DE]; ASTRID BENIE [DE]; MARIA NORMAN HOCKAUF [DK]; Lyngby, DK-2800, DK|NOVOZYMES A/S [DK]; Bagsvaerd, DK-2880, DK|
339582|Patente|MX/a/2015/011526|22/09/2008|01/06/2016|<i>B29C45/10</i> <b>(2006-01)</b>|SISTEMAS Y METODOS DE FABRICACION MOVIL Y/O MODULAR.|Sistemas y métodos de fabricación que son escalables y des-escalables en base a los requisitos de producción de la fábrica de fabricación del cliente. Los sistemas y métodos para fabricación móvil y/o modular colocada en o junto a una fábrica de producción del cliente que son escalables y des-escalables en base a los requisitos de producción de la fábrica de producción del cliente. Los sistemas y métodos de fabricación pueden incluir identificar requisitos de producción del cliente en la fábrica de producción del cliente, designar una celda de fabricación en base a los requisitos de producción identificados, entregar componentes para la celda de fabricación a una ubicación en o junto a la fábrica de producción del cliente, montar los componentes para formar la celda de fabricación en la ubicación, y capacitar personal operacional para operar la celda de fabricación. Los sistemas y métodos pueden comprender el uso de un sistema modular de moldeo de preformas.|KARIN S. GAISER [US]; Dayton, Ohio, 45413-0418, US|ECOVISION TECHNOLOGIES, LLC [US]; Dayton, Ohio, 45413-0418, US|
339583|Patente|MX/a/2011/008643|16/08/2011|01/06/2016|<i>C07D401/10</i> <b>(2006-01)</b>; <i>A61K31/4412</i> <b>(2006-01)</b>; <i>A61K31/444</i> <b>(2006-01)</b>; <i>A61K31/497</i> <b>(2006-01)</b>; <i>A61K31/501</i> <b>(2006-01)</b>; <i>A61P19/02</i> <b>(2006-01)</b>; <i>A61P29/00</i> <b>(2006-01)</b>; <i>C07D401/14</i> <b>(2006-01)</b>; <i>C07D403/14</i> <b>(2006-01)</b>; <i>C07D413/14</i> <b>(2006-01)</b>|INHIBIDORES DE TIROSINA CINASA DE BRUTON.|La presente invención se refiere a compuestos de fórmula general A: (ver fórmula A)) en donde la variable Z* tiene el significado definido antes, que inhiben la Btk. Los compuestos aquí descritos son útiles para modular la actividad de Btk y tratar enfermedades asociadas con una actividad excesiva de Btk. Estos compuestos son también útiles para tratar enfermedades inflamatorias y autoinmunes asociadas con una proliferación aberrante de las células B, por ejemplo artritis reumatoide. Se describen también composiciones que contienen los compuestos de fórmula A y por lo menos un vehículo, diluyente o excipiente.|ZACHARY KEVIN SWEENEY [US]; STEVEN JOSEPH BERTHEL [US]; FARIBORZ FIROOZNIA [US]; TIMOTHY D. OWENS [US]; KESHAB SARMA [US]; MATTHEW C. LUCAS [GB]; YAN LOU [CN]; JOSHUA PAUL GERGELY TAYGERLY [US]; DANIEL FISHLOCK [CA]; JUN-BAE HONG [KR]; Redwood City, California, 94062, US|F. HOFFMANN-LA ROCHE AG.* [CH]; Basilea, CH-4070, CH|
339584|Patente|MX/a/2012/002972|09/03/2012|01/06/2016|<i>C12N9/96</i> <b>(2006-01)</b>; <i>A61K31/4709</i> <b>(2006-01)</b>; <i>A61K31/4725</i> <b>(2006-01)</b>; <i>A61K31/496</i> <b>(2006-01)</b>; <i>A61K31/519</i> <b>(2006-01)</b>; <i>A61K31/5377</i> <b>(2006-01)</b>; <i>A61K31/538</i> <b>(2006-01)</b>; <i>A61K38/00</i> <b>(2006-01)</b>; <i>A61P35/00</i> <b>(2006-01)</b>; <i>C07D401/14</i> <b>(2006-01)</b>; <i>C07D413/14</i> <b>(2006-01)</b>; <i>C07D417/14</i> <b>(2006-01)</b>; <i>C07D487/04</i> <b>(2006-01)</b>; <i>C07D495/04</i> <b>(2006-01)</b>; <i>C12N9/99</i> <b>(2006-01)</b>|INHIBIDORES DE PI3 CINASA Y USOS DE LOS MISMOS.|La presente invención se refiere a un conjugado caracterizado porque comprende una o más PI3 cinasas que tienen un residuo de cisteína, CysX, en donde el CysX se une covalente e irreversiblemente a un inhibidor, de tal manera que la inhibición de la PI3 cinasa es mantenida, en donde el inhibidor comprende, antes de la unión, un grupo funcional den forma de ojiva -L-Y capaz de unir covalentemente a Cysx. El compuesto para usarse en un método para inhibir una o más PI3 cinasas, o un mutante de las mismas, actividad en una muestra biológica. El compuesto para usarse en un método in vitro para inhibir una o más PI3 cinasas, o un mutante de las mismas.|ARTHUR F. KLUGE [US]; DEQIANG NIU [US]; JUSWINDER SINGH [GB]; HORMOZ MAZDIYASNI [US]; LIXIN QIAO [US]; RUSSELL C. PETTER [US]; ZHENDONG ZHU [US]; KEVIN KUNTZ [US]; Lincoln, Massachusetts, 01773, US|AVILA THERAPEUTICS, INC. [US]; Waltham, Massachusetts, 02453-8425, US|
339585|Patente|MX/a/2013/000857|21/01/2013|01/06/2016|<i>A23L33/00</i> <b>(2016-01)</b>; <i>A23L33/21</i> <b>(2016-01)</b>|PROCESO PARA MODIFICAR LAS PROPIEDADES DE LA FIBRA DE CITRICOS.|La presente invención se refiere a un proceso para modificar la fibra de cítrico. La fibra de cítrico se obtiene teniendo un valor de concentración de envasado cercano a c* de menos de 3.8% en peso. La fibra de cítrico puede tener una viscosidad de al menos 1000 mPa.s, en donde tal fibra de cítrico es dispersada en agua estandarizada a una velocidad de mezclado desde 800 rpm hasta 1000 rpm, a una solución de agua estandarizada/fibra cítrica al 3% en p/p, y en donde tal viscosidad es medida a una velocidad de corte de 5 s-1 a 20°C. La fibra de cítrico se puede obtener teniendo un valor CIELAB L* de al menos 90. La fibra de cítrico se puede usar en productos alimenticios, productos forrajeros, bebidas, productos para el cuidado personal, productos farmacéuticos o productos detergentes.|TODD WALTER GUSEK [US]; JACQUES ANDRE CHRISTIAN MAZOYER [FR]; DAVID HIRAM REEDER [US]; JOEL RENE PIERRE WALLECAN [BE]; Crystal, Minnesota, 55422, US|CARGILL, INCORPORATED.* [US]; Wayzata, Minnesota, 55413, US|
339586|Patente|MX/a/2014/001444|05/02/2014|01/06/2016|<i>H04N5/08</i> <b>(2006-01)</b>; <i>H04N5/067</i> <b>(2006-01)</b>|SECUENCIA DE SEÑAL DE CAMBIO DIGITAL CON PROPOSITOS DE CAMBIO, APARATO QUE INCLUYE LA SECUENCIA DE SEÑAL DE CAMBIO DIGITAL EN UNA SEÑAL DE INFORMACION DE AUDIO DIGITAL Y APARATO QUE RECIBE LA SEÑAL DE INFORMACION PROPORCIONADA CON LA SECUENCIA DE SEÑAL DE CAMBIO.|Una secuencia de señal de cambio digital es sugerida, esta secuencia de señal de cambio es realizada como una señal de ruido blanco filtrada de paso alto, previamente digitalizada de una longitud predeterminada T, con una frecuencia de corte de paso alto que se sitúa por encima de la frecuencia en donde la característica de umbral de intensidad acústica en silencio de la escucha humana tiene su sensibilidad más alta, si fuera posible (Figura 5) . La secuencia de señal de cambio es empleada con propósitos de cambio (206), por ejemplo, para el cambio entre dos señales información (201, 207) . Figura 2.|MARTIN LINK [DE]; Gauting, D-82131, DE|INSTITUT FÜR RUNDFUNKTECHNIK GMBH [DE]; München, 80939, DE|
339587|Patente|MX/a/2012/008908|01/08/2012|01/06/2016|<i>C08F290/06</i> <b>(2006-01)</b>; <i>B32B27/08</i> <b>(2006-01)</b>; <i>B41M5/24</i> <b>(2006-01)</b>; <i>C08F290/14</i> <b>(2006-01)</b>; <i>C09D151/08</i> <b>(2006-01)</b>|PELICULA QUE SE PUEDE ROTULAR CON LASER RESISTENTE AL CALOR.|Una película que se puede rotular con láser, que comprende una capa de contraste basada en una composición de revestimiento de acrilato curada y, dispuesta sobre la capa de contraste, una capa de grabado, en donde la composición de revestimiento de acrilato curada se basa en una composición que comprende desde 30 hasta 80% en peso de un oligómero trifuncional A, desde O hasta 20% en peso de un monómero trifuncional B, desde 1 hasta 30% en peso de un monómero difuncional C, y desde 2 hasta 40% en peso de un pigmento de colorante.|STEPHAN ZÖLLNER [DE]; KLAUS KEITE-TELGENBÜSCHER [DE]; MICHAEL SIEBERT [DE]; PHILIPP PREUSS [DE]; JAN ELLINGER [DE]; Buchholz/Nordheide, 21244, DE|TESA SE [DE]; Norderstedt, 22848, DE|
339588|Patente|MX/a/2013/012696|30/10/2013|01/06/2016|<i>A01N63/00</i> <b>(2006-01)</b>; <i>A01N37/46</i> <b>(2006-01)</b>; <i>A01N43/36</i> <b>(2006-01)</b>; <i>A01N43/90</i> <b>(2006-01)</b>; <i>A01P13/00</i> <b>(2006-01)</b>; <i>A01P3/00</i> <b>(2006-01)</b>; <i>A01P5/00</i> <b>(2006-01)</b>|METODO Y COMPOSICION PARA TRATAMIENTO DE SEMILLAS.|La presente invención se refiere a un método de tratamiento de semillas, que comprende: proporcionar un lote de semillas; agregar una primera mezcla que comprende al menos un insecticida, al menos un fungicida, y al menos un agente de recubrimiento a las semillas en un periodo de aproximadamente 6 a 15 segundos; homogeneizar las semillas por 5 a 25 segundos; agregar una segunda mezcla que comprende al menos un inoculante y al menos un protector a las semillas un periodo de aproximadamente 6 a 15 segundos; y homogeneizar las semillas por aproximadamente 5 a 25 segundos.|CARLOS BECCO [AR]; (B1638BGE) Vicente Lopez, Buenos Aires, B1638BGE, AR|SYNGENTA PARTICIPATIONS AG [CH]; Basel, CH-4058, CH|
339589|Patente|MX/a/2015/000899|20/01/2015|01/06/2016|<i>H04W72/04</i> <b>(2009-01)</b>; <i>H04J1/00</i> <b>(2006-01)</b>; <i>H04J11/00</i> <b>(2006-01)</b>; <i>H04J99/00</i> <b>(2009-01)</b>; <i>H04W72/12</i> <b>(2009-01)</b>|METODO DE RADIOCOMUNICACION, ESTACION BASE DE RADIO, TERMINAL DEL USUARIO Y SISTEMA DE RADIOCOMUNICACION.|La presente invención se diseña para hacer posible una adjudicación de recursos de radio de enlace ascendente adecuados para la información de reconocimiento de suministro de un canal de datos compartido de enlace descendente cuando la información de control de enlace descendente se transmite utilizando un canal de control de enlace descendente mejorado. El sistema de radiocomunicación de acuerdo con la presente invención tiene los pasos en los cuales una estación de base de radio configura una pluralidad de conjuntos de PDCCH mejorados, los cuales se forman cada uno para incluir una pluralidad de elementos de canal de control mejorado (eCCEs) adjudicados al canal de control de enlace descendente mejorado, para una terminal del usuario, la estación de base de radio transmite, a la terminal del usuario, la información de control de enlace descendente, a la cual se agregan identificadores de recursos (ARIs), los identificadores de recursos son diferentes entre la pluralidad de conjuntos de PDCCH mejorados, y la terminal del usuario determina los recursos de radio para un canal de control de enlace ascendente que se utilizan para transmitir información de reconocimiento de suministro del canal de datos compartido de enlace descendente con base en valores de compensación que están asociados con los identificadores de recursos (ARIs)|YOSHIHISA KISHIYAMA [JP]; KAZUAKI TAKEDA [JP]; SATOSHI NAGATA [JP]; QIN MU [CN]; LIU LIU [CN]; LAN CHEN [CN]; Chiyoda-ku, Tokyo, 100-6150, JP|NTT DOCOMO, INC. [JP]; Chiyoda-ku, Tokyo, 100-6150, JP|
339590|Patente|MX/a/2014/010811|09/09/2014|01/06/2016|<i>G06K19/073</i> <b>(2006-01)</b>; <i>G06K19/07</i> <b>(2006-01)</b>|ETIQUETA DE IDENTIFICACION POR RADIOFRECUENCIA CONMUTABLE.|Se describen una etiqueta RFID y su método de uso. Esta etiqueta RFID (400) incluye una primera, segunda y tercera incrustaciones RFID (406a-c) incluidas en un alojamiento de etiqueta (402); la primera, segunda y tercera incrustaciones RFID (406a-c) corresponden, cada una, a un identificador tarifario diferente. La etiqueta incluye, además, un panel (404) acoplado con el alojamiento y que puede moverse entre la primera, segunda y tercera posiciones. El panel incluye estructuras de cortocircuito RFID (412a-c), cada una colocada para hacer contacto eléctrico con una de la primera, segunda y tercera incrustaciones RFID para que, en cualquiera de la primera, segunda y tercera posiciones, solo una de la primera, segunda y tercera incrustaciones RFID permanezca activa.|BRUCE B. ROESNER [US]; North Caroline, 27795, US|3M INNOVATIVE PROPERTIES COMPANY [US]; Saint Paul, Minnesota, 55144-1000, US|
