Número de concesión|Tipo de documento|Número de solicitud|Fecha de presentación|Fecha de concesión|Clasificación CIP|Título|Resumen|Inventor(es)|Titular
340377|Patente|MX/a/2012/014144|04/12/2012|07/07/2016|<i>C08F10/08</i> <b>(2006-01)</b>; <i>C08F10/10</i> <b>(2006-01)</b>; <i>D21H17/35</i> <b>(2006-01)</b>; <i>D21H21/14</i> <b>(2006-01)</b>|AGENTES DE LIBERACIÓN DE CRESPONADO|Se describe una composición novedosa que comprende (a) 50 a 98 partes de aceite de hidrocarburo, (b) 1 a 40 partes de emulsificante, y (c) 1-10 partes de un polímero de hidrocarburo no curado. También se describe un método para reducir la adhesión a la superficie del equipo utilizado en la fabricación de papel o en los procesos de conversión de papel, que comprende aplicar a la superficie la composición novedosa descrita.|CHRISTOPHER P. DILKUS [US]; Woodlyne, NJ, 08107, US|SOLENIS TECHNOLOGIES CAYMAN, L.P. [CH]; Schaffhausen, 8200, CH|
340378|Patente|MX/a/2014/014428|26/11/2014|07/07/2016|<i>G01N29/04</i> <b>(2006-01)</b>; <i>G01N29/22</i> <b>(2006-01)</b>|DISPOSITIVO DE DETECCION DE DEFECTOS, METODO DE DETECCION DE DEFECTOS, PROGRAMA Y MEDIO DE ALMACENAMIENTO.|Un dispositivo de detección de defectos (100) comprende: una sonda de arreglo en fases (120) que está dispuesta fuera de la superficie exterior (200G) de un tubo de acero soldado por resistencia eléctrica (200), y en la cual una pluralidad de transductores ultrasónicos (121) están dispuestos; un transmisor (144) para emitir, desde un grupo de transductores ultrasónicos de detección de imperfecciones que consiste de una pluralidad de transductores ultrasónicos desde una porción de la pluralidad de transductores ultrasónicos (121) dispuestos en la sonda de arreglo en fases (120), un haz ultrasónico de detección de imperfecciones (131) hacia la superficie exterior (200G) del tubo de acero soldado por resistencia eléctrica (200) en un ángulo oblicuo; un receptor (145) para recibir el haz ultrasónico de detección de imperfecciones reflejado (131) por el grupo de transductores ultrasónicos para detección de imperfecciones; y una unidad de determinación de defectos (147) para determinar, con base en el haz ultrasónico de detección de imperfecciones (131) recibido por el receptor (145), ya sea que un defecto exista en una porción soldada (210). El transmisor (144) transmite un haz ultrasónico de detección de imperfecciones (131) de modo que el haz ultrasónico de detección de imperfecciones (131), que entra al interior de un tubo de acero soldado (200) desde la superficie exterior (200G) del tubo de acero soldado (200), es directamente incidente de una manera sustancialmente perpendicular a la cara de soldadura sin reflejar la superficie interior del tubo de acero soldado (200), y es enfocado en la cara de soldadura.|YASUAKI NAGATA [JP]; YUGO SATO [JP]; Chiyoda-ku, Tokio, 100-8071, JP|NIPPON STEEL & SUMITOMO METAL CORPORATION [JP]; Chiyoda-ku, Tokio, 100-8071, JP|
340379|Patente|MX/a/2014/004597|15/04/2014|07/07/2016|<i>G08G1/095</i> <b>(2006-01)</b>; <i>F21V15/01</i> <b>(2006-01)</b>|DISPOSITIVOS Y SISTEMA PARA ENSAMBLE MEJORADO DE SEÑAL DE CONTROL DE TRAFICO.|Se proporcionan métodos y aparatos para dispositivos de control de tráfico mejorados incluyendo un sistema de soporte de barra de suspensión central continua que es integral al dispositivo de control de tráfico y proporciona una trayectoria de carga central. En una modalidad de la invención, la carcasa terminal y la carcasa de la señal de tráfico del dispositivo de control de tráfico pueden incluirse en una carcasa unitaria individual. Una carcasa unitaria individual también puede incluir una placa trasera integral. Las modalidades con una placa trasera integral pueden proporcionar un sistema para la generación de energía solar que utiliza una superficie exterior de la señal de tráfico como un sub-estrato para asegurar los laminados de fotoceldas de película delgada (TFPVL). La barra de suspensión central continua integrada con la carcasa unitaria individual puede proporcionar el dispositivo de control de tráfico con el aseguramiento mejorado de los componentes eléctricos y estabilidad estructural para la supervivencia durante eventos con fuertes vientos cuando se compara con los dispositivos de señal de tráfico convencionales.|ROBERT E. TOWNSEND, JR. [US]; Lake Wales, Florida, 33898, US|ROBERT E. TOWNSEND, JR. [US]; West Palm Beach, Florida, US|
340380|Patente|MX/a/2012/009982|28/08/2012|07/07/2016|<i>A61B18/18</i> <b>(2006-01)</b>|INSTRUMENTO QUIRURGICO.|Un aparato quirúrgico para uso en cirugía endoscópica tiene una interfaz de usuario acoplada operativamente a un montaje de herramienta de articulación por medio de un miembro tubular alargado. El movimiento en la herramienta de articulación refleja el movimiento en la interfaz de usuario proporcionando así una operación intuitiva del aparato quirúrgico. El aparato está configurado de tal manera que el intervalo de movimiento del montaje de herramienta de articulación emula el intervalo de movimiento de la muñeca humana.|BASEL S. HASSOUN [US]; Oklahoma City, Oklahoma, 73142, US|BASEL S. HASSOUN [US]; Oklahoma City, Oklahoma, 73142, US|
340381|Patente|MX/a/2013/007916|05/07/2013|07/07/2016|<i>A47B91/00</i> <b>(2006-01)</b>|MONTAJE DE CONEXION PARA BASE Y MONTAJE DE GABINETE DE MAQUINA DE ELABORACION DE HIELO.|Se describe un montaje de conexión para una máquina de elaboración de hielo, que incluye una base que tiene un riel y un montaje de gabinete que tiene una deslizadera. La deslizadera se desliza sobre el riel para conectar removiblemente la base y el montaje de gabinete, mientras que se almea el montaje de gabinete vertical y horizontalmente con relación a la base. Preferentemente, el riel y la deslizadera tienen geometrías complementarias en donde la base y el riel se ajustan conjuntamente, tal que las geometrías complementarias limitan el movimiento vertical y horizontal relativo del riel y la deslizadera uno con respecto al otro. En configuraciones alternativas, la base puede tener una deslizadera y el gabinete puede tener un riel. El montaje de conexión puede también incluir un tope que limita el movimiento lineal relativo entre el riel y la deslizadera, asegurando adicionalmente el alineamiento apropiado del gabinete y la base. El montaje de conexión puede también incluir un mecanismo de aseguramiento que limita el movimiento lineal relativo de la base y el gabinete.|CURT R. CAYEMBERG [US]; DEAN M. PETERSEN [US]; MARK P. GIEBEL [US]; JOHN P. MYERS [US]; Manitowoc, Wisconsin, 54220, US|MANITOWOC FOODSERVICE COMPANIES, LLC [US]; Manitowoc, Wisconsin, 54220, US|
340382|Patente|MX/a/2015/005024|21/04/2015|07/07/2016|<i>B65D88/76</i> <b>(2006-01)</b>; <i>G02B6/44</i> (2006-01); <i>H02G3/18</i> <b>(2006-01)</b>; <i>H02G9/10</i> <b>(2006-01)</b>|CAJA PARA SERVICIOS PUBLICOS RASANTE, RASANTE DEL SUELO, DE RESISTENCIA MEJORADA.|Una caja de servicios públicos rasante del suelo de resistencia mejorada comprende una estructura de pared vertical que tiene un panel de pared interno erigido (46) que se extiende desde un borde superior a un borde inferior de la estructura. El panel de pared interno (46) tiene una cara interior que abarca el interior del recinto. Una o más regiones ranuradas que se extienden verticalmente, estrechas (58) están rebajadas en la cara interior del panel de pared. Barras de soporte rígidas erigidas (60), opcionalmente adaptadas para uso como anaqueles de cables, se colocan y se fijan rígidamente para separar regiones ranuradas sobre el panel de pared. Las barras de soporte (60) proporcionan un medio continuo de soporte vertical rígido desde el borde superior hacia abajo, al fondo del borde de la estructura de pared de la caja. Las barras de soporte rebajadas, en combinación con la estructura de pared vertical, proporcionan resistencia de pared mejorada que excede las normas de pruebas de carga de pared lateral vertical y de carga central, industriales.|EDWARD J. BURKE [US]; Temecula, California, 92589, US|CHANNELL COMMERCIAL CORPORATION [US]; Temecula, California, 92589, US|
340383|Patente|MX/a/2015/016232|15/10/2014|07/07/2016|<i>H04N19/593</i> <b>(2014-01)</b>; <i>H04N19/577</i> <b>(2014-01)</b>|METODO Y APARATO PARA DETERMINAR IMAGENES DE REFERENCIA PARA INTER-PREDICCION.|La presente invención se refiere a un método para determinar una imagen de referencia para inter-predicción, y a un método de inter-predicción de conformidad con la misma. El método para determinar una imagen de referencia incluye: confirmar el tipo de fragmento de un bloque; si el tipo de fragmento es un tipo de fragmento B capaz de realizar predicción unidireccional o predicción bidireccional, determinar la dirección de inter-predicción del bloque como una primera dirección, una segunda dirección, o ambas direcciones; si la dirección de inter-predicción no es la segunda dirección, determinar un índice de referencia para un bloque como un índice de referencia de primera dirección a partir de una lista de imagen de referencia de primera dirección; y, si la dirección de ínter-predicción no es la primera dirección, determinar un índice de referencia para el bloque como un índice de segunda dirección a partir de una lista de imagen de referencia de segunda dirección.|TAMMY LEE [US]; Seocho-gu, Seoul, 137-070, KR|SAMSUNG ELECTRONICS CO., LTD. [KR]; Suwon-si, Gyeonggi-do, 443-742, KR|
340384|Patente|MX/a/2014/012620|17/10/2014|07/07/2016|<i>G06N3/02</i> <b>(2006-01)</b>; <i>G06N3/04</i> <b>(2006-01)</b>; <i>G06N3/08</i> <b>(2006-01)</b>|METODOS Y APARATOS PARA MOLDEAR LAS CARACTERISTICAS DEL ESQUISTO EN LODOS BASADOS EN LODOS BASADOS EN AGUA UTILIZANDO UNA RED NEURAL ARTIFICIAL.|Se describe un aparato y método para determinar la interacción formación-fluido de una formación objetivo y un fluido de perforación objetivo. El método puede incluir el entrenamiento de una red neural artificial utilizando un grupo de datos de entrenamiento. El grupo de datos de entrenamiento puede incluir una característica de la formación de una formación fuente y una característica de fluido de un fluido de perforación fuente. Una vez que es entrenada la red neural artificial, una característica de la formación de la formación objetivo puede ser introducida. La característica de la formación de la formación objetivo puede corresponder a la característica de formación de la formación fuente. Una interacción formación-fluido de la formación objetivo y el fluido de perforación objetivo puede ser determinado utilizando un valor enviado por la red neural artificial.|SHADAAB S. MAGHRABI [IN]; DALE E. JAMISON [US]; DHANASHREE GAJANAN KULKARNI [IN]; SANDEEP D. KULKARNI [IN]; KUSHABHAU D. TEKE [IN]; Kennedy Road, Maharashtra, 411001, IN|HALLIBURTON ENERGY SERVICES, INC. [US]; Houston, Texas, 77072, US|
340385|Patente|MX/a/2012/008244|08/08/2006|07/07/2016|<i>A61K8/02</i> <b>(2006-01)</b>; <i>A61K8/31</i> <b>(2006-01)</b>; <i>A61K8/34</i> <b>(2006-01)</b>; <i>A61K8/38</i> <b>(2006-01)</b>; <i>A61K8/41</i> <b>(2006-01)</b>; <i>A61K8/44</i> <b>(2006-01)</b>; <i>A61K8/60</i> <b>(2006-01)</b>|PREPARACIONES TOPICAS ANTIACNE QUE CONTIENEN RETINOIDE (TAZAROTENO O ADAPALENO), ANTIBIOTICO (FOSFATO DE CLINDAMICINA) Y/O QUERATOLITICO (PEROXIDO DE BENZOILO EN MICROESPONJAS).|La presente invención se refiere a una preparación tópica para el tratamiento del Acné en forma de Gel y Crema que contenga Retinoide (Tazaroteno o Adapaleno), Antibiótico (Fosfato de Clindamicina) y/o Queratolítico (Peroxido de Benzoilo en microesponjas) como principios activos y un vehículo formulado con todos o algunosde los siguientes componentes: Polioxil 35 aceite de Castor, Propilenglicol, Glicerina, Carbomero, Trietanolamina, EDTA, Cera no iónica ernulsificante (Polawax), Etanol, Antioxidantes y Conservadores. Las ventajas de la presente invención con respecto de las composiciones del estado de la técnica radican que la presente composición antiacné, contiene un Retinoide, un Antibiótico y/o un agente Queratolítico, que permite controlar todos los tipos de acné de leve a vulgar, ofreciendo menores efectos adversos.|FERNANDO AHUMADA AYALA [MX]; Distrito Federal, 14020, MX|LABORATORIOS DERMATOLOGICOS DARIER, S.A. DE C.V.* [MX]; Distrito Federal, 14000, MX|
340386|Patente|MX/a/2014/000161|07/01/2014|07/07/2016|<i>G10L19/032</i> <b>(2013-01)</b>; <i>G10L19/12</i> <b>(2013-01)</b>; <i>G10L21/038</i> <b>(2013-01)</b>|APARATO Y METODO PARA GENERAR SEÑAL EXTENDIDA DE ANCHO DE BANDA.|Se describe un aparato para generar una señal extendida de ancho de banda incluye una unidad de procesamiento anti-escasez para realizar procesamiento anti-escasez sobre un espectro de baja frecuencia; y una unidad de decodificación de extensión de alta frecuencia de dominio de frecuencia para realizar codificación de extensión de alta frecuencia en el dominio de frecuencia sobre el espectro de baja frecuencia en el cual se realiza procesamiento anti-escasez.|KI-HYUN CHOO [KR]; Gwangjin-gu, Seoul, 143-775, KR|SAMSUNG ELECTRONICS CO., LTD. [KR]; Suwon-si, Gyeonggi-do, 443-742, KR|
340387|Patente|MX/a/2013/005798|23/05/2013|06/07/2016|<i>B65D5/42</i> <b>(2006-01)</b>; <i>B65D5/20</i> <b>(2006-01)</b>; <i>B65D71/40</i> <b>(2006-01)</b>|EMPAQUE PARA RECIPIENTES.|Un portador que comprende un panel superior, un primer panel lateral conectado de manera plegable al panel superior, un segundo panel lateral conectado de manera plegable al panel superior, un primer panel inferior conectado al primer panel lateral mediante al menos un primer puntal, y un segundo panel inferior conectado al segundo panel lateral mediante al menos un segundo puntal. Al menos una porción que recibe el recipiente puede comprender una primera característica de retención y una segunda característica de retención opuesta. Al menos una porción de la primera característica de retención o la segunda característica de retención, se coloca en el primer panel lateral o el segundo panel lateral. Un recipiente puede retenerse mediante al menos una de la primera característica de retención y la segunda característica de retención. Al menos una porción de al menos uno del primer panel inferior y el segundo panel inferior se coloca entre el recipiente y el panel superior.|HOLLEY, JOHN, MURDICK, JR. [US]; Lawrenceville, GA, 30044, US|GRAPHIC PACKAGING INTERNATIONAL, INC. [US]; Marietta, Georgia, 30067, US|
340388|Patente|MX/a/2013/005794|23/05/2013|06/07/2016|<i>B05B15/02</i> <b>(2006-01)</b>; <i>B08B1/04</i> <b>(2006-01)</b>|DISPOSITIVO DE LIMPIEZA Y CEPILLO DE LIMPIEZA PARA UN ATOMIZADOR Y METODO DE LIMPIEZA CORRESPONDIENTE.|La invención se refiere a un dispositivo de limpieza (1) para un atomizador (2) que tiene un contorno exterior específico, en particular para limpiar un atomizador giratorio (2), que comprende al menos un cepillo de limpieza (5) para limpiar el atomizador (2), en donde el cepillo de limpieza (5) tiene un contorno de cepillo específico. De acuerdo con la invención, el contorno de cepillo del cepillo de limpieza (5) se adapta al contorno exterior del atomizador (2) de manera que el cepillo de limpieza (5) se acomode contra el atomizador (2). La invención se refiere además a un cepillo de limpieza (5) y a un método de limpieza adecuado correspondiente.|GEORG M. SOMMER [DE]; FRANK HERRE [DE]; MICHAEL BAUMANN [DE]; THOMAS BUCK [DE]; MARCUS KLEINER [DE]; RALF SCHÄFER [DE]; MARTIN WURST [DE]; Besigheim, 74354, DE|DÜRR SYSTEMS GMBH [DE]; Bietigheim-Bissingen, 74321, DE|
340389|Patente|MX/a/2014/003398|20/03/2014|06/07/2016|<i>B60S1/38</i> <b>(2006-01)</b>; <i>A47L13/11</i> <b>(2006-01)</b>; <i>B60S1/04</i> <b>(2006-01)</b>|RASQUETA LIMPIADORA.|Problema Una rasqueta limpiadora convencional tiene tales desventajas que mientras la porción limpiadora se mueve sobre la superficie del parabrisas a fin de retirar el agua de lluvia, etc., unida a la superficie del parabrisas, el agua de lluvia, etc., atrapada por la porción limpiadora fluye desde una porción de extremo libre de la porción limpiadora hacia la superficie del parabrisas mediante la fuerza centrífuga aplicada al agua de lluvia atrapada, etc., de manera que se disminuye la visibilidad del parabrisas. Manera de Resolver el Problema El dispositivo limpiador de la presente invención comprende una porción limpiadora que tiene una porción de reborde que se desliza sobre la superficie del parabrisas de un vehículo para limpiar la superficie del parabrisas, y una porción que reserva el agua de lluvia formada sobre una superficie lateral de una porción de extremo de punta de la porción de reborde, extendiéndose la porción que reserva el agua de lluvia normalmente y hacia el exterior desde una superficie lateral de la porción de extremo de punta de la porción de reborde y teniendo una superficie posterior cóncava. La superficie cóncava y la superficie de extremo de la porción que reserva el agua de lluvia forman un extremo de punta agudo.|TATSUMI KEIJI [JP]; Nerima-Ku, Tokyo, 1790071, JP|TREND EAST YUGEN KAISHA [JP]; Nerima-Ku, Tokyo, 1790071, JP|
340390|Patente|MX/a/2014/014534|27/11/2014|06/07/2016|<i>E21B43/26</i> <b>(2006-01)</b>; <i>E21B21/01</i> <b>(2006-01)</b>; <i>E21B21/06</i> <b>(2006-01)</b>|SISTEMA PARA CONTENCIÓN, MEDICIÓN Y REUTILIZACIÓN DE FLUIDOS EN FRACTURACIÓN HIDRÁULICA|El sistema incluye un número de estructuras de contención de fluido flexibles o tubos para almacenar fluidos usados o producidos durante la fracturación. Los tubos pueden ser llenados para almacenar agua antes de introducción al pozo o desperdicio de perforación expulsado del pozo. Una serie de válvulas y bombas controlan el flujo de fluidos a los tubos y de los tubos, pozo y equipo de purificación. Un obstáculo de retroflujo que incluye una compuerta primaria, compuerta delantera y compuerta de retorno soporta la transferencia de fluido bidireccional con el pozo. Los fluidos de perforación son encauzados a la compuerta delantera y salen por la compuerta primaria al pozo. Un medidor de flujo puede ser acoplado a la compuerta delantera para determinar el volumen de fluido que fluye a través de la compuerta delantera al pozo. El desperdicio de perforación puede también regresar del pozo vía la compuerta primaria y salir de la compuerta de retorno que puede también incluir un medidor de flujo.|PAUL VICKERS [US]; Calgary, Alberta, T2P 1G1, CA|P.V. FLOOD CONTROL CORP. [CA]; Calgary, Alberta, T2P 1G1, CA|
340391|Patente|MX/a/2013/008617|25/07/2013|06/07/2016|<i>A61M37/00</i> <b>(2006-01)</b>|DISPOSITIVOS DE SUMINISTRO DE MEDICAMENTOS PARA LA ADMINISTRACIÓN DE UN MEDICAMENTO DENTRO DE UNA JERINGA PRECARGADA.|Un aparato incluye un alojamiento, un contenedor de medicamento y un miembro móvil. El contenedor de medicamento se configura para moverse dentro del alojamiento entre una primera posición y una segunda posición en respuesta a una fuerza producida por un miembro de almacenamiento de energía. Una porción de extremo proximal del contenedor de medicamento incluye un reborde y tiene un émbolo dispuesto en la misma. Una primera saliente del miembro móvil se configura para ejercer la fuerza sobre el reborde para mover el contenedor de medicamento desde la primera posición hasta la segunda posición. Una porción de la primera saliente se deforma cuando el contenedor de medicamento se encuentra en la segunda posición, de tal manera que al menos una porción de la fuerza se ejerce sobre el émbolo. Una segunda saliente del miembro móvil se configura para ejercer una fuerza de retracción sobre el reborde para mover el contenedor de medicamento desde la segunda posición hacia la primera posición.|EDWARDS, ERIC S. [US]; EDWARDS, EVAN T. [US]; LICATA, MARK J. [US]; MEYERS, PAUL F. [US]; Midlothian, Virginia, 23112, US|KALEO, INC. [US]; Virginia, 23219, US|
340392|Patente|MX/a/2012/009784|23/08/2012|06/07/2016|<i>A61K31/4184</i> <b>(2006-01)</b>; <i>C12N9/12</i> <b>(2006-01)</b>|MUTACIONES DEL PROTOONCOGEN DE SERINA/TREONINA-PROTEINA CINASA B-RAF (BRAF) QUE CONFIEREN RESISTENCIA A LOS INHIBIDORES DEL PROTOONCOGEN DE SERINA/TREONINA-PROTEINA CINASA B-RAF.|La presente invención se refiere a métodos, composiciones y equipos con respecto a la resistencia al tratamiento con un agente anticanceroso, de manera específica un inhibidor de BRAF. En las modalidades particulares, la invención se relaciona con mutaciones en una secuencia de BRAF que confieren resistencia a un inhibidor de BRAF. La identificación de tales mutaciones en la secuencia de BRAF permite la identificación y el diseño de inhibidores de BFAF de segunda generación. Los métodos y equipos para detectar la presencia de una secuencia de BRAF mutante en una muestra también se proporcionan.|GARRAWAY, LEVI [US]; EMERY, CAROLINE [GB]; Newton, MA, 02460-1945, US|DANA-FARBER CANCER INSTITUTE, INC. [US]; Boston, Massachusetts, 02115-5450, US|
340393|Patente|MX/a/2013/002095|21/02/2013|07/07/2016|<i>G06Q30/06</i> <b>(2012-01)</b>; <i>G06Q50/00</i> <b>(2012-01)</b>|SISTEMA EN RED CON ACCESO MULTIMEDIA DE SOPORTE Y REDES SOCIALES.|Se divulgan modalidades para un sistema en red que soporta el acceso a activos multimedia así como interacciones sociales entre usuarios. Un aspecto puede pertenecer a un sistema en red y un método para proporcionar recomendaciones a los usuarios del sistema en red. El sistema en red puede proporcionar contenido multimedia y/o red social a los usuarios. Por ejemplo, el sistema en red puede pertenecer a un sistema multimedia incorporando las redes sociales. El sistema en red puede evaluar a los usuarios y/o actividades para determinar cuándo y a cual usuario debe proporcionarse una recomendación. Otro aspecto puede pertenecer a la creación o edición de perfiles. Los perfiles pueden usarse con un sistema multimedia en línea, incluyendo un perfil multimedia que representa los intereses multimedia del usuario. Los perfiles también pueden facilitar la red social vía el sistema multimedia en línea.|ANSELM P. BAIRD-SMITH [US]; PAYAM MIRRASHIDI [US]; STEVE, S. GEDIKIAN [US]; Cupertino, California, 95014, US|APPLE INC. [US]; Cupertino, California, 95014, US|
340394|Patente|MX/a/2011/013093|07/12/2011|07/07/2016|<i>C02F1/52</i> <b>(2006-01)</b>; <i>C02F3/02</i> <b>(2006-01)</b>|REACTOR DE TRATAMIENTO DE FLUIDOS.|La presente invención se refiere a un reactor de tratamiento de fluido. Puertos de alimentación separados para flujo entrante y efluente reciclado sirven para eliminar la necesidad de ajustar el pH o separación del carbonato de los flujos de flujo entrante y efluente reciclado.|KEVIN PATRICK O´LEARY [US]; Lemont, Illinois, 60439, US|NALCO COMPANY [US]; Naperville, Illinois, 60563-1198, US|
340395|Patente|MX/a/2012/008010|09/07/2012|07/07/2016|<i>A61M11/00</i> <b>(2006-01)</b>; <i>A61M15/00</i> <b>(2006-01)</b>|SISTEMAS INHALADORES DE UNA SOLA DOSIS SIN CONSERVADOR.|Un sistema de aerosolización incluye un recipiente comprimible que tiene un cuerpo de recipiente resiliente o elástico. El recipiente está configurado para suministrar una dosificación unitaria de un líquido cuando se comprime una sola vez. El sistema también incluye un aerosolizador que está construido de un alojamiento que define una boquilla y un generador de aerosol dispuesto en el alojamiento. El generador de aerosol comprende una membrana vibrable que tiene una cara frontal y una cara trasera, y un elemento vibrable utilizado para vibrar la membrana. Además, el alojamiento incluye una abertura que está adaptada para recibir una dosificación unitaria del líquido desde el recipiente. La abertura proporciona una ruta líquida a la cara trasera de la membrana vibrable.|JOHN S. PATTON [US]; RYAN S. PATTON [US]; MEI-CHANG KUO [US]; YEHUDA IVRI [US]; San Francisco, California, 94103, US|DANCE PHARMACEUTICALS INC.* [US]; San Francisco, California, 94103, US|
340396|Patente|MX/a/2015/002743|02/03/2015|07/07/2016|<i>H05K7/20</i> <b>(2006-01)</b>; <i>H01L23/36</i> <b>(2006-01)</b>|APARATO DE CONTROL ELECTRÓNICO|Un componente (3) de generación de calor se monta en una superficie (4b), en un lado de una carcasa (12), de una tarjeta (4) de circuito. Una porción (5) rebajada se forma en una posición que confronta el componente (3) de generación de calor, en un lado de superficie (12e) de pared inferior de una pared (l2a) interior de la carcasa (12). Entre una superficie (5a) de pared interior de esta porción (5) rebajada y el componente (3) de generación de calor, un espacio libre (Ca) de componente de tamaño predeterminado se proporciona, y un miembro (6) de irradiación de calor se interpone en una posición del espacio libre (Ca) de componente. Un espacio libre (Cb) periférico se proporciona entre la superficie (4b), en el lado de la carcasa (12) , de la tarjeta (4) de circuito y la superficie (12e) de pared interior de la pared (l2a) inferior de la carcasa (12) en un lado de borde periférico de la porción (5) rebajada.|YOSHIO KAWAI [JP]; HIRONORI OHHASHI [JP]; YUUICHI YANAGISAWA [JP]; KUMIKO YOSHINAGA [JP]; EIJI ICHIKAWA [JP]; Isesaki-shi, Gunma, 372-0023, JP|HITACHI AUTOMOTIVE SYSTEMS, LTD. [JP]; Hitachinaka-shi, Ibaraki, 312-8503, JP|
