Número de concesión|Tipo de documento|Número de solicitud|Fecha de presentación|Fecha de concesión|Clasificación CIP|Título|Resumen|Inventor(es)|Titular
337704|Patente|MX/a/2011/012607|25/11/2011|15/03/2016|<i>A01N59/08</i> <b>(2006-01)</b>; <i>A01N59/00</i> <b>(2006-01)</b>|SOLUCIONES DE BROMO ACTIVADAS Y ESTABILIZADAS COMO BIOCIDA Y COMO AGENTE ANTI-INCRUSTACION.|La presente invención se refiere a un proceso de eliminación de bioincrustación o prevención de bioincrustación o desinfección en un volumen de un líquido acuoso sobre una superficie en contacto con un líquido acuoso, caracterizado porque comprende las etapas de: i) proporcionar una composición acuosa, en donde la composición acuosa es una solución de reserva antiincrustación o biocida que contiene urea y una fuente de halógeno activa, en donde la fuente de halógeno activa comprende una fuente de bromo activa, la fuente de bromo activa comprende un oxidante en donde el oxidante comprende un hipoclorito, en donde la relación molar urea/halógeno es al menos 1/1, la concentración de halógeno medida como cloro activo es de 1,000 ppm a 100,000 ppm, y el pH de la composición acuosa es menor a 4; y ii) poner en contacto el volumen o la superficie con la solución de reserva o con una dilución acuosa de la misma, en donde dicha solución de reserva está libre de sulfato y libre de álcali cáustico, y es estable en almacenamiento prolongado hasta dos años.|DAVID FELDMAN [IL]; SHLOMO ANTEBI [IL]; CHEN ZOLKOV [IL]; Haifa, 34997, IL|BROMINE COMPOUNDS LTD. [IL]; Beer Sheva, 84101, IL|
337705|Patente|MX/a/2012/006132|28/05/2012|15/03/2016|<i>A61K31/40</i> <b>(2006-01)</b>; <i>A61K38/21</i> <b>(2006-01)</b>; <i>A61P31/00</i> <b>(2006-01)</b>; <i>A61P31/12</i> <b>(2006-01)</b>; <i>A61P35/00</i> <b>(2006-01)</b>|USO TERAPEUTICO DE CONJUGADOS PROTEINA-POLIMERO.|La presente invención se refiere a el uso de una cantidad efectiva de un conjugado de fórmula 1: en donde cada uno de R1, R2, R3,R4 y R5 es independientemente, H, alquilo C1-5, alquenilo C2-5, alquinilo C2-5, arilo, heterarilo, cicloalquilo C3-8 o heterocicloalquilo C3-8; cada uno de A1 y A2 es independiente, una porción polimérica; cada uno de G1 y G2 es independientemente, un enlace o un grupo funcional ligante; G3 es un enlace, P es una porción de interferón ? en la cual el grupo amino del término N está enlazado a G3, m es 0 o un entero de 1-10; y n es entero de 1-10; en la fabricación de un medicamento para el tratamiento de mielofibrosis idiopática, policitemia vera o trombocitemia esencial.|KO-CHUNG LIN [US]; DR. RUDOLF WIDMANN [AT]; Lexington, Massachusetts, 02421, US|PHARMAESSENTIA CORPORATION.* [TW]; Nankang District Taipei, 115, TW|
337706|Patente|MX/a/2014/003640|26/03/2014|15/03/2016|<i>B65D17/00</i> <b>(2006-01)</b>; <i>B41M5/26</i> <b>(2006-01)</b>; <i>G06K19/06</i> <b>(2006-01)</b>|EXTREMOS DE LATA QUE TIENEN INFORMACION LEGIBLE POR MAQUINA.|Un sistema y método para marcado láser de un extremo de lata, incluyendo un panel central de extremo de lata y/o pestaña para jalar; el extremo de lata decorado y/o pestañas pueden tener una imagen legible por máquina.|LAURA JANE, MCGIRR [GB]; CHRISTOPHER PAUL, RAMSEY [GB]; Eglinton Co., Derry, BT47 3XL, GB|CROWN PACKAGING TECHNOLOGY, INC. [US]; Alsip, Illinois, 60803, US|
337707|Patente|MX/a/2014/010310|27/08/2014|15/03/2016|<i>G06F17/30</i> <b>(2006-01)</b>|SISTEMA DE GESTION DE DATOS DE IDENTIDAD PARA PRODUCCION DE ALTO VOLUMEN DE DATOS DE IDENTIDAD ESPECIFICOS DEL PRODUCTO.|Se proporciona un método y aparato para mantener niveles de inventario de datos de identidad que se aprovisionan en dispositivos electrónicos. El método incluye monitorear a través de una red de comunicaciones los niveles de inventario de registros de datos de identidad almacenados en una pluralidad de servidores de personalización de datos de identidad los cuales aprovisionan cada uno alas dispositivos electrónicos con un registro de datos de identidad. Adicionalmente, si el nivel de inventario en al menos uno de los servidores de personalización de datos de identidad cae por debajo de un nivel mínimo especificado, se envía una solicitud de relleno a una autoridad de gestión de datos de identidad que solicita que se carguen los registros de datos de identidad adicionales en el servidor de personalización de datos de identidad.|CHIA LING TSAI [US]; XIN QIU [US]; TING YAO [US]; San Diego, California, 92127, US|ARRIS TECHNOLOGY, INC. [US]; Pennsylvania, 19044, US|
337708|Patente|MX/a/2014/013132|29/10/2014|15/03/2016|<i>H04L12/26</i> <b>(2006-01)</b>; <i>H04J3/16</i> <b>(2006-01)</b>; <i>H04N21/24</i> <b>(2011-01)</b>; <i>H04N21/437</i> <b>(2011-01)</b>; <i>H04N21/61</i> <b>(2011-01)</b>|ASEGURAR ESTABILIDAD DE MEDICION DE CALIDAD DE CANAL CORRIENTE ARRIBA EN UN SISTEMA DE UNION DE CANAL CORRIENTE ARRIBA UTILIZANDO MULTIPLICADOR DE TIEMPO FUERA T4.|Un método y dispositivo de cómputo para mantener la estabilidad de las mediciones de calidad de canal corriente arriba en un sistema unido de canal corriente arriba; el método configura un módem de cable, que comunica utilizando canales unidos para intercambiar periódicamente mensajes de rango en los canales unidos, donde un intervalo de rango de canal unido determina un periodo para el intercambio; el método también monitorea una métrica de calidad de señal para un canal monitoreado de los canales unidos recuperando periódicamente una medición de calidad para el canal monitoreado, un periodo entre cada recuperación determinado por un intervalo de monitoreo de calidad de canal; el método envía un mensaje de rango de invitación al módem de cable antes de la recuperación de la medición de calidad para el canal monitoreado, y recupera la medición de calidad para el canal monitoreado; el método basa la métrica de calidad de señal para el canal monitoreado en la medición de calidad.|BRIAN K. THIBEAULT [US]; DEBORAH P. CLARK [US]; Attleboro, Massachusetts, 02703, US|ARRIS TECHNOLOGY, INC. [US]; Pennsylvania, 19044, US|
337709|Patente|MX/a/2014/011414|22/09/2014|15/03/2016|<i>H02M7/44</i> <b>(2006-01)</b>|TECNICAS DE CONTROL PARA PLANTAS DE ENERGIA FOTOVOLTAICA.|Una planta de energía fotovoltaica (100) incluye celdas solares e inversores (130) que convierten la corriente directa generada por las celdas solares en corriente alterna; las energías reactivas generadas por los inversores (130) están basadas en una energía reactiva generada por un inversor virtual; el inversor virtual tiene una impedancia equivalente que representa las impedancias de los inversores (130) en la planta de energía fotovoltaica (100); los puntos de ajuste de la energía reactiva de los inversores pueden ser recibidos desde un interpretador local (132); el interpretador local (132) puede generar los puntos de ajuste de energía reactiva a partir de un punto de ajuste global de energía reactiva generado por un controlador de rejilla (116).|SESHADRI SIVAKUMAR [CA]; JIYONG LIAN [CA]; San Jose, California, 95134, US|SUNPOWER CORPORATION [US]; San Jose, California, 95134, US|
337710|Patente|MX/a/2014/009478|06/08/2014|15/03/2016|<i>H04B7/06</i> <b>(2006-01)</b>; <i>H04L25/02</i> <b>(2006-01)</b>|CORRECCION DE NORMALIZACION DE GANANCIA DE LA REALIMENTACION PMI Y CQI PARA ESTACION DE BASE CON MATRIZ DE ANTENAS.|Un dispositivo de comunicaciones inalámbricas y un método del mismo incluye estimar un canal para cada uno de una pluralidad de puertos de antena de transmisión usando un símbolo de referencia recibido del correspondiente puerto de antena, determinar la estimación de canal compuesto en base a los canales estimados y en base a una matriz de precodificación, y determinar una estimación actualizada de canal compuesto usando la estimación de canal compuesto y usando una corrección de ganancia correspondiente a la matriz de precodificación. La corrección de ganancia puede obtenerse por aire o computarse en el dispositivo de comunicaciones inalámbricas.|SANDEEP H. KRISHNAMURTHY [IN]; TYLER A. BROWN [US]; FRANK D. COLIN [US]; Sunnyvale, California, 94089, US|MOTOROLA MOBILITY LLC [US]; Libertyville, Illinois, 60048, US|
337711|Patente|MX/a/2013/002304|27/02/2013|15/03/2016|<i>C07D417/14</i> <b>(2006-01)</b>; <i>A61K31/423</i> <b>(2006-01)</b>; <i>A61K31/427</i> <b>(2006-01)</b>; <i>A61P19/10</i> <b>(2006-01)</b>; <i>A61P29/00</i> <b>(2006-01)</b>; <i>A61P3/10</i> <b>(2006-01)</b>; <i>C07D413/04</i> <b>(2006-01)</b>; <i>C07D417/04</i> <b>(2006-01)</b>|COMPUESTOS QUE MODULAN EL CALCIO INTRACELULAR.|Se describen el el presente, compuestos y composiciones farmacéuticas que contienen dichos compuestos, que modulan la actividad de canales de calcio operados por acumulación (SOC) También se describen en el presente, métodos de usar dichos moduladores del canal de SOC, solos o en combinación con otros compuestos, para tratar enfermedades o condiciones que se beneficiarían de la inhibición de la actividad del canal de SOC.|JEFFREY P. WHITTEN [US]; YAZHONG PEI [US]; JIANGUO CAO [US]; EVAN ROGERS [US]; BRIAN DYCK [US]; JONATHAN GREY [US]; ZHIJUN WANG [US]; Santee, California, 92071, US|CALCIMEDICA INC. [US]; California, 92037, US|
337712|Patente|MX/a/2013/011774|09/10/2013|15/03/2016|<i>C07C233/55</i> <b>(2006-01)</b>; <i>A61K31/195</i> <b>(2006-01)</b>; <i>A61K31/196</i> <b>(2006-01)</b>; <i>A61K45/06</i> <b>(2006-01)</b>; <i>A61P9/00</i> <b>(2006-01)</b>; <i>C07C235/38</i> <b>(2006-01)</b>|DERIVADOS DE ACIDO 3-FENILPROPIONICO RAMIFICADOS Y SU USO.|La presente solicitud se refiere a nuevos derivados de ácido 3-fenilpropiónico que poseen en la posición 3 un sustituyente de alquilo ramificado o cíclico, a procedimientos para su preparación y a su uso para el tratamiento y/o la prevención de enfermedades, así como a su uso para la preparación de medicamentos para el tratamiento y/o la prevención de enfermedades, en particular para el tratamiento y/o la prevención de afecciones cardiovasculares.|SCHLEMMER, KARL-HEINZ [DE]; STASCH, JOHANNES-PETER [DE]; LAMPE, THOMAS [DE]; KNORR, ANDREAS [DE]; WUNDER, FRANK [DE]; WOLTERING, ELISABETH [DE]; LI, VOLKHART MIN-JIAN [DE]; HAHN, MICHAEL [DE]; BECKER-PELSTER, EVA-MARIA [DE]; STOLL, FRIEDERICKE [DE]; Wuppertal, 42113, DE|BAYER INTELLECTUAL PROPERTY GMBH [DE]; Monheim, 40789, DE|
337713|Patente|MX/a/2012/013353|16/11/2012|16/03/2016|<i>H01F7/02</i> <b>(2006-01)</b>|MODULO DE IMANES PARA UN APARATO MEDIDOR DE CAUDAL MAGNETICO NUCLEAR.|Se representa y describe un grupo (1) constructivo magnético para un aparato medidor de caudal magnético nuclear con una disposición que comprende al menos un imán (2) permanente como componente. El grupo constructivo magnético cuya introducción en los alojamientos de imán del dispositivo de magnetización del aparato medidor de caudal se simplifica, y que en particular evita desprendimientos de material magnético en los imanes permanentes se caracteriza porque la disposición (3) está provista con un revestimiento (4) para la protección de los imanes (2) permanentes contra desprendimientos de material magnético debido a cargas mecánicas, en particular al introducir el grupo (1) constructivo magnético en los alojamientos de imanes del aparato medidor de caudal, y/o para simplificar la introducción de los imanes (2) permanentes en los alojamientos de imán mediante reducción de la fricción entre el grupo (1) constructivo magnético y los alojamientos de imanes y/o para influir en el campo magnético generado por los imanes (2) permanentes.|JAN TEUNIS AART PORS [NL]; JAN-WILLEM RAMONDT [NL]; JOHANNES ANTONIUS SPITHOVEN [NL]; EK Oud-Beijerland, 3262, NL|KROHNE AG.* [CH]; Basel, 4019, CH|
337714|Patente|MX/a/2013/002558|05/03/2013|16/03/2016|<i>C07D471/04</i> <b>(2006-01)</b>; <i>A61K31/4188</i> <b>(2006-01)</b>; <i>A61K31/437</i> <b>(2006-01)</b>; <i>A61K31/52</i> <b>(2006-01)</b>; <i>A61K31/5377</i> <b>(2006-01)</b>; <i>A61P3/04</i> <b>(2006-01)</b>; <i>A61P3/06</i> <b>(2006-01)</b>; <i>A61P3/10</i> <b>(2006-01)</b>; <i>A61P43/00</i> <b>(2006-01)</b>; <i>A61P9/12</i> <b>(2006-01)</b>; <i>C07D473/00</i> <b>(2006-01)</b>; <i>C07D495/04</i> <b>(2006-01)</b>|DERIVADO DE IMIDAZOL DE HETEROANILLO FUSIONADO QUE TIENE EFECTO DE ACTIVACION DE PROTEINA CINASA ACTIVADA POR MONOFOSFATO DE ADENOSINA (AMK).|Se describe un compuesto que es útil con un activador de AMPK. Un compuesto representado por la fórmula: (ver Fórmula) su sal farmacéuticamente aceptable o un solvato del mismo, en donde un grupo representado por la fórmula: (ver Fórmula) es un grupo representado por la fórmula: (ver Fórmula) R1 es cada uno independientemente halógeno, hidroxi, ciano, nitro, carboxi, alquilo sustituido o no sustituido, alquenilo sustituido o no sustituido o similares; m es un entero de 0 a 3; R2 es hidrógeno o alquilo sustituido o no sustituido; X es -O-; y Y es arilo sustituido o no sustituido, o heteroarilo sustituido o no sustituido.|NOBUYUKI TANAKA [JP]; EIICHI KOJIMA.* [JP]; KEISUKE TONOGAKI [JP]; AKIRA INO [JP]; MANABU KATOU [JP]; MASAFUMI IWATSU [JP]; MASAHIRO FUJIOKA [JP]; Toyonaka-shi, Osaka, 591-0825, JP|SHIONOGI & CO., LTD.* [JP]; Osaka-shi, Osaka, 541-0045, JP|
337715|Patente|MX/a/2013/005701|21/05/2013|16/03/2016|<i>A01N59/26</i> <b>(2006-01)</b>; <i>A01N31/16</i> <b>(2006-01)</b>; <i>A01N65/00</i> <b>(2009-01)</b>; <i>A01P3/00</i> <b>(2006-01)</b>; <i>A23B7/154</i> <b>(2006-01)</b>; <i>A23B7/157</i> <b>(2006-01)</b>|NUEVO PROCESO DE TRATAMIENTO DE PRODUCTOS VEGETALES ANTES O DESPUES DE LA COSECHA CON ACIDO FOSFONICO Y UN ACEITE ESENCIAL.|La presente invención se refiere al tratamiento fungicida y/o bactericida de los productos vegetales antes o después de la cosecha por medio del ácido fosfónico al menos parcialmente salificado y un aceite esencial o de uno del (de los) agente(s) terpénico(s) que el mismo contiene, y/o sus mezclas, a temperatura ambiente, así como a las composiciones adaptadas a este proceso.|ALBERTO SARDO [IT]; Chateaurenard, F-13160, FR|XEDA INTERNATIONAL [FR]; Saint-Andiol, F-13670, FR|
337716|Patente|MX/a/2012/009945|27/08/2012|16/03/2016|<i>A61K35/74</i> <b>(2015-01)</b>; <i>A23L1/30</i> <b>(2006-01)</b>; <i>A61P3/06</i> <b>(2006-01)</b>; <i>A61P37/08</i> <b>(2006-01)</b>; <i>C12N1/20</i> <b>(2006-01)</b>; <i>C12R1/01</i> (2006-01)|PREPARACION QUE CONTIENE BACTERIA DE ACIDO LACTICO.|La presente invención se refiere a una bacteria de ácido láctico altamente segura que es efectiva para profilaxis y tratamiento de alergias y/o reducción de niveles de triglicéridos en la sangre; y una preparación de bacteria de ácido láctico. Específicamente, se agrega una composición que contiene células de una bacteria de ácido láctico obtenida al cultivar la cepa R037 de Pediococcus acidilactici o un producto procesado de la misma, como un ingrediente activo, a un producto farmacéutico, alimento o bebida.|AIRO TATEGAKI [JP]; KAZUYA HAMADA [JP]; TOYOAKI WATANABE [JP]; Takasago-shi, Hyogo, 6768688, JP|KANEKA CORPORATION.* [JP];|
337717|Patente|MX/a/2013/008159|12/07/2013|16/03/2016|<i>H04H20/33</i> <b>(2008-01)</b>|APARATO Y METODO PARA REDUCIR RELACION DE POTENCIA PICO A PROMEDIO (PAPR) EN SISTEMA DE COMUNICACION DE DIFUSION.|Se proporciona un aparato y un método para reducir la relación de potencia pico a promedio (PAPR) en un sistema de comunicación de difusión, el cual proporciona un servicio de difusión al dividir una banda de difusión en por lo menos dos bandas de canal. Por lo menos un tono de reservación primario se inyecta en las señales de difusión de cada una de las bandas de canal. Una señal de difusión integrada de la banda de difusión se genera al combinar las señales de difusión de las bandas de canal. Se inyecta por lo menos un tono de reserva secundario en la señal de difusión integrada de la banda de difusión y se transmite la señal de difusión integrada.|HYUN-KOO YANG [KR]; HONG-SIL JEONG [KR]; SUNG-RYUL YUN [KR]; Gangnam-gu, Seoul, 135-858, KR|SAMSUNG ELECTRONICS CO., LTD. [KR]; Suwon-si, Gyeonggi-do, 443-742, KR|
337718|Patente|MX/a/2013/015363|19/12/2013|16/03/2016|<i>C12P19/04</i> <b>(2006-01)</b>|PROCESOS PARA ELABORAR DERIVADOS DE QUITINA.|La presente invención se refiere a un proceso caracterizado porque comprende (1) formar una mezcla acuosa que comprende una composición microbiana y quitina sólida, en donde tal composición microbiana comprende uno o más microbios que producen enzimas para digerir la quitina; y (2) fermentar la mezcla por un tiempo suficiente para digerir enzimáticamente toda o parte de la quitina para formar una mezcla fermentada que comprende quitosano y glucosamina. En algunas modalidades, la quitina se deriva de la biodegradacián de artrópodos marinos que contienen quitina. En otras modalidades, la quitina se obtiene de hongos, hongos filamentosos y levadura que contienen quitina la cual es extraída vía un proceso químico. En aún otra modalidad, la quitina se obtiene por la biodegradación de hongos, hongos filamentosos, levadura y/o insectos que contienen quitina, preferiblemente usando HQE para la digestión. En algunas modalidades, el proceso se lleva a cabo con una solución que ya contiene quitosano y/o glucosamina tal como HYTb, la fracción acuosa se obtiene a partir de la biodegradación de organismos que contienen quitina.|JAIME LÓPEZ-CERVANTES [MX]; Cd. Obregón, Sonora, 85137, MX|AGRINOS AS [NO]; Lysaker, N-1366, NO|
337719|Patente|MX/a/2012/001887|13/02/2012|16/03/2016|<i>B65D1/24</i> <b>(2006-01)</b>; <i>B65D1/36</i> <b>(2006-01)</b>; <i>B65D21/00</i> <b>(2006-01)</b>|BANDEJA APILABLE DE BAJA PROFUNDIDAD.|Una bandeja incluye una base que incluye una pluralidad de paredes base cada una tiene una pared periférica que define un alojamiento que recibe el envase en el mismo. Los pares adyacentes de las paredes periféricas de las paredes base se separan para definir los divisores longitudinal y lateral de bajo perfil. La base incluye una pared divisora superior generalmente horizontal que conecta las paredes periféricas. Un par de paredes laterales opuestas cada una incluye una porción superior y una pluralidad de porciones inferiores separadas. Una pluralidad de columnas laterales tienen paredes externas que se extienden hacia arriba de las porciones superiores de las paredes laterales y tiene paredes internas que se extienden hacia abajo a la base. Las columnas laterales están dispuestas entre las porciones inferiores separadas de las paredes laterales. Un par de paredes extremas opuestas cada una incluye una barra superior y una barra inferior que se extienden entre un par de columnas de esquina. Una abertura de mango es definida entre la barra superior y la barra inferior. Cada barra inferior es conectada con la base por una pared interna extrema.|WILLIAM P. APPS [US]; Alpharetta, Georgia, 30022, US|REHRIG PACIFIC COMPANY [US]; Los Angeles, California, 90058, US|
337720|Patente|MX/a/2013/014988|17/12/2013|16/03/2016|<i>H04W28/20</i> <b>(2009-01)</b>; <i>H04W72/04</i> <b>(2009-01)</b>|SISTEMA Y METODO PARA REGULAR EL LIMITE DEL ANCHO DE BANDA PROPORCIONADO A UN DISPOSITIVO MOVIL.|La invención proporciona un sistema para regular el límite del ancho de banda proporcionado a un dispositivo móvil, que comprende un facilitador de regulación del ancho de banda dispuesto para recibir un requerimiento de un dispositivo móvil para regular el límite del ancho de banda; un delimitador de ancho de banda en comunicación con el facilitador de regulación de ancho de banda; el delimitador de ancho de banda está adaptado para restringir o asignar el ancho de banda disponible en exceso al dispositivo móvil; en donde, al recibir el requerimiento, el facilitador de regulación de ancho de banda procesa el requerimiento y si el requerimiento es procesado exitosamente, regula el ancho de banda proporcionado al dispositivo móvil a través del delimitador de ancho de banda. El sistema puede además estar adaptado para facturar/cargar con base, ya sea en un modelo de pago por tiempo especificado o en un modelo de pago por acción. La invención está convenientemente adecuada para utilizarse en sistemas de telecomunicaciones y no requiere hacer modificaciones en los sistemas de telecomunicaciones existentes.|MENDIOLA, DENNIS [US]; New York, New York, 10011, US|CHIKKA PTE LTD [SG]; Clifford Centre Singapore, 048621, SG|
337721|Patente|MX/a/2013/014577|10/12/2013|16/03/2016|<i>C07D413/14</i> <b>(2006-01)</b>; <i>A61K31/4245</i> <b>(2006-01)</b>; <i>A61K31/445</i> <b>(2006-01)</b>; <i>A61P25/00</i> <b>(2006-01)</b>|COMPUESTOS DE HETEROARILO COMO LIGANDOS DEL RECEPTOR 5-HT4.|La presente invención se relaciona con compuestos novedosos de fórmula (I) y sus sales farmacéuticamente aceptables, y con composiciones que los contienen. (Ver Formula) La presente invención también se relaciona con un proceso para la preparación de los compuestos novedosos mencionados y de sus sales farmacéuticamente aceptables. Los compuestos de fórmula (I) son útiles en el tratamiento de diversos trastornos relacionados con los receptores 5-HT4.|JASTI, VENKATESWARLU [US]; NIROGI, RAMAKRISHNA [IN]; BHYRAPUNENI, GOPINADH [IN]; MOHAMMED, ABDUL RASHEED [IN]; SHINDE, ANIL KARBHARI [IN]; RAVULA, JYOTHSNA [IN]; PATNALA, SRIRAMACHANDRA MURTHY [IN]; KAMBHAMPATI, RAMASASTRI [IN]; YARLAGADDA, SURESH [IN]; RAVELLA, SRINIVASA RAO [IN]; ROAYAPALLEY, PRAVEEN KUMAR [IN]; JAYARAJAN, PRADEEP [IN]; Hyderabad, Andhra Pradesh, 500 034, IN|SUVEN LIFE SCIENCES LIMITED [IN]; Hyderabad, Andhra Pradesh, 500 034, IN|
337722|Patente|MX/a/2012/011427|01/10/2012|16/03/2016|<i>A61K31/505</i> <b>(2006-01)</b>; <i>A61P35/00</i> <b>(2006-01)</b>; <i>A61P35/02</i> <b>(2006-01)</b>|USO DE NUEVOS INHIBIDORES DE PAN-CDK PARA TRATAR TUMORES.|La invención se refiere al uso de derivados seleccionados de anilinopirimidina sustituidos con sulfoximina de la fórmula (I) para tratar tumores (Ver Formula).|GERHARD SIEMEISTER [DE]; ULRICH LÜCKING [DE]; ANTJE MARGRET WENGNER [DE]; Berlin, 10317, DE|BAYER INTELLECTUAL PROPERTY GMBH [DE]; Monheim, 40789, DE|
337723|Patente|MX/a/2013/006964|08/06/2011|15/03/2016|<i>A61K38/04</i> <b>(2006-01)</b>; <i>A61K39/395</i> <b>(2006-01)</b>; <i>A61K47/48</i> <b>(2006-01)</b>|VACUNA DE PEPTIDO CH3 DE IGE.|La presente invención se refiere a un inmunógeno caracterizado porque comprende al menos un péptido de IgE antigéno unido a un vehículo inmunogénico, en donde dicho péptido de IgE antigénico consiste de una secuencia de aminoácidos seleccionada del grupo que consiste de las SEQ ID Nos: 311-317, 326-331, 340-344, 353-356, 365-367, 376, 377 y 386.|JONES, LYN HOWARD [GB]; BROWN, ALAN DANIEL [GB]; ROBERTS, LEE RICHARD [GB]; PRYDE, DAVID CAMERON [GB]; CHAMPION, BRIAN ROBERT [GB]; CHRISTY, CLARE [GB]; GERVAIS, DAVID PAUL [GB]; KJERRSTROM, ANNE MARIA KRISTINA [SE]; WYATT, DAVID MICHAEL [GB]; Sandwich, Kent, CT13 9NJ, GB|PFIZER VACCINES LLC [US]; New York, New York, 10017-5755, US|
337724|Patente|MX/a/2013/009423|14/08/2013|15/03/2016|<i>A61B5/00</i> <b>(2006-01)</b>; <i>A61B3/12</i> <b>(2006-01)</b>|APARATO Y METODO PARA TOMOGRAFIA DE COHERENCIA OPTICA.|Se provee un aparato (100; 200) para registrar un perfil de profundidad de un tejido biológico, en particular una sección ocular frontal (140) de un ojo humano, de acuerdo con el principio de la tomografía de coherencia óptica (TCO), que comprende: una fuente de luz (101) adaptada para generar un haz (102) de rayos de luz que comprende longitudes de onda en un intervalo predeterminado de longitudes de onda que tiene un ancho de banda predeterminado (&) y comprende una longitud de onda de operación (Xo); un arreglo de interferómetros que comprende un dispositivo divisor de haces (120), adaptado para separar espacialmente el haz de rayos de luz generado por la fuente de luz en un haz de referencia (104; 204) y un haz de medición (106) dirigido hacia el tejido (140), un dispositivo de deflexión del haz de referencia (130; 230) adaptado para desviar el haz de referencia, un dispositivo de superposición (150) adaptado para superponer espacialmente el haz de referencia desviado sobre el haz de medición desviado por el tejido hacia un haz superpuesto (108; 208), y un arreglo de detectores (160, 170; 270) para detectar información en el haz superpuesto asociado con la diferencia de la longitud de trayectoria óptica del haz de referencia y el haz de medición; el intervalo de longitud de onda predeterminado está en un intervalo de 300 nm a 500 nm, preferiblemente de 350 nm a 450 nm y más preferiblemente cercano a 403 nm.|VOGLER, KLAUS [DE]; MROCHEN, MICHAEL [DE]; DONITZKY, CHRISTOF [DE]; GORSCHBOTH, CLAUDIA [DE]; WUELLNER, CHRISTIAN [DE]; Eckental/Eschenau, 90542, DE|WAVELIGHT GMBH [DE]; Erlangen, 91058, DE|
