Número de concesión|Tipo de documento|Número de solicitud|Fecha de presentación|Fecha de concesión|Clasificación CIP|Título|Resumen|Inventor(es)|Titular
337533|Patente|MX/a/2014/014343|24/10/2012|09/03/2016|<i>F17D3/00</i> <b>(2006-01)</b>; <i>F16K31/00</i> <b>(2006-01)</b>; <i>F16K31/16</i> <b>(2006-01)</b>|VALVULA DE CIERRE DE GOLPE CONTROLADA EN FORMA NEUMATICA.|La presente invención se refiere a un método para el control neumático de una válvula de cierre de golpe caracterizado porque comprende: detectar una presión corriente abajo de una válvula de cierre de golpe; transmitir la presión detectada a una válvula de control de desconexión; emitir una señal de presión neumática desde la válvula de control de desconexión al diafragma del accionador de un ensamble del accionador; mover el pasador del accionador conectado a un diafragma del ensamble del accionador y mover un extremo proximal de un eslabón mecánico con el pasador del accionador; y transmitir el movimiento del extremo proximal del sistema de eslabón a través del eslabón mecánico a un extremo distal del eslabón mecánico, por lo cual: se inicia el movimiento de un elemento de cierre de la válvula de cierre de golpe desde una posición abierta a una posición cerrada; en donde transmitir el movimiento el extremo proximal del sistema de eslabón a través del eslabón mecánico a un extremo distal del eslabón mecánico incluye además liberar un disco en una válvula de ventilación para moverla a su posición cerrada.|DAVID C. BUTLER [US]; Ogden, Utah, 84403, US|DRESSER, INC. [US]; Addison, Texas, 75001, US|
337534|Patente|MX/a/2011/010941|14/10/2011|09/03/2016|<i>F23D14/06</i> <b>(2006-01)</b>|QUEMADOR DELTA.|La presente invención se refiere a un quemador poligonal de gas para un equipo de uso doméstico, que comprende: a) un cuerpo de quemador formado por lados que están formados por al menos un muro almenado, cada lado con extremos; vértices que unen a los muros almenados en uno de los extremos del lado; una zona para la mezcla de gas combustible con aire primario para formar una mezcla aire-gas; una cámara interna con una mesa interna; una zona con puertos divergentes con puertos principales en una cara superior del muro almenado, en donde los puertos principales comprenden una base y un ápice, y en donde dicha base tiene un ángulo a que varía de aproximadamente 10° a aproximadamente 60° en relación a la horizontal en el quemador; y b) una tapa que cubre al cuerpo del quemador cerrando a la cámara interna y permite el paso de la mezcla a través de los puertos principales; en donde la tapa comprende una superficie inferior y al menos dos periferias, cada periferia formando un lado, en donde la superficie inferior de la tapa tiene una costilla por cada lado de la tapa, en donde la costilla y el ápice de los puertos principales tienen un ángulo ( ) que varía de aproximadamente 1° a aproximadamente 60° en relación a la horizontal en el quemador, en donde la tapa está formada por una primera superficie curva sobre el plano horizontal y una segunda superficie curva en el plano vertical la cual corta en al menos un costado de la primera superficie curva a dicha primera superficie curva, y en donde próximos a, o en el remate de los lados de la tapa, cada lado comprende un bisel y una extremidad sustancialmente paralelos a la costilla.|JOSÉ ARTURO LONA SANTOYO [MX]; ERNESTO ARIAS DEL CAMPO [MX]; ROBERTO CABRERA BOTELLO [MX]; Santiago de Querétaro, Querétaro, 76127, MX|MABE, S.A. DE C.V.* [MX]; Santiago de Queretaro, Queretaro, 76127, MX|
337535|Patente|MX/a/2013/011515|03/10/2013|09/03/2016|<i>C07K16/18</i> <b>(2006-01)</b>; <i>G01N33/53</i> <b>(2006-01)</b>|ANTICUERPO, KIT Y METODO PARA LA DETERMINACION DE PEPTIDOS AMILOIDES.|La presente invención se refiere al campo de los inmunoensayos que permiten la detección de péptidos Aß17 en virtud del uso de un anticuerpo anti-Aß17 y un kit y un método que usan dicho anticuerpo. La invención también se refiere a un método para diagnosticar o distinguir entre diferentes fases de una enfermedad neurodegenerativa.|SARASA BARRIO, MANUEL [ES]; Zaragoza, E-50005, ES|ARACLON BIOTECH, S.L. [ES]; Zaragoza, E-50008, ES|
337536|Patente|MX/a/2014/009325|01/08/2014|09/03/2016|<i>B22D45/00</i> <b>(2006-01)</b>|SISTEMA DE DESBORDAMIENTO PARA LA COLADA DE UN COMPONENTE Y UN METODO DE CAPTURA DEL DESBORDAMIENTO DE UN FLUIDO LIQUIDO.|Un método de captura del desbordamiento de un fluido líquido utilizado para la colada de un componente y un sistema de desbordamiento para la colada del componente se desvelan. La arena se compacta para formar un molde. Un cortador de un dispositivo de corte está en una posición desacoplada separada de una superficie superior del molde cuando el dispositivo de corte está en una primera posición y el cortador está en una posición acoplada que acopla la superficie superior del molde cuando el dispositivo de corte está en una segunda posición. El cortador se acciona cuando el dispositivo de corte está en la segunda posición y el cortador está en la posición acoplada para eliminar la arena de la superficie superior para definir un rebaje en su interior para capturar el desbordamiento del fluido líquido. El rebaje se separa de una abertura. Al menos un mecanismo de bloqueo, mecanismo de soplado y mecanismo de ajuste se utiliza para ayudar al dispositivo de corte.|KENNETH ROLEY [US]; Century, Florida, 32535, US|GREDE LLC [US]; Southfield, MI, 48075, US|
337537|Patente|MX/a/2013/011006|25/09/2013|10/03/2016|<i>F41G3/16</i> <b>(2006-01)</b>|APARATO Y SISTEMA DE MONTAJE DE CAMARA PARA UN VISOR.|Esta descripción se refiere a un aparato para montar una cámara en un arma de fuego y un dispositivo asociado para captar imágenes y grabaciones de un objetivo de arma de fuego. El aparato permite la unión fácil de cámaras de diferentes tamaños sobre el visor de un arma de fuego a lo largo del mismo eje longitudinal del visor. El aparato comprende una manga conectada con un visor de un arma de fuego, la manga es hueca y tiene un eje longitudinal que forma un calibre axial despejado y generalmente coaxial con respecto a un eje longitudinal del visor; un miembro de base con un orificio y adaptado para recibir una cámara donde el orificio del miembro de base está ubicado junto a la lente de la cámara y el eje longitudinal de la cámara es generalmente coaxial con respecto al eje longitudinal del visor. La figura más representativa de la invención es la número 5.|RUSSELL, ROBERT, WAYNE [US]; Sikeston, Missouri, 63801, US|RUSSELL, ROBERT, WAYNE [US]; Sikeston, Missouri, 63801, US|
337538|Patente|MX/a/2014/002380|28/02/2014|09/03/2016|<i>A61L2/20</i> <b>(2006-01)</b>|VAPORIZADOR DE PEROXIDO DE HIDROGENO CON DIFUSOR CALENTADO.|La presente invención proporciona un aparato para descontaminar una región. El aparato incluye un alojamiento que define ahí una cámara. El alojamiento tiene una entrada y una salida que comunican con la cámara. Un soplador circula un gas portador desde la región, a través de la entrada del alojamiento, a través de la cámara y fuera del alojamiento. Un atomizador introduce una nebulización atomizada de un fluido en el gas portador que se circula a través de la cámara. El difusor se coloca respecto a la salida de la cámara para redirigir el gas portador que sale de la cámara en una dirección predeterminada. El difusor incluye un elemento de calentamiento.|HILL, AARON, LEIF [US]; BRUSKEVITH, RYAN, ANTHONY [US]; GOUGHNOUR, JEFFREY, ALLAN [US]; Madison, OH, 44057, US|AMERICAN STERILIZER COMPANY [US]; Mentor, Ohio, 44060-1834, US|
337539|Patente|MX/a/2014/013988|18/11/2014|10/03/2016|<i>H02H1/00</i> <b>(2006-01)</b>; <i>H02H1/06</i> <b>(2006-01)</b>|SISTEMA DE MONITOREO DE ENERGÍA DE CIRCUITO DERIVADO INALÁMBRICO.|Un cortacircuito (tal como un cortacircuito miniatura) que comunica de manera inalámbrica información de estado y de falla a un módulo de monitoreo de energía principal. El cortacircuito inalámbrico incluye un transceptor y una fuente de alimentación que recolecta energía de manera inductiva del conductor de corriente de línea sin la necesidad de una conexión a un conductor neutro. El cortacircuito inalámbrico se puede implementar en el mismo paquete como cortacircuitos existentes, eliminando la necesidad de reemplazar el panel cuando se moderniza a un sistema que emplea módulo de monitoreo de energía principal. El cortacircuito inalámbrico también puede incluir un dispositivo de almacenamiento de energía para suministrar energía al cortocircuito después de que se ha desconectado, permitiendo que el cortacircuito trasmita información después de una desconexión. El módulo de monitoreo de energía principal incluye un procesador y una puerta de acceso para evaluar y transmitir información recibida del cortacircuito a otras aplicaciones, tal como páginas web teléfonos inteligentes.|BRETT LARSON [US]; ROBERT ERGER [US]; WILLIAM BROGHAMMER [US]; PAUL A. REID [US]; Cedar Rapids, Iowa, 52411, US|SCHNEIDER ELECTRIC USA, INC. [US]; Palatine, Illinois, 60067, US|
337540|Patente|MX/a/2013/014765|11/12/2013|10/03/2016|<i>H01H33/53</i> <b>(2006-01)</b>; <i>H01H9/34</i> <b>(2006-01)</b>|SILENCIADOR PARA PROTECCION MEJORADA DE ARCO|Se describe un silenciador para protección mejorada de arco. En el caso de un evento de arco interno en un encierro eléctrico, el silenciador desfoga plasma y gas de arco paralelos a la superficie del encierro, en lugar de directamente hacia donde pueden estar localizadas las personas. El silenciador incluye placas perforadas y placas deflectoras en su espacio interior. Las placas perforadas tienen patrones de perforación descentrados uno de otro, y las placas deflectoras se proporcionan en partes opuestas, provocando que el plasma y gas tomen múltiples cambios de dirección. Las placas perforadas también filtran el plasma y gas de arco. Estos cambios de dirección y filtración dan por resultado reducción de energía del desfogue, lo que proporciona un margen incrementado de seguridad. Además, el silenciador proporciona un nivel adecuado de ventilación en el encierro, manteniendo de este modo fríos a los componentes.|FRANK MICHAEL PAGE II [US]; Easley, California, 29642, US|SCHNEIDER ELECTRIC USA, INC. [US]; Palatine, Illinois, 60067, US|
337541|Patente|MX/a/2013/009898|28/08/2013|10/03/2016|<i>F16L15/04</i> <b>(2006-01)</b>|JUNTA ROSCADA PARA TUBERIAS.|Juntas roscadas de tipo de sello radial para tuberías de acero tienen todavía un margen de mejora para asegurar la capacidad de sellado en términos de la rigidez de la nariz de extremo macho. Específicamente, la superficie circunferencial externa de la nariz 8 del extremo macho 3 tiene una forma curvada convexa hacia el exterior, y la superficie de sellado de la unión hembra 1 tiene una forma ahusada; y el área de sección transversal del extremo macho 3 en un punto de sello sp que es una porción en la superficie circunferencial externa de la nariz 8 del extremo macho 3, la porción que primero entra en contacto con la superficie de sellado de la unión hembra 1 cuando se une de forma roscada, es 35 % o más del área de sección transversal de una porción de tubería original correspondiente a una porción no procesada.|OSAMU SONOBE [JP]; TAKUYA NAGAHAMA [JP]; MASAKI YOSHIKAWA [JP]; JUN TAKANO [JP]; TAKAMASA KAWAI [JP]; KAZUNARI TAKAHASHI [JP]; HIROSHI CHIKATSUNE [JP]; MASAKI UETA [JP]; Chiyoda-ku, Tokio, 100-0011, JP|JFE STEEL CORPORATION [JP]; Chiyoda-ku, Tokio, 100-0011, JP|
337542|Patente|MX/a/2012/000871|14/03/2008|10/03/2016|<i>H01M8/06</i> <b>(2006-01)</b>; <i>C01B3/38</i> <b>(2006-01)</b>; <i>H01M8/00</i> <b>(2006-01)</b>; <i>H01M8/04</i> <b>(2006-01)</b>|SISTEMA DE CELULA ENERGETICA QUE PRODUCE HIDROGENO, CEBADO TERMICAMENTE.|La presente invención se refiere a un sistema de procesamiento de combustible productor de hidrógeno cebado térmicamente, caracterizado porque comprende: un montaje de procesamiento de combustible que comprende una región productora de hidrógeno que contiene un catalizador de reformación, en donde la región productora de hidrógeno está localizada dentro de un alojamiento que define una superficie exterior y está configurada para recibir un flujo de alimentación que contiene al menos una alimentación que contiene carbón y agua y, cuando la región productora de hidrógeno está al menos dentro de un rango de temperatura de producción de hidrógeno, para producir desde el flujo de alimentación un flujo de gas mezclado que contiene gas hidrógeno y otros gases; una estructura de contención aislada que incluye un recinto, donde el recinto incluye paredes que incluyen superficies internas que definen un compartimiento interno que contiene al menos región productora de hidrógeno del montaje de procesamiento de combustible, donde la superficie exterior del alojamiento está separada de al menos una porción de las superficies internas, donde el reciento incluye un puerto de flujo de alimentación, el cual está configurado para recibir el flujo de alimentación en el compartimiento interno, y además donde el recinto incluye un puerto de producto de hidrógeno, el cual está configurado para permitir salir al menos gas hidrógeno del flujo de gas mezclado del compartimiento interno; un conducto de flujo de alimentación que está configurado para transportar el flujo de alimentación del puerto de flujo de alimentación al montaje de procesamiento de combustible; un conducto de producto de hidrógeno que está configurado para transportar al menos el gas hidrógeno del montaje de procesamiento de combustible al puerto de producto de hidrógeno; un montaje de calentamiento configurado para calentar y mantener al menos el compartimiento interno de la estructura de contención aislada en o por encima de una temperatura de producto de hidrógeno umbral que está dentro del intervalo de temperatura de producción de hidrógeno, donde el montaje de calentamiento es un calentador eléctrico que está configurado para recibir un flujo de aire y para calentar el flujo de aire para generar un flujo de fluido de calentamiento del mismo, y además donde el reciento incluye un puerto de entrada que está configurado para recibir el flujo de fluido de calentamiento dentro del compartimiento interno y un puerto de escape que está configurado para permitir al flujo de fluido de calentamiento salir del compartimiento interno; y un controlador configurado para controlar selectivamente la operación del sistema de procesamiento de combustible productor de hidrógeno cebado térmicamente para calentar y mantener al menos el compartimiento interno de la estructura de contención aislada en o por encima de la temperatura de producción de hidrógeno umbral durante periodos en los cuales no hay demanda activa para que el montaje de procesamiento de combustible produzca el flujo de gas mezclado y el montaje de procesamiento de combustible no está produciendo el flujo de gas mezclado de manera que la región productora de hidrógeno generará el flujo de gas mezclado responsable directamente de recibir el flujo de alimentación.|DAVID J. EDLUND [US]; Bend, Oregon, 97701, US|IDATECH, LLC. [US]; Bend, Oregon, 97701, US|
337543|Patente|MX/a/2013/010949|24/09/2013|10/03/2016|<i>C07K16/22</i> <b>(2006-01)</b>; <i>C07K16/26</i> <b>(2006-01)</b>|MOLECULAS DE UNION BIESPECIFICAS QUE SE UNEN A VEGF Y ANG2.|La presente invención se refiere a moléculas de unión biespecíficas que se unen tanto a VEGF como a Ang2, preferiblemente en forma de dominios variables individuales de inmunoglobulina tales como VHH y anticuerpos de dominio, composiciones farmacéuticas que las contienen y su uso en el tratamiento de enfermedades que están asociadas con los efectos mediados por VEGF y/o Ang2 sobre la angiogénesis. Además, también se describen ácidos nucleicos que codifican moléculas de unión biespecíficas, células hospedadoras y métodos para prepararlos.|ANDREAS GSCHWIND [DE]; JOACHIM BOUCNEAU [BE]; RENE GEORG OTT [AT]; MARIE-ANGE BUYSE [BE]; ERIK DEPLA [BE]; Ingelheim am Rhein, 55216, DE|BOEHRINGER INGELHEIM INTERNATIONAL GMBH [DE]; Ingelheim Am Rhein, 55216, DE|
337544|Patente|MX/a/2013/014290|05/12/2013|10/03/2016|<i>C08G18/28</i> <b>(2006-01)</b>; <i>C08G18/10</i> <b>(2006-01)</b>; <i>C08G18/66</i> <b>(2006-01)</b>; <i>C08G18/75</i> <b>(2006-01)</b>; <i>C08L75/08</i> <b>(2006-01)</b>; <i>C09D7/00</i> <b>(2006-01)</b>|ESPESANTES NO IONICOS ASOCIADOS QUE CONTIENEN CICLOHEXILOLES DE ALQUILO, FORMULACIONES QUE LOS CONTIENEN Y SUS USOS.|La presente invención se refiere a nuevos espesantes asociativos de tipo HEUR (uretano-óxido de etileno modificado hidrófugamente), en los que el monómero hidrófugo se deriva de ciclohexiloles de alquilo. Estos nuevos poliuretanos permiten espesar en gran medida una formulación acuosa a un gradiente de cizallamiento medio, limitando al mismo tiempo el aumento de la viscosidad a un gradiente de cizallamiento bajo. La invención también se refiere a las composiciones que los contienen y a sus utilizaciones en diferentes formulaciones, tales como las pinturas acuosas.|JEAN-MARC SUAU [FR]; DENIS RUHLMANN [FR]; Lucenay, F-69480, FR|COATEX [FR]; Genay, F-69730, FR|
337545|Patente|MX/a/2013/014521|09/12/2013|10/03/2016|<i>A61F13/537</i> <b>(2006-01)</b>; <i>A61F13/535</i> <b>(2006-01)</b>; <i>A61F13/539</i> (2006-01)|ARTICULO ABSORBENTE CON ESTRUCTURA DE ENTRADA.|Un artículo absorbente (1) que comprende una cubierta exterior permeable al fluido (2), una cubierta interior impermeable al fluido (4) y un núcleo absorbente (6) incluido entre la cubierta exterior (2) y la cubierta interior (4). El núcleo absorbente (6) comprende una primera capa absorbente (22) que tiene una apertura (25) que se extiende a través de la misma. Una estructura de control de flujo de fluido (24) se arregla entre la primera capa absorbente (22) y la cubierta interior (4). La estructura de control de flujo de fluido (24) es una estructura en capas que comprende una capa polimérica fibrosa no perforada (31) y una primera capa polimérica perforada (32) que tiene un peso base de entre 50 g/m2 y 100 g/m2.|PATRICK ANDERSSON [SE]; PER BERGSTRÖM [SE]; MALIN LUNDMAN [SE]; Billdal, S-427 42, SE|SCA HYGIENE PRODUCTS AB [SE]; Göteborg, S-405 03, SE|
337546|Patente|MX/a/2014/008642|16/07/2014|10/03/2016|<i>H04N21/61</i> <b>(2011-01)</b>; <i>H04N21/643</i> <b>(2011-01)</b>; <i>H04W28/14</i> <b>(2009-01)</b>; <i>H04W72/00</i> <b>(2009-01)</b>|SISTEMA DE COMUNICACION INALAMBRICA DE EVOLUCION A LARGO PLAZO PARA PROPORCIONAR SERVICIOS DENOMINADOS "PUSH TO VIDEO".|Un sistema de comunicación inalámbrica LTE incluye una estación base LTE y dispositivos de comunicación inalámbrica móviles. Cada dispositivo de comunicación inalámbrica móvil intercambia datos de vídeo con otro dispositivo de comunicación inalámbrica móvil por intermedio de la estación base LTE y enviando al menos una demanda de PTV y una demanda de RTV a la estación base LTE. La estación base LTE está configurada, cuando el tráfico de red es inferior a un valor umbral, para asignar ancho de banda para una conexión de PTV entre un dispositivo de comunicación inalámbrica móvil dado y otro dispositivo de comunicación inalámbrica móvil dado, y cuando el tráfico de red supere el valor umbral, para asignar ancho de banda para una conexión de RTV entre el dispositivo de comunicación inalámbrica móvil dado y el otro dispositivo de comunicación inalámbrica móvil dado.|BARRY EINSIG [US]; Red Lion, Pennsylvania, 17356, US|HARRIS CORPORATION [US]; Melbourne, Florida, 32919, US|
337547|Patente|MX/a/2013/010087|02/09/2013|10/03/2016|<i>B29C45/00</i> <b>(2006-01)</b>; <i>B29C45/06</i> <b>(2006-01)</b>; <i>B29C45/14</i> <b>(2006-01)</b>|PRENSA PARA FABRICAR UN OBJETO DE UNA SOLA PIEZA Y PROCEDIMIENTO PARA UTILIZAR DICHA PRENSA.|La invención se refiere a una prensa que permite fabricar un objeto de una sola pieza, como por ejemplo un tubo, así como al procedimiento para utilizar dicha prensa. Esto objeto está constituido por una primera pieza, por ejemplo un faldón, por una segunda pieza, por ejemplo una tapa abatible y por una tercera pieza, por ejemplo una cabeza de distribución, siendo esta tercera pieza sobremoldeada sobre las otras dos. La prensa incorpora dos placas rotatorias (110, 210) paralelas, pero separadas, incorporando cada una un molde (120, 220) que presenta dos partes (121, 122; 221, 222). Cada parte puede ser colocada por unos medios de rotación ya sea en la parte superior o bien en la parte inferior, de manera que la parte (121) del primer molde situada en la parte superior se encuentre enfrente de la parte (222) del segundo molde situada en la parte inferior. Conforme al procedimiento, las primeras piezas son insertadas en la prensa dentro de una primera zona, llamada zona de inserción (Z1). Paralelamente, las segundas piezas son introducidas en una segunda zona llamada zona de introducción (Z2). Dentro de una tercera zona (Z3), llamada zona común, las terceras piezas son sobremoldeadas sobre las primeras piezas y las segundas piezas puestas en posición previamente dentro de la zona de inserción y de la zona de introducción y puestas en proximidad las unas respecto de las otras dentro de la zona común en la posición que tendrán dentro del objeto acabado. Después de la estabilización y del enfriamiento parciales, la prensa se abre, las placas son giradas de forma que los objetos acabados se encuentren dentro de la parte del segundo molde que se encuentra en la parte superior, mientras que las primeras partes se encuentran dentro de la parte del segundo molde que se encuentra en la parte inferior y las segundas piezas se encuentran dentro de la parte del primer molde que se encuentra en la parte superior.|BODET, HERVÉ [FR]; FOURNET, DOMINIQUE [FR]; Verdun, F-55100, FR|LINDAL FRANCE SAS [FR]; Briey, F-54150, FR|
337548|Patente|MX/a/2012/011776|10/10/2012|10/03/2016|<i>C07D209/14</i> <b>(2006-01)</b>; <i>A61K31/437</i> <b>(2006-01)</b>; <i>A61P25/28</i> <b>(2006-01)</b>; <i>C07D401/14</i> <b>(2006-01)</b>; <i>C07D471/04</i> <b>(2006-01)</b>; <i>C07D495/04</i> <b>(2006-01)</b>|NUEVOS COMPUESTOS PARA TRATAMIENTO DE ENFERMEDADES ASOCIADAS CON PROTEINAS AMILOIDES O TIPO AMILOIDE.|La presente invención se refiere a nuevos compuestos que se pueden emplear en el tratamiento de un grupo de trastornos y anormalidades asociadas con proteína amiloide, tal como enfermedad de Alzheimer, y de enfermedades asociadas con proteínas tipo amiloide. Los compuestos de la presente invención también se pueden usar en el tratamiento de enfermedades oculares asociadas con anormalidades/cambios patológicos en los tejidos del sistema visual. La presente invención se refiere adicionalmente a composiciones farmacéuticas que comprenden estos compuestos y al uso de estos compuestos para la preparación de medicamentos para tratar o prevenir enfermedades o condiciones asociadas con proteínas amiloides y/o tipo amiloide. También se describe un método para tratar o prevenir enfermedades o condiciones asociadas con proteínas amiloides y/o tipo amiloide.|ANDREAS MUHS [DE]; WOLFGANG FROESTL [AT]; NAMPALLY SREENIVASACHARY [IN]; HEIKO KROTH [DE]; COTINICA HAMEL [RO]; PASCAL BENDERITTER [FR]; Pully, VD, CH-1009, CH|AC IMMUNE S.A.* [CH]; Lausanne, CH-1015, CH|
337549|Patente|MX/a/2012/014641|13/12/2012|10/03/2016|<i>C07K14/62</i> <b>(2006-01)</b>|DERIVADOS DE INSULINA QUE CONTIENEN ENLACES DISULFURO ADICIONALES.|La presente invención se refiere a derivados de insulina que contienen enlaces disulfuro adicionales y métodos para su elaboración.|PETER MADSEN [DK]; SVEND LUDVIGSEN [DK]; FRANTISEK HUBALEK [CZ]; THOMAS BØRGLUM KJELDSEN [DK]; Bagsvaerd, DK-2880, DK|NOVO NORDISK A/S.* [DK]; Bagsvaerd, DK-2880, DK|
337550|Patente|MX/a/2012/008546|23/07/2012|10/03/2016|<i>A23L1/236</i> <b>(2006-01)</b>|METODOS PARA TRATAR MEZCLAS DE GLICOSIDOS PARA OBTENER UNO O MAS DE ESTOS GLICOSIDOS EN FORMA MAS PURA.|La presente invención se refiere a métodos para tratar mezclas que contienen rebaudiósido A (Reb A), rebaudiósido B (Reb B), y rebaudiósido D (Reb D) naturales, contrapartes sintéticas de estos, y/o derivados de las modalidades naturales o sintéticas para obtener uno o más de estos glicósidos en forma más pura. En muchas modalidades, la invención se puede usar para procesar mezclas de glicósidos obtenidas al menos en parte de fuentes naturales tal como la planta Stevia. Esto permite, por ejemplo, la recuperación de un producto que incluye material de Reb A en forma más pura con relación a material de Reb B o material de Reb D. Como una alternativa o además de la recuperación del material de Reb A purificado, se puede obtener un producto que incluye Reb B y/o material de Reb D en forma más pura con relación al material de Reb A.|ALLAN S. MYERSON [US]; TROY ALLEN RHONEMUS [US]; JOHN JOSEPH HAHN [US]; ANDREW KEITH OHMES [US]; KERN M. STORO [US]; CHRISTOPHER AUSTIN TYLER [US]; ARON BROMAN ERICKSON [US]; Chicago, Illinois, 60640, US|CARGILL, INCORPORATED.* [US]; Wayzata, Minnesota, 55391, US|
