Número de concesión|Tipo de documento|Número de solicitud|Fecha de presentación|Fecha de concesión|Clasificación CIP|Título|Resumen|Inventor(es)|Titular
340041|Patente|MX/a/2013/014225|04/12/2013|23/06/2016|<i>H05B3/12</i> <b>(2006-01)</b>; <i>H05B3/86</i> <b>(2006-01)</b>|ELEMENTO DE CALENTAMIENTO QUE TIENE PELICULAS.|La invención se refiere a un elemento de calentamiento que comprende un sustrato (1) equipado con un apilamiento de capas de películas delgadas, el apilamiento de películas delgadas comprende una película (3) adecuada para calentamiento, que tiene una resistencia eléctrica superficial de 20 a 200 O/cuadrado, en donde el elemento de calentamiento también incluye dos conductores colectores adecuados para ser alimentados con voltaje eléctrico, la película adecuada para calentamiento es una película de óxido transparente eléctricamente conductor, y la película (3) adecuada para calentamiento no se trabaja a máquina y se conecta eléctricamente a ambos colectores conductores. La película (3) que es adecuada para calentamiento tiene un espesor de entre 50 nm y 300 nm. La invención hace posible instalar fácilmente un elemento de calentamiento, que tiene una película adecuada para calentamiento y simple de fabricar, en un vehículo eléctrico, o conectar fácilmente el elemento a la red de energía pública.|BERNARD NGHIEM [FR]; EMMANUELLE PETER [FR]; EMILIE CHARLET [FR]; STEPHANE LAURENT [FR]; Arsy, F-60190, FR|SAINT-GOBAIN GLASS FRANCE [FR]; Courbevoie, F-92400, FR|
340042|Patente|MX/a/2015/002809|04/03/2015|23/06/2016|<i>F21V8/00</i> <b>(2006-01)</b>; <i>B60Q3/02</i> <b>(2006-01)</b>|PANEL DE VIDRIO ILUMINADO.|La presente invención se refiere a un acristalamiento de iluminación que comprende - una primera hoja (1) de vidrio transparente o plástico con una primera cara (11) principal, una segunda cara (12) principal y un reborde (13); - una guía de onda (3) plana con una primera cara (31) principal, una segunda cara (32) principal, un reborde (33) de inyección y un reborde (34) biselado, opuesto al reborde de inyección; - una fuente (2) de luz, de preferencia un módulo de diodo emisor de luz (módulo de LED), colocado de frente al reborde (33) de inyección de la guía de onda (3) plana, la guía de onda (3) plana se fija mediante la segunda cara (32) principal a la primera cara (11) principal de la primera hoja de vidrio (11).|ADÈLE VERRAT-DEBAILLEUL [FR]; CHRISTOPHE KLEO [FR]; PASCAL BAUERLE [DE]; Villers-Sur-Coudun, F-60150, FR|SAINT-GOBAIN GLASS FRANCE [FR]; Courbevoie, F-92400, FR|
340043|Patente|MX/a/2013/014079|29/11/2013|22/06/2016|<i>A01N1/02</i> <b>(2006-01)</b>; <i>C12N5/00</i> <b>(2006-01)</b>|COMPOSICION CONSERVADORA DE ORGANOS Y USOS.|La presente invención se refiere al uso de una composición que comprende al menos un globina DE Arenicolidae, un protómero de globina de Arenicolidae o una hemoglobina extracelular de Arenicolidae, una solución estabilizante y/o una solución de conservación de órganos, dicha composición tiene una temperatura de entre 0°C y 37°C, para la conservación de un órgano en una donación después de muerte cerebral o una donación después de muerte cardiaca. Un método para conservar un órgano ex situ en una donación después de muerte cerebral o una donación después de muerte cardiaca, el método caracterizado porque comprende los siguientes pasos : a) perfusión de dicho donante fallecido con una composición, b) recolección del órgano a ser trasplantado; luego c) conservación por perfusión estática o dinámica de dicho órgano obtenido en el paso b), a una temperatura de entro 0°C y 37°C, preferiblemente entre 2°C y 25°C, más preferiblemente de aproximadamente 4°C, durante un tiempo predeterminado de acuerdo con dicho órgano, en la composición o la solución acuosa definida en el paso a).|ZAL, FRANCK [FR]; ROUSSELOT, MORGANE [FR]; DUTHEIL, DELPHINE [FR]; HAUET, THIERRY [FR]; Ploujean-Morlaix, F-29600, FR|HEMARINA [FR]; Morlaix, F-29600, FR|
340044|Patente|MX/a/2013/011350|30/09/2013|22/06/2016|<i>B63B35/03</i> <b>(2006-01)</b>; <i>F16L1/20</i> <b>(2006-01)</b>|EMBARCACION DE TENDIDO DE TUBERIAS PARA TENDER UNA TUBERIA EN UN LECHO MARINO.|Una embarcación de tendido de tuberías para tender una tubería en el lecho marino, cuya embarcación de tendido de tuberías comprende un casco, un dispositivo de posicionamiento para posicionar una sección de tubería en una línea de mira a lo largo de la que se tiende la tubería, cuyo dispositivo de posicionamiento está soportado por el casco, y una pinza para sujetar la tubería está suspendida desde la embarcación, en donde la pinza está ubicada en la línea de mira, y comprende un dispositivo de soporte diseñado y dispuesto para permitir que la pinza sostenga una tubería de un primer modo en donde la pinza tiene una posición fija en relación con el dispositivo de posicionamiento, y de un segundo modo en donde la pinza se puede articular en relación con el dispositivo de posicionamiento.|VAN ZANDWIJK, CORNELIS [NL]; AA Leiden, NL-2332, NL|HEEREMA MARINE CONTRACTORS NEDERLAND SE [NL]; AA Leiden, NL-2332, NL|
340045|Patente|MX/a/2013/005921|24/05/2013|22/06/2016|<i>A61F9/007</i> <b>(2006-01)</b>; <i>A61B3/00</i> <b>(2006-01)</b>; <i>A61B3/113</i> <b>(2006-01)</b>; <i>A61B3/13</i> <b>(2006-01)</b>; <i>A61B3/15</i> <b>(2006-01)</b>; <i>A61F9/00</i> <b>(2006-01)</b>; <i>G06T7/00</i> <b>(2006-01)</b>|METODO Y APARATO PARA REGISTRO OCULAR MULTI-NIVEL.|Un método para realizar registro ocular que comprende: obtener una primera imagen ocular de referencia inicial por un primer dispositivo de diagnóstico y definir un sistema de coordenadas de referencia; obtener una segunda imagen ocular por un dispositivo quirúrgico, dicha segunda imagen ocular es obtenida en una fase de pre-cirugía antes de que la cirugía ha comenzado; realizar un primer registro entre dicha primera imagen ocular y dicha segunda imagen ocular para obtener un primer resultado de registro; obtener una tercera imagen ocular por dicho dispositivo quirúrgico, dicha tercera imagen ocular es obtenida después de que la cirugía ha comenzado; realizar un segundo registro entre dicha segunda imagen ocular y dicha tercera imagen ocular para obtener un segundo resultado de registro; combinar dichos primero y segundo resultados de registro para obtener un resultado de registro combinado para así obtener un registro entre dicha imagen ocular de referencia inicial obtenida por dicho dispositivo de diagnóstico y dicha tercera imagen ocular obtenida por dicho dispositivo quirúrgico después de que la cirugía ha comenzado.|KERSTING, OLIVER [DE]; GRECU, HORIA [RO]; Kleinmachnow, 14532, DE|ALCON PHARMACEUTICALS LTD. [CH]; Fribourg, CH-1701, CH|
340046|Patente|MX/a/2012/009078|19/08/2011|22/06/2016|<i>A23B4/02</i> <b>(2006-01)</b>; <i>A23L3/3454</i> <b>(2006-01)</b>; <i>A23L3/358</i> <b>(2006-01)</b>|METODO PARA MEJORAR LAS PROPIEDADES SENSORIALES Y LA RESISTENCIA DE LOS PRODUCTOS ALIMENTICIOS Y PARA BEBER A MICROORGANISMOS.|La presente invención se refiere a un método para mejorar las propiedades sensoriales y la resistencia de los productos alimenticios y para beber, especialmente productos cárnicos sin curar, a varios tipos de microorganismos y en particular bacterias que afectan los alimentos o bacterias que envenenan los alimentos, en donde el producto entra en contacto con una composición que comprende sales de metal alcalino que tienen como aniones propionato y un co-anión seleccionado de lactato, acetato y combinaciones de los mismos, y como cationes potasio e hidrógeno, en donde la relación basada en el peso de lactato/propionato está en la escala de 0 a 20 y la relación basada en el peso de acetato/propionato está en la escala de 0.05 a 3.5.|VISSER, DIANA [NL]; KNIKKER, DIRK ALEXANDER [NL]; LP Rotterdam, NL-3039, NL|PURAC BIOCHEM BV [NL]; AC Gorinchem, NL-4206, NL|
340047|Patente|MX/a/2015/005754|07/05/2015|22/06/2016|<i>B23K26/04</i> <b>(2014-01)</b>; <i>B23K26/14</i> <b>(2014-01)</b>; <i>B23K26/38</i> <b>(2014-01)</b>|BOQUILLA LASER QUE TIENE UN ELEMENTO MOVIL EXTERNO.|La invención se relaciona con una boquilla para el corte con láser, que comprende un cuerpo de la boquilla (1) que comprende un primer pasaje axial (5); una cubierta externa (13) que comprende un alojamiento axial (7), el cuerpo de la boquilla (1) se coloca al menos parcialmente en el alojamiento axial (7); un elemento móvil (3) que comprende un segundo pasaje axial (4) y una porción frontal (3a) que forma un faldón, el elemento móvil (3) está colocado entre la cubierta externa (13) y el cuerpo de la boquilla (1), y se mueve traslacionalmente en el alojamiento axial (7) de la cubierta externa (13); y un elemento elástico (8) colocado en el alojamiento axial (7), entre la cubierta externa (13) y el cuerpo de la boquilla (1). De acuerdo con la invención, el elemento móvil (3) es capaz, y está diseñado para moverse traslacionalmente en el alojamiento axial (7) en la dirección del primer orificio de salida (14) bajo el efecto de una presión gaseosa del gas de ayuda (23), la presión se aplica en el alojamiento axial (7) y se ejerce en el elemento móvil (3), el elemento elástico (8) ejerce una fuerza de retorno elástica en el elemento móvil (3), que tiende a oponerse al movimiento de traslación del elemento móvil (3). Cabezal láser y aparato asociados. Proceso de corte que emplea tal boquilla.|JOUANNEAU THOMAS [FR]; LEFEBVRE PHILIPPE [FR]; Grenoble, F-38000, FR|L'AIR LIQUIDE, SOCIETE ANONYME POUR L'ETUDE ET L'EXPLOITATION DES PROCEDES GEORGES CLAUDE [FR]; Paris, 75007, FR|
340048|Patente|MX/a/2014/013480|06/11/2014|22/06/2016|<i>G08G1/0967</i> <b>(2006-01)</b>|SISTEMA Y METODO DE SUMINISTRO DE INFORMACION EN EL INTERIOR DE UN VEHICULO.|Se proporciona un sistema de visualización de información en el interior del vehículo, que comprende un receptor GPS que determina la ubicación de un vehículo, y una interfaz de usuario para comunicar información recibida sobre una red de comunicación inalámbrica, caracterizado por que la información recibida sobre la red de comunicación inalámbrica se comunica a una interfaz de usuario dependiendo de la velocidad del vehículo. Además, el contenido de la información recibida sobre la red de comunicación inalámbrica y comunicada al usuario depende de la velocidad del vehículo. El sistema hace uso de una pantalla delantera, de manera que la información del contenido solamente se dirige al usuario. La presente invención también proporciona un método para comunicar información sobre una red de comunicación inalámbrica a un vehículo.|BRADEN, JUDE [IE]; Mallorca, E-07320, ES|ITCICO SPAIN, S.L. [ES]; Palma de Mallorca, E-07001, ES|
340049|Patente|MX/a/2013/012446|24/10/2013|22/06/2016|<i>B65D71/00</i> <b>(2006-01)</b>; <i>B65D79/02</i> <b>(2006-01)</b>; <i>F16B11/00</i> <b>(2006-01)</b>|PARCHE ADHESIVO Y METODO DE USO EN UN SISTEMA DE ENVASADO.|Se describen un parche adhesivo y método de uso del mismo para formar una pluralidad de artículos apilables en una carga apilada verticalmente. El método puede incluir suministrar una pila alineada de artículos situada sobre un palé para su transporte final mientras se minimiza la desalineación de los artículos apilables.|IVOSEVIC, MILAN [RU]; TITUS, NOEL [IN]; Kinnelon, NJ., 07405, US|BECTON, DICKINSON AND COMPANY [US]; Franklin Lakes, New Jersey, 07417-1880, US|
340050|Patente|MX/a/2014/010948|11/09/2014|22/06/2016|<i>G06F9/455</i> <b>(2006-01)</b>|TRANSFORMACION DE ESPECIFICADORES DE INSTRUCCIONES NO CONTIGUOS A ESPECIFICADORES DE INSTRUCCIONES CONTIGUOS.|Se describe la emulación de instrucciones que incluyen especificadores no contiguos que es facilitada. Un especificador no contiguo especifica un recurso de una instrucción, tal como un registro, utilizando múltiples campos de la instrucción. Por ejemplo, múltiples campos de la instrucción (dos campos) incluyen bits que conjuntamente designan un registro particular a ser usado por la instrucción. especificadores no contiguos de instrucciones definidas en una arquitectura de sistema de computadora son transformados a especificadores contiguos utilizables por instrucciones definidas en otra arquitectura de sistema de computadora. Las instrucciones definidas en la otra arquitectura de sistema de computadora emulan las instrucciones definidas para la arquitectura de sistema de computadora.|GSCHWIND, MICHAEL. KARL [US]; Poughkeepsie, New York, 12601, US|INTERNATIONAL BUSINESS MACHINES CORPORATION [US]; Armonk, New York, 10504, US|
340051|Patente|MX/a/2015/004150|31/03/2015|22/06/2016|<i>H01J5/10</i> <b>(2006-01)</b>; <i>H01J17/26</i> <b>(2012-01)</b>; <i>H05H1/34</i> <b>(2006-01)</b>|SOPLETE DE ARCO DE PLASMA QUE TIENE MULTIPLES MODOS DE OPERACION.|La presente invención proporciona un soplete de arco de plasma multimodal que incluye un recipiente cilíndrico que tiene un primer extremo y un segundo extremo, una primera entrada/salida tangencial conectada a o próxima al primer extremo, una segunda entradas/salida tangencial conectada a o próximo al segundo extremo, un alojamiento de electrodo conectado al primer extremo del recipiente cilíndrico tal que un primer electrodo se (a) alinea con un eje longitudinal del recipiente cilíndrico, y (b) se extiende en el recipiente cilíndrico, y una boquilla de electrodo hueca conectada al segundo extremo del recipiente cilíndrico tal que la línea central de la boquilla de electrodo hueca se alinea con el eje longitudinal del recipiente cilíndrico. El ajuste de una posición de electrodo con respecto al electrodo hueco provoca que el soplete de arco de plasma multimodal opere en un modo resistivo de corto circuito, un modo de arco sumergido, un modo de electrólisis, un modo de descarga luminiscente o un modo de arco de plasma.|FORET, TODD [US]; The Woodlands, Texas, US|FORET PLASMA LABS, LLC [US]; The Woodlands, Texas, 77381, US|
340052|Patente|MX/a/2015/009458|22/07/2015|22/06/2016|<i>G06F17/16</i> <b>(2006-01)</b>|CODIGO DE EXCEPCION DEL VECTOR.|Se facilita el manejo de la excepción del vector. Se ejecuta una instrucción vectorial que opera en uno o más elementos de un registro del vector. Cuando una excepción se encuentra durante la ejecución de la instrucción, se proporciona un código de excepción del vector, que indica una posición dentro del registro del vector que causó la excepción. El código de excepción del vector también incluye una razón para la excepción.|SLEGEL, TIMOTHY [US]; SCHWARZ, ERIC, MARK [US]; BRADBURY, JONATHAN, DAVID [US]; GSCHWIND, MICHAEL, KARL [US]; Poughkeepsie, New York, 12601-5400, US|INTERNATIONAL BUSINESS MACHINES CORPORATION [US]; Armonk, New York, 10504, US|
340053|Patente|MX/a/2013/013293|14/11/2013|22/06/2016|<i>C12N15/11</i> <b>(2006-01)</b>; <i>C12Q1/04</i> <b>(2006-01)</b>; <i>C12Q1/68</i> <b>(2006-01)</b>|METODOS, COMPOSICIONES Y KITS PARA DETERMINAR EL VIRUS DE LA INMUNODEFICIENCIA HUMANA (VIH).|La presente invención se refiere a composiciones, procedimientos y kits para determinar la presencia o ausencia de VIH en una muestra, en particular para determinar VIH-1 del grupo M, VIH-1 del grupo O y/o VIH-2, en particular para determinar de forma simultánea VIH-1 del grupo M, VIH-1 del grupo O y VIH-2.|WRONSKA, DANUTA [US]; SCHOUEST, KATHERINE [US]; TREMLETT, LESLIE [US]; Raleigh, North Caroline, 27613, US|GRIFOLS THERAPEUTICS INC.* [US]; Research Triangle Park, North Caroline, 27709, US|
340054|Patente|MX/a/2015/005755|07/05/2015|22/06/2016|<i>B23K26/04</i> <b>(2014-01)</b>; <i>B23K26/14</i> <b>(2014-01)</b>; <i>B23K26/38</i> <b>(2014-01)</b>|BOQUILLA DE LASER QUE TIENE ELEMENTO MOVIBLE INTERNO Y CUBIERTA EXTERNA.|Se describe una boquilla de láser que comprende un cuerpo de boquilla (1) que comprende un primer alojamiento axial (5) que comprende un primer orificio de salida (11) ubicado en la cara frontal (1a) del cuerpo de boquilla (1); un elemento movible (2) dispuesto en el primer alojamiento axial (5) del cuerpo de boquilla (1), que comprende una porción frontal (2a) que forma un faldón y un pasaje axial (4) que tiene un segundo orificio de salida (12) que emerge de la porción frontal (2a) que forma un faldón y un elemento elástico (8) dispuesto en el primer alojamiento axial (5), entre el cuerpo de boquilla (1) y el elemento movible (2). De acuerdo con la invención, el elemento movible (2) es apto para moverse traslacionalmente en el primer alojamiento axial (5) en dirección del primer orificio de salida (11) bajo el efecto de una presión gaseosa ejercida sobre el elemento movible (2) y el elemento elástico (8) ejerce una fuerza de retorno elástica sobre el elemento movible (2) que tiende a oponerse al movimiento traslacional en el primer alojamiento axial (5) en dirección del primer orificio de salida (11). Además, la boquilla comprende adicionalmente una cubierta externa (13) que forma un manguito alrededor de todo o algo del cuerpo de la boquilla (1). La cabeza de enfoque y aparato de corte por láser asociado. El proceso de corte por haz de láser emplea una boquilla de acuerdo con la invención, una cabeza de enfoque de láser de acuerdo con la invención o un aparato de acuerdo con la invención.|JOUANNEAU THOMAS [FR]; LEFEBVRE PHILIPPE [FR]; Meulan, F-78250, FR|L'AIR LIQUIDE, SOCIETE ANONYME POUR L'ETUDE ET L'EXPLOITATION DES PROCEDES GEORGES CLAUDE [FR]; Paris, F-75007, FR|
340055|Patente|MX/a/2011/010825|13/10/2011|22/06/2016|<i>A61K9/51</i> <b>(2006-01)</b>; <i>A61K31/337</i> <b>(2006-01)</b>; <i>G01N33/53</i> <b>(2006-01)</b>|METODOS Y COMPOSICIONES DE NANOPARTICULAS SIN PRIONES.|La presente invención se refiere a composiciones sin priones que comprenden nanopartículas que comprenden fármacos insolubles en albúmina y sustancialmente en agua. También se proporcionan métodos para producir composiciones libres de o sin priones y métodos de extracción de proteínas de prión de las composiciones de nanopartículas. También se proporcionan métodos de uso de las composiciones, así como equipos útiles para la realización de los métodos.|SOON-SHIONG, PATRICK [US]; DESAI, NEIL, P. [US]; PEYKOV, VIKTOR [US]; Los Angeles, California, 90025, US|ABRAXIS BIOSCIENCE, LLC [US]; ABRAXIS BIOSCIENCE, LLC [US]; Los Angeles, California, 90025, US|
340056|Patente|MX/a/2013/008365|18/07/2013|22/06/2016|<i>C07K14/765</i> <b>(2006-01)</b>; <i>A61K38/38</i> (2006-01); <i>A61K47/12</i> (2006-01); <i>A61K47/14</i> (2006-01); <i>C12N7/06</i> (2006-01)|INACTIVACION VIRAL POR CAPRILATO.|La presente invención se refiere a un procedimiento de preparación de albúmina a partir de una solución que comprende albúmina, el procedimiento comprende: (i) ajustar la concentración de proteínas de la solución a menos del 5%, (ii) añadir ácido caprílico (ácido octanoico) o caprilato de sodio a la solución obtenida en el paso (i); (iii) ajustar el pH de la solución obtenido en el paso (ii) a pH 5 o menos; (iv) aumentar la temperatura de la solución obtenida en el paso (iii) a 27°C -30°C; e (v) incubar la solución obtenida en el paso (iv) por 30 min a 120 min.|LEBING, WYTOLD [US]; BURNS, DOUG [US]; ROTH, NATHAN [US]; HOTTA, JOANN [US]; Seattle, Washington, 98117, US|GRIFOLS, S.A. [ES]; Barcelona (Barcelona), 08022, ES|
340057|Patente|MX/a/2012/001176|27/01/2012|22/06/2016|<i>C08K5/092</i> <b>(2006-01)</b>; <i>C08K3/00</i> (2006-01); <i>C08K5/00</i> <b>(2006-01)</b>; <i>C08K5/09</i> <b>(2006-01)</b>|COMPOSICION EN POLVO O GRANULADA QUE CONSTA DE UN COPOLIMERO, UN ACIDO DICARBOXILICO Y UN ACIDO GRASO MONOCARBOXILICO.|Una composición en polvo o granulada que consta de al menos 30% por peso de una mezcla de los siguientes componentes (a), (b) y (c) con (a) un copolímero compuesto de unidades polimerizadas de C1 - C4 alquil ésteres de ácido acrílico o metacrílico y de monómeros alquil(met)acrilato con un grupo amino terciario en el radical alquilo y (b) 0.5 a 10% por peso con base en (a) de un ácido dicarboxílico que tiene 3 a 10 átomos de carbono y (c) 5 a 20% por peso con base en (a) de un ácido monocarboxílico graso que tiene 8 a 18 átomos de carbono.|ERNA ROTH. [DE]; RÜDIGER ALEXOWSKY. [DE]; HANS-ULRICH PETEREIT. [DE]; CHRISTIAN MEIER. [DE]; Darmstadt, 64297, DE|EVONIK RÖHM GMBH [DE]; Darmstadt, 64293, DE|
340058|Patente|MX/a/2013/012768|31/10/2013|23/06/2016|<i>B42D15/00</i> <b>(2006-01)</b>|DISPOSITIVO DE SEGURIDAD.|Un dispositivo de seguridad tiene un dispositivo lenticular que comprende un arreglo de elementos de enfoque lenticulares (2); un arreglo correspondiente de conjuntos de franjas de imagen (1-4), los conjuntos de franjas de imagen que tienen sustancialmente la misma periodicidad como, o un múltiplo integral de la periodicidad de, el arreglo de elementos de enfoque lenticulares. Las franjas de imagen (1- 4) se forman y los elementos de enfoque (2) se ubican con relación a las franjas de imagen tal que en cada una de una pluralidad de ángulos de visualización (A-D), una respectiva de una franja de imagen de cada conjunto se visualiza en respuesta a la luz incidente que cae sobre un elemento de enfoque lenticular respectivo. Las franjas de imagen (1-4) se construyen tal que el dispositivo presenta una secuencia cíclicamente de repetición de imágenes a medida que el dispositivo se visualiza en ángulos de visualización sucesivos, la secuencia de imagen que comprende un cambio en la forma de una imagen entre una primera forma y una segunda forma y luego una reversión de la secuencia nuevamente a la primera forma, las secuencias de imagen combinadas que presentan una variación contigua en la forma de imagen.|BRIAN WILLIAM HOLMES [GB]; Fleet Hampshire, GU51 5HZ, GB|DE LA RUE INTERNATIONAL LIMITED [GB]; Basingstoke, Hampshire, RG22 4BS, GB|
340059|Patente|MX/a/2014/002300|26/02/2014|23/06/2016|<i>B29C43/02</i> <b>(2006-01)</b>; <i>B29C43/36</i> <b>(2006-01)</b>; <i>B29C43/40</i> <b>(2006-01)</b>; <i>B29C45/14</i> <b>(2006-01)</b>; <i>B32B3/26</i> <b>(2006-01)</b>; <i>B32B7/04</i> <b>(2006-01)</b>|SISTEMA Y METODO PARA FABRICAR UN COMPONENTE DE GUARNICION PARA VEHICULO MEDIANTE MOLDEO POR CONFORMACION E INYECCION POR COMPRESION CONCURRENTE.|Se proporciona un método para fabricar un componente de guarnición para vehículo que incluye disponer un panel de fibra sobre una primera superficie de una cavidad de molde. El método también incluye comprimir el panel de fibra entre la primera superficie y una segunda superficie de la cavidad del molde para conformar el panel de fibra en una forma deseada. El método además incluye inyectar resma en la cavidad de molde para llenar al menos un vacío entre la primera superficie y la segunda superficie adyacente al panel de fibra.|BART W. FOX [US]; JEFFREY A. DEYOUNG [US]; TONY M. POKORZYNSKI [US]; Zeeland, Michigan, 49464, US|JOHNSON CONTROLS TECHNOLOGY COMPANY [US]; Holland, Michigan, 49423, US|
340060|Patente|MX/a/2014/000226|09/02/2010|23/06/2016|<i>A61K31/5025</i> <b>(2006-01)</b>; <i>A61P35/00</i> <b>(2006-01)</b>; <i>C07D235/04</i> <b>(2006-01)</b>; <i>C07D237/06</i> <b>(2006-01)</b>; <i>C07D237/20</i> <b>(2006-01)</b>; <i>C07D249/10</i> <b>(2006-01)</b>; <i>C07D249/12</i> <b>(2006-01)</b>; <i>C07D277/82</i> <b>(2006-01)</b>; <i>C07D487/02</i> <b>(2006-01)</b>|NUEVOS DERIVADOS DE 6-TRIAZOLOPIRIDAZINA-SULFANIL BENZOTIAZOL Y BENCIMIDAZOL, SU PROCESO DE PREPARACION, SU APLICACION COMO MEDICAMENTOS, COMPOSICIONES FARMACEUTICAS Y NUEVO USO PRINCIPALMENTE COMO INHIBIDORES DE MET.|La presente invención se refiere a productos nuevos de fórmula (I): en donde ---- representa un enlace sencillo o doble; Ra representa H, Hal, alcoxi, 0-cicloalquilo, heteroarilo, fenilo, NHCOaIk, NHCOcicloalk o NR1R2; X representa S, SO o SO2 A representa NH o S; W representa H, alquilo o COR con R que representa cicloalquilo; alquilo sustituido opcionalmente con NR3R4, alcoxi, hidroxi, fenilo, heteroarilo o heterocicloalquilo; alcoxi sustituido opcionalmente con NR3R4, es decir un radical O-(CH2)n-NR3R4, un radical O-fenilo o O-(CH2)n-fenilo, con fenilo sustituido opcionalmente y n= 1 a 4; o el radical NR1R2 ; R1 representa H o alk y R2 representa H, cicloalquilo o alquilo; R3 y R4 representan H, alk, cicloalquilo, heteroarilo o fenilo; R1, R2 y/o R3,R4 forman con N un ciclo que contiene opcionalmente O, S, N y/o NH; estando todos los heterocicloalquilo, heteroarilo y fenilo y cíclicos sustituidos opcionalmente; estando estos productos en todas las formas isómeras y las sales, como medicamentos principalmenté como inhibidores de MET.|EVA ALBERT [FR]; ERIC BACQUE [FR]; CONCEPTION NEMECEK [FR]; ANTONIO UGOLINI [CA]; SYLVIE WENTZLER [FR]; Paris, F-75013, FR|SANOFI-AVENTIS [FR]; Paris, F-75013, FR|
