Número de concesión|Tipo de documento|Número de solicitud|Fecha de presentación|Fecha de concesión|Clasificación CIP|Título|Resumen|Inventor(es)|Titular
340759|Patente|MX/a/2008/011783|15/09/2008|11/03/2015|<i>C12P7/64</i> <b>(2006-01)</b>; <i>A01H1/00</i> <b>(2006-01)</b>; <i>A01H1/06</i> <b>(2006-01)</b>; <i>C12N15/14</i> <b>(2006-01)</b>; <i>C12P21/06</i> <b>(2006-01)</b>|ACEITES DE SEMILLAS VEGETALES QUE CONTIENEN ÁCIDOS GRASOS POLI-INSATURADOS.|La presente invención se refiere a plantas que han sido modificadas genéticamente para que expresen un sistema del tipo policético sintasa (PKS) para la producción de ácidos grasos poli insaturados (PUFA) (un sistema PKS de PUFA), en donde los aceites producidos por la planta contienen al menos un PUFA producido por el sistema PKS de PUFA y están libres de los PUFA de cadena más corta mixta y menos insaturados, que son productos de ácido graso producidos mediante la modificación de productos del sistema de sintasa de ácido graso (FAS) en las rutas de ácido graso estándar. También se describen las semillas de aceite, aceites y productos que contienen estos aceites producidos por este sistema, así como también métodos para producir estas plantas.|JAMES G. METZ [US]; Longmont, Colorado, 80501, US|DSM IP ASSETS B.V.* [NL];|
340760|Patente|MX/a/2012/002329|23/02/2012|21/07/2016|<i>A61K39/12</i> <b>(2006-01)</b>; <i>A61K39/00</i> <b>(2006-01)</b>; <i>A61K39/02</i> <b>(2006-01)</b>; <i>A61K39/39</i> <b>(2006-01)</b>|METODOS PARA REDUCIR LA ACTIVIDAD VIRICIDA EN COMPOSICIONES DE CIRCOVIRUS PORCINO TIPO II (PCV-2) Y COMPOSICIONES DE CIRCOVIRUS CON INMUNOGENICIDAD MEJORADA.|La presente invención se refiere a métodos para reducir la actividad viricida de una composición que comprende un antígeno PCV-2 así como preparaciones antigénicas y composiciones inmunogénicas que comprenden un antígeno PCV-2, en el que la actividad viricida se ha reducido. Además, la presente invención también se refiere a un método para aumentar la inmunogenicidad de una composición inmunogénica que comprende un antígeno PCV-2, así como una composición inmunogénica con una inmunogenicidad aumentada.|MERRILL SCHAEFFER [US]; MARC EICHMEYER [US]; CAROLINE ANN KOHLER [US]; GUOSONG ZHAO [US]; ALI KHAZRAEINAZMPOUR [US]; BERND COLIN EICHENMUELLER [DE]; GREGORY HAIWICK [US]; St. Joseph, Missouri, 64506-2002, US|BOEHRINGER INGELHEIM VETMEDICA, INC. [US]; St. Joseph, Missouri, 64506-2002, US|
340761|Patente|MX/a/2014/004937|24/04/2014|26/07/2016|<i>H01H19/02</i> <b>(2006-01)</b>; <i>H01H1/00</i> <b>(2006-01)</b>; <i>H01H1/02</i> <b>(2006-01)</b>; <i>H01H1/50</i> <b>(2006-01)</b>; <i>H01R13/02</i> <b>(2006-01)</b>|SISTEMA DE CONTACTO GIRATORIO PARA SU INTEGRACION EN CONDUCTORES TUBULARES DE UN CONMUTADOR DE ALTO VOLTAJE.|La presente invención se refiere a dispositivos eléctricos, más específicamente a ensambles de contactos movibles, usados en un conmutador de alto voltaje, tales como un sistema de contacto giratorio para su integración en conductores tubulares de un conmutador de alto voltaje, que comprende: un perno principal; un primer ensamble, conformado por un conductor tubular primario y un conductor cilíndrico macho; un segundo ensamble, conformado por un accesorio secundario, un conductor secundario y un conductor cilíndrico hembra, estando dicho segundo ensamble acoplado de manera giratoria al primer ensamble, por medio del perno principal.|MIKHAIL SOTNIKOV [CA]; Saint Bruno, Quebec, J3V6B9, CA|MIKHAIL SOTNIKOV [CA]; Saint Bruno, Quebec, J3V6B9, CA|
340762|Patente|MX/a/2014/011900|02/10/2014|26/07/2016|<i>G01V1/28</i> <b>(2006-01)</b>; <i>G01V1/36</i> <b>(2006-01)</b>|SISTEMAS Y METODOS PARA EL APILAMIENTO OPTIMO DE DATOS SISMICOS.|Los sistemas y métodos incluyen el apilamiento de datos sísmicos derivados de un grupo de volúmenes de imágenes. El apilamiento incluye encontrar un subgrupo de volúmenes de imágenes sísmicas (y en algunas implementaciones sus respectivos pesos de apilamiento) o varias realizaciones de subgrupos de volúmenes de imágenes sísmicas desde un grupo dado que son consistentes y similares unos a otros. Algunos o la totalidad de los volúmenes de imágenes sísmicas de entrada se pueden apilar juntos como lo harían con una pila convencional. Sin embargo, la relación de la señal al ruido se puede mejorar apilando solamente aquellos volúmenes que contienen información consistente y relevante. El apilamiento óptimo puede utilizar un algoritmo que se puede implementar en una forma de ventana móvil.|MADHAV VYAS [US]; ARVIND SHARMA [US]; Naperville, Illinois, 60563, US|BP CORPORATION NORTH AMERICA INC. [US]; Houston, Texas, 77079, US|
340763|Patente|MX/a/2012/002518|30/01/2008|26/07/2016|<i>E03F5/04</i> <b>(2006-01)</b>; <i>A47K3/00</i> <b>(2006-01)</b>|ADAPTADOR DE TUBO DE DESCARGA PARA DUCHA.|La presente invención se refiere a una instalación del tubo de descarga de la ducha, que comprende: un cuerpo del tubo de descarga; un reborde de acoplamiento inferior que se extiende desde el cuerpo del tubo de descarga, el reborde de acoplamiento inferior acoplado con un componente de un sistema de tubo de descarga de la batea de la ducha instalado en un tubo de desagüe; una membrana impermeable unible que se extiende hacia afuera desde el cuerpo del tubo de descarga; y un reborde de acoplamiento integrado que se extiende desde el cuerpo del tubo de descarga, el reborde de unión integrado unido a la membrana impermeable unible para proporcionar un sello substancialmente impermeable entre la membrana y el adaptador.|LOONIE C. DEGOOYER [US]; South Jordan, UT, 84095, US|SCHLUTER SYSTEMS L.P. [US]; Plattsburgh, NY, 12901-5841, US|
340764|Patente|MX/a/2009/008204|30/07/2009|26/07/2016|<i>C09K5/04</i> <b>(2006-01)</b>; <i>C09K5/00</i> <b>(2006-01)</b>|COMPOSICIONES QUE CONTIENEN DIFLUOROMETANO Y OLEFINAS SUSTITUIDAS CON FLUOR.|Se describen composiciones que contienen olefinas multifluoradas y HFC-32. Tales composiciones son útiles, particularmente, para refrigeración estacionaria y equipo de acondicionamiento de aire.|RAJAT S. BASU [US]; HANG T. PHAM [US]; IAN SHANKLAND [US]; RYAN J. HULSE [US]; RAJIV R.SINGH [US]; JUSTIN L. BECKER [US]; ROBERT G. RICHARD [US]; Getzville, New York, 14068, US|HONEYWELL INTERNATIONAL INC. [US]; Morristown, NJ, 07962-2245, US|
340765|Patente|MX/a/2014/013877|14/11/2014|25/07/2016|<i>H04W72/04</i> <b>(2009-01)</b>; <i>H04L5/00</i> <b>(2006-01)</b>; <i>H04W72/00</i> <b>(2009-01)</b>|METODO Y DISPOSITIVO DE COMUNICACION EN SISTEMA DE COMUNICACION INALAMBRICA.|Se describen un método y dispositivo de comunicación en un sistema de comunicación inalámbrica, el método de comunicación comprende: una estación base en el sistema de comunicación determina de acuerdo con la configuración del sistema actual del sistema de comunicación, la categoría de una configuración del elemento de canal de control mejorado en un canal de control de enlace descendente físico mejorado, la configuración del elemento de canal de control mejorado comprende el número de elementos de recursos en cada elemento de canal de control mejorado, y el número de elementos de canal de control mejorados en cada par de bloques de recursos físicos, y la configuración del elemento de canal de control mejorado se clasifica en una pluralidad de categorías que corresponden respectivamente a las configuraciones del sistema diferentes del sistema de comunicación; y notificar a un nodo de terminal en el sistema de comunicación de la información relacionada con la categoría determinada de la configuración del elemento de canal de control mejorado.|QIMEI CUI [CN]; YINGNI ZHANG [CN]; XIAONA LI [CN]; HUI WANG [CN]; Haidian District, Beijing, 100876, CN|SONY CORPORATION [JP]; Minato-ku, Tokio, 108-0075, JP|
340766|Patente|MX/a/2014/015614|17/12/2014|26/07/2016|<i>H04N19/44</i> <b>(2014-01)</b>; <i>H04N19/00</i> <b>(2014-01)</b>; <i>H04N19/10</i> <b>(2014-01)</b>; <i>H04N19/117</i> <b>(2014-01)</b>; <i>H04N19/146</i> <b>(2014-01)</b>; <i>H04N19/70</i> <b>(2014-01)</b>; <i>H04N19/80</i> <b>(2014-01)</b>; <i>H04N19/86</i> <b>(2014-01)</b>|APARATO Y METODO DE PROCESAMIENTO DE IMAGENES.|La presente descripción pertenece a un dispositivo de procesamiento de imágenes y método que habilita una reducción en la cantidad de codificación durante la codificación y descodificación. Una unidad de establecimiento de tipo utiliza valores de pixeles de post-desbloqueo, en unidades de LCU, para establecer el tipo de un filtro que es común para componentes Y, Cb, y Cr, y suministra el resultado a una unidad de escritura de sintaxis. Una unidad de ajuste de compensación utiliza los valores de pixeles de post- desbloqueo para establecer una compensación que es independiente para cada uno de los componentes Y, Cb y Cr en unidades de LCU. Una unidad de ajuste de información de control de SAO suministra a la unidad de escritura de sintaxis una compensación o un indicador de fusión que se establece haciendo referencia a la compensación de la unidad de ajuste de compensación. Las presentes descripciones, por ejemplo, pueden aplicarse, a un dispositivo de procesamiento de imágenes.|OHJI NAKAGAMI [JP]; Minato-ku, Tokio, 108-0075, JP|SONY CORPORATION [JP]; Minato-ku, Tokio, 108-0075, JP|
340767|Patente|MX/a/2009/010914|28/10/2005|26/07/2016|<i>B32B21/02</i> <b>(2006-01)</b>; <i>B32B17/06</i> <b>(2006-01)</b>|LOSETAS Y METODOS PARA EL REVESTIMIENTO DE SUPERFICIES, DISEÑADAS CON ENCHAPADO DE SUPERFICIE DURA.|La presente invención se refiere a un montaje de losetas modular, que comprende: un substrato substancialmente rígido que comprende una madera dura, madera procesada, o material de papel, que tiene una superficie superior, una superficie inferior opuesta, y una pluralidad de bordes laterales periféricos, el substrato es substancialmente plano; al menos una capa de sellado que tiene una superficie superior y una superficie inferior opuesta, una superficie inferior de una primera capa de sellado de la al menos una capa de sellado que se adhiere a la superficie superior del substrato; y al menos una loseta que tiene una dureza Mohs mayor a 3 y un espesor de entre 2 y 10 mm y que tiene una cara superior, una capa inferior opuesta, y bordes laterales, la al menos una loseta se adhiere a al menos una porción de la superficie superior de la primera capa de sellado; en donde una porción de al menos uno de los bordes laterales periféricos del substrato forma una lengüeta alargada y en donde una porción de al menos uno de los bordes laterales periféricos del substrato define una ranura alargada complementaria en el mismo; y en donde la al menos una loseta tiene dimensiones de longitud y anchura que se extienden entre, los bordes ,laterales respectivos del mismo, en donde el substrato tiene dimensiones de longitud y anchura que se extienden entre los bordes laterales periféricos respectivos del mismo, y en donde las dimensiones de longitud y anchura de la loseta en menor que las dimensiones de longitud y anchura del substrato para proporcionar un hueco de lechada.|ROBERT J. MILLER [US]; Dalton, GA, 30720, US|SHAW INDUSTRIES GROUP, INC. [US]; Dalton, GA, 30722-2128, US|
340768|Patente|MX/a/2015/009338|20/07/2015|26/07/2016|<i>F02D15/02</i> <b>(2006-01)</b>; <i>F01N3/24</i> <b>(2006-01)</b>; <i>F02B75/04</i> <b>(2006-01)</b>|DISPOSITIVO Y METODO PARA CONTROLAR MOTOR DE COMBUSTION INTERNA DE RELACION DE COMPRESION VARIABLE.|Un corte de combustible durante la desaceleración se ejecuta en el punto de tiempo t1. Una cantidad (rOS) de almacenamiento de oxígeno que incrementa con este corte de combustible se estima con base en una relación de combustible- aire de escape y una cantidad de aire de admisión. Cuando la cantidad (rOS) de almacenamiento de oxígeno alcanza un valor de umbral (en el punto de tiempo t2), una relación (tCR) de compresión objetivo se corrige para volverse menor que una relación (tCR) de compresión objetivo básica. Aunque se ejecuta una •recuperación de combustible en el punto de tiempo t4, una temperatura de combustión se reduce debido a la reducción de la relación de compresión mecánica, de modo que se suprime una producción de NOx en una cámara de combustión. Por consiguiente, se suprime el empeoramiento del NOx incluso si la cantidad (rOS) de almacenamiento de oxígeno del catalizador (4) de purificación de emisiones de escape es excesiva.|SHINOBU KAMADA [JP]; EIJI TAKAHASHI [JP]; Atsugi-shi, Kanagawa, 243-0123, JP|NISSAN MOTOR CO., LTD. [JP]; Yokohama-shi, Kanagawa, 221-0023, JP|
340769|Patente|MX/a/2015/009005|13/07/2015|26/07/2016|<i>H04L5/00</i> <b>(2006-01)</b>; <i>H04J11/00</i> <b>(2006-01)</b>|SISTEMAS Y METODOS PARA ACCIONAR LA REDUCCION DE LA INTERFERENCIA SIN PARTICION DE RECURSOS.|Se describen sistemas y métodos para accionar la reducción de interferencia en un dispositivo inalámbrico en una red de comunicaciones celulares. En una modalidad, un nodo asociado con una red de comunicaciones celulares hace una determinación para activar la reducción de interferencias en un dispositivo inalámbrico basado en una carga de señal en al menos una celda de interferencia de la cual las transmisiones producen interferencias en el dispositivo inalámbrico durante la recepción de una celda deseada, una relación entre las señales de referencia utilizadas en la celda deseada y por lo menos una celda de interferencia, y una relación de tiempo entre al menos uno de un grupo que consiste en: señales transmitidas por la celda deseada y la al menos una celda de interferencia y las señales recibidas en el dispositivo inalámbrico desde la celda deseada y la al menos una celda de interferencia. En respuesta a hacer la determinación, el nodo acciona la reducción de interferencias en el dispositivo inalámbrico.|MUHAMMAD KAZMI [SE]; CHRYSOSTOMOS KOUTSIMANIS [GR]; LARS LINDBOM [SE]; Stockholm, SE-112 19, SE|TELEFONAKTIEBOLAGET L M ERICSSON (PUBL) [SE]; Stockholm, SE-164 83, SE|
340770|Patente|MX/a/2014/001116|28/01/2014|26/07/2016|<i>A61F9/009</i> <b>(2006-01)</b>|DESEMPEÑADOR DE INTERFAZ DE PACIENTE.|Se presenta un sistema de acoplamiento oftálmico que puede reducir una condensación de una interfaz de paciente de un sistema de láser quirúrgico. El sistema de acoplamiento oftálmico incluye una interfaz de paciente que tiene una porción proximal configurada para conectarse a un sistema oftálmico, una porción distal configurada para conectarse a un ojo que incluye una lente de contacto y un sistema de conexión de interfaz; y un descondensador, acoplado a la interfaz de paciente y configurado para reducir una condensación de vapor en la lente de contacto.|FERENC RAKSI [US]; Mission Viejo, California, 92691, US|ALCON LENSX, INC.* [US]; Aliso Viejo, California, 92656, US|
340771|Patente|MX/a/2015/009004|13/07/2015|26/07/2016|<i>F02D15/02</i> <b>(2006-01)</b>; <i>F02D13/02</i> <b>(2006-01)</b>; <i>F02D41/12</i> <b>(2006-01)</b>; <i>F02D43/00</i> <b>(2006-01)</b>; <i>F02D45/00</i> <b>(2006-01)</b>|DISPOSITIVO DE CONTROL DE MOTOR DE COMBUSTION INTERNA Y METODO DE CONTROL.|Un motor (1) de combustión interna que tiene un mecanismo (2) de relación de compresión variable tiene mecanismos (7, 8) de válvula variable para una válvula (4) de admisión y una válvula (5) de escape, respectivamente. Si se detecta un mal funcionamiento en el mecanismo (2) de relación de compresión variable, que controla una relación de compresión mecánica por medio de un motor (31) eléctrico, a partir de la amplitud de las variaciones en una relación de compresión real, entonces si se corta el suministro de combustible para el motor de combustión interna, una válvula (14) reguladora se abre más amplia de lo que sería el caso si el mecanismo (2) de relación de compresión variable no estuviera funcionando mal, reduciendo por consiguiente la presión negativa dentro del cilindro durante la carrera de admisión. Además, se adelanta la temporización con la cual la válvula de admisión se cierra y se retarda la temporización con la cual la válvula de escape se abre, incrementando la presión positiva dentro del cilindro durante las carreras de compresión y expansión. Esto previene que el mecanismo (2) de relación de compresión variable incremente la relación de compresión cuando se pierde el control.|RYOSUKE HIYOSHI [JP]; SHINOBU KAMADA [JP]; SHO OHTSU [JP]; Atsugi-shi, Kanagawa, 243-0123, JP|NISSAN MOTOR CO., LTD. [JP]; Yokohama-shi, Kanagawa, 221-0023, JP|
340772|Patente|MX/a/2011/008759|18/08/2011|26/07/2016|<i>C07K16/12</i> <b>(2006-01)</b>; <i>C07K1/10</i> <b>(2006-01)</b>|MEDIOS Y METODOS PARA FABRICAR NEUROTOXINA ALTAMENTE PURA.|La presente invención se refiere a un anticuerpo el cual enlaza específicamente a polipéptido de neurotoxina no procesado y/o parcialmente procesado o un anticuerpo el cual enlaza específicamente un epítopo el cual consiste de un péptido el cual tiene una secuencia de aminoácidos como se muestra en cualquiera de las SEQ ID NO: 1 a 16 y a métodos para la fabricación de los anticuerpos. Por otra parte, la presente invención se relaciona a una composición la cual comprende el polipéptido de neurotoxina procesado libre de polipéptido de neurotoxina no procesado o parcialmente procesado y a un método para fabricar el polipéptido de neurotoxina en base a los anticuerpos de la invención. La presente invención también se relaciona al uso del anticuerpo mencionado anteriormente para separar polipéptido de neurotoxina procesados a partir de polipéptidos de neurotoxina no procesados o parcialmente procesados o para determinar los polipéptidos de neurotoxina no procesados o parcialmente procesados. La presente invención se relaciona a un método para la fabricación de un medicamento.|MICHAEL PFEIL [DE]; JOSEF FRIEDRICH [DE]; HAROLD V. TAYLOR [US]; KARL-HEINZ EISELE [DE]; CORNELIA BRÜNN [DE]; Königstein, 61462, DE|MERZ PHARMA GMBH & CO. KGAA [DE]; Frankfurt Am Main, 60318, DE|
340773|Patente|MX/a/2014/000153|07/01/2014|26/07/2016|<i>A47J31/46</i> <b>(2006-01)</b>|DISPOSITIVO PARA PREPARAR UNA BEBIDA.|Se describe un dispositivo para elaboración de bebidas, para preparar una bebida adecuada para consumo humano con una capa de crema superior de burbujas finas. El dispositivo comprende: una unidad de bebidas (3) para suministrar la bebida; por lo menos una boquilla (7) en comunicación fluida con la unidad de bebidas (3); un conducto de surtido (13) provisto con una cavidad (23) con una pared de fondo (25) y paredes laterales (27, 29, 31); un área central de recolección de bebidas en un fondo de la cavidad. Además, por lo menos dos aberturas de surtido de bebida (41) están provistas en la pared de fondo (25), en lados opuestos del área central de recolección de bebidas. Para cada abertura de surtido de bebidas (41), un miembro de compresión de burbujas (47A, 47B, 49) se dispone entre el área central de recolección de bebidas y la respectiva abertura de surtido de bebidas (41). La bebida fluye desde el área central de recolección de bebidas a través de los miembros de compresión de burbujas (47A, 47B, 49) y hacia las aberturas de surtido de bebida respectivas.|MARCO MARCHI [IT]; CESARE LENZI [IT]; AE Eindhoven, NL-5656, NL|KONINKLIJKE PHILIPS N.V. [NL]; KONINKLIJKE DOUWE EGBERTS B.V. [NL]; AE Eindhoven, NL-5656, NL|
340774|Patente|MX/a/2015/008015|19/06/2015|26/07/2016|<i>B65G45/10</i> <b>(2006-01)</b>; <i>B08B1/00</i> <b>(2006-01)</b>; <i>B08B1/04</i> <b>(2006-01)</b>|LIMPIADOR DE RODILLOS.|La presente invención se refiere a un dispositivo limpiador (10) para remover residuos de rodillos transportadores giratorios (12), e incluye un alojamiento (18) construido y arreglado para inserción entre dos rodillos giratorios adyacentes, el alojamiento tiene un primer conjunto de ruedas limpiadoras (30) en un primer extremo del alojamiento (24) asociadas con un primer rodillo transportador, y un segundo conjunto de ruedas limpiadoras (32) ubicadas en un extremo opuesto (26) del alojamiento y asociadas con un segundo rodillo transportador. Al menos una de las ruedas limpiadoras (30a) es oscilante con respecto al alojamiento entre una posición retraída que permite la inserción del alojamiento entre los rodillos, y una posición extendida que extiende la rueda oscilante hacia el rodillo adyacente para limitar el movimiento lateral del alojamiento entre los rodillos. En el movimiento del alojamiento entre los rodillos en una dirección paralela a un eje longitudinal de los rodillos, las ruedas limpiadoras operacionalmente acoplan y remueven los residuos recolectados en los rodillos.|RONALD EDWARD SCHENCK [US]; WILLIAM JAMES DOTY [US]; ANTHONY A. HENRY [US]; Valparaiso, Indiana, 46385, US|UNITED STATES GYPSUM COMPANY [US]; Chicago, Illinois, 60661-3676, US|
340775|Patente|MX/a/2014/013322|03/11/2014|26/07/2016|<i>D21H17/67</i> <b>(2006-01)</b>; <i>D21H17/44</i> <b>(2006-01)</b>; <i>D21H17/63</i> <b>(2006-01)</b>|METODO PARA INCREMENTAR DESAGUADO, RESISTENCIA DE LA TRAMA HUMEDA DE LA HOJA Y RESISTENCIA A LA HUMEDAD EN LA FABRICACION DEL PAPEL.|La presente invención proporciona un método de mejoramiento de la eficiencia del desaguado, para aumentar la resistencia de la trama húmeda de la hoja, para aumentar la resistencia en húmedo de la hoja y para mejorar la retención del rellenador en un proceso de fabricación de papel. El método mejora la eficiencia del adyuvante para el desaguado por el recubrimiento de al menos algunas de las partículas del rellenador con un material que previene que los materiales del rellenador se adhieran a los adyuvantes para el desaguado. El adyuvante para el desaguado mantiene juntas estrechamente a las fibras del papel y no son desechadas sobre las partículas del rellenador.|JUN LI [CN]; YULIN ZHAO [CN]; QING LONG RAO [CN]; WEIGUO CHENG [US]; Shanghai, 200062, CN|NALCO COMPANY [US]; Naperville, Illinois, 60563, US|
340776|Patente|MX/a/2015/003940|26/03/2015|26/07/2016|<i>G01F1/58</i> <b>(2006-01)</b>|CAUDALIMETRO MAGNETICO.|Se proporciona un caudalímetro magnético (300) para la detección de flujo de proceso. El caudalímetro incluye un tubo (200), (319) configurado para recibir el flujo del fluido de proceso a través del mismo. Una pluralidad de electrodos (216) está dispuesta para hacer contacto con el fluido del proceso. Por lo menos una bobina electromagnética (210), (212) está dispuesta próxima al tubo (200), (319). La electrónica del caudalímetro (130), (148) está configurada para conducir una corriente a través de por lo menos una bobina electromagnética y para detectar una señal que se desarrolla a través de una pluralidad de electrodos (216) dispuesta para contactar con el fluido del proceso. Un módulo de circuito flexible (220) se dispone próximo al tubo, y tiene por lo menos un circuito flexible que contiene una pluralidad de pistas eléctricas eléctricamente acopladas a la electrónica del caudalímetro. La al menos una bobina electromagnética (210), (212) incluye una primera bobina en el módulo de circuito flexible (220) que se acopla a las pistas eléctricas.|MAYER, MICHAEL, JOHN [US]; SMITH, JOSEPH ALAN [US]; ROGERS, STEVEN, BRUCE [US]; MORALES, NELSON, MAURICIO [US]; JUNK, BRIAN, SCOTT [US]; Minneapolis, Minnesota, 55410, US|MICRO MOTION, INC.* [US]; Boulder, Colorado, 80301, US|
340777|Patente|MX/a/2014/013548|07/11/2014|25/07/2016|<i>H01R4/02</i> <b>(2006-01)</b>; <i>H02G5/04</i> <b>(2006-01)</b>|DISPOSITIVO ELECTRICO CON UNA UNIDAD DE BARRA DE ALIMENTACION QUE TIENE UN ARMAZON QUE PROPORCIONA ACCESO PARA SOLDADURA POR LASER.|Un dispositivo eléctrico que tiene un componente electrónico, el cual tiene una terminal eléctrica, y una unidad de barra de alimentación que tienen una barra de alimentación y un armazón. La barra de alimentación está formada de una cinta de material conductor y tienen un primero y segundo costados de la barra de alimentación que están opuestos entre sí. El armazón tiene una superficie de contacto de la barra de alimentación y un miembro de recubrimiento. La superficie de contacto de la barra de alimentación se extiende a través de un primer costado de armazón. La barra de alimentación se recibe en la superficie de contacto de la barra de alimentación y se aloja en el armazón de tal forma que el primer costado de la barra de alimentación esté separado del primer costado del armazón de tal forma que la barra de alimentación esté contenida totalmente dentro del armazón. El miembro de recubrimiento está contiguo al segundo costado de la barra de alimentación y define una abertura de irradiación que está configurada para recibir un haz de láser proveniente de una soldadora por láser a través de la misma. Una soldadura por láser fusiona la barra de alimentación a la terminal eléctrica.|LUMETTA, JEFFREY [US]; Canton, Michigan, 48187, US|YAZAKI NORTH AMERICA, INC. [US]; Canton, Michigan, 48187, US|
