Número de concesión|Tipo de documento|Número de solicitud|Fecha de presentación|Fecha de concesión|Clasificación CIP|Título|Resumen|Inventor(es)|Titular
Gaceta: Patentes, Registros de Modelos de Utilidad y de Diseños Industriales Volúmen: Julio
340215|Patente|PA/a/2006/004927|03/05/2006|24/06/2016|<i>F24J2/02</i> <b>(2006-01)</b>|HORNO SOLAR DE ALIMENTOS CON RESPALDO ELÉCTRICO.|La presente invención se refiere a un horno solar de alimentos con respaldo eléctrico que comprende: Un cuerpo de cocedor (1) con sus paredes aisladas térmicamente definiendo en su interior una cámara de cocción (25) y una pluralidad de reflectores (4, 5, 7, 9) ajustables angularmente dispuestos perimetralmente a la tapa (6) reflejan los rayos solares sobre la tapa (6) y al interior de la cámara de cocción (25); una base (23) con resistencias eléctricas está dispuesta al fondo de la cámara (25) de cocción caracterizada porque: a. El cuerpo del cocedor (1) es semicilíndrico y está dispuesto giratoriamente sobre una mesa (21); entre la mesa (21) y el cocedor (1) hay un elemento de unión que es un mecanismo de tracción para el giro del cocedor (1): b. el mecanismo de tracción (16, 17, 18) incluye; un perno roscado (17) fijo en un extremo a una primer bisagra (12a) unida al cocedor (1): una segunda bisagra (18) está unida a la mesa (21) y un mecanismo de volante roscado centralmente (16) está fijo a dicha segunda bisagra (18), el perno roscado (17) está acoplado al volante (16) de manera que el giro de este desplaza al perno (17) y este a su vez hace girar al cocedor (1).|JESÚS ANTONIO DEL RÍO PORTILLA [MX]; SAÚL TAPIA SALINAS [MX]; OSCAR ALFREDO JARAMILLO SALGADO [MX]; CUERNAVACA, Morelos, 62240, MX|UNIVERSIDAD NACIONAL AUTONOMA DE MEXICO [MX]; COYOACAN, Distrito Federal, 04510, MX|
340216|Patente|MX/a/2013/014603|11/12/2013|24/06/2016|<i>G01J9/02</i> <b>(2006-01)</b>; <i>G01B9/02</i> <b>(2006-01)</b>|LÁSER HETERODINO ESTABILIZADO EN LONGITUD DE ONDA.|Se describe un láser estabilizado en longitud de onda que al ser heterodino permite determinar por medio de interferencia entre las dos frecuencias el desplazamiento y velocidad del objeto en el que se refleja la radiación. La invención involucra la incorporación de anillos para el ajuste discreto de los valores de la frecuencia intermodal, que es un elemento que no ha sido utilizado en otros desarrollos de fuente para interferómetros y que facilita la operación de una etapa electrónica de baja frecuencia en el procesamiento de las señales de corrección del control de estabilidad. Adicionalmente el uso simplificado de un Fotodiodo y los elementos de polarización adicionados simplifica notablemente el arreglo óptico usado para la discriminación de la señal de error del control facilitando la reducción de tamaño de la fuente laser. El funcionamiento es el descrito, la aplicación se puede llevar a cabo en cualquier situación donde se requiera de medir la posición, la velocidad y la aceleración en los límites impuestos por la tecnología.|RAFAEL QUINTERO TORRES [MX]; HÉCTOR ALFONSO CASTILLO MATADAMAS [MX]; MARCOS MENDOZA RESENDIZ [MX]; Juriquilla, Queretaro, 76230, MX|UNIVERSIDAD NACIONAL AUTÓNOMA DE MÉXICO [MX]; COYOACAN, Distrito Federal, 04512, MX|
340217|Patente|MX/a/2011/013436|16/02/2006|30/06/2016|<i>A61K39/00</i> <b>(2006-01)</b>; <i>A61K39/395</i> <b>(2006-01)</b>|METODO PARA EL TRATAMIETNO Y BIOENSAYO QUE INVOLUCRA EL FACTOR DE INHIBICION DE MIGRACION DE MACROFAGOS (MIF), COMO UN FACTOR DE DEPRESION DEL MIOCARDIO, DERIVADO DEL CORAZON.|La presente invención se refiere a una composición farmacéutica, la cual incluye una cantidad efectiva terapéuticamente de al menos un anticuerpo anti-MIF; y al menos un portador aceptable. Otra modalidad de la presente invención se refiere a una composición farmacéutica, la cual incluye una cantidad efectiva terapéuticamente de al menos un anticuerpo anti-CD74; y al menos un portador aceptable farmacéuticamente. Otra modalidad de la presente invención se refiere a otra composición farmacéutica, la cual incluye una cantidad efectiva terapéuticamente de al menos un anticuerpo anti- TNFR, una cantidad efectiva terapéuticamente de al menos un anticuerpo anti-MIF, y al menos un portador aceptable farmacéuticamente. Otras modalidades de la presente invención se refieren a métodos para tratar o prevenir una disfunción cardiaca, cardiodepresión, disfunción cardiaca asociada con lesiones por quemaduras, mejorar la función cardiaca en un sujeto en seguida de un infarto agudo al miocardio, e identificar un inhibidor del Factor Inhibidor de la Migración de Macrófagos (MIF).|BRETT GIROIR [US]; MONTE WILLIS [US]; VIDAL DE LA CRUZ [US]; THAIS SIELECKI [US]; Dallas, Texas, 75230, US|BOARD OF REGENTS THE UNIVERSITY OF TEXAS SYSTEM [US]; CYTOKINE PHARMASCIENCES, INC. [US]; King of Prusia, Pennsylvania, 19406, US|
340218|Patente|MX/a/2014/005022|25/04/2014|30/06/2016|<i>C08F226/02</i> <b>(2006-01)</b>|MICROPARTICULAS DE COPOLIMERO QUE CONTIENEN VINILAMINA COMO ADITIVOS EN LA FABRICACION DE PAPEL.|Se describe una polimerización de n-vinilformamida de emulsión/dispersión iniciada por radicales libres mediados por tensioactivos, con copolímeros de estireno o estireno sustituido, y sus productos subsecuentes hidrolizados que llevan formamida, amina y funcionalidad estirénica. También se describen los procesos para polimerización, composición polimérica, e hidrólisis de tales polimeros. Estos polímeros que llevan funcionalidad catiónica pueden utilizarse en aplicaciones de fabricación de papel como aditivos de resistencia al secado, aditivos de resistencia a la humedad, auxiliares de retención, auxiliares de drenaje, agentes de encolado, promotores de encolado y agentes de control de resina y material adherente.|SACHIN BORKAR [IN]; Wilmington, DE, 19808, US|SOLENIS TECHNOLOGIES CAYMAN, L.P. [CH]; Schaffhausen, 8200, CH|
340219|Patente|MX/a/2013/014815|13/12/2013|30/06/2016|<i>C07D307/28</i> <b>(2006-01)</b>; <i>C07D307/93</i> <b>(2006-01)</b>; <i>C07D311/94</i> <b>(2006-01)</b>|METODO PARA PRODUCIR ETERES DE ENOL CICLICOS.|La invención se refiere a un método para producir éteres de enol cíclicos de las fórmulas (I) y/o (II).|KLAUS EBEL [DE]; RALF PELZER [DE]; BERNHARD BRUNNER [DE]; CHRISTOPH STOCK [DE]; Lampertheim, 68623, DE|BASF SE [DE]; Ludwigshafen, 67056, DE|
340220|Patente|MX/a/2014/008465|10/07/2014|01/07/2016|<i>B32B5/16</i> <b>(2006-01)</b>; <i>B42D25/369</i> <b>(2014-01)</b>|ARTICULO CON CUADRO DINAMICO FORMADO CON HOJUELAS DE PIGMENTO ALINEADAS.|Se describe un artículo que incluye un sustrato y un componente gráfico que forma una imagen y un componente óptico que incluye hojuelas de pigmento magnéticas alineadas para formar un patrón de cuadro que rodea la imagen. Cuando la luz es incidente sobre las hojuelas de pigmento de una fuente de luz, la luz reflejada del patrón de cuadro forma un cuadro dinámico que rodea la imagen y parece moverse a medida que el sustrato es inclinado con respecto a la fuente de luz. La imagen parece estacionaria cuando el cuadro dinámico parece moverse.|VLADIMIR P. RAKSHA [US]; JOHN HYNES [US]; LAURENCE HOLDEN [GB]; PAUL G. COOMBS [US]; Santa Rosa, California, 95403, US|JDS UNIPHASE CORPORATION [US]; Milpitas, California, 95035, US|
340221|Patente|MX/a/2014/008467|10/07/2014|01/07/2016|<i>B41M1/00</i> <b>(2006-01)</b>; <i>B42D25/369</i> <b>(2014-01)</b>; <i>B42D25/378</i> <b>(2014-01)</b>; <i>B42D25/41</i> <b>(2014-01)</b>|ARTICULO CON PATRONES CURVOS FORMADOS DE HOJUELAS DE PIGMENTO ALINEADAS.|Se describe un artículo con patrones curvos formados de hojuelas de pigmento alineadas. En un artículo impreso, hojuelas magnéticas son alineadas magnéticamente para formar patrones curvos en una pluralidad de secciones transversales normales a una línea imaginaria continua, en donde los radios de los patrones curvos se incrementan a lo largo de la línea imaginaria desde el primer punto al segundo punto. Cuando la luz es incidente sobre las hojuelas de pigmento alineadas de una fuente de luz, la luz reflejada del patrón alineado forma una imagen brillante que parece cambiar gradualmente su forma y moverse de un lado de la línea imaginaria continua a otro lado de la línea imaginaria continua cuando el sustrato es inclinado con respecto a la fuente de luz.|VLADIMIR P. RAKSHA [US]; JOHN HYNES [US]; LAURENCE HOLDEN [GB]; PAUL G. COOMBS [US]; Santa Rosa, California, 95403, US|JDS UNIPHASE CORPORATION [US]; Milpitas, California, 95035, US|
340222|Patente|MX/a/2013/013249|13/11/2013|01/07/2016|<i>A24D3/04</i> <b>(2006-01)</b>; <i>A24D3/06</i> <b>(2006-01)</b>|FILTRO DE ARTÍCULO PARA FUMAR|La presente invención se refiere a un filtro de artículo para fumar (3), caracterizado porque comprende: material de filtro; un miembro contenedor de aditivo (2) para liberar selectivamente el aditivo en el material de filtro, y un miembro de transferencia de aditivo (5) para transferir el aditivo liberado del miembro contenedor de aditivo (2) a la periferia del filtro (3) para indicar que el aditivo ha sido liberado, en donde el miembro de transferencia de aditivo (5) está formado de un material con efecto de mecha adaptado para encender más rápidamente el aditivo que el material de filtro y en donde una región del mismo de transferencia de aditivo (5) está provista en la periferia del filtro (3)|AWTY, EDWARD [GB]; NANDRA, CHARANJIT [GB]; NICHOLLS, JANE [GB]; SPENCER, ALFRED [GB]; Londres, WC2R 3LA, GB|BRITISH AMERICAN TOBACCO (INVESTMENTS) LIMITED [GB]; London, Londres, WC2R 3LA, GB|
340223|Patente|MX/a/2014/005299|30/04/2014|01/07/2016|<i>B32B5/24</i> <b>(2006-01)</b>; <i>B32B5/26</i> <b>(2006-01)</b>; <i>B60R13/00</i> <b>(2006-01)</b>|ARTÍCULO FABRICADO DE UN MATERIAL COMPUESTO MULTICAPA Y MÉTODO PARA LA PREPARACIÓN DEL MISMO|La presente invención se refiere a un artículo fabricado de un material compuesto multicapa que comprende un elemento central (I) colocado entre una primera y una segunda capa de refuerzo (B) para formar una estructura (B) - (I) - (B), dicho elemento central (I) comprende: - una primera y una segunda capa estructural (A), donde cada una comprende por lo menos una estera de fibras punzonadas del tipo termoplástico y/o natural o bien una estera de polímero termoplástico expandido, dichas capas estructurales (A) son impregnadas con una resina termoendurecible; - una tercera capa de refuerzo (B) colocada entre dichas dos capas estructurales (A), dicha primera, segunda y tercera capa de refuerzo (B) consisten en un material fibroso, que comprende uno o más tipos de fibras seleccionadas del grupo que consiste en fibras de vidrio, fibras naturales, fibras de carbono, fibras de basalto, fibras de kevlar, fibras de aramida o una mezcla de tales fibras. La presente invención también se refiere a un proceso para preparar el artículo ya mencionado. El artículo de la invención es especialmente capaz de ser usado como un componente para automóviles.|GIUSEPPE DI SANTE [IT]; MARIO BIGGIO [IT]; MARIO DI PAOLANTONIO [IT]; GIANLUCA GIOVINE [IT]; Roseto Degli Abruzzi (te), I-64026, IT|INDUSTRIALESUD S.P.A. [IT]; Roma, I-00146, IT|
340224|Patente|MX/a/2013/008987|02/08/2013|30/06/2016|<i>G01V1/08</i> <b>(2006-01)</b>; <i>G01V1/38</i> <b>(2006-01)</b>|MÉTODO Y DISPOSITIVO PARA EL CONTROL DINÁMICO DE RETRASOS EN UN CONTROLADOR DE PISTOLA|Se describe un método que controla un retraso de una pistola de aire en una fuente sísmica acuática. El método incluye un paso de recibir un atributo de la pistola de aire durante el estudio sísmico acuático; un paso de calcular, con base en un algoritmo de retraso de tiempo que utiliza el atributo, el tiempo de sincronización de la pistola de aire; un paso de determinar si el tiempo de sincronización es menor que un umbral de tiempo dado; un paso de instruir a un controlador a, (1) esperar un tiempo predeterminado antes de calcular de nuevo el tiempo de sincronización de la pistola de aire si el tiempo de sincronización es menor que el umbral de tiempo dado, o (2) calcular un tiempo de asincronización actualizado para la pistola de aire con base en el atributo si el tiempo de asincronización es mayor que el umbral de tiempo dado; y un paso de enviar el tiempo de asincronización actualizado a un controlador de pistola de la pistola de aire para ajustar un tiempo de retraso para disparar la pistola de aire.|YUAN NI [CN]; CHEIKH NIANG [CN]; RISTO SILIQI [FR]; Massy, 91300, FR|CGG SERVICES SA [FR]; Massy, 91300, FR|
340225|Patente|MX/a/2011/012995|02/12/2011|30/06/2016|<i>B25B21/00</i> <b>(2006-01)</b>; <i>B25B23/00</i> <b>(2006-01)</b>; <i>B25B23/14</i> <b>(2006-01)</b>|APARATO PARA APRETAR Y SOLTAR SUJETADORES.|Se describen aparatos para apretar o aflojar un sujetador neumáticamente, eléctricamente, hidráulicamente y manualmente, y en un ejemplo incluyen: un elemento receptor (111), soportado de manera rotatoria en el aparato para apretar o aflojar, para recibir el sujetador, un aparato (100) para efectuar la rotación del elemento receptor para apretar o aflojar el sujetador, y un aparato (150) el cual transfiere una fuerza de reacción durante la acción de apretar o aflojar los sujetadores. El aparato que transfiere una fuerza de reacción incluye: un primer elemento transmisor de fuerza (160) que se puede adherir de manera rotatoria alrededor de un eje de fuerza de giro del aparato para efectuar la rotación, y un segundo elemento transmisor de fuerza (170) que se puede adherir ya sea de manera rotatoria alrededor, de manera extensible y adherirse de manera retractable a lo largo, o adherirse de manera rotatoria alrededor de manera extensible y retractable a lo largo de al menos una porción del primer elemento.|PETER KOPPENHOEFER [US]; JOHN K. JUNKERS [US]; CALVIN A. BONAS [US]; Saddle River, New Jersey, 07458, US|HYTORC DIV. UNEX CORPORATION.* [US]; Mahwah, New Jersey, 07430, US|
340226|Patente|MX/a/2013/015015|17/12/2013|30/06/2016|<i>G01V1/28</i> <b>(2006-01)</b>; <i>G01V1/30</i> <b>(2006-01)</b>|AGRUPACION 4D ORIENTADA A OBJETIVO EN UN PUNTO DE REFLEXION COMUN.|Se presentan métodos y sistemas para la agrupación 4D orientada a objetivo de datos sísmicos. Se selecciona un horizonte de profundidad objetivo cerca de donde se esperan cambios 4D. Respectivamente para cada dato "vintage", se establecen relaciones entre las trazas sísmicas y agrupaciones de reflexión, asociadas con la superficie de profundidad, y las trazas sísmicas se dividen en subgrupos de ángulo de reflexión comunes. Las mejores trazas coincidentes de ambos "vintages" se seleccionan para cada agrupación de reflexión y se envían para procesamiento adicional.|JULIE SVAY [FR]; NICOLAS BOUSQUIE [FR]; ANNA SEDOVA [FR]; Massy, 91300, FR|CGG SERVICES SA [FR]; Massy, 91300, FR|
340227|Patente|MX/a/2015/001747|29/07/2013|01/07/2016|<i>B01D53/10</i> <b>(2006-01)</b>; <i>B01J20/12</i> <b>(2006-01)</b>; <i>B01J21/16</i> <b>(2006-01)</b>; <i>B01J29/04</i> <b>(2006-01)</b>|LAVADO DE GASES DE CHIMENEA.|Se describe en el presente documento una composición para lavado de gases de chimenea, un método de uso de la composición de lavado del gas de chimenea y un método de enterramiento del mercurio recogido con la composición de lavado del gas de chimenea. La composición de lavado del gas de chimenea incluye una mezcla de un material sorbente de mercurio que comprende una arcilla, cobre y azufre; y cal que comprende óxido de calcio y/o hidróxido de calcio. El método de recogida del mercurio de un gas de chimenea incluye inyectar la composición de lavado del gas de chimenea de cualquiera de las reivindicaciones anteriores en un conducto de humos que comprende el gas de chimenea; hacer reaccionar el material sorbente de mercurio con el mercurio contenido en el gas de chimenea para formar un material que contiene el mercurio absorbido y reducir con ello la concentración de mercurio en el gas de chimenea; hacer reaccionar la cal con los SO2, SO3, y/o HCI contenidos en el gas de chimenea para formar sulfato de calcio y/o cloruro de calcio; y recoger una mezcla que incluye el material que contiene mercurio absorbido. El método de enterramiento del mercurio incluye mezclar la mezcla recogida de cualquiera de las reivindicaciones 6 a 9 con agua para formar un hormigón recién mezclado; y colar el hormigón recién mezclado en un molde.|ZHEN WANG [US]; Lake Zurich, Illinois, 60047, US|AMCOL INTERNATIONAL CORPORATION [US]; Hoffman Estates, Illinois, 60192, US|
340228|Patente|MX/a/2014/013293|31/10/2014|30/06/2016|<i>H01R12/72</i> <b>(2011-01)</b>; <i>H01R13/6587</i> <b>(2011-01)</b>; <i>H01R43/16</i> <b>(2006-01)</b>; <i>H01R9/24</i> <b>(2006-01)</b>|UNA PLACA DE CONEXIONES PARA UN MÓDULO DE CONTACTO Y SU MÉTODO DE FABRICACIÓN|Una placa de conexiones para un módulo de contacto comprende contactos para señales (162) dispuestos en pares (260) para portar señales diferenciales. Cada par de contactos para señal comprende un primer contacto para señal que tiene un primer haz de acoplamiento (232a) y un segundo contacto para señal que tiene un segundo haz de acoplamiento (232b). Cada uno de los haces de acoplamiento primero y segundo comprenden un vástago (262) y un ramal (264) que se extiende desde el vástago, una primera aleta (252= que se extiende desde el vástago y una segunda aleta (254) que se extiende desde el ramal. En una orientación estampada inicial, los haces de acoplamiento primer ay segunda dentro del mismo par de contactos de señales forman un ángulo no paralelo entre sí.|JEFFREY BYRON MCCLINTON [US]; MICHAEL JOSEPH VINO IV [US]; LEO JOSEPH GRAHAM [US]; MICHAEL CHRISTOPHER D'IMPERIO [US]; DAVID ALLISON TROUT [US]; WAYNE SAMUEL DAVIS [US]; RODNEY TIMOTHY YANCEY [US]; Landisville, Pennsylvania, 17538, US|TYCO ELECTRONICS CORPORATION [US]; Berwyn, Pennsylvania, 19312, US|
340229|Patente|MX/a/2013/001359|01/02/2013|30/06/2016|<i>G01V1/143</i> <b>(2006-01)</b>; <i>G01B1/00</i> <b>(2006-01)</b>; <i>G01V1/00</i> <b>(2006-01)</b>|DISEÑO DE BARRIDO PARA FUENTES SISMICAS.|Se describen aquí un sistema y método para generar un grupo de señal de barrido de frecuencia para usarse en la reunión de datos sísmicos. Se combinan modificaciones de baja velocidad de barrido frecuencia para compensar limitaciones vibradoras y repuestas de campo lejano vibradoras con modificaciones de alta velocidad de barrido de frecuencia para compensar la absorción, y después se genera el grupo de señal de barrido de frecuencia con base en la combinación de modificaciones de alta y baja velocidad de barrido de frecuencia.|JULIEN MEUNIER [FR]; Massy, 91300, FR|CGGVERITAS SERVICES SA [FR]; Massy, 91300, FR|
340230|Patente|MX/a/2012/010215|27/10/2009|01/07/2016|<i>A61B5/155</i> <b>(2006-01)</b>; <i>A61B5/00</i> <b>(2006-01)</b>; <i>A61B5/145</i> <b>(2006-01)</b>|INSTRUMENTO Y SISTEMA DE PRODUCCION DE MUESTRA DE LIQUIDO CORPORAL Y DE ANALISIS DEL MISMO.|La presente invención se refiere a un instrumento para la producción de una muestra de líquido corporal para análisis mediante la perforación de la piel con un elemento de punción por lanceta que tiene una punta de perforación de piel, caracterizado porque comprende: un alojamiento; un impulsor de punción por lanceta dentro del alojamiento que empuja o desplaza el elemento de punción por lanceta conectado con el mismo en un movimiento de punción en el cual se mueve el elemento de punción por lanceta, después de la activación del movimiento de punción, en una dirección de punción hasta que alcance el punto de desplazamiento máximo y en dirección contraria después que haya alcanzado el punto de desplazamiento máximo, un anillo de presión que rodea un orificio de contacto de piel y que es adaptado para presionar contra la piel, de manera que la piel se hinche hacia el orificio favoreciendo la expresión de fluido corporal, en donde el orificio de contacto de piel tiene un área de orificio que corresponde con un círculo con un diámetro al menos de 3 mm y a lo más de 8 mm, y el instrumento incluye un dispositivo de control de fuerza de presión que regula la fuerza que actúa entre el anillo de presión y la piel en el momento de la activación del movimiento de punción, para que sea al menos de 3 N y a lo más de 8 N.|VOLKER ZIMMER.* [DE]; HANS LIST [DE]; UWE KRAEMER [DE]; WOLFGANG ROEDEL [DE]; STEPHAN-MICHAEL FREY [DE]; PAUL PATEL [US]; CHRISTIAN HOERAUF [DE]; Laumersheim, 67229, DE|F. HOFFMANN-LA ROCHE AG.* [CH]; Basel, CH-4070, CH|
340231|Patente|MX/a/2012/006090|25/05/2012|01/07/2016|<i>A61K8/64</i> <b>(2006-01)</b>; <i>A61K8/66</i> <b>(2006-01)</b>; <i>A61Q19/00</i> <b>(2006-01)</b>; <i>C07K14/46</i> <b>(2006-01)</b>; <i>C12N9/64</i> <b>(2006-01)</b>|ENZIMAS FLUIDAS INCUBADAS Y USOS DE LAS MISMAS.|La presente invención se refiere a una composición farmacéutica o cosmética caracterizada porque comprende: (i) un polipéptido que comprende una secuencia de aminoácidos como se expone en SEQ ID NO. 1: o (ii) un polipéptido que comprende una secuencia de aminoácidos que es al menos 70% idéntica a una región comparable de una secuencia de aminoácidos como se expone en SEQ ID NO: 1; o (iii) un polipéptido que comprende una porción de una secuencia de aminoácidos como se expone en SEQ ID NO. 1, en donde la porción comprende al menos 150 aminoácidos; o (iv) un polipéptido que comprende una porción de una secuencia de aminoácidos que es al menos 70% idéntica a una región comparable de una secuencia de aminoácidos como se establece en SEQ ID NO.1, en donde la porción comprende al menos 150 aminoácidos; y/o (v) una o más moléculas de ácido nucleico que codifican para un polipéptido como se expone a una cualquiera de (i) a (iv), o una secuencia complementaria de la misma, y uno o más excipientes y/o diluyentes farmacéuticamente o cosméticamente aceptables cuando se usan en terapia cosmética o médica.|HANS KRISTIAN LEREN [NO]; BERNT TH. WALTHER [NO]; Bergen, N-5020, NO|AQUA BIO TECHNOLOGY ASA [NO]; Bergen, N-5008, NO|
340232|Patente|MX/a/2012/008317|17/07/2012|01/07/2016|<i>A23L33/18</i> <b>(2016-01)</b>; <i>A23L2/52</i> <b>(2006-01)</b>; <i>A23L2/66</i> <b>(2006-01)</b>; <i>A23L33/185</i> <b>(2016-01)</b>; <i>A23L33/21</i> <b>(2016-01)</b>|USO PREBIOTICO DE POLISACARIDO DE SOJA SOLUBLE EN AGUA.|La presente invención se refiere a una composición para usarse como un prebiótico, en donde el prebiótico incrementa selectivamente el crecimiento de las bifidobacterias, la composición comprende un polisacárido de soja soluble en agua, en donde el polisacárido de soja soluble en agua comprende un contenido de ácido galacturónico inferior a 40% mol, de manera preferente inferior a 30% mol y un contenido de azúcar neutro (cadena laterales) mayor de 40% mol, de manera preferente mayor de 50% mol, y en donde la composición está adaptada para ser consumible por un humano en una cantidad de por lo menos 2g de polisacárido de soja soluble en agua por día.|MICHEL MELLEMA [NL]; ROBÈR ANTOINE KEMPERMAN [NL]; AT Vlaardingen, NL-3133, NL|UNILEVER N.V.* [NL]; AL Rotterdam, NL-3013, NL|
340233|Patente|MX/a/2013/002329|27/02/2013|01/07/2016|<i>C07D207/04</i> <b>(2006-01)</b>; <i>A61K38/06</i> <b>(2006-01)</b>; <i>A61P25/04</i> <b>(2006-01)</b>; <i>C07D207/27</i> <b>(2006-01)</b>|AGONISTAS DE RECEPTORES DE NEUROTROFINA Y SUS USOS COMO MEDICAMENTOS|La presente invención se refiere a compuestos de la Fórmula (I) y sales farmacéuticamente aceptables del mismo, en donde R1, R2 y R3 se definen como se establece en la especificación. Los compuestos son agonistas de receptores de neurotrofina (tales como factor de crecimiento nervioso)|ANGEL MESSEGUER [ES]; PABLO VILLOSLADA [DE]; Barcelona, E-08034, ES|BIONURE FARMA, S.L. [ES];|
340234|Patente|MX/a/2012/009597|17/08/2012|01/07/2016|<i>C07K7/08</i> <b>(2006-01)</b>; <i>A61K38/10</i> <b>(2006-01)</b>; <i>A61K45/06</i> <b>(2006-01)</b>|TRATAMIENTO PARA TRANSTORNOS GASTROINTESTINALES.|La presente invención se refiere a péptidos, composiciones, y métodos relacionados para tratar trastornos y condiciones gastrointestinales, que incluyen pero no se limitan a, síndrome del intestino irritable (lBS), trastornos de movilidad gastrointestinal, trastornos gastrointestinales funcionales, enfermedad de reflujo gastroesofageal (GERD), reflujo duodenogástrico, enfermedad de Crohn, colitis ulcerativa, enfermedad inflamatoria del intestino, acidez funcional, dispepsia, dolor visceral, gastropáresis, pseudo-obstrucción intestinal crónica (o pseudo-obstrucción colónica), trastornos y condiciones asociadas con estreñimiento, y otras condiciones o trastornos son descritos en la presente, usando péptidos y otros agentes que activan al receptor de guanilato ciclasa C (GC-C).|ANGELIKA FRETZEN [DE]; HONG ZHAO [CN]; MARCO KESSLER [US]; Somerville, Massachusetts, 02143, US|IRONWOOD PHARMACEUTICALS, INC. [US]; Cambridge, Massachusetts, 02142, US|
340235|Patente|MX/a/2013/001528|07/02/2013|01/07/2016|<i>A61K9/48</i> <b>(2006-01)</b>; <i>A61K9/50</i> <b>(2006-01)</b>|PROCESO PARA MANUFACTIURAR UNA CAPSULA ESTABLE DE GEL SUAVE, QUE CONTIENE BACTERIAS PROBIOTICAS MICROENCAPSULADAS.|La presente invención se refiere a una cápsula de gel suave que contiene bacterias probióticas microencapsuladas que se manufacturan de modo que la cápsula de gel suave es estable durante por lo menos aproximadamente 24 meses a temperatura ambiente.|CLAUDIA VALLA [IT]; ROSA BERTOLAMI [IT]; GIOVANNI ROSINA [IT]; KAREN HELSON [NL]; Piacenza, I-29100, IT|R.P. SCHERER TECHNOLOGIES, LLC [US]; Carson City, Nevada, 89706, US|
