Número de concesión|Tipo de documento|Número de solicitud|Fecha de presentación|Fecha de concesión|Clasificación CIP|Título|Resumen|Inventor(es)|Titular
Gaceta: Patentes, Registros de Modelos de Utilidad y de Diseños Industriales Volúmen: Marzo de 2016
337369|Patente|MX/a/2011/008057|29/07/2011|25/02/2016|<i>G01N33/00</i> <b>(2006-01)</b>; <i>A61K48/00</i> <b>(2006-01)</b>; <i>G01N1/00</i> <b>(2006-01)</b>|BIOMARCADOR PARA EL DIAGNOSTICO DE CANCER DE MAMA.|La presente invención se refiere a un proceso para el diagnóstico inmunológico de cáncer de mama, así como a un equipo de diagnóstico inmunológico de cáncer de mama. El proceso se basa en la detección inmunológica de la proteína de vesícula sináptica en células y/o tejido sospechoso de cáncer de mama.|MARICRUZ ANAYA RUIZ [MX]; CINDY RODRIGUEZ BANDALA [MX]; ELEAZAR LARA PADILLA [MX]; Distrito Federal, 06720, MX|INSTITUTO POLITÉCNICO NACIONAL [MX]; INSTITUTO MEXICANO DEL SEGURO SOCIAL [MX]; Distrito Federal, 06720, MX|
337370|Patente|MX/a/2011/003546|01/04/2011|29/02/2016|<i>B65D83/08</i> <b>(2006-01)</b>; <i>G06F17/00</i> <b>(2006-01)</b>; <i>G08B21/00</i> <b>(2006-01)</b>|DISPENSADORES QUE PROPORCIONAN UNA DISPENSACION CONTROLADA Y METODOS DE DISPENSACION CONTROLADOS ASOCIADOS.|En esta solicitud de patente se dan a conocer dispensadores y método para una dispensación controlada de productos, preferentemente productos de papel. Varias formas de realización de la presente invención pueden comprender una carcasa, un conjunto de separación, un mecanismo de suministro y un mecanismo de avance. La carcasa puede soportar componentes interiores del dispensador. La carcasa puede sujetar un apilamiento del producto de producto de papel que se va a dispensar. El conjunto de separación puede comprender un elemento separador. El elemento separador puede separar una o más servilletas desde su apilamiento del producto. El elemento separador se puede controlar por un controlador para operaciones de dispensación controladas. El mecanismo de suministro puede desplazar la servilleta o servilletas separadas hacia una ranura dispensadora para su dispensación. El mecanismo de avance puede avanzar el apilamiento del producto de servilletas de modo que, cuando esté agotado el apilamiento del producto desde un extremo de este último, un resto del apilamiento del producto se haga avanzar hacia el elemento separador para su dispensación. Otros aspectos, formas de realización y características son también reivindicados y descritos en la presente invención.|DANIEL J. GEDDES [US]; ANTONIO M. CITTADINO [US]; MICHAEL R. KILGORE [US]; CHRISTOPHER M. REINSEL [US]; BRET A. KUEHNEMAN [US]; ABBY C. CASE [US]; Green Bay, Wisconsin, 54313, US|GEORGIA-PACIFIC CONSUMER PRODUCTS LP [US]; Atlanta, GA, 30303, US|
337371|Patente|MX/a/2013/004657|25/04/2013|01/03/2016|<i>C09J7/02</i> <b>(2006-01)</b>|CINTAS ADHESIVAS SENSIBLES A LA PRESION PARA PEGAR VENTANAS, EN PARTICULAR EN DISPOSITIVOS MOVILES.|La invención se refiere a una cinta adhesiva bilateral, que comprende una capa de soporte así como dos capas de adhesivo sensible a la presión exteriores, siendo que al menos una de los adhesivos sensibles a la presión es el producto del reticulado de una composición polimérica que comprende al menos los componentes siguientes: A) un componente polimérico (componente A) que comprende 88 a 100% en peso de uno o varios poliacrilatos (componente A1) compuestos de al menos: a) 1 a 15% en peso, con relación al componente A1, de uno o varios monómeros que tienen al menos un enlace etilénico insaturado, que se seleccionan cada uno de manera que las temperaturas Tg de transición a vidrio de los homopolímeros correspondientes del respectivo monómero son de al menos 0°C (monómeros a), siendo que al menos una parte de los monómeros (a) comprende además al menos un grupo de ácido carboxílico (monómeros a1), b) 85 a 99% en peso, con relación al componente A1, de uno o varios monómeros del grupo de los ésteres acrílicos y ésteres metacrílicos, los cuales en cada caso se seleccionan de manera que las temperaturas Tg de transición a vidrio de los homopolímeros correspondientes del respectivo monómero no son superiores a -30°C (monómeros b), B) al menos un agente de reticulado bi o polifuncional de reticulado covalente (componente B), siendo que los componentes A y B constituyen en total al menos 95% en peso de la composición polimérica, y siendo que el mínimo de un agente reticulado está presente en una cantidad que la relación cuantitativa B = nz/np de la cantidad de sustancia nz de los centros con actividad de reticulado del agente de reticulado con respecto a la cantidad de sustancia np teórica de las macromoléculas del componente polimérico A1 tiene un valor entre 0.15 y 0.60, siendo que la cantidad de sustancia nz de los centros con actividad de reticulado del agente de reticulado resulta de la masa mv del agente de reticulado multiplicada con el número f de los centros con actividad de reticulado por molécula de agente de reticulado dividida entre la masa molar M, del agente de reticulado, o sea nz = f.mv/Mv, y la cantidad de sustancia teórica np de las macromoléculas del componente polimérico A1 resulta de la masa mp del componente polimérico en el adhesivo sensible a la presión dividida entre la masa molar de este componente, o sea np = mp/ Mn,P.|MARC HUSEMANN [DE]; KAI ELLRINGMANN [DE]; MARCO KUPSKY [DE]; CLAUS MEYER [DE]; Hamburg, 22559, DE|TESA SE [DE]; Norderstedt, 22848, DE|
337372|Patente|MX/a/2013/008010|09/07/2013|01/03/2016|<i>G01G19/387</i> <b>(2006-01)</b>; <i>G01G11/18</i> <b>(2006-01)</b>|BASCULA DE COMBINACION.|Se proporciona una báscula de combinación que puede evitar daños a los objetos que se rompen o dañan con facilidad, debido a un impacto o similar generado cuando éstos se dejan caer. Una báscula de combinación de conformidad con una modalidad de la presente invención comprende una pluralidad de cintas transportadoras de pesaje (1) que se alimentan manualmente con objetos y transportan los objetos alimentados manualmente; una pluralidad de sensores de peso (2) provistos para corresponder con las cintas transportadoras de pesaje (1), respectivamente, para medir pesos de los objetos portados sobre las cintas transportadoras se pesaje (1); una sección de control (5) que encuentra una combinación de descarga que incluye una combinación de las cintas transportadoras de pesaje (1) que portan los objetos en los cuales un peso de los mismos se ubica dentro de un intervalo de pesos objetivo, con base en los valores de peso de los sensores de peso (2) y activa las cintas transportadoras de pesaje (1) seleccionadas para constituir la combinación de descarga para transportar los objetos sobre las cintas transportadoras de pesaje (1) en una primera dirección descargar los objetos de un extremo de las cintas transportadoras de pesaje (1); y una cinta transportadora de recolección (3) la cual se alimenta con los objetos descargados de un extremo de las cintas transportadoras de pesaje (1) transporta los objetos en una dirección; y descarga los objetos.|KAWASHIMA, TAKAAKI [JP]; Akashi-shi, Hyogo, 673-0849, JP|YAMATO SCALE CO., LTD. [JP]; Akashi-shi, Hyogo, 673-0849, JP|
337373|Patente|MX/a/2013/012902|05/11/2013|29/02/2016|<i>G06K19/077</i> <b>(2006-01)</b>|ETIQUETA INTERRUPTOR DE RFID.|En el presente se divulgan varias representaciones de dispositivos interruptores de RFID. Dichos dispositivos interruptores de RFID ventajosamente permiten la activación/desactivación manual del módulo de RF. El dispositivo interruptor de RFID puede incluir un módulo de RF con un circuito integrado adaptado para conectarse óhmicamente a un patrón de rastreo conductivo sustancialmente coplanar, así como una antena multiplicadora para aumentar el rango operativo del dispositivo de RFID. El rango operativo del dispositivo interruptor de RFID puede aumentarse cuando una región de la antena multiplicadora se superpone a una región del patrón de rastro conductivo en el módulo de RF mediante acoplamiento inductivo o capacitivo. El dispositivo interruptor de RFID puede además incluir un indicador visual que muestra un primer color si el dispositivo interruptor de RFID se encuentra en estado activo y/o un segundo color si el dispositivo interruptor de RFID se encuentra en estado inactivo.|JOE MULLIS [US]; SHESHI NYALAMADUGU [US]; Oceanside, California, 92057, US|NEOLOGY, INC. [US]; Poway, California, 92064, US|
337374|Patente|MX/a/2013/001352|01/02/2013|25/02/2016|<i>E21B19/02</i> <b>(2006-01)</b>; <i>E21B33/06</i> <b>(2006-01)</b>|UNIDAD DE INSTALACION DE LINEA DE CONTROL.|Un instalador de tuberías extiende una sección de una tubería en un pozo, mientras encinta una línea de control a la sección de tubería. El instalador incluye una base que tiene un conector tubular que se extiende hacia abajo para conexión a un extremo superior de un conjunto de prevención de explosiones. Unos cilindros hidráulicos están montados en la base y se extienden hacia arriba desde la misma. Un piso de soporte, que tiene cuñas de soporte, está montado en los cilindros hidráulicos a una distancia fija por encima de la base. Una base de cuñas de avance, que contiene cuñas de avance, está montada en extremos superiores de vástagos de pistón de los cilindros hidráulicos. Un conjunto de elevación de tubos está soportado por la base para elevar y posicionar una unión adicional de tubería que debe añadirse a la sección de tubería. Un mecanismo de montaje de tubos está soportado por la base para hacer girar la unión adicional en acoplamiento roscado con la sección de tubería. Una fuente de suministro de línea de control para suministrar línea de control hacia y a lo largo de la sección de tubería en un punto entre la base y el piso de soporte.|ERROL A. SONNIER [US]; Broussard, Los Ángeles, 70518, US|TESCO CORPORATION [CA]; Houston, Texas, 77043, US|
337375|Patente|MX/a/2013/001446|01/02/2013|25/02/2016|<i>G05D13/62</i> <b>(2006-01)</b>; <i>F03D5/06</i> <b>(2006-01)</b>; <i>F03D9/00</i> <b>(2006-01)</b>; <i>F03G7/08</i> <b>(2006-01)</b>|AEROGENERADOR RESONANTE POR VORTICIDAD.|Aerogenerador que consiste en un anclaje al suelo o basamento y un mástil cuya frecuencia de oscilación natural se ajusta de manera deliberada a la frecuencia con la que aparecen los vórtices o remolinos de aire producidos tras la colisión de un flujo de aire laminar y estacionario sobre su superficie. La energía aeroelástica así absorbida se transforma en energía eléctrica gracias al uso materiales con alto acoplamiento electromecánico.|DAVID JESÚS YAÑEZ VILLAREAL [ES]; Avila, 05003, ES|DEUTECNO, S.L.* [ES]; ABACCUS SOLUCIONES E INNOVACION S.L. [ES]; Madrid, 28043, ES|
337376|Patente|MX/a/2012/004008|03/04/2012|29/02/2016|<i>A61K31/731</i> <b>(2006-01)</b>; <i>A61K31/715</i> <b>(2006-01)</b>; <i>A61K45/06</i> <b>(2006-01)</b>; <i>A61K47/36</i> <b>(2006-01)</b>; <i>A61K9/08</i> <b>(2006-01)</b>|COMPOSICIONES ANTIMICROBIANAS ACUOSAS QUE CONTIENEN CARRAGENINA.|Se describen composiciones para inhibir la transmisión de una infección de transmisión sexual que contienen uno o más microbicidas polianiónicos, tales como carrageninas, así como sales de metal solubles en agua y agentes antirretrovirales específicos que comprenden ITINN e ITIN. También son descritos métodos para hacer y usar las composiciones.|MAGUIRE, ROBIN, A. [US]; THORN, MITCHELL. [US]; PHILLIPS, DAVID, M. [US]; RUTENBERG, NAOMI [US]; Ossining, New York, 10562, US|THE POPULATION COUNCIL, INC. [US]; New York, New York, 10017, US|
337377|Patente|MX/a/2014/011391|23/09/2014|01/03/2016|<i>C08L81/02</i> <b>(2006-01)</b>; <i>C08L23/26</i> <b>(2006-01)</b>|COMPOSICION DE RESINA DE SULFURO DE POLIARILENO Y CUERPO MOLDEADO.|Una composición de resina de sulfuro de poliarileno que contiene una resina de sulfuro de poliarileno (A) y una cera olefínica (B) con un valor ácido dentro del rango de 65 a 150 [mgKOH/g], caracterizada porque la cantidad de la cera olefínica (B) es de 0.01 a 5 partes por masa en relación a las 100 partes por masa de la composición de resina de sulfuro de poliarileno (A) y la cera olefínica (B) contiene un grupo carboxilo y un grupo de anhídrido carboxílico. También se ofrece un producto moldeado preparado moldeando la composición. La composición de resina de sulfuro de poliarileno tiene excelentes propiedades mecánicas y propiedades de liberación del molde y el producto preparado a partir de la composición de resina de sulfuro de poliarileno presenta buena adhesión a resinas epoxi.|SHIGERU KOYANAGI [JP]; Ichihara-shi, Chiba, 2908585, JP|DIC CORPORATION [JP]; Itabashi-ku, Tokio, 1748520, JP|
337378|Patente|MX/a/2011/002469|04/03/2011|02/03/2016|<i>B29C73/04</i> <b>(2006-01)</b>|PARCHE DE REFUERZO INTEGRADO.|Se proporcionan métodos y un parche de llanta para reparar una porción de llanta dañada. En una modalidad, tal método incluye los pasos de: pulir una superficie interior de la llanta sobre un perímetro de la porción de llanta dañada para formar una superficie para recibir el parche, la superficie interior es pulida a una profundidad suficiente para colocar un refuerzo de parche de llanta de un parche de llanta una distancia de aproximadamente 3 milímetros o menos de un refuerzo de llanta dañada; cubrir la porción dañada aplicando un parche pre-ensamblado a la superficie que recibe el parche a lo largo de la superficie interior de la llanta, el parche de llanta está dimensionado para cubrir el área dañada, tal parche incluye una capa de refuerzo interpuesta entre una capa impermeable al aire y una capa adhesiva, la capa de adhesivo está por lo menos parcialmente no curada para facilitar la unión del parche de reparación a la llanta; y, curar el parche a la llanta.|E. BRUCE COLBY [US]; NATHAN J. PANNING [US]; CESAR ZARAK [US]; Greenville, South Caroline, 29607, US|MICHELIN RECHERCHE ET TECHNIQUE S.A. [CH]; Granges-Paccot, CH-1763, CH|
337379|Patente|MX/a/2012/014361|07/12/2012|02/03/2016|<i>C23C18/16</i> <b>(2006-01)</b>; <i>C25D15/00</i> <b>(2006-01)</b>; <i>C25D17/16</i> <b>(2006-01)</b>; <i>C25D5/10</i> <b>(2006-01)</b>|MATERIALES METALICOS CON PARTICULAS LUMINICENTES INCORPORADAS.|Formación de un elemento de autenticación por deposición de una capa de metal con partículas incorporadas sobre el sustrato metálico, en donde las partículas incorporadas están configuradas para convertir energía de una longitud de onda a otra. Las partículas incorporadas pueden ser fósforos sobreconversores, subconversores o fosforescentes, los cuales pueden detectarse y medirse con equipo analítico cuando están depositados en la capa metálica. Un sustrato metálico puede incluir acuñación.|JEFFREY L. CONROY [US]; PHILIP B. FORSHEE [US]; JAMES A. SHEARER [US]; Allen, Texas, 75013, US|THE ROYAL MINT LIMITED [GB]; AUTHENTIX, INC.* [US]; Pontyclun, CF72 8YT, GB|
337380|Patente|MX/a/2012/013636|23/11/2012|02/03/2016|<i>A01N25/32</i> <b>(2006-01)</b>; <i>A01N43/90</i> <b>(2006-01)</b>; <i>A01P7/00</i> <b>(2006-01)</b>; <i>C07D211/94</i> <b>(2006-01)</b>; <i>C07D471/10</i> <b>(2006-01)</b>|COMPOSICIONES PESTICIDAS.|La presente invención se refiere a una composición pesticida que comprende una cantidad pesticida efectiva de al menos un compuesto de fórmula (I), donde los sustituyentes son como se define en la reivindicación 1, y un fitoprotector.|ANKE BUCHHOLZ [DE]; CHRISTOPH GRIMM [AT]; Stein, CH-4332, CH|SYNGENTA PARTICIPATIONS AG [CH]; Basel, CH-4058, CH|
337381|Patente|MX/a/2014/000300|08/01/2014|02/03/2016|<i>C03C3/087</i> <b>(2006-01)</b>; <i>C03C4/02</i> <b>(2006-01)</b>; <i>C03C4/08</i> <b>(2006-01)</b>; <i>C03C6/00</i> <b>(2006-01)</b>|COMPOSICION DE CONTENENDOR DE VIDRIO.|Un contenedor de vidrio y métodos de fabricación relacionados. El contenedor de vidrio tiene una composición de vidrio que incluye materiales de vidrio base de cal sodada, y un óxido de vanadio para buenas propiedades de bloqueo de luz ultravioleta y un óxido de selenio para decolorar el vidrio para buena calidad y decoloración. La composición de vidrio del contenedor también puede incluir un óxido de azufre.|STEPHEN D. BARTON [US]; CAROLA A. CKICK [US]; TERENCE K.G. HOWSE [US]; Dansville, New York, 14437, US|OWENS-BROCKWAY GLASS CONTAINER INC. [US]; Perrysburg, Ohio, 43551, US|
337382|Patente|MX/a/2014/012885|23/10/2014|02/03/2016|<i>G01N17/00</i> <b>(2006-01)</b>; <i>G01N21/59</i> <b>(2006-01)</b>; <i>G01N33/02</i> <b>(2006-01)</b>; <i>G01N33/15</i> <b>(2006-01)</b>|METODOS PARA PRODUCIR NUEVOS DISEÑOS DE ENVASES CON BASE EN MATERIALES FOTOPROTECTORES.|Esta invención proporciona métodos para la cuantificación del rendimiento fotoprotector de conceptos de envasado en un marco de tiempo acelerado. Los métodos se pueden usar para generar modelos para la predicción de valores de rendimiento fotoprotector de materiales no evaluados con base en alguna otra propiedad cualitativa o cuantitativa conocida. Los métodos usan una fuente de luz que proporciona un haz de luz que afecta a un material fotoprotector (28) antes de ser transmitido a una célula de muestra (44) que comprende una entidad fotosensible, como un nutriente fotosensible.|PETER JERNAKOFF [US]; MICHAEL PATRICK MILONE [US]; PHILIPP MARTIN NIEDENZU [US]; CHERYL MARIE STANCIK [US]; Wilmington, Delaware, 19808, US|E. I. DU PONT DE NEMOURS AND COMPANY [US]; Wilmington, Delaware, 19898, US|
337383|Patente|MX/a/2014/004133|04/04/2014|02/03/2016|<i>C02F1/48</i> <b>(2006-01)</b>; <i>C02F5/00</i> (2006-01)|DISPOSITIVO Y METODO PARA TRATAR AGUA.|Un sistema de tratamiento de agua que comprende una pluralidad de tubos; cada uno de la pluralidad de tubos está formado de una aleación de metal de tierra rara y está configurado para el paso de agua a través de él en una dirección de flujo de agua; donde la excitación de los electrones en la aleación de metal de tierra rara de por lo menos un tubo en la pluralidad de tubos forma un campo eléctrico a lo largo del por lo menos un tubo; el campo eléctrico tiene una dirección perpendicular a la dirección de flujo de agua en el al menos un tubo; y una pluralidad de imanes permanentes, configurados para crear un campo magnético a lo largo del al menos un tubo; el campo magnético tiene una dirección perpendicular a la dirección de flujo de agua del al menos un tubo; donde el campo eléctrico y el campo magnético están configurados para romper por lo menos algunas uniones hidrógeno entre moléculas de agua del agua que pasa a través del al menos un tubo.|HONGJI HOU [CN]; Linfen City, Shanxi Province, CN|HONGJI HOU [CN]; Linfen City, Shanxi Province, CN|
337384|Patente|MX/a/2014/011361|22/09/2014|02/03/2016|<i>C10G21/27</i> <b>(2006-01)</b>; <i>C10G21/28</i> <b>(2006-01)</b>; <i>C10G31/08</i> <b>(2006-01)</b>; <i>C10G53/06</i> <b>(2006-01)</b>|PROCESO PARA LA ELIMINACION DE NITROGENO DE CORRIENTES DE COMBUSTIBLE CON LIQUIDOS IONICOS DE CAPROLACTAMIO.|La presente invención se refiere a un proceso para eliminar un compuesto de nitrógeno de una alimentación de combustible, tal como un gasóleo de vacío o un combustible diesel, en el donde el proceso incluye las etapas de poner en contacto la alimentación de combustible que comprende el compuesto de nitrógeno, con un líquido iónico de caprolactamio inmiscible en combustible, para producir una mezcla de líquido iónico de caprolactamio inmiscible en combustible y combustible; y separar la mezcla para producir un efluente de gasóleo de vacío o de diesel que tiene un contenido de nitrógeno reducido con respecto a la alimentación de gasóleo de vacío o diesel inicial. La invención proporciona además un uso alternativo para el líquido iónico caprolactamio que se produce en grandes cantidades para la fabricación de caprolactama.|ALAKANANDA BHATTACHARYYA [US]; ALAN B. LEVY [US]; MANUELA SERBAN [US]; LIHAO TANG [US]; Des Plaines, Illinois, 60017-5017, US|UOP LLC [US]; Des Plaines, Illinois, 60017-5017, US|
337385|Patente|MX/a/2012/002176|20/02/2012|02/03/2016|<i>E21B10/32</i> <b>(2006-01)</b>; <i>E21B10/30</i> <b>(2006-01)</b>; <i>E21B10/34</i> <b>(2006-01)</b>; <i>E21B17/10</i> <b>(2006-01)</b>; <i>E21B7/28</i> (2006-01)|APARATO DE RODAMIENTO DE RODILLO EXPANDIBLE PARA POZO ABAJO.|Se describe un aparato de cojinete con rodillo expandible para pozo abajo (2). El aparato (2) comprende una pluralidad de ensambles de rodillo que comprenden por lo menos un rodillo (12) montado de manera giratoria entre los pistones (14). Un miembro de retención tal como una barra con muescas (26) se monta de manera removible en una ranura de chaveta formada en el cuerpo (4). Cada pistón (14) comprende una abertura (30) a través de la cual la barra con estrías (26) se proyecta en las posiciones tanto retraídas hacia adentro como desplegadas hacia afuera de los pistones (14).|PAUL BERNARD LEE [CA]; Calgary, Alberta, T3L 2NS, CA|PAUL BERNARD LEE [CA]; Calgary, Alberta, T3L 2NS, CA|
337386|Patente|MX/a/2013/009410|14/08/2013|01/03/2016|<i>B01D17/04</i> <b>(2006-01)</b>; <i>B01J19/00</i> <b>(2006-01)</b>; <i>C10G33/04</i> <b>(2006-01)</b>; <i>G01N33/28</i> <b>(2006-01)</b>|SIMULADOR DE SEPARACION DE FASE TERMICA.|Se describe un simulador de reparación de fase térmica y método de prueba para productos químicos. El simulador comprende un carrusel con calentador de bloque circular del (10) montado para girar en una plataforma (20). El carrusel incluye una configuración circular de los pocillos de prueba (12) para recibir una pluralidad de botellas de prueba (60), una pluralidad de elementos de calentamiento (14) y termopares (15) dispuestos entre los pocillos. Cada pocillo tiene un puerto de iluminación (40) y una ranura vertical (24) hacia el exterior para permitir la observación visual o formación de imágenes de una muestra vertical de la botella. Una fuente de iluminación (41) se alinea con el puerto de iluminación de cada pocillo en respuesta a la rotación del carrusel. El método incluye la adición de un fluido de fase mixta a una pluralidad de botellas, la adición de un agente químico para cada botella, y la simulación de una separación de fase térmica. Imágenes del líquido de cada botella se capturan y se analizan para determinar el desempeño de los un o más agentes químicos.|PAUL R. HART [US]; LEE E. NUEBLING [US]; ROBERT R. CLEARY [US]; VIRGIL T. LITTLE [US]; JAN H. BEETGE [US]; Fresno, Texas, 77545, US|CHAMPION TECHNOLOGIES, INC. [US]; Houston, Texas, 77027, US|
337387|Patente|MX/a/2013/015151|18/12/2013|02/03/2016|<i>H05B37/03</i> <b>(2006-01)</b>; <i>H05B37/02</i> <b>(2006-01)</b>; <i>H05B41/298</i> <b>(2006-01)</b>|SISTEMA Y METODO DE PROTECCION DE FALLA PARA BALASTOS DE LAMPARAS FLUORESCENTES.|Se proporciona un sistema de balasto de iluminación y un método para lámparas fluorescentes. El sistema y método utilizan un bucle de control de corriente de lámpara para controlar el nivel de luz de una lámpara fluorescente. El balasto incluye un detector de bucle abierto que reconoce un bucle de control de corriente abierto como una indicación de una condición de falla o riesgo, y provoca que el balasto emita un voltaje de lámpara seguro o no emita voltaje. La condición de falla o riesgo puede ser por ejemplo, un voltaje muy alto en la lámpara o una corriente muy baja a través de la lámpara. El balasto también incluye un circuito de desactivación que evita que el detector de bucle abierto se desconecte en momentos cuando se espera que el bucle esté abierto, tal como durante el encendido y reinicio de mantenimiento de la lámpara.|GANG YAO [CN]; JAMES DOMINIC MIESKOSKI [US]; Lousville, Kentucky, 40217, US|GENERAL ELECTRIC COMPANY [US]; Schenectady, New York, 12345, US|
337388|Patente|MX/a/2014/004684|16/04/2014|02/03/2016|<i>F21S8/08</i> <b>(2006-01)</b>; <i>F21V29/00</i> <b>(2015-01)</b>; <i>F21V7/00</i> <b>(2006-01)</b>; <i>F21V7/04</i> <b>(2006-01)</b>|REFLECTOR, ILUMINADOR Y USO DE LOS MISMOS.|La presente invención proporciona un reflector (1), un iluminador y el uso de los mismos. El reflector (1) comprende pares de piezas reflectoras, cada par de piezas reflectoras comprende por lo menos una unidad reflectora, cada unidad reflectora incluye una primera porción (100) reflectora, una segunda porción (200) reflectora y una primera porción (120) fija y una segunda porción (220) fija cuyos extremos inferiores están conectados respectivamente con la primera porción reflectora y la segunda porción reflectora. La primera porción fija está ubicada en el lado de la primera porción reflectora que está opuesta a un centro óptico de la unidad reflectora y la segunda porción fija está ubicada en un lado de la segunda porción reflectora que está opuesta al centro óptico de la unidad reflectora.|JIPING ZOU [CN]; YUN JIANG [CN]; CHAO PAN [CN]; CUIJUAN ZHOU [CN]; Shanghai, Shanghai, 201203, CN|GE LIGHTING SOLUTIONS, LLC [US]; East Cleveland, Ohio, 44112, US|
337389|Patente|MX/a/2011/007452|12/07/2011|02/03/2016|<i>G09F3/12</i> <b>(2006-01)</b>; <i>B65D63/00</i> <b>(2006-01)</b>; <i>F16B15/00</i> <b>(2006-01)</b>; <i>G09F3/14</i> <b>(2006-01)</b>|ENSAMBLE DE FIJACION FABRICADO DE UN MATERIAL SOLUBLE EN AGUA Y METODOS RELACIONADOS.|La invención se refiere a un ensamble de fijación que presenta un elemento hecho de un material soluble en agua o que incluye un material soluble en agua, y métodos relativos para fabricación, o disolución o debilitamiento, del ensamble de fijación que presenta por lo menos una parte soluble en agua que comprende el material soluble en agua.|CHARLES J. BUROUT [US]; THOMAS SHILALE [US]; Bedford, New Hampshire, 03110, US|AVERY DENNISON CORPORATION [US]; Pasadena, California, 91103, US|
