Número de concesión|Tipo de documento|Número de solicitud|Fecha de presentación|Fecha de concesión|Clasificación CIP|Título|Resumen|Inventor(es)|Titular
339896|Patente|MX/a/2014/011273|19/09/2014|15/06/2016|<i>A61F13/511</i> <b>(2006-01)</b>; <i>A61F13/15</i> <b>(2006-01)</b>; <i>A61F13/472</i> <b>(2006-01)</b>; <i>A61F13/53</i> <b>(2006-01)</b>|ARTICULOS ABSORBENTES CON ESTRUCTURAS DECOLORANTES.|Un artículo absorbente de cuidado personal para la higiene femenina incluye una capa de lienzo superior, una capa de lienzo inferior, al menos una capa núcleo absorbente colocada entre la capa de lienzo superior y la capa de lienzo inferior y una estructura decolorante colocada a lo largo de los bordes laterales del artículo, con la estructura decolorante que se extiende lateralmente más allá de los bordes más laterales de la capa núcleo absorbente.|SANGWOOK LEE [KR]; Bundang-gu, Seongnam-si, 463-785, KR|KIMBERLY-CLARK WORLDWIDE, INC. [US]; Neenah, Wisconsin, 54956, US|
339897|Patente|MX/a/2015/000323|08/01/2015|15/06/2016|<i>A61F13/496</i> <b>(2006-01)</b>; <i>A61F13/15</i> <b>(2006-01)</b>; <i>A61F13/49</i> <b>(2006-01)</b>; <i>A61F13/505</i> <b>(2006-01)</b>|CALZON DE CONTENCION.|Un calzón de contención permanentemente cerrado incluye un armazón elásticamente extensible y una eslinga posicionada dentro del armazón. La eslinga se une a la región delantera de la cintura y a la región trasera de la cintura. La eslinga incluye una lámina base impermeable a los fluidos y una aleta de contención unida con la lámina base para crear una bolsa impermeable a los fluidos. La eslinga incluye además una primera transición y una segunda transición que son elásticamente extensibles en una dirección longitudinal y en una dirección transversal. La lámina base es una tela laminada con poliuretano y la aleta de contención es una tela laminada con poliuretano. La superficie de poliuretano de la lámina base se termoadhiere de manera ultrasónica de frente a la superficie de poliuretano de la aleta de contención. El calzón de contención permanentemente cerrado prácticamente carece de un núcleo absorbente integrado.|MARCILLE FAYE RUMAN [US]; CONNIE MAY MCMORROW [US]; ANGELA ANN JOHNSTON [US]; STEPHEN CARL BAUMGARTNER [US]; STACY ELAINE EVENSON [US]; KEVIN LEON LABERGE [US]; BROOKE ANN ROBAIDEK [US]; KATHERINE CAROL SHAW [US]; Oshkosh, Wisconsin, 54901, US|KIMBERLY-CLARK WORLDWIDE, INC. [US]; Neenah, Wisconsin, 54956, US|
339898|Patente|MX/a/2015/007148|05/06/2015|15/06/2016|<i>A47K10/42</i> <b>(2006-01)</b>|CONTENEDOR DE ALMACENAMIENTO Y DE DISPENSADO PARA TOALLITAS.|Un contenedor para toallitas incluye una carcasa dispensadora. La carcasa define las paredes superior e inferior, las primera y segunda paredes laterales, y las primera y segunda paredes de extremo. Las paredes definen colectivamente un espacio interior. La pared superior incluye un orificio de dispensado que se recubre por un ensamble de tapa. El ensamble de tapa incluye un anillo y una tapa abatible. El anillo se fija de manera permanente a la pared superior, y la tapa abatible se conecta de manera articulada al anillo. El anillo tiene una porción superior y una pestaña de amortiguación. La porción superior generalmente se extiende a lo largo del perímetro del orificio de dispensado. En una modalidad, la pestaña de amortiguación sobresale de la porción superior en el espacio interior, y una altura de la pestaña de amortiguación es mayor que un grosor de la pared superior. En otra modalidad, la pestaña de amortiguación sobresale de la porción superior en el espacio interior más allá de la superficie interior de la pared superior.|CHRISTOPHER M. BECHYNE [US]; Menasha, Wisconsin, 54952, US|KIMBERLY-CLARK WORLDWIDE, INC. [US]; Neenah, Wisconsin, 54956, US|
339899|Patente|MX/a/2013/009820|26/08/2013|16/06/2016|<i>C07D401/06</i> <b>(2006-01)</b>; <i>A61K31/4709</i> <b>(2006-01)</b>; <i>A61P29/00</i> <b>(2006-01)</b>; <i>C07D471/04</i> <b>(2006-01)</b>; <i>C07D519/00</i> <b>(2006-01)</b>|COMPUESTOS DE TRIAZOLOPIRIDINA COMO INHIBIDORES DE PIM CINASA.|Se describen compuestos de la Fórmula I: en donde R1, R2, R3, R4, y R1A tienen los significados dados en la especificación, y son inhibidores de receptor tirosina útiles en el tratamiento de enfermedades mediadas por PIM-1 y/o PIM-2 y/o PIM-3 cinasas.|BIN WANG [CN]; JAMES F. BLAKE [US]; ROBERT KIRK DELISLE [US]; LISA A. DE MEESE [US]; JAMES M. GRAHAM [US]; YVAN LE HUEROU [US]; MICHAEL LYON [US]; JOHN E. ROBINSON [US]; ELI M. WALLACE [US]; RUI XU [CN]; Boulder, Colorado, 80301, US|ARRAY BIOPHARMA INC. [US]; Boulder, Colorado, 80301, US|
339900|Patente|MX/a/2014/011690|26/09/2014|16/06/2016|<i>G05B19/042</i> <b>(2006-01)</b>; <i>G05B19/02</i> <b>(2006-01)</b>|SISTEMA Y METODO DE MONITOREO Y CONTROL DE UN DISPOSITIVO OPERATIVO DIANA DE UN SISTEMA DE CONTROL DE PROCESOS.|Un método de monitoreo y control de un dispositivo operativo diana de un sistema de control de procesos. El método comprende: detectar la activación de una o más partes del dispositivo operativo diana con un sensor de una unidad inalámbrica de retención; retener un interruptor de la unidad inalámbrica de retención de un estado activo a un estado inactivo cuando se detecta la activación de la una o más de las partes; transmitir una o más señales activas desde la unidad inalámbrica de retención a una estación base al retener el interruptor en estado activo; detectar la desactivación de la una o más partes del dispositivo operativo diana con el sensor de la unidad inalámbrica de retención; ignorar la desactivación detectada en la unidad inalámbrica de retención y continuar la transmisión de una o más señales activas de la unidad inalámbrica de retención a la estación base. También se describe un sistema de control y monitoreo inalámbrico.|MITCHELL S. PANTHER [US]; KURTIS K. JENSEN [US]; Marshalltown, Iowa, 50158, US|FISHER CONTROLS INTERNATIONAL LLC [US]; Marshalltown, Iowa, 50158, US|
339901|Patente|MX/a/2013/015169|18/12/2013|16/06/2016|<i>C09J123/14</i> <b>(2006-01)</b>; <i>C09J123/30</i> (2006-01); <i>C09J151/06</i> <b>(2006-01)</b>|COMPOSICION ADHESIVA DE FUSION EN CALIENTE MODIFICADA POR UN INICIADOR DE RADICALES LIBRES QUE INCLUYE EL POLIMERO DE PROPILENO-ALFA-OLEFINA Y POLIETILENO FUNCIONALIZADO.|A composición adhesiva de fusión por calor que incluye un primer copolimero que incluye el producto de reacción de un polietileno funcionalizado, un polímero de propileno-alfa-olefina que incluye al menos 50 mol % de propileno y tiene una viscosidad no mayor que 10,000 centipoise a 190 °C, una relación entre el peso molecular promedio z (Mz) y el peso molecular promedio numérico (Mn) (Mz/Mn) mayor que 20, y una relación entre el Mz y el peso molecular promedio en peso (Mw) (Mz/Mw) mayor que 3.0, y un iniciador de radicales libres.|KEVIN DAVIS [US]; SHARF U. AHMED [US]; STEPHEN M. WILLGING [US]; RICHARD A. MILLER [US]; TIMOTHY W. ROSKA [US]; White Bear Lake, Minnesota, 55110, US|H.B. FULLER COMPANY [US]; St. Paul, Minnesota, 55164-0683, US|
339902|Patente|MX/a/2013/003621|27/03/2013|16/06/2016|<i>A61M15/00</i> <b>(2006-01)</b>|INHALADOR.|Un inhalador, incluyendo el inhalador un cuerpo (104) y un cartucho (106), comprendiendo el cartucho una porción de almacenamiento de dosis (122) y una vía aérea (124), siendo adecuada la porción de almacenamiento de dosis para contener una pluralidad de dosis de un medicamento inhalable, incluyendo la vía aérea una boquilla (128) en un extremo de la misma, configurado y dispuesto el dispositivo inhalador de tal manera que se puede tener acceso y disponer de una dosis de medicamento inhalable a partir de la porción de almacenamiento de dosis en una configuración de administración para administrarse a un usuario a través de la vía aérea después de la inhalación a través de la boquilla por parte del usuario, caracterizado el inhalador porque el cartucho se puede remover de manera reemplazable del cuerpo.|GRANT SMETHAM [GB]; JOHN PALMER-FELGATE [GB]; STEVEN DUDLEY [GB]; SEAN REYNOLDS [GB]; IAIN BREAKWELL [GB]; JON JAMIN [GB]; STEVE AUGUSTYN [GB]; LAURA KAYE [GB]; JOHN MCGARVA [GB]; GB-Horsham, West Sussex, RH12 5AB, GB|NOVARTIS AG.* [CH]; Basilea, CH-4056, CH|
339903|Patente|MX/a/2011/008567|12/08/2011|15/06/2016|<i>A01P13/00</i> <b>(2006-01)</b>; <i>A01N25/28</i> <b>(2006-01)</b>; <i>A01N37/26</i> <b>(2006-01)</b>|ENCAPSULACION DE HERBICIDAS PARA REDUCIR DAÑOS EN CULTIVOS.|La presente invención se refiere a un herbicida de acetamida particulado microencapsulado caracterizado porque comprende: un material de núcleo inmiscible en agua que comprende el herbicida de acetamida y una microcápsula que tiene una pared de recubrimiento de poliurea, dicha microcápsula contienen el material de núcleo, en donde la pared de recubrimiento se forma en un medio de polimerización mediante una reacción de polimerizacióntrente un componente de poliisocianato que comprende un poliisocianato o una mezcla de poliisocianatos y un componente de poliamina que comprende una poliamina o una mezcla de poliaminas para formar la poliurea, en donde la relación de equivalente molares de amina contenidos en el componente de poliamina a equivalentes molares de isocianato contenidos en el componente de polissocianato es de 1.1:1 a 1.7:1, y en donde una población de las microcápsulas tiene un tamaño de partícula promedio en el rango de 7 µm a 15 µm.|ABRAHAM, WILLIAM [IN]; BECHER, DAVID Z. [US]; PROSCH, S. DOUGLAS [US]; BUSSLER, BRETT H. [US]; HERR, AMANDA C. [US]; St. Louis, Missouri, 63167, US|MONSANTO TECHNOLOGY LLC [US]; St. Louis, Missouri, 63167, US|
339904|Patente|MX/a/2011/010257|29/09/2011|15/06/2016|<i>E01F15/00</i> <b>(2006-01)</b>|ENSAMBLE DE VALLA DE SEGURIDAD, POSTE DE SOPORTE DE SEPARACION PARA UNA VALLA DE SEGURIDAD Y METODOS PARA EL ENSAMBLE Y USO DE LOS MISMOS.|Un poste de soporte de separación para una valla de seguridad incluye un elemento de poste superior y un elemento de poste inferior; los elementos de poste superior e inferior se traslapas y están configurados de manera que los elementos de poste. superior e inferior no son giratorios en relación uno con el otro alrededor de un eje que se extiende en una dirección de impacto axial; en una modalidad, un sujetador elástico se extiende en la dirección de impacto axial y conecta las porciones que se traslapan de los elementos de poste superior e inferior; en otra modalidad, un sujetador de corte se extiende transversalmente a la dirección de impacto axial y es la única conexión entre los elementos de poste superior e inferior; en otro aspecto, un ensamble de valla de seguridad incluye primera y segunda secciones de valla, con un elemento de deformación que deforma la primera sección de valla a medida que se mueve en relación con la segunda sección de valla; también se proporcionan los métodos para utilizar y ensamblar un ensamble de valla de seguridad.|LEONHARDT, PATRICK A. [US]; STEPHENS, BARRY D. [US]; BUEHLER, MICHAEL J. [US]; SINDORF, BRENT S. [US]; Rocklin, California, 95677, US|ENERGY ABSORPTION SYSTEMS, INC. [US]; Chicago, Illinois, 60601, US|
339905|Patente|MX/a/2013/000144|07/01/2013|15/06/2016|<i>A61F5/00</i> <b>(2006-01)</b>; <i>A61M25/10</i> <b>(2013-01)</b>|SONDA OROGASTRICA PARA GASTRECTOMIA LONGITUDINAL.|La invención se refiere a una sonda orogástrica para una gastrectomía longitudinal; el objetivo de la invención es proveer una sonda orogástrica que constituya una alternativa ventajosa para las sondas mal adaptadas actualmente utilizadas, facilitando el trabajo del cirujano; esta novedosa sonda orogástrica está caracterizada porque esta parte distal porta un balón (25) que presenta, en el estado inflado, una forma sustancialmente complementaria a aquella del antro pilórico (4), a modo de poder alojarse en este antro pilórico (4), el extremo del balón (25) inflado está entonces, preferiblemente, apoyado contra el píloro (5) y el extremo distal del cuerpo de la sonda (20) en lo que a ella se refiere, de preferencia está apoyado sobre el antro pilórico (4), mientras que la parte del cuerpo (21) de la sonda (20) dispuesta sobre el balón (25) inflado está colocada contra la pared de la curvatura pequeña (6) del estómago (1), y de esta forma permite: determinar el posicionamiento del inicio de la línea de resección-cierre al nivel del antro pilórico (4), definir la línea de resección-cierre, y calibrar el antro pilórico (4) y el maguito gástrico a conservar.|NOCCA, DAVID [FR]; Montpellier, F-34000, FR|MEDICAL INNOVATION DEVELOPPEMENT. [FR]; Dardilly, F-69570, FR|
339906|Patente|MX/a/2013/011986|14/10/2013|15/06/2016|<i>E03D11/02</i> <b>(2006-01)</b>; <i>B28B1/00</i> <b>(2006-01)</b>|INODORO DE CERAMICA Y METODO DE FABRICACION DE LA TAZA.|Una taza de cerámica obtenida por medio del moldeado en moldes comprende: un retrete de recolección de líquido (2) con un eje de extensión principal (Z); un reborde de distribución de líquidos (3) que tiene por lo menos una porción configurada para reproducir el reborde superior (7) del retrete (2) a lo largo de un plano común (P) de posicionamiento; la porción de borde (3) tiene una cámara tubular (4) con sección transversal toroidal para el paso de líquidos y que tiene como eje de rotación el eje (Z) del retrete (2); una carcasa exterior separada (5) para alojar el componente individual formado por el retrete (2) y el borde (3); la taza comprende un primer conjunto de superficies perimetrales (8, 14, 31) que definen una parte de la cámara tubular (4) del borde (3) y la superficie que une la porción de borde (3) al retrete (2) y que son paralelos entre sí y se extienden en una dirección transversal al plano común (P) de posicionamiento, y un segundo conjunto de superficies perimetrales (6, 12) que definen la otra parte de la cámara tubular (4) y se extienden en paralelo al plano (P) de posicionamiento y se conectan al primer conjunto de superficies (8, 14, 31) para configurar superficies exteriores continuas carentes de hendiduras o proyecciones; una de las superficies (12) del segundo conjunto que define la pared superior de la cámara tubular (4) se provee con una pestaña de proyección (13) que forma una superficie (3) para el descanso del borde (3) sobre una superficie superior (15) de la carcasa (5).|MAZZANTI, VASCO [IT]; BERNABEI, ALESSANDRO [IT]; Imola (Bologna), 40026, IT|SACMI COOPERATIVA MECCANICI IMOLA SOCIETA' COOPERATIVA [IT]; Imola (Bologna), 40026, IT|
339907|Patente|MX/a/2011/005006|11/05/2011|14/06/2016|<i>C12N1/20</i> <b>(2006-01)</b>; <i>A23C19/032</i> <b>(2006-01)</b>; <i>A23C9/12</i> <b>(2006-01)</b>; <i>A23L1/03</i> <b>(2006-01)</b>; <i>A23L1/30</i> <b>(2006-01)</b>; <i>A23L33/135</i> <b>(2016-01)</b>; <i>A61K35/74</i> <b>(2015-01)</b>; <i>A61K35/745</i> <b>(2015-01)</b>; <i>C12R1/01</i> <b>(2006-01)</b>|BIFIDOBACTERIUM LONGUM.|La presente invención se refiere a las múltiples modalidades descritas en la presente comprenden el genoma de una cepa de probiótico Bifidobacterium Iongum y los genes codificados por el genoma. Se describen diversas variedades de Bifidobacterium Iongum nuevas. Una cepa aislada de Bifidobacterium longum BL1207 (PTA.9608). Una formulación que comprende una cepa aislada de Bifidobacterium longum. El uso de una cepa de Bifidobacterium Iongum como cepa probiótica.|LIAM O'MAHONY [IE]; DUANE LARRY CHARBONNEAU [US]; DOUWE VAN SINDEREN [NL]; JUN XU [CN]; WENZHU STEVEN ZHAO [US]; RAYMOND A. GRANT [US]; YULI SONG [CN]; CHARLES BASCOM [US]; Camgrohane, County Cork, IE|ALIMENTARY HEALTH LIMITED [IE]; THE PROCTER & GAMBLE COMPANY.* [US]; Kinsale Road, Cork, IE|
339908|Patente|MX/a/2014/004439|11/04/2014|14/06/2016|<i>A61K6/00</i> <b>(2006-01)</b>; <i>A61C13/23</i> <b>(2006-01)</b>|COMPOSICIONES ADHESIVAS PARA DENTADURAS POSTIZAS.|Una composición adhesiva para dentaduras postizas que tiene un componente adhesivo para dentaduras postizas y un componente aditivo de cohesión. El componente aditivo de cohesión puede ser uno de sales de monofosfato, sales de difosfato o sales de trifosfato.|JAYANTH RAJAIAH [US]; ARIF ALI BAIG [US]; ROBERT SCOTT LEONARD [US]; Loveland, Ohio, 45140, US|THE PROCTER & GAMBLE COMPANY [US]; Cincinnati, Ohio, 45202, US|
339909|Patente|MX/a/2014/000457|10/01/2014|14/06/2016|<i>A61K31/6615</i> <b>(2006-01)</b>; <i>A61K8/19</i> <b>(2006-01)</b>; <i>A61K8/21</i> <b>(2006-01)</b>; <i>A61K8/25</i> <b>(2006-01)</b>; <i>A61K8/27</i> <b>(2006-01)</b>; <i>A61K8/362</i> <b>(2006-01)</b>; <i>A61Q11/00</i> <b>(2006-01)</b>|COMPOSICIONES PARA EL CUIDADO BUCAL QUE COMPRENDE ACIDO FITICO.|Una composición para el cuidado bucal, que comprende una fuente de ion estanoso y/o una fuente de ion zinc; un ácido fítico, una sal del ácido fítico o mezclas de estos; en donde el ácido fítico o la sal del ácido fítico tienen un lPn promedio mayor que 5.2. En una composición que comprende estaño, se disminuye el estaño soluble a la vez que se mantiene una eficacia equivalente a una composición que comprende un nivel más alto de estaño soluble; además, se observa una mayor eficacia para evitar problemas relacionados con las manchas y la astringencia. Cuando hay iones de zinc presentes, se ha descubierto, sorprendentemente, que una disminución del zinc soluble puede proporcionar una eficacia antimicrobiana equivalente a una composición que comprende un mayor nivel de zinc soluble.|STEVEN HAMILTON HOKE II [US]; ROSS STRAND [GB]; XIAOLI WANG [CN]; YIQUN ZHANG [CN]; West Chester, Ohio, 45069, US|THE PROCTER & GAMBLE COMPANY [US]; Cincinnati, Ohio, 45202, US|
339910|Patente|MX/a/2012/015064|18/12/2012|15/06/2016|<i>C12N5/00</i> <b>(2006-01)</b>; <i>C12N15/52</i> <b>(2006-01)</b>; <i>C12N9/02</i> <b>(2006-01)</b>; <i>C12P7/62</i> <b>(2006-01)</b>|PROCESO PARA LA SEPARACION MEJORADA DE UNA SOLUCION ORGANICA HIDROFOBICA DE UN MEDIO DE CULTIVO ACUOSO.|La presente invención es concerniente con un proceso para la separación mejorada de una solución orgánica hidrofóbica de un medio de cultivo acuoso, que comprende las etapas de: provisión de un medio de cultivo acuoso que comprende una célula metabólicamente activa, contacto el medio de cultivo acuoso con una solución orgánica hidrofóbica, separación de la solución orgánica hidrofóbica del medio de cultivo acuoso, la célula tiene actividad disminuida, en comparación con su tipo silvestre, por lo menos una enzima que cataliza una de las reacciones de la beta-oxidación de ácidos grasos. La invención es concerniente además con el uso de una célula metabólicamente activa que tiene actividad disminuida, en comparación con su tipo silvestre, de una enzima que cataliza una de las reacciones de la beta-oxidación de ácidos grasos, preferiblemente de una enzima seleccionada del grupo que comprende FadA, FadB, FadO, FadL y FadE, también como variantes de las mismas, más preferiblemente FadE o una variante de la misma, para la separación mejorada de una solución orgánica hidrofóbica de un medio de cultivo acuoso que comprende la célula metabólicamente activa.|STEFFEN SCHAFFER [DE]; MIRJA WESSEL [DE]; THOMAS HAAS [DE]; JASMIN GIELEN [DE]; KATHARINA BERSE [DE]; SABINE HAFKEMEYER [DE]; MARKUS PÖTTER [DE]; FRANK ERHARDT [DE]; MARION SCHIEBELHUT [DE]; HANS-GEORG HENNEMANN [DE]; Marl, 45770, DE|EVONIK INDUSTRIES AG.* [DE]; Essen, 45128, DE|
339911|Patente|MX/a/2012/000001|02/01/2012|16/06/2016|<i>B02B5/02</i> <b>(2006-01)</b>; <i>B02C9/04</i> <b>(2006-01)</b>|CUCHILLAS UNIVERSALES Y ACCESORIOS PARA PROCESADORES DE ALIMENTOS.|Utensilio de procesamiento de alimentos que consta de: paletas; utensilio central que consta de : eje acoplable a un motor de un procesador de alimentos y conectado a una base acoplable a un bol de procesador de alimentos y cuchillas cortantes, las paletas acopladas al utensilio central y las cuchillas configuradas para permitir el corte uniforme de los alimentos siempre y cuando las paletas no estén sobre las cuchillas.|DAVID MENASHES [IL]; Haifa, 34670, IL|DAVID MENASHES [IL]; Haifa, 34670, IL|
339912|Patente|MX/a/2015/014235|18/01/2012|17/06/2016|<i>H04N5/76</i> <b>(2006-01)</b>|SISTEMAS, METODOS Y MEDIOS LEGIBLES POR COMPUTADORA PARA MEMORIA DE RECEPTOR DE RADIOFUSION DIGITAL Y REDUCCION DE POTENCIA.|Un método de desintercalado por bloques de datos recibidos en un receptor de radiodifusión digital se describe. El método incluye proporcionar un bloque de memoria que tiene n x k direcciones, en donde el bloque comprende una sola tabla, recibir una señal de radiodifusión digital en el receptor, y desmodular la señal de radiodifusión digital en una pluralidad de unidades de datos intercaladas. Para al menos una serie de n x k unidades de datos un tamaño de etapa de puntero se determina, y para cada unidad de datos en la serie, una dirección en el bloque se calcula basándose en el tamaño de etapa de puntero, y una unidad de dato de salida se lee en el bloque en la dirección, de manera que las unidades de datos de salida representan unidades de datos desintercaladas por bloques. Una unidad de datos de entrada de la pluralidad de unidades de datos intercaladas entonces se escribe en el bloque en la dirección. Sistemas asociados y medios de almacenamiento legibles por computadora se presentan.|MAREK MILBAR [IL]; Huntingdon Valley, PA, 19006, US|IBIQUITY DIGITAL CORPORATION [US]; Columbia, MD, 21046, US|
339913|Patente|MX/a/2014/016001|19/12/2014|17/06/2016|<i>H04N19/122</i> <b>(2014-01)</b>; <i>H04N19/12</i> <b>(2014-01)</b>; <i>H04N19/124</i> <b>(2014-01)</b>; <i>H04N19/157</i> <b>(2014-01)</b>; <i>H04N19/176</i> <b>(2014-01)</b>; <i>H04N19/70</i> <b>(2014-01)</b>|DISPOSITIVO Y METODO DE PROCESAMIENTO DE IMAGENES.|La presente invención pertenece a un dispositivo y método de procesamiento de imágenes por el cual es posible evitar una caída en la calidad de imagen debido a la codificación y descodificación, La presente invención se proporciona con: una unidad de cuantificación que cuantifica todos los elementos de un bloque actual al utilizar el coeficiente de ponderación de 1 cuando un proceso de transformada ortogonal se salta para el bloque actual, y que cuantifica cada elemento del bloque actual utilizando una matriz de cuantificación cuando el proceso de transformada ortogonal se lleva a cabo en el bloque actual; una unidad de codificación que codifica el coeficiente del bloque actual el cual se cuantifica por medio de la unidad de cuantificación; y una unidad de transferencia para transferir los datos codificados de bloque actual el cual se obtiene al codificarse por medio de la unidad de codificación. La presente invención puede aplicarse, por ejemplo, a un dispositivo de procesamiento de imágenes.|KAZUSHI SATO [JP]; YOSHITAKA MORIGAMI [JP]; SHUO LU [JP]; Minato-ku, Tokio, 1080075, JP|SONY CORPORATION [JP]; Minato-ku, Tokio, 1080075, JP|
339914|Patente|MX/a/2014/015998|19/12/2014|17/06/2016|<i>H04N19/122</i> <b>(2014-01)</b>; <i>H04N19/12</i> <b>(2014-01)</b>; <i>H04N19/124</i> <b>(2014-01)</b>; <i>H04N19/157</i> <b>(2014-01)</b>; <i>H04N19/176</i> <b>(2014-01)</b>; <i>H04N19/60</i> <b>(2014-01)</b>; <i>H04N19/70</i> <b>(2014-01)</b>|DISPOSITIVO Y METODO DE PROCESAMIENTO DE IMAGENES.|La presente invención pertenece a un dispositivo y método de procesamiento de imagen por el cual es posible evitar una caída en la calidad de imagen debido a codificación y descodificación. La presente invención se proporciona con: una unidad de cuantificación que cuantifica todos los elementos de un bloque actual al utilizar el coeficiente de ponderación de 1 cuando se salta un proceso de transformada ortogonal para el bloque actual, y el cual cuantifica cada elemento del bloque actual utilizando una matriz de cuantificación cuando el proceso de transformada ortogonal se lleva a cabo en el bloque actual ; una unidad de codificación que codifica el coeficiente del bloque actual que se cuantifica por medio de la unidad de cuantificación; y una unidad de transferencia para transferir los datos codificados el bloque actual que se obtienen al ser codificados por medio de la unidad de codificación. La presente invención puede aplicarse, por ejemplo, a un dispositivo de procesamiento de imágenes.|KAZUSHI SATO [JP]; YOSHITAKA MORIGAMI [JP]; SHUO LU [JP]; Minato-ku, Tokio, 1080075, JP|SONY CORPORATION [JP]; Minato-ku, Tokio, 1080075, JP|
339915|Patente|MX/a/2015/014768|26/09/2014|17/06/2016|<i>H04N19/50</i> <b>(2014-01)</b>; <i>H04N19/117</i> <b>(2014-01)</b>; <i>H04N19/44</i> <b>(2014-01)</b>; <i>H04N19/86</i> <b>(2014-01)</b>|DISPOSITIVO Y METODO PARA EL PROCESAMIENTO DE IMAGENES.|La presente descripción se refiere a un dispositivo y un método de procesamiento de imágenes capaces de suprimir el ruido de bloque. Una unidad de cálculo de ß LUT_entrada y una unidad de limitación calculan el ß LUT entrada que es el valor introducido a una unidad de generación del parámetro ß existente y una unidad de generación del parámetro ß extendido. Cuando el valor de ß LUT_entrada gp de la unidad de limitación es igual o menor a 51, la unidad de generación del parámetro ß existente calcula el parámetro ß usando la LUT definida en el método HEVC y suministra el parámetro ß calculado a una unidad de determinación del filtrado. Cuando el valor de ß LUT_entrada qp de la unidad de limitación es mayor a 51, la unidad de generación del parámetro ß extendido calcula el parámetro ß extendido y suministra el parámetro ß calculado a la unidad de determinación del filtrado. La presente descripción puede ser aplicada a un dispositivo de procesamiento de imágenes, por ejemplo.|MASARU IKEDA [JP]; SHUO LU [CN]; Minato-ku, Tokio, 1080075, JP|SONY CORPORATION [JP]; Minato-Ku, Tokio, 1080075, JP|
