Número de concesión|Tipo de documento|Número de solicitud|Fecha de presentación|Fecha de concesión|Clasificación CIP|Título|Resumen|Inventor(es)|Titular
337892|Patente|MX/a/2010/000730|19/01/2010|28/03/2016|<i>F16B17/00</i> <b>(2006-01)</b>; <i>B62D25/00</i> <b>(2006-01)</b>|DISPOSITIVOS SEPARADORES POLIMERICOS MOLDEADOS.|Los sustratos tales como componentes de metales en lámina pueden mantenerse separados uno del otro usando un dispositivo de separación polimérico moldeado. El dispositivo de separación tiene un cuerpo principal con un groso que corresponde a la separación mínima deseada entre los sustratos y, extendiéndose desde el cuerpo principal o una base conectado al cuerpo principal, un miembro de conexión capaz de insertarse en una abertura en uno de los sustratos, pero resistente para ser retirado fácilmente de dicha abertura. El ruido y vibración que pudieran generarse de alguna manera o propagarse por sustratos estrechamente próximos se reducen mediante el uso de dichos dispositivitos de separación poliméricos moldeados, que pueden configurarse integralmente de un hule.|MARK W. ZIEHM [US]; MICHAEL J. RADLICK III [US]; LAWRENCE R. WEBER [US]; Rochester Hills, Michigan, 48307, US|HENKEL AG & CO. KGAA [DE]; Düsseldorf, 40589, DE|
337893|Patente|MX/a/2012/005399|09/05/2012|28/03/2016|<i>A61K9/10</i> <b>(2006-01)</b>; <i>A61K31/4045</i> <b>(2006-01)</b>; <i>A61K47/38</i> <b>(2006-01)</b>|NANOSUSPENSION DE UN FARMACO DEBILMENTE SOLUBLE PREPARADA POR UN PROCESO DE MICROFLUIDIZACION.|Se proporcionan las composiciones y los métodos para la preparación y administración de una nanosupensión oral con biodisponibilidad mejorada de un fármaco débilmente soluble. El método se optimiza por el proceso de microfluidización con excipientes poliméricos solubles en agua, en ausencia de agentes tensoactivos.|THOMAS LEE [US]; MING J. CHEN [US]; HO-WAH HUI [US]; PAUL KURTULIK [US]; SEKHAR SURAPANENI [US]; West Windsor, NJ, 08550, US|CELGENE CORPORATION.* [US]; Summit, NJ, 07901, US|
337894|Patente|MX/a/2014/014493|15/03/2013|28/03/2016|<i>H01H71/24</i> <b>(2006-01)</b>|BOBINA DE SOLENOIDE QUE TIENE UN CAMPO MAGNETICO MEJORADO.|Se proporciona un solenoide mejorado que tiene un campo magnético mejorado y la operación a prueba por pérdidas, en donde un devanado primario y un devanado secundario se construyen tal que la fuerza combinada impartida en un núcleo móvil por ambos devanados energizados juntos, es mayor que la suma de las fuerzas impartidas por los devanados primario y secundario energizados separadamente, resultando en un solenoide menor capaz de proporcionar una fuerza predeterminada, y proporcionando un solenoide capaz de arrancar o iniciar un circuito de interrupción enganchado incluso si uno de los devanados está interrumpido.|STEPHEN PAUL SIMONIN [US]; Northfield, Connecticut, 06778, US|HUBBELL INCORPORATED [US]; Shelton, Connecticut, 06484-1000, US|
337895|Patente|MX/a/2014/012601|17/10/2014|23/03/2016|<i>G01V5/12</i> <b>(2006-01)</b>; <i>G01V5/10</i> <b>(2006-01)</b>; <i>G06F19/00</i> <b>(2011-01)</b>; <i>G06F19/28</i> <b>(2011-01)</b>|SISTEMA Y METODO PARA DETERMINAR UN VALOR INDICATIVO DE INDICE DE HIDROGENO.|Determinación de un valor indicativo de índice de hidrógeno. Al menos algunas de las modalidades ejemplares son métodos que incluyen obtener una tasa de conteo de inelásticas y una tasa de conteo de captura de un primer detector de rayos gamma para una profundidad de pozo particular, obtener una tasa de conteo de inelásticas y una tasa de conteo de captura de un segundo detector de rayos gamma para la profundidad de pozo particular, calcular una relación de una tasa de conteo de inelásticas con respecto a una tasa de conteo de captura para el primer detector de rayos gamma, creando de esta manera un primer valor, calcular una relación de una tasa de conteo de inelásticas con respecto a una tasa de conteo de captura para el segundo detector de rayos gamma, creando de esta manera un segundo valor, calcular una relación del primer y segundo valores, y determinar un valor indicativo de índice de hidrógeno con base en la relación del primer y segundo valores.|WEIJUN GUO [CN]; LARRY, A. JACOBSON [US]; Houston, Texas, 77024, US|HALLIBURTON ENERGY SERVICES, INC. [US]; Houston, Texas, 77072, US|
337896|Patente|MX/a/2013/007227|21/06/2013|23/03/2016|<i>A61K8/22</i> <b>(2006-01)</b>; <i>A61K8/81</i> <b>(2006-01)</b>; <i>A61K8/86</i> <b>(2006-01)</b>; <i>A61Q11/00</i> <b>(2006-01)</b>|COMPOSICIONES DE CUIDADO ORAL.|Se describen composiciones para el cuidado oral que comprenden una poiiviriilpirrolidona reticulada en complejo con peróxido de hidrogeno, junto con un copolímero de bloque de óxido de etileno-óxido de propileno. Algunas modalidades comprenden además un abrasivo de calcio, por ejemplo pirofosfato de calcio o carbonato de calcio, y algunas pueden tener menos de 3% de agua.|PRAKASARAO MANDADI [US]; SUMAN CHOPRA [US]; VENDA PORTER [US]; DENNIS ONTUME [US]; Flemington, New Jersey, 08822, US|COLGATE-PALMOLIVE COMPANY [US]; New York, New York, 10022, US|
337897|Patente|MX/a/2014/004840|22/04/2014|28/03/2016|<i>C09K8/584</i> <b>(2006-01)</b>; <i>C11D1/06</i> <b>(2006-01)</b>; <i>C11D1/29</i> <b>(2006-01)</b>; <i>C11D1/34</i> <b>(2006-01)</b>|METODO PARA PRODUCIR ACEITE MINERAL UTILIZANDO AGENTES TENSIOACTIVOS SOBRE LA BASE DE UNA MEZCLA DE ALCOXILATOS DE HIDROCARBUROS QUE CONTIENEN C24-GUERBET, C26-GUERBET, C28-GUERBET.|La invención se refiere a una mezcla de agentes tensioactivos que contiene, en relación a la parte de hidrocarburo (R1) (R2)-CH-CH2- al menos tres diferentes agentes tensioactivos iónicos de formula general (I), en la que R1, R2, A0, k, X, o, Y, a, b, M tienen el significado indicado en la descripción y las reivindicaciones. La invención además se refiere al uso y producción de los mismos y a formulaciones acuosas de agentes tensioactivos que contienen las mezclas y a un método para la producción de aceite mineral por medio de inundaciones de microemulsión Winsor tipo III, en el cual la formulación de agente tensioactivo acuoso se fuerza a través de pozos de inyección en un depósito de aceite mineral y el petróleo crudo se retira del depósito a través de pozos de producción.|GÜNTER OETTER [DE]; SOPHIE MAITRO-VOGEL [FR]; CHRISTIAN BITTNER [DE]; JACK TINSLEY [US]; CHRISTIAN SPINDLER [DE]; GABRIELA ALVAREZ JÜRGENSON [ES]; Bensheim, 64625, DE|BASF SE [DE]; Ludwigshafen, 67056, DE|
337898|Patente|MX/a/2012/006435|04/06/2012|28/03/2016|<i>C22B3/04</i> <b>(2006-01)</b>; <i>C22B15/00</i> <b>(2006-01)</b>; <i>C22B3/02</i> <b>(2006-01)</b>; <i>C22B5/00</i> <b>(2006-01)</b>|OPERACIONES DE LIXIVIACION EN PILA.|Se describe un método de lixiviación en pila o por acumulación que consiste en formar un nivel apilado, instalando un sistema horizontal de recolección de soluciones entre las capas acumuladas que contienen una tubería horizontal con una herramienta alámbrica para la recolección de datos colocada en ésta, disponer un modelo de lixiviación en pila para modelar la operación de lixiviación en pila que incluye una formulación de solvente y una configuración de irrigación, obtener los datos recolectados a partir de la herramienta alámbrica para la recolección de datos durante la irrigación del nivel acumulado, los datos recolectados contienen parámetros del material in situ de las capas acumuladas y parámetros de la solución in situ de la solución que fluye en las capas acumuladas, modelar la operación de lixiviación en pila utilizando los datos recopilados, con base en el modelo de lixiviación en pila para obtener un resultado, y ajustar la operación de lixiviación en pila con base en el resultado.|GILLES MATHIEU [FR]; KENT JAY LANG [US]; ROLAND CLAUDE BANAS [FR]; ROBERT A. WILL [US]; Oro Valley, Arizona, 85737, US|SCHLUMBERGER TECHNOLOGY B.V.* [NL]; The Hague, 2514, NL|
337899|Patente|MX/a/2008/008910|10/07/2008|28/03/2016|<i>C05C1/02</i> <b>(2006-01)</b>|COMPOSICIONES ESTABILIZADAS QUE COMPRENDEN NITRATO DE AMONIO.|Aspectos preferidos de la presente invención ofrecen composiciones de nitrato de amonio que comprenden nitrato de amonio y por lo menos un agente de estabilización, y preferentemente un tercer compuesto. En ciertas modalidades, el agente de estabilización junto con el tercer compuesto, está presente bajo condiciones y en cantidades efectivas para reducir sustancialmente la sensibilidad de detonación de la composición y/o para mejorar de otra forma una propiedad deseada de la composición.|JAMES A. KWEEDER [US]; RICHARD J. WILLIAMS [US]; Chesterfield, VA, 23832, US|HONEYWELL INTERNATIONAL INC. [US]; Morristown, New Jersey, 07962-2245, US|
337900|Patente|MX/a/2013/008066|10/07/2013|28/03/2016|<i>H05B37/02</i> <b>(2006-01)</b>|CIRCUITO PARA EXPANSION DE LA GAMA DE INTENSIDADES DE UNA LAMPARA DE DIODO EMISOR DE LUZ.|Un circuito y método para controlar uno o más diodos emisores de luz (LEDs) incluye uno o más LEDs conectados al emisor de un transistor, y controlar la brillantez de los LEDs en una gama grande basada en una gama de voltaje en una base del transistor controlada por un mecanismo de ajuste automático.|STEPHEN M. LISCINSKY [US]; Stratford, Connecticut, 06615, US|HUBBELL INCORPORATED [US]; Shelton, Connecticut, 06484, US|
337901|Patente|MX/a/2012/003977|02/04/2012|28/03/2016|<i>A01H1/02</i> <b>(2006-01)</b>; <i>A01H5/00</i> <b>(2006-01)</b>|CULTIVAR DE ARROZ DENOMINADO "CL261".|La presente invención se refiere a cultivares híbridos y derivados del cultivar de arroz denominado "CL261". Semillas y plantas de arroz híbridas producidas cruzando el cultivar "CL261" con otro cultivar de arroz. Otros derivados del cultivar de arroz "CL261".|STEVEN D. LINSCOMBE [US]; Rayne, Louisiana, 70578, US|BOARD OF SUPERVISORS OF LOUISIANA STATE UNIVERSITY AND AGRICULTURAL AND MECHANICAL COLLEGE [US]; Baton Rouge, LA, 70803, US|
337902|Patente|MX/a/2009/005948|28/05/2004|22/03/2016|<i>A61K31/353</i> <b>(2006-01)</b>; <i>A61K36/18</i> <b>(2006-01)</b>; <i>A61P25/28</i> <b>(2006-01)</b>; <i>A61P3/00</i> <b>(2006-01)</b>; <i>A61P31/18</i> <b>(2006-01)</b>|METODOS PARA HACER Y UTILIZAR TEAFLAVIN, TEAFAVLIN-3-GALATO, TEAFLAVIN-3'-GALATO Y TEAFLAVIN 3,3´-DIGALATO Y MEZCLAS DE LAS MISMAS.|La presente invención describe métodos para hacer una mezcla de teaflavin-3-galato, teaflavin-3'-galato y teaflavin 3,3'-digalato, composiciones farmacéuticas de la mezcla anterior de teaflavinas, composiciones de complemento de dieta de la mezcla anterior de teaflavinas y métodos para utilizar las mezclas anteriores de teaflavin y composiciones farmacéuticas de las mismas para tratar o prevenir varias enfermedades. La presente invención también describe métodos para hacer teaflavin, teaflavin-3-galato, teaflavin-3'-galato y teaflavin 3,3'-digalato, cada uno como un compuesto separado, composiciones farmacéuticas de los compuestos anteriores, composiciones de complemento de dieta de los compuestos anteriores y métodos para utilizar los compuestos anteriores para tratar o prevenir diversas enfermedades.|JIAN ZHAO [US]; RUI ZHOU [CN]; HU CHEN [CN]; Irvine, California, 92614, US|NASHAI BIOTECH, LLC. [US]; Brentwood, Tennessee, 37027, US|
337903|Patente|MX/a/2012/007079|18/06/2012|28/03/2016|<i>C08F2/40</i> <b>(2006-01)</b>; <i>C08F2/04</i> <b>(2006-01)</b>; <i>C08F4/40</i> <b>(2006-01)</b>; <i>C08F4/42</i> <b>(2006-01)</b>; <i>C08F4/50</i> <b>(2006-01)</b>|CONTROL MEJORADO SOBRE PROCESOS CONTROLADOS DE POLIMERIZACION DE RADICALES.|Se describe un procedimiento para control de temperatura mejorado en procesos controlados de polimerización de radicales. El procedimiento se dirige al control de la concentración del radical persistente en polimerizaciones de ATRP y NMP y la concentración de radicales en un proceso de polimerización de RAFT alimentando un agente de reducción o precursor de radicales continuamente o intermitente al medio de reacción a través de uno o más puertos.|JAMES SPANSWICK [US]; WOJCIECH JAKUBOWSKI [PL]; Pittsburgh, PA, 15213, US|ATRP SOLUTIONS, INC.* [US]; Pittsburgh, PA, 15238, US|
337904|Patente|MX/a/2013/014806|13/12/2013|28/03/2016|<i>A01H1/04</i> <b>(2006-01)</b>; <i>A01G1/00</i> <b>(2006-01)</b>; <i>G01N21/84</i> <b>(2006-01)</b>|DISPOSITIVO DE EXPLORACION PARA EXPLORAR EPECIMIENES DE PLANTA.|La presente invención se refiere a un dispositivo de exploración (110) para explorar por lo menos un espécimen de planta (112) en una pluralidad de especímenes de planta (114). El dispositivo de exploración (110) comprende un detector (116) adaptado para adquirir imágenes espacialmente resueltas (117). El dispositivo de exploración (110) comprende además al menos un dispositivo de selección (118) adaptado para seleccionar un espécimen de planta (120) o un grupo de especímenes de planta (122) a partir de la pluralidad de especímenes de planta (114) para escaneo por el detector (11 6). El dispositivo de selección (118) comprende un dispositivo de desviación (124) adaptado para desviar ondas electromagnéticas propagando entre los especímenes de planta (112) y el detector (116).|FREDERIK LEYNS [BE]; CEDRICK VANDAELE [BE]; PIERRE LEJEUNE [BE]; JEROEN BAERT [BE]; FABIO FIORANI [IT]; Oosterzele, B-9860, BE|BASF PLANT SCIENCE COMPANY GMBH [DE]; Ludwigshafen, 67056, DE|
337905|Patente|MX/a/2013/002435|28/02/2013|23/03/2016|<i>B01D24/02</i> <b>(2006-01)</b>; <i>B01D61/08</i> <b>(2006-01)</b>; <i>C02F1/00</i> <b>(2006-01)</b>; <i>C02F1/28</i> <b>(2006-01)</b>|DISPOSITIVO DE FILTRACION DE AGUA Y METODO PARA SU USO.|En una realización, el dispositivo de filtración de agua incluye una primera cámara que incluye una primera pluralidad de partículas inorgánicas; y una segunda cámara en comunicación acuosa con la primera cámara. La segunda cámara incluye además una segunda pluralidad de partículas inorgánicas. En otra realización adicional, cada una de la primera y la segunda pluralidad de partículas inorgánicas se selecciona independientemente del grupo que consiste en partículas de cerámica porosa, arcilla de esmectita, perlita, vermiculita, zeolita, tierra de batanero, zeolita de tierra diatomácea y sus combinaciones. En ciertos casos, cada una de la primera y la segunda cámara incluye independientemente arena. El dispositivo de filtración de agua puede ser portátil o de un tamaño fijo para el uso comunitario.|KEVIN S. SPITTLE [US]; FREDERICK R. SEGAL [US]; MICHAEL ROBESON [US]; JESSIE CLARK [US]; JOHN A. SCHOCH, JR. [US]; GARY LANE BOWERS [US]; Vero Beach, Florida, 32963, US|PROCLEANSE LLC [US]; Buffalo Grove, Illinois, 60089, US|
337906|Patente|MX/a/2012/001823|17/04/2009|28/03/2016|<i>C07D487/14</i> <b>(2006-01)</b>|COMPUESTOS DE HETEROARILO, COMPOSICIONES DE LOS MISMOS, Y SU USO COMO INHIBIDORES DE PROTEINA CINASAS.|Se proporcionan aquí los compuestos heterocíclicos que tienen la siguiente estructura: (I) en donde R1, R2, L, X, Y, Z, Q, A y B son como se definen aquí, las composiciones que comprenden una cantidad efectiva de un compuesto de heteroarilo y métodos para el tratamiento o prevención del cáncer, condiciones inflamatorias, condiciones inmunológicas, condiciones metabólicas y condiciones tratables o prevenibles por inhibición de una vía o trayectoria de la cinasa, que comprende la administración de una cantidad efectiva de un compuesto de heteroarilo a un paciente en necesidad del mismo.(ver fórmula (I)).|RONALD J. ALBERS [US]; MARIA MERCEDES MEDEROS DELGADO [ES]; JOHN JOSEPH SAPIENZA [US]; BRANDEN G. LEE [US]; DEHUA HUANG [CN]; KIMBERLY LYN SCHWARZ [US]; JASON SIMON PARNES [US]; PATRICK WILLIAM PAPA [US]; ROY LEONARD HARRIS III [US]; GRAZIELLA ISABEL SHEVLIN [US]; GARRICK K. PACKARD [US]; LIDA RADNIA TEHRANI [US]; SOPHIE PERRIN-NINKOVIC [FR]; DEBORAH SUE MORTENSEN [US]; San Diego, California, 92117, US|SIGNAL PHARMACEUTICALS, LLC [US]; San Diego, California, 92121, US|
337907|Patente|MX/a/2013/001293|30/01/2013|28/03/2016|<i>G01N33/573</i> <b>(2006-01)</b>|ENSAYOS BIOMARCADORES PARA DETECTAR O MEDIR INHIBICION DE ACTIVIDAD QUINASA TOR.|La presente invención se refiere a el uso de un anticuerpo anti-p4EBP1 para la preparación de un equipo para detectar o medir la inhibición de la actividad de quinasa TOR in vitro en un sujeto, donde el anticuerpo anti-p4EBP1 es utilizado en citometría de flujo para medir la cantidad 4EBP1 fosforilada en una muestra biológica del sujeto antes y después de la administración de un inhibidor de quinasa TOR, en donde el inhibidor de quinasa TOR tiene la fórmula (II): o una sal, clatrato, solvato, estereoisómero, tautómero, o profármaco farmacéuticamente aceptable de los mismos, en donde: R1 es piridilo sustituido o no sustituido; R2 es H, alquilo de c C1-8 sustituido o no sustituido, cicloalquilo sustituido o no sustituido, heterociclilo sustituido o no sustituido, heterociclilalquilo sustituido o no sustituido, aralquilo sustituido o no sustituido, o cicloalquilalquilo sustituido o no sustituido; y R3 es H, o un alquilo de C1-8 sustituido o no sustituido.|SHUICHAN XU [US]; LILLY WONG [US]; JIAN-HUA DING [US]; Solana Beach, CA, 92075, US|SIGNAL PHARMACEUTICALS, LLC [US]; San Diego, CA, 92121, US|
337908|Patente|MX/a/2011/008555|12/08/2011|28/03/2016|<i>C09J175/06</i> <b>(2006-01)</b>; <i>B32B7/12</i> <b>(2006-01)</b>; <i>C09J191/00</i> <b>(2006-01)</b>|ADHESIVOS DE POLIURETANO LIQUIDOS, QUE PUEDEN SER CURADOS CON HUMEDAD, PARA LAMINACION Y MONTAJE.|Esta invención se refiere a los adhesivos que contienen prepolímero de poliuretano que son líquidos a temperatura ambiente y no presentan separación de fases en las condiciones de almacenamiento y uso típicas y que pueden ser curados por exposición a la humedad o a agentes de curado que contengan hidrógeno activo. Los adhesivos prepolímeros de poliuretano presentan sorprendentemente buena adhesión a plásticos como pueden ser plásticos reforzados con fibra de vidrio ("FRP").|SHUHUI QIN [CN]; YINGJIE LI [US]; Bartlett, Illinois, 60103, US|HENKEL IP & HOLDING GMBH [DE];|
337909|Patente|MX/a/2013/014561|22/04/2010|28/03/2016|<i>B65D5/22</i> <b>(2006-01)</b>|ARTICULO DE SERVICIO DE MESA DE CARTON PRENSADO CON PANEL INFERIOR ARQUEADO Y TRANSICION DE BORDE AGUDO.|La presente invención se refiere a un plato de papel desechable formado por prensado a partir de un corte de cartón generalmente plano, teniendo el plato un diámetro característico, D, de aproximadamente 8 1/2'' hasta aproximadamente 10 1/4 " (desde aproximadamente 21.6 cm hasta aproximadamente 26.7 cm), y caracterizado porque comprende: (a) un panel inferior; (b) una primera porción de transición anular que se extiende hacia arriba y hacia fuera desde el panel inferior; (c) una porción de pared lateral opcional que se extiende hacia arriba y hacia afuera desde la primera porción de transición anular; (d) una segunda porción de transición anular que se ensancha hacia afuera con respecto a la primera porción de transición anular que define un segundo radio de curvatura, R2, la relación de R2/D es de 0.0125 o menor; y (e) una porción de pestaña exterior que se extiende hacia afuera con respecto a la segunda porción de transición anular; (f) una pluralidad de pliegues que se extienden radialmente, espaciados circunferencialmente, formados a partir de una pluralidad de laminillas de cartón reunidas en estructuras fibrosas sustancialmente integradas, generalmente inseparables en sus laminillas constituyentes, extendiéndose los pliegues sobre al menos una porción de la segunda porción de transición anular y al menos una porción de la porción de pestaña exterior del plato, en el que el plato define una estructura plegada que tiene un perfil, y en el que además se seleccionan el perfil y el corte de cartón, y la formación del plato, incluyendo el plegamiento, se controla de tal manera que el plato de papel exhiba una rigidez SSI Normalizada de al menos 1.8 g/lb de peso base.|MARK B. LITTLEJOHN [US]; Appleton, Wisconsin, 54914, US|DIXIE CONSUMER PRODUCTS LLC [US]; Atlanta, Georgia, 30303, US|
337910|Patente|MX/a/2013/002599|06/03/2013|28/03/2016|<i>G01V3/26</i> <b>(2006-01)</b>|ESTIMACION DE LA ORIENTACION DE LA FRACTURA Y DETECCION DE LA FRACTURA EN TIEMPO REAL USANDO LAS MEDICIONES DE INDUCCION TRAIXIALES.|Un método para determinar la existencia de una fractura en una formación que rodea un hoyo perforado a través de formaciones rocosas de subsuperficie incluye calcular la resistividad vertical, la resistividad horizontal, la inclinación de formación aparente, el azimut de formación aparente y la resistividad axial para una pluralidad de separaciones longitudinales del instrumento usando las mediciones de un instrumento de registro de pozo de inducción triaxiales dispuesto en la formación. Se determina una propagación en los valores de resistividad axiales y el umbral de propagación de resistividad axial del mismo. Los valores de indicador de fractura y los valores de orientación de la fractura se calculan a partir de los componentes transversales de las mediciones de inducción triaxiales. La presencia de una fractura se indica cuando al menos un valor de indicador de fractura sobrepasa un umbral seleccionado, la propagación de resistividad axial sobrepasa el umbral de propagación y cuando la inclinación de formación aparente sobrepasa un umbral seleccionado.|PETER T. WU [US]; THOMAS D. BARBER [US]; DEAN HOMAN [US]; WEIXIN DONG [CN]; Sugar Land, Texas, 77479, US|SCHLUMBERGER TECHNOLOGY B.V.* [NL]; JG The Hague, 2514, NL|
337911|Patente|MX/a/2010/014107|17/12/2010|28/03/2016|<i>H01H35/24</i> <b>(2006-01)</b>; <i>H01H35/26</i> <b>(2006-01)</b>; <i>H01H35/34</i> <b>(2006-01)</b>; <i>H01H35/38</i> <b>(2006-01)</b>|INTERRUPTOR HIDRONEUMATICO DE CORRIENTE ELECTRICA PARA BOMBAS DE AGUA CON INDICADOR DE VACIO Y BOTON DE ARRANQUE.|La presente invención se refiere a un interruptor hidroneumático de corriente eléctrica para bombas de fluido con indicador de vacío y botón de arranque comprende las siguientes partes, elementos y funcionamiento que le comprenden y lo hacen único: un gabinete (12) con una pared superior, una pared inferior, una pared frontal, una pared posterior, una pared lateral derecha (8) y una pared lateral izquierda (13), que tiene un par de orificios (17, 18) de los cuales uno es central (18); La pared lateral derecha (8) tiene una boquilla de gabinete (16), la cual tiene un barreno central pasado el cual atraviesa dicha boquilla de gabinete (16); Un cople tubular (10) con una derivación para acoplarse al gabinete (16) y derivaciones para en uso acoplar el interruptor hidroneumático a la tubería por donde circulará el fluido impulsado por la bomba; Una membrana diafragmática (9) que hace contacto con la boquilla de gabinete (16) para detectar caída de presión por falta de flujo de fluido en el cople (10), dicha membrana diafragmática (9) está dispuesta entre la pared lateral derecha(8) y la derivación del cople (10) que acopla al gabinete (12); un interruptor alojado al interior del gabinete (12), acoplado al orificio central (18) de la pared lateral izquierda (13) por un extremo y por el otro extremo dicho interruptor se acopla a la boquilla (16), dicho interruptor está conformado por un cuerpo de alojamiento (4) que tiene acoplado un embolo maestro (6), hilos contactores (2) que atraviesan al cuerpo de alojamiento (4) y un resorte supresor (7) dispuesto en el émbolo maestro (6); el cuerpo de alojamiento (4) comprende un botón de arranque (1) siendo este elemento del interruptor el que se acopla al orificio central (18) de la pared lateral izquierda (13); el embolo maestro (6) está conformado de un vástago principal (20) el cual cuenta en su extremo distal de un pin contactor (5) y el resorte supresor (7) está dispuesto alrededor de dicho vástago principal (20) un tope (19) conformado unilateralmente al vástago principal con dimensiones diametrales mayores al vástago principal (20) y una base conformada unilateralmente al tope (19) y vástago principal (20) menor en dimensiones que el tope y la boquilla de gabinete (16), de forma que la boquilla de gabinete (16) aloja la base (20) del embolo maestro (6) limitado por el tope (19); Los hilos contactores (2) atraviesan transversalmente el barreno del cuerpo de alojamiento (4) de forma que se encuentren paralelamente entre sí, conectados a un foco piloto (11) que esta soportado en el segundo orificio (17) de la pared lateral izquierda (13) y a una fuente de corriente por medio de un cableado (3) dichos hilos contactores (2) cierran el circuito del interruptor haciendo contacto con el pin contactor (5) desplazado junto con el embolo maestro (6) al, detectar caída de presión en el flujo del tubo de fluido (10) por medio de la membrana diafragmática (9) los cuales hacen que el botón de arranque (1) sobresalga de la pared lateral izquierda (13).|ENRIQUE ORTIZ SANTA MARIA [MX]; LUIS ALBERTO ORTIZ SANTA MARIA [MX]; Distrito Federal, 07530, MX|ENRIQUE ORTIZ SANTA MARIA [MX]; LUIS ALBERTO ORTIZ SANTA MARIA [MX]; Distrito Federal, 07530, MX|
