Número de concesión|Tipo de documento|Número de solicitud|Fecha de presentación|Fecha de concesión|Clasificación CIP|Título|Resumen|Inventor(es)|Titular
340567|Patente|MX/a/2014/005395|02/05/2014|14/07/2016|<i>H04L12/16</i> <b>(2006-01)</b>; <i>G06Q50/30</i> <b>(2012-01)</b>; <i>H04W4/00</i> <b>(2009-01)</b>|ALGORITMOS QUE LIMITAN VELOCIDAD DE LADO DE SERVIDOR PARA ACCESO A INTERNET DE FORMA INALAMBRICA A ACTUALIZACIONES SOCIALES PARA DISPOSITIVOS MOVILES.|En una modalidad, un dispositivo móvil determina un modo de notificación basándose en el modo de interfase de usuario del dispositivo móvil, y transmite un mensaje que comprende el modo de notificación a un servidor, haciendo que el servidor transmita uno o más mensajes al dispositivo móvil basándose en el modo de notificación.|MATTHEW NICHOLAS PAPAKIPOS [US]; MICHAEL JOHN MCKENZIE TOKSVIG [US]; Menlo Park, California, 94025, US|FACEBOOK, INC. [US]; Menlo Park, California, 94025, US|
340568|Patente|MX/a/2013/010043|30/08/2013|14/07/2016|<i>A61K31/137</i> <b>(2006-01)</b>; <i>A61K31/138</i> <b>(2006-01)</b>; <i>A61K31/185</i> <b>(2006-01)</b>; <i>A61K31/195</i> <b>(2006-01)</b>; <i>A61K31/42</i> <b>(2006-01)</b>; <i>A61K31/64</i> <b>(2006-01)</b>; <i>A61P25/00</i> <b>(2006-01)</b>; <i>A61P25/16</i> <b>(2006-01)</b>; <i>A61P25/28</i> <b>(2006-01)</b>|TERAPIA PARA TRANSTORNOS NEUROLOGICOS A BASE DE BACLOFENO Y ACAMPROS ATO.|La presente invención se refiere a combinaciones y procedimientos para el tratamiento de trastornos neurológicos relacionados con la excitotoxicidad por glutamato y la toxicidad por 3 amiloides. Más específicamente, la presente invención se refiere a nuevas terapias de combinación de esclerosis múltiple, enfermedad de Alzheimer, trastorno relacionado con la enfermedad de Alzheimer, esclerosis lateral amiotrófica, enfermedad de Parkinson, enfermedad de Huntington, dolor neuropático, neuropatía alcohólica, alcoholismo o síndrome de abstinencia por alcohol, o lesión de la médula espinal, a base de una combinación de baclofeno y acamprosato.|DANIEL COHEN [FR]; ILYA CHUMAKOV [FR]; SERGUEI NABIROCHKIN [FR]; EMMANUEL VIAL [FR]; MICKAEL GUEDJ [FR]; Le Vésinet, F-78110, FR|PHARNEXT [FR]; Issy Les Moulineaux, F-92130, FR|
340569|Patente|MX/a/2013/006341|05/06/2013|13/07/2016|<i>B65G47/26</i> <b>(2006-01)</b>|ACUMULADOR DE TRANSPORTADOR PARA CONTROLAR EL FLUJO DE ARTICULOS QUE SE ESTAN TRANSPORTADO.|Un montaje amortiguador está configurado para amortiguar una corriente de artículos que se mueve a través de un transportador; el montaje de amortiguador está interpuesto en dicho transportador; el montaje de amortiguador comprende un acumulador de entrada de alimentación horizontal que está configurado para recibir la corriente de artículos de dicho transportador y un acumulador de almacenamiento masivo horizontal conectado a una salida del acumulador de entrada de alimentación horizontal para recibir dicha corriente de artículos del mismo; cada uno del acumulador de entrada de alimentación horizontal y el acumulador de almacenamiento masivo horizontal están configurados para amortiguar dicha corriente de artículos; el montaje de amortiguador comprende además un acumulador de salida de alimentación horizontal conectado a la salida del acumulador de almacenamiento masivo horizontal que está configurado para amortiguar la corriente de artículos; amortiguar la entrada de alimentación de los artículos evita la compresión del producto y amortiguar los artículos de salida de alimentación evita la formación de huecos entre los artículos de producto.|STEEBER, DORIAN F. [US]; Fort Gibson, Oklahoma, 74434, US|FLEETWOODGOLDCOWYARD, INC. [US]; Lynchburg, Virginia, 24502, US|
340570|Patente|MX/a/2014/011876|01/10/2014|13/07/2016|<i>H04N13/04</i> <b>(2006-01)</b>; <i>G02B27/26</i> <b>(2006-01)</b>; <i>G03B21/28</i> <b>(2006-01)</b>; <i>G03B35/26</i> <b>(2006-01)</b>|APARATO DE IMAGEN ESTEREOSCOPICA.|Se describe un aparato de imagen estereoscópica que es capaz de reducir al mínimo la pérdida de energía óptica y mejorar la calidad de una imagen estereoscópica; el aparato de imagen estereoscópica incluye un divisor del haz de polarización para reflejar o transmitir luz incidente con base en los componentes de polarización de la luz para separar la luz en por lo menos tres direcciones diferentes, un miembro reflector para reflejar la luz reflejada por el divisor del haz de polarización a una pantalla, por lo menos un modulador para modular la luz reflejada por el miembro reflector y la luz transmitida a través del divisor del haz de polarización, y un miembro de refracción dispuesto en una dirección de avance de la luz para ser incidente en el divisor del haz de polarización para refractar la luz para ser incidente en el divisor del haz de polarización.|LEE, CHUL WOO [KR]; CHO, SUNG HO [KR]; LIM, BYUNG GUL [KR]; Seongnam-si, Gyeonggi-do, 463-727, KR|MASTERIMAGE 3D ASIA, LLC. [KR]; Geumcheon-gu, Seoul, 153-803, KR|
340571|Patente|MX/a/2014/011760|29/09/2014|13/07/2016|<i>A61K9/48</i> <b>(2006-01)</b>; <i>A61K35/74</i> <b>(2015-01)</b>; <i>A61K38/00</i> <b>(2006-01)</b>; <i>A61K38/16</i> (2006-01); <i>A61K38/45</i> (2006-01); <i>A61K47/36</i> <b>(2006-01)</b>; <i>A61K47/42</i> <b>(2006-01)</b>; <i>A61K9/14</i> <b>(2006-01)</b>; <i>A61K9/36</i> <b>(2006-01)</b>; <i>A61K9/40</i> <b>(2006-01)</b>; <i>A61P1/00</i> <b>(2006-01)</b>|CAPSULA QUE SE DESINTEGRA ESPECIFICAMENTE EN EL INTESTINO GRUESO.|La presente invención es para obtener cápsulas que no se desintegren en el estómago ni en el intestino delgado después de administrarlas oralmente y que se desintegren específicamente en el intestino grueso; la presente invención así proporciona una cápsula que se desintegra específicamente en el intestino grueso, que comprende un contenido que comprende un agente principal y una carcasa que cubre el contenido y que comprende un polímero natural soluble en agua como material base de carcasa y quitosano en polvo que se dispersa en el polímero natural soluble en agua.|KAMAGUCHI, RYOSEI [JP]; MIZUTANI, MASAFUMI [JP]; Hirakata-shi, Osaka, 573-0128, JP|MORISHITA JINTAN CO., LTD. [JP]; Osaka-shi, Osaka, 540-8566, JP|
340572|Patente|MX/a/2013/004036|02/02/2012|13/07/2016|<i>C07D213/73</i> <b>(2006-01)</b>; <i>C07D471/04</i> <b>(2006-01)</b>|PROCESO PARA LA FABRICACION DE COMPUESTOS FARMACEUTICAMENTE ACTIVOS.|De acuerdo con la presente invención se proporcionan procesos novedosos para la fabricación del compuesto de la fórmula 1 (ver Fórmula) así como novedosas rutas de síntesis para intermediarios clave empleados en estos procesos.|HILDBRAND, STEFAN [CH]; MAIR, HANS-JUERGEN [DE]; RADINOV, ROUMEN NIKOLAEV [US]; REN, YI [US]; WRIGHT, JAMES ANDERSON [US]; Gelterkinden, CH-4460, CH|F. HOFFMANN-LA ROCHE AG.* [CH]; Basel, CH-4070, CH|
340573|Patente|MX/a/2013/004041|02/02/2012|13/07/2016|<i>C07D213/73</i> <b>(2006-01)</b>; <i>C07D471/04</i> <b>(2006-01)</b>|PROCESO PARA LA FABRICACION DE COMPUESTOS FARMACEUTICAMENTE ACTIVOS.|De acuerdo con la presente invención se proporcionan procesos novedosos para la fabricación del compuesto de la fórmula 1 (ver Fórmula) así como novedosas rutas de síntesis para intermediarios clave empleados en estos procesos.|HILDBRAND, STEFAN [CH]; MAIR, HANS-JUERGEN [DE]; RADINOV, ROUMEN NIKOLAEV [US]; REN, YI [US]; WRIGHT, JAMES ANDERSON [US]; Gelterkinden, CH-4460, CH|F. HOFFMANN-LA ROCHE AG.* [CH]; Basel, CH-4070, CH|
340574|Patente|MX/a/2013/010183|05/09/2013|13/07/2016|<i>C07D487/04</i> <b>(2006-01)</b>; <i>A61K31/4985</i> <b>(2006-01)</b>; <i>A61P35/02</i> <b>(2006-01)</b>|IMIDAZO PIRAZINAS.|Se proporcionan los compuestos de la fórmula (ver Fórmula) y sus sales farmacéuticas aceptables se describen, así como las composiciones farmacéuticas que contienen dichos compuestos y sus sales farmacéuticas aceptables, y el uso de dichos compuestos y composiciones farmacéuticas para el tratamiento, control o mejora de AML.|KIN-CHUN THOMAS LUK [US]; MICHAEL SOTH [US]; North Caldwell, New Jersey, 07006, US|F. HOFFMANN-LA ROCHE AG [CH]; Basel, CH-4070, CH|
340575|Patente|MX/a/2015/004022|27/03/2015|13/07/2016|<i>G10L19/03</i> <b>(2013-01)</b>; <i>G10L19/02</i> <b>(2013-01)</b>; <i>G10L19/028</i> (2013-01); <i>G10L21/0388</i> <b>(2013-01)</b>|APARATO Y METODO PARA CODIFICAR Y DECODIFICAR UNA SEÑAL DE AUDIO CODIFICADA UTILIZANDO MODELADO DE RUIDO TEMPORAL/DE PARCHE|Un aparato para decodificar una señal de audio codificada, el que comprende: un decodificador de audio de dominio espectral (602) para generar una primera representación decodificada de un primer conjunto de primeras porciones espectrales que son valores residuales de predicción espectral; un regenerador de frecuencia (604) para generar una segunda porción espectral reconstruida utilizando una primera porción espectral del primer conjunto de primeras porciones espectrales, en el que la segunda porción espectral reconstruida comprende, adicionalmente, valores residuales de predicción espectral; y un filtro de predicción inversa (606) para llevar a cabo una predicción inversa sobre la frecuencia utilizando los valores espectrales residuales para el primer conjunto de primeras porciones espectrales y la segunda porción espectral reconstruida que utiliza la información del filtro de predicción (607) incluida en la señal de audio codificada.|EDLER, BERND [DE]; GEIGER, RALF [DE]; BAYER, STEFAN [DE]; NAGEL, FREDERIK [DE]; HELMRICH, CHRISTIAN [DE]; SCHMIDT, KONSTANTIN [DE]; NEUKAM, CHRISTIAN [DE]; DISCH, SASCHA [DE]; THOSHKAHNA, BALAJI NAGENDRAN [DE]; Fürth, 90766, DE|FRAUNHOFER-GESELLSCHAFT ZUR FÖRDERUNG DER ANGEWANDTEN FORSCHUNG E.V. [DE]; Munich, 80686, DE|
340576|Patente|MX/a/2015/016229|04/07/2013|13/07/2016|<i>H04N19/176</i> <b>(2014-01)</b>; <i>H04N19/105</i> <b>(2014-01)</b>; <i>H04N19/11</i> <b>(2014-01)</b>; <i>H04N19/134</i> <b>(2014-01)</b>; <i>H04N19/136</i> <b>(2014-01)</b>; <i>H04N19/137</i> <b>(2014-01)</b>|METODO DE CODIFICACION PARA PREDICCION DE IMAGEN, DISPOSITIVO DE CODIFICACION PARA PREDICCION DE IMAGEN, PROGRAMA DE CODIFICACION PARA PREDICCION DE IMAGEN, METODO DE DESCODIFICACION PARA PREDICCION DE IMAGEN, DISPOSITIVO DE DESCODIFICACION PARA PREDICCION DE IMAGEN, Y PROGRAMA DE DESCODIFICACION PARA PREDICCION DE IMAGEN.|Cuando una gran cantidad de modos de predicción se proporcionan en generación de señales pronosticadas intra-cuadros, información de modo para identificar un método de predicción intra-cuadros de un bloque objetivo, se codifica eficientemente. Un método de codificación predictiva de imagen incluye: determinación de un modo de predicción óptimo a partir de una pluralidad de métodos de predicción para una señal de pixel de un bloque objetivo; una señal pronosticada se genera de acuerdo con el modo; una señal residual se determina entre la señal de pixel del bloque objetivo en la señal pronosticada; la señal residual y el modo de predicción óptimo se codifican para generar una señal comprimida; la señal comprimida se restaura; la señal restaurada se almacena como una señal de pixel reproducido. En la codificación de modo de predicción, una lista de modos de predicción de candidatos se genera como una que contiene elementos de los modos de predicción óptimos de una pluralidad de bloques previamente reproducidos vecinos al bloque objetivo; una bandera para indicar si la lista contiene un elemento que corresponde al modo de predicción óptimo se codifica; un índice al elemento correspondiente se codifica si el elemento correspondiente está presente en la lista; el modo de predicción óptimo se codifica con base en la numeración de los elementos en la lista, a menos de que no haya elemento correspondiente en la lista.|THIOW KENG TAN [MY]; JUNYA TAKIUE [JP]; CHOONG SENG BOON [MY]; Chiyoda-Ku, Tokyo, 100-6150, JP|NTT DOCOMO, INC. [JP]; Chiyoda-Ku, Tokyo, 100-6150, JP|
340577|Patente|MX/a/2013/011132|26/09/2013|13/07/2016|<i>A61K31/519</i> <b>(2006-01)</b>; <i>A61K31/535</i> <b>(2006-01)</b>; <i>A61P35/00</i> <b>(2006-01)</b>; <i>C07D495/04</i> <b>(2006-01)</b>|INHIBIDOR DE FOSFOINOSITIDA 3-QUINASA CON UNA PORCION DE ENLACE DE CINC.|La invención proporciona un compuesto de fórmula I, (Ver Formula) Composiciones farmacéuticas que comprenden dichos compuestos y el uso de dichos compuestos en el tratamiento de enfermedades y trastornos tales como el cáncer relacionadas con fosfoinositida 3-quinasa. La presente solicitud se relaciona además con el tratamiento de enfermedades y trastornos relacionados con histona deacetilasa y fosfoinositida 3-quinasa.|XIONG CAI [US]; HAIXIAO ZHAI [US]; CHENGJUNG LAI [US]; CHANGGENG QIAN [US]; RUDI BAO [US]; Bedford, Massachusetts, 01730, US|CURIS, INC. [US]; Lexington, Massachusetts, 02421, US|
340578|Patente|MX/a/2012/011238|27/09/2012|13/07/2016|<i>C08K5/01</i> <b>(2006-01)</b>; <i>E01C5/20</i> <b>(2006-01)</b>; <i>E01F9/00</i> <b>(2006-01)</b>; <i>G09F19/22</i> <b>(2006-01)</b>; <i>G09F7/00</i> <b>(2006-01)</b>|COMPUESTOS TERMOPLASTICOS PREFORMADOS DE ALTA RETROREFLECTIVIDAD ANTI-PATINAMIENTO PARA APLICACIONES DE PISTA.|Se revela una señalización de pista de aeropuerto termoplástica premanufacturada a base de resma alquídica o resma de hidrocarburo que es aplicada en secciones relativamente grandes sobre una pista de aeropuerto, en donde el compuesto a base de resma alquídica o resma de hidrocarburo incluye una cera funcionalizada incorporada en el compuesto a base de resma en el intervalo de 0.2 a 3 por ciento en peso, permitiendo mediante esto que el compuesto a base de resma exista en estado fundido en un intervalo de viscosidad de entre 35,000 y 85,000 centipoises y en donde la superficie superior provee un área para materiales de indicaciones de superficie existentes sobre la superficie superior junto con perlas de vidrio retroreflejantes con un índice de refracción de 1.9, de tal manera que cuando las perlas son suspendidas en y aplicadas sobre la superficie del compuesto a base de resma en estado fundido, las perlas no se hunden al compuesto a base de resma provisto, para permitir y mantener una retroreflectividad global de alrededor de 1000 milicandelas/m2/lux (med).|ROBERT W. GREER.* [US]; SIMON YAKOPSON [US]; CATHERINE BINDER [US]; Virginia Beach, VA., 23452, US|FLINT TRADING, INC. [US]; Thomasville, North Caroline, 27360, US|
340579|Patente|MX/a/2012/008029|10/07/2012|27/06/2016|<i>B29C51/14</i> <b>(2006-01)</b>; <i>B29C51/00</i> <b>(2006-01)</b>; <i>B29C63/00</i> <b>(2006-01)</b>|PANEL TERMICO.|La presente invención se relaciona a un panel térmico de termo-espuma, que se caracteriza porque dicho panel térmico está comprendido de tres capas aislantes, en donde la primera capa, es una capa o película aluminizada que sirve como una película reflejante a la temperatura; la segunda capa, es una lámina de plástico corrugado que funciona como un difusor de temperatura; y la tercera capa, es una placa de espuma aislante, el cual sirve para aislar cualquier cambio de temperatura que se encuentra en el medio ambiente.|PABLO ANDRADE CHALVE [MX]; Naucalpan, Estado de México, 53280, MX|PABLO ANDRADE CHALVE [MX]; Naucalpan, Estado de México, 53280, MX|
340580|Patente|MX/a/2014/002193|25/02/2014|15/07/2016|<i>B28B21/44</i> <b>(2006-01)</b>; <i>B28B21/88</i> <b>(2006-01)</b>; <i>B28B21/90</i> <b>(2006-01)</b>; <i>B28B7/30</i> <b>(2006-01)</b>; <i>B28B7/34</i> <b>(2006-01)</b>; <i>C23C24/04</i> <b>(2006-01)</b>; <i>C23C4/18</i> <b>(2006-01)</b>; <i>H01M4/88</i> <b>(2006-01)</b>; <i>H01M8/00</i> <b>(2006-01)</b>; <i>H01M8/12</i> <b>(2006-01)</b>; <i>H01M8/24</i> <b>(2006-01)</b>|PROCESO PARA PRODUCIR ESTRUCTURAS DE CERAMICA TUBULARES DE SECCION TRANSVERSAL NO CIRCULAR.|Se provee un proceso para producir estructuras de cerámica tubulares (10) de sección transversal no circular, el cual comprende: a) hacer girar un ensamble de mandril-husillo (45) que tiene una sección transversal externa no circular que corresponde a la sección transversal interna no circular de la estructura de cerámica tubular (11) para ser producida, el ensamble de mandril-husillo (45) comprendiendo un componente de mandril (47) y un componente de husillo (43), el componente de mandril (47) siendo un tubo polimérico que puede contraerse por calor de sección transversal no circular, la superficie externa del cual corresponde a la superficie interna de la estructura de cerámica tubular (11) de sección transversal no circular para ser producido y la superficie interna del cual define un orificio (71), el componente de husillo (43) teniendo una sección transversal no circular que corresponde al del orificio (71) del mandril (47) y estando en contacto de ajuste estrecho pero deslizablemente removible con el mismo; b) aplicar una composición de formación de cerámica a la superficie externa del componente de mandril (47) del ensamble de mandril-husillo giratorio (45) para producir una estructura de cerámica tubular (11) de sección transversal no circular, la superficie interna del cual está en contacto con la superficie externa del mandril (47); c) remover el husillo (43) del orificio (71) del mandril (47) para proveer un ensamble de estructura de cerámica tubular con mandril (70) en el cual la superficie interior (75) de la estructura de cerámica tubular (11) en sección transversal no circular permanece en contacto con la superficie externa del mandril (47), y d) contraer por calor el componente de mandril (47, 76) del ensamble de estructura de cerámica tubular con mandril (70) para ocasionar que el mandril (47, 76) se someta a contracción a un tamaño reducido en el cual la superficie externa (77) del mandril (76) se separa de la superficie interior (75) de la estructura de cerámica tubular (11) de la sección transversal no circular facilitando la remoción del mandril (76) de la misma.|CAINE M. FINNERTY [US]; BENJAMIN J. EMLEY [US]; Buffalo, NY, 14223, US|WATT FUEL CELL CORP. [US]; Port Washington, NY, 11050, US|
340581|Patente|MX/a/2013/005937|27/05/2013|15/07/2016|<i>B65D41/00</i> <b>(2006-01)</b>; <i>A47G19/22</i> <b>(2006-01)</b>; <i>A47G23/00</i> <b>(2006-01)</b>; <i>B65D51/00</i> <b>(2006-01)</b>|ADAPTADOR PARA TAPAS.|Las realizaciones de la invención proporcionan un adaptador adecuado para su uso con vasos y tapas. En algunas realizaciones, el adaptador está diseñado de manera que una única tapa con un diámetro predeterminado encaje, por medio del adaptador, con vasos de papel de diferentes diámetros. En algunas realizaciones, un adaptador que incluye un diámetro interno que se corresponde con el diámetro superior del vaso de papel interacciona con la porción superior del vaso. El adaptador también incluye un diámetro externo que se corresponde con el diámetro predeterminado de la tapa, para garantizar un encaje seguro entre el vaso de un tamaño particular y la tapa de plástico que tiene un diámetro predeterminado.|SHAWN A. OAKES [US]; JOSEPH R. POUNDER [US]; ANN M. ANDRES [US]; MARGARET P. HOKS [US]; Greenville, Wisconsin, 54942, US|DIXIE CONSUMER PRODUCTS LLC [US]; Atlanta, GA, 30303, US|
340582|Patente|MX/a/2012/010023|30/08/2012|12/07/2016|<i>C05D9/00</i> <b>(2006-01)</b>|PROCEDIMIENTOS DE PREPARACION DE MATERIALES A BASE DE AZUFRE Y ADITIVOS, PRODUCTOS RESULTANTES Y PROCEDIMIENTO DE USO EN CULTIVOS AGRICOLAS.|La presente invención comprende a dos procedimientos para la conformación de materiales a base de azufre elemental, aditivos funcionales y aditivos texturales, uno por extrusión y otro por medio de la centrifugación; los materiales resultantes y la aplicación del los mismos en el campo agrícola. Los materiales pueden utilizarse como fertilizantes y acidificadores de suelos de cultivo; la composición química de los materiales permite que estos sean benéficos para los cultivos. El tamaño preferido de la materia prima utilizada para la preparación se sitúa entre 200 y 400 mallas/in2 los extrudidos y/o centrigfugados de azufre pueden contener también agentes texturales (filosilicatos, etc.) y nutricionales (NPK), en una amplia gama de combinaciones o proporciones, que van desde 10 a 30 % peso, dependiendo de las necesidades específicas de los cultivos, por ejemplo slaes minerales (nitratos, cloruros, sulfatos de calcio (Ca), magnesio (Mg), potasio, etc.), así como micronutrientes tales como zinc (Zn); hierro (Fe), manganeso (Mn), cobre (Cu) y boro (B); otros componentes de interés son la urea u otras formas de agentes fertilizantes funcionales, incorporados en los agregados desde 10 a 25% peso. Las propiedades mecánicas de los extrudidos comprenden una resistencia a la compresión que puede variar desde 2 a 8 Kg fuerza, en función de la composición, cantidad del agente textural, de la humedad, tipo de agente peptizante, secado, temperatura, etc., tal como se describe, obteniéndose una baja atrición, inferior a 2%, Finalmente, todos estos materiales pueden aplicarse como agentes acidificadores de suelos de cultivo, una práctica agronómica que se fundamenta en el rango de pH, entre 6.5 y 7, adecuado para la fijación simbiótica del nitrógeno, misma que alcanza su máxima eficiencia a estos valores.|JOSÉ MANUEL DOMÍNGUEZ ESQUIVEL [MX]; PATRICIA FLORES SÁNCHEZ [MX]; Distrito Federal, 07730, MX|INSTITUTO MEXICANO DEL PETRÓLEO [MX]; Distrito Federal, 07730, MX|
340583|Patente|MX/a/2015/007095|04/06/2015|15/07/2016|<i>C03B23/025</i> <b>(2006-01)</b>; <i>C03B23/00</i> <b>(2006-01)</b>|DISPOSITIVO DE CURVADO PARA LA CONFORMACION DE VIDRIO DE USO EN PANELES TRANSPARENTES PARA AERONAVES.|Un dispositivo para el curvado de hojas incluye un carril de conformación de las hojas que tiene una parte del carril de conformación estacionaria montado en un miembro de soporte y una parte articulada del carril de conformación montada de forma pivotante en el miembro de soporte para el movimiento desde una posición de no conformación hasta una posición de conformación. Un miembro de retención limita el movimiento de una hoja que ha de ser conformada con respecto a la parte del carril de conformación estacionaria cuando la parte articulada del carril de conformación se mueve hacia la posición de conformación. También se divulga un procedimiento de "corte a medida" para conformar una hoja para su utilización en la fabricación de un panel transparente para aeronaves.|DEANGELIS, JOHN E. [US]; JIAO, YU [US]; WARREN, DENNIS D. [US]; YU, CHAO [CN]; Allison Park, Pennsylvania, 15101, US|PPG INDUSTRIES OHIO, INC. [US]; Cleveland, Ohio, 44111, US|
340584|Patente|MX/a/2010/005732|26/05/2010|15/07/2016|<i>F25C1/00</i> <b>(2006-01)</b>|UNIDAD PRODUCTORA DE HIELOS Y REFRIGERADOR QUE LA CONTIENE.|En este documento se revelan una unidad productora de hielo que utiliza una unidad de enfriamiento en la cual se recibe un tubo de refrigerante, y un refrigerador que la incluye. La unidad enfriadora incluye un enfriador para conducir frío, siendo que una superficie interna del enfriador entra en contacto directo con el tubo de refrigerante, realizando así una operación de producción de hielo del tipo de enfriamiento directo. Debajo de la unidad de enfriamiento se proporciona una bandeja rotatoria de manera que un elemento separador de hielo fijo en la unidad de enfriamiento empuja el hielo al rotar la bandeja, permitiendo que el hielo se descargue en una dirección opuesta a la dirección de rotación de la bandeja.|JIN JEONG [KR]; YOUNG SHIK SHIN [KR]; SANG HYUN PARK [KR]; KHANQASIM [PK]; Yongin-si, Gyeonggi-do, KR|SAMSUNG ELECTRONICS CO., LTD.* [KR]; Suwon-si, Gyeonggi-do, KR|
340585|Patente|MX/a/2013/006004|29/05/2013|15/07/2016|<i>C07D413/12</i> <b>(2006-01)</b>; <i>A61K31/5377</i> <b>(2006-01)</b>; <i>A61P23/00</i> <b>(2006-01)</b>|DERIVADOS DE 5-METIL-1-(NAFTALEN-2-IL)-1H-PIRAZOL Y SU USO EN POTENCIALIZAR EL EFECTO DE LOS ANALGESICOS OPIOIDES.|La invención se refiere a derivados de pirazol de fórmula I que tienen actividad farmacológica (ver Fórmula) y a procedimientos de preparación de tales compuestos, a composiciones farmacéuticas que los comprenden, y a su uso en la terapia y/o la profilaxis de dolor.|ANTONI TORRENS JOVER [ES]; MARÍA CUBERES ALTISENT [ES]; Terrasa, Barcelona, E-08221, ES|LABORATORIOS DEL DR. ESTEVE, S.A. [ES]; Barcelona, E-08041, ES|
