Número de concesión|Tipo de documento|Número de solicitud|Fecha de presentación|Fecha de concesión|Clasificación CIP|Título|Resumen|Inventor(es)|Titular
276789|Patente|MX/a/2007/001523|02/02/2007|21/06/2010|<i>F16K51/00</i> <b>(2006-01)</b>; <i>F16L37/40</i> <b>(2006-01)</b>|CONECTOR RAPIDO DE FLUIDO SALIENTE CON INTERFAZ DE VALVULA DE DESCONEXION.|Un conector rápido de fluido con una interfaz de válvula de desconexión se puede montar en un primer extremo, tal como una saliente de instalación de cañería de un edificio. El conector rápido lleva un retenedor en un extremo opuesto para enganchar de manera liberable un segundo elemento operativo de fluido a la saliente. Una válvula de desconexión internamente movible es transportada en el alojamiento del conector rápido y se desvía normalmente a una posición de bloqueo de fluido. La inserción de un segundo extremo a través del segundo extremo del alojamiento el conector rápido supera la fuerza de desviación en la válvula y mueve la válvula a una posición de flujo de fluido abierta permitiendo el flujo el fluido entre la saliente y el segundo extremo.|ERIK E. PIERSON; 4975 Oakwood Road, 48462, Ortonville, Michigan, E.U.A.|BRASSCRAFT MANUFACTURING COMPANY; COOPER STANDARD AUTOMOTIVE, INC.; 39500 Orchard Hill PLace, 48375, Novi, Michigan, E.U.A.|
276790|Patente|MX/a/2007/013233|24/10/2007|22/06/2010|<i>C09D7/12</i> <b>(2006-01)</b>; <i>C09D5/03</i> <b>(2006-01)</b>|COMPOSICIONES DE REVESTIMIENTO QUE PROPORCIONAN RESISTENCIA MEJORADA A DAÑOS Y RASPADURAS Y METODOS PARA USAR LAS MISMAS.|Se describe un revestimiento formado por una composición que contiene una resina que forma una película y una pluralidad de partículas dispersas en la resina. El tamaño de partículas promedio es de 0.1 a 50 micrómetros, y las partículas tienen una dureza suficiente para impartir mayor resistencia a daños y/o raspaduras al revestimiento en comparación con un revestimiento donde no hay partículas presentes. También, la diferencia entre las refracciones está en el rango desde 1 al 1.5. Un método para preparar un revestimiento polvo que incluye las partículas también se proporciona.|DEIRDRE D. RAGAN; JOHN R. SCHNEIDER; KAREN A. BARKAC; ANTHONY M. CHASSER; ROY E. DEAN; MILDRED LISA PERRINE; KAREN S. RECHENBERG; 9980 Buckingham Place, 15642, North Huntingdon, Pennsylvania, E.U.A.|PPG INDUSTRIES OHIO, INC.*; 3800 West 143rd Street, 44111, Cleveland, Ohio, E.U.A.|
276791|Patente|PA/a/2006/008342|21/07/2006|22/06/2010|<i>A61K38/00</i> <b>(2006-01)</b>|METODOS PARA REDUCIR DAÑO OXIDATIVO.|La presente invención se refiere a un método para reducir el daño oxidativo en un mamífero, un órgano removido, o una célula que lo necesita. El método comprende administrar una cantidad efectiva de un péptido aromático-catiónico. El péptido aromático-catiónico tiene (a) al menos una carga positiva neta; (b) un mínimo de tres aminoácidos; (c) un máximo de alrededor de 20 aminoácidos; (d) una relación entre el número mínimo de cargas positivas netas (pm) y el número total de residuos de aminoácido (r), donde 3pm es el número mayor que es menor o igual que r+1; (e) una relación entre el número mínimo de grupos aromáticos (a) y el número total de cargas positivas netas (pt) donde 3a o 2a es el número mayor que es menor o igual que pt+1, salvo que cuando a es 1, pt puede también ser 1; y (f) al menos un aminoácido tirosina o triptofano.|HAZEL H. SZETO; 50 East 89th Street, Apartment 25A, 10128, New York, New York, E.U.A.|CORNELL RESEARCH FOUNDATION, INC.*; 20 Thornwood Drive, 14850, Ithaca, New York, E.U.A.|
276792|Patente|PA/a/2001/012641|07/12/2001|22/06/2010|<i>A61K38/46</i> <b>(2006-01)</b>; <i>A23L1/29</i> <b>(2006-01)</b>; <i>A61K35/74</i> <b>(2006-01)</b>; <i>A61P1/00</i> <b>(2006-01)</b>; <i>A61P17/00</i> <b>(2006-01)</b>; <i>A61P25/00</i> <b>(2006-01)</b>; <i>A61P35/00</i> <b>(2006-01)</b>|COMPOSICIÓN QUE COMPRENDE ESFINGOMIELINASA ALCALINA DE ORIGEN BACTERIANO PARA USO COMO UNA PREPARACION DIETETICA, SUPLEMENTO ALIMENTICIO O PRODUCTO FARMACÉUTICO|La presente invención se refiere a composiciones las cuales, dependiendo del usuario, pueden ser tomadas como una preparación nutricional, dietética o estrictamente terapéutica, que comprenden como su sustancia activa, esfingomielinasa alcalina, la cual es capaz de prevenir o tratar varias condiciones patológicas incluyendo procesos cancerosos, procesos inflamatorios del intestino, hipercolesterolemia e infecciones con Helicobacter pylori.|DE SIMONE, CLAUDIO; Via Nuoro, I-00040, 12, Ardea., ITALIA|VSL PHARMACEUTICALS INC.; 800 South Frederick Avenue, 20877, Gaithersburg, Maryland, E.U.A.|
276793|Patente|PA/a/2005/009446|05/09/2005|22/06/2010|<i>A61N1/00</i> <b>(2006-01)</b>|DISPOSITIVO Y METODOS DE TERAPIA ELECTROMAGNETICA.|La presente invención se refiere a los sistemas y técnicas para aplicar un campo electromagnético al tejido corporal, que incluye un dispositivo generador de campo electromagnético, auto-contenido y portátil, colocado sobre una superficie del tejido corporal, tal que los campos electromagnéticos radiados chocan sobre el tejido corporal. El dispositivo incluye un generador de campo electromagnético, el cual está acoplado a una antena que está acomodada para radiar el campo electromagnético. Una fuente de energía es acoplada al generador para proporcionar la energía para el dispositivo, y un activador es utilizado para iniciar la radiación del campo electromagnético. Se describen también los métodos para inducir la corriente eléctrica en los tejidos corporales y tratar trastornos, tales como trastornos relacionados al dolor.|ANDREW J. WHELAN; JOHN MARTINEZ; TIMOTHY COX; STEPHANIE TOY; JAMES WOODHAMS; 3612 Sprigg Street South, 21704, Frederick, Maryland, E.U.A.|BIOELECTRONICS CORP.; 3612 Sprigg Street South, 21704, Frederick, Maryland, E.U.A.|
276794|Patente|PA/a/2004/009966|11/10/2004|22/06/2010|<i>B29C70/50</i> <b>(2006-01)</b>; <i>B29C44/32</i> <b>(2006-01)</b>|MATERIAL ESTRUCTURAL COMPUESTO Y MÉTODO PARA FABRICAR EL MISMO.|Se describe un material estructural, compuesto que es adecuado, por ejemplo, como un reemplazo para tableros de madera. Éste comprende un material de núcleo dimensionalmente estable encerrado en una cubierta laminada dimensionalmente estable que es adherente para el material de núcleo. La cubierta laminada está comprendida de al menos una capa de cordones paralelos (19) unidos a al menos una capa de material de hoja continua, rigidizado (10) seleccionado del grupo que consiste de papel y tela. Los materiales de núcleo adecuados incluyen espuma de poliuretano (38), opcionalmente rellena con partículas (32) de caucho granulado, perlita expandida, perlas de polímero expandible y/o microesferas de vidrio. Los cordones paralelos (19) son suministrados preferiblemente en la forma de una cinta de tela de poliéster, como los cordones de la urdimbre de la misma. El material de hoja continua (10) es preferiblemente papel kraft que es rigidizado con una resina de epoxi.|ARTHUR J. ROTH; PATRICK H. WINTERS; MICHAEL H. CLEMENT; CHERUVARI KARTHIK HARI DHARAN; 14 Ramona Drive, 94563, Orinda, California, E.U.A.|HUNTER PAINE ENTERPRISES, LLC; 3687 Mount Diablo Boulevard, Suite 315, 94549, Lafayette, California, E.U.A.|
276795|Patente|MX/a/2007/003101|15/03/2007|22/06/2010|<i>H04J3/16</i> <b>(2006-01)</b>|PROCEDIMIENTO MEJORADO DE PRE-NOTIFICACION PARA RED DE ACCESO DE RADIO DE ENTORNO MEJORADO DE DATOS DE SISTEMA GLOBAL DE COMUNICACIONES MOVILES (GERAN) DE SERVICIO MULTIMEDIA DE RADIODIFUSION/MULTIDIFUSION (MBMS).|La presente invención se refiere a un método, caracterizado porque comprende: obtener información de notificación previa que identifica por lo menos parcialmente un servicio de portador de servicio de difusión/multidifusión multimedia que va a ser notificado; y transmitir la información de notificación previa a por lo menos una estación móvil, en donde la información de notificación previa comprende por lo menos una porción de una identidad de grupo móvil temporal.|HARRI JOKINEN; RAMI VAITTINEN; GUILLAUME SEBIRE; Vahahiidentie 450, FIN-25370, Pertteli, FINLANDIA|NOKIA CORPORATION; Keilalahdentie 4, FIN-02150, Espoo, , FINLANDIA|
276796|Patente|MX/a/2008/001664|01/02/2008|22/06/2010|<i>C07D277/68</i> <b>(2006-01)</b>; <i>A61K31/428</i> <b>(2006-01)</b>; <i>A61K31/4439</i> <b>(2006-01)</b>; <i>A61K31/454</i> <b>(2006-01)</b>; <i>A61P11/06</i> <b>(2006-01)</b>; <i>A61P11/08</i> <b>(2006-01)</b>; <i>C07D417/12</i> <b>(2006-01)</b>|DERIVADOS NOVEDOSOS DE BENZOTIAZOLONA.|La presente invención proporciona compuestos de fórmula (I) en donde e, R1, R2, R3, R4, R5, R6, R7, R7a, R7b, A, D, m y n son como se definen en la especificación, procedimientos para su preparación, composiciones farmacéuticas que los contienen y su uso en terapia.|ROGER BONNERT; MICHAEL STOCKS; GARRY PAIRAUDEAU; ALICE FLAHERTY; AstraZeneca R&D Charnwood, Bakewell Road, LE11 5RH, Loughborough, Leicestershire, REINO UNIDO|ASTRAZENECA AB; , S-151 85, Södertälje, SUECIA|
276797|Patente|PA/a/2002/005659|07/06/2002|22/06/2010|<i>A01K67/027</i> <b>(2006-01)</b>; <i>A61K38/00</i> <b>(2006-01)</b>; <i>A61K39/39</i> <b>(2006-01)</b>; <i>A61K39/395</i> <b>(2006-01)</b>; <i>A61K48/00</i> <b>(2006-01)</b>; <i>A61P19/00</i> <b>(2006-01)</b>; <i>A61P19/10</i> <b>(2006-01)</b>; <i>A61P43/00</i> <b>(2006-01)</b>; <i>C07K14/47</i> <b>(2006-01)</b>; <i>C07K14/475</i> <b>(2006-01)</b>; <i>C07K14/705</i> <b>(2006-01)</b>; <i>C07K16/18</i> <b>(2006-01)</b>; <i>C07K17/08</i> <b>(2006-01)</b>|MOLECULAS SIMILARES A CORDINA Y USOS DE LAS MISMAS.|La presente invención se refiere a polipéptidos similares a cordina (CHL, por sus siglas en inglés) y moléculas de ácido nucleico que codifican para las mismas. La invención también proporciona agentes de unión selectivos, vectores, células huéspedes y métodos para producir polipéptidos CHL. La invención proporciona además composiciones farmacéuticas y métodos para el diagnóstico, tratamiento, disminución o prevención de enfermedades, desórdenes y trastornos asociados con polipéptidos CHL.|NAKAYAMA, NAOKI; WEN, DUANZHI; HAN, CHUN-YA; HE, CHING; YU, DONGYIN; 325 Briar Bluff Circle, 91360, Thousand Oaks, California, E.U.A.|AMGEN INC.*; One Amgen Center Drive, 91320-1799, Thousand Oaks, California, E.U.A.|
276798|Patente|PA/a/2006/004400|20/04/2006|22/06/2010|<i>C08G18/08</i> <b>(2006-01)</b>; <i>C09D175/00</i> <b>(2006-01)</b>|DISPERSIONES DE POLIURETANO LIBRES DE N-METILPIRROLIDONA BASADAS EN ACIDO DIMETILOLPROPIONICO.|La invención se refiere a dispersiones acuosas de poliuretano que contienen como agente de hidrofilización ácido dimetilolpropiónico y se preparan sin uso de N-metilpirrolidona así como a su uso como agentes de recubrimiento con grandes propiedades de resistencia.|ROLF GERTZMANN; ERHARD LÜHMANN; RICHARD KOPP; Karl-Jaspers-Str. 57, 51377, Leverkusen, ALEMANIA|BAYER MATERIALSCIENCE AG; , 51368, Leverkusen, ALEMANIA|
276799|Patente|PA/a/2004/003759|21/04/2004|22/06/2010|<i>A61K31/401</i> <b>(2006-01)</b>; <i>A61K31/4025</i> <b>(2006-01)</b>; <i>A61K31/4155</i> <b>(2006-01)</b>; <i>A61K31/4178</i> <b>(2006-01)</b>; <i>C07D403/12</i> <b>(2006-01)</b>; <i>C07D413/12</i> <b>(2006-01)</b>|DERIVADOS DE PIRROLIDIN N-SUBSTITUIDO COMO INHIBIDORES DE DIPEPTIDIL PEPTIDASA IV.|La presente invención se refiere a compuestos de fórmula (I)(ver fórmula (I)en donde R1, R2, y X son como se ha definido en la descripción y reivindicaciones y sales farmacéuticamente aceptables de los mismos. Los compuestos son útiles para el tratamiento y/o prevención de enfermedades que están asociadas con DPP IV tales como diabetes, particularmente diabetes mellitus no-insulino dependiente y disminución de la tolerancia a la glucosa.|HOLGER KUEHNE; HANS PETER WESSEL; RAMAKANTH SARABU; MARKUS BOEHRINGER; DANIEL HUNZIKER; BERND MICHAEL LOEFFLER; Ritterstrasse 85 , 79639, Grenzach-Wyhlen, ALEMANIA|F. HOFFMANN-LA ROCHE AG; 124 Grenzacherstrasse , CH-4070, Basilea, SUIZA|
276800|Patente|MX/a/2007/014589|21/11/2007|22/06/2010|<i>C07D209/14</i> <b>(2006-01)</b>; <i>A61K31/404</i> <b>(2006-01)</b>; <i>A61P11/00</i> <b>(2006-01)</b>; <i>A61P19/00</i> <b>(2006-01)</b>; <i>A61P25/00</i> <b>(2006-01)</b>|INHIBIDORES DE LA FOSFOLIPASA A2 CITOSOLICA.|La invención provee inhibidores químicos de la actividad de diversas enzimas fosfolipasa, particularmente de las enzimas fosfolipasa A2 citosólica (cPLA2), más particularmente incluyendo inhibidores de las enzimas fosfolipasa A2 alfa citosólica (cPLA2(). En algunas modalidades, los inhibidores poseen la fórmula I: (ver fórmula I) donde las variables constituyentes son como se han definido aquí.|CARA WILLIAMS; SUZANA MARUSIC; KEVIN PONG; JOHN C. MCKEW; KATHERINE L. LEE; LIHREN CHEN; RICHARD VARGAS; JAMES D. CLARK; VALERIE CLERIN; 11 Observatory Road, 01844, Methuen, Massachusetts, E.U.A.|WYETH.*; Five Giralda Farms, 07940, Madison, New Jersey, E.U.A.|
276801|Patente|MX/a/2007/010845|05/09/2007|22/06/2010|<i>B23B45/04</i> <b>(2006-01)</b>|HERRAMIENTA NEUMATICA MANUAL PARA ROMPER ROCA.|La presente invención se refiere una herramienta (12) para romper material duro, que comprende: a. un cuerpo (14) que tiene una abertura (16) a través de él formando un cañón (18), caracterizado porque el cañón (18) tiene una parte superior y una parte inferior (20 y 22), una abertura (30) en la parte inferior (22) de él, y una entrada de presión (44) para comunicación fluida en el cañón (18), y el cañón (18) recibe un pistón (24) en él, y tiene un imán (23) en la parte superior (20) del cañón (18), dicho imán (23) está contiguo a la entrada de presión (44); b. un tubo para espiga activadora (26) que tiene primer y segundo extremos (32 y 34), y una abertura (36) a través de él para acoplar de manera deslizable una espiga activadora (38), caracterizado porque el primer extremo (32) del tubo para la espiga activadora (26) está acoplado de manera segura en la abertura (309 en la parte inferior (22) del cañón (18); c. la espiga activadora (38) tiene una punta (40) y un cabezal de retención (42) en extremos opuestos (41 y 43) de ella, en donde el cabezal de retención (42) es más ancho que la abertura (36) en el tubo para la espiga activadora (26), y la espiga activadora (38) es más larga que el tubo para la espiga activadora (26) lo que permite que la punta (40) se extienda a través del segundo extremo (34) del tubo para la espiga activadora (26); y d. el pistón (24) tiene una parte superior (52) y una parte inferior (54), y está colocado de manera deslizable en el cañón (18) entre el imán (23) y el cabezal de retención (42), caracterizado porque el imán (23) atrae y sostiene la parte superior (52) del pistón (24) con una fuerza M cuando está en contacto parcial con él; Y la entrada de presión (44) está en comunicación fluida con la parte superior (52) del pistón (24) para desalojar forzosamente el pistón (24) al aplicar presión a través de la entrada de presión (44), de tal forma que el pistón (24) hace impacto con el cabezal de retención (42).|CARROL BASSETT; HC68 Box 64B, 24938, Friars Hill, West Virginia, E.U.A.|CARROL BASSETT; HC68 Box 64B, 24938, Friars Hill, West Virginia, E.U.A.|
276802|Patente|MX/a/2009/008420|27/10/2006|22/06/2010|<i>A61J1/00</i> <b>(2006-01)</b>; <i>A61J1/20</i> <b>(2006-01)</b>|DISPOSITIVO MEDICO PARA FARMACOS LIQUIDOS.|La presente invención se refiere aun dispositivo médico para fármacos líquidos para usarse con una jeringa que tenga una punta de jeringa con un extremo distal con un labio que se proyecta lateralmente que tiene un diámetro externo D2, y un frasco medicinal con un tapón de caucho, el dispositivo presenta un adaptador para ajustarse a presión en el recipiente y que incluye un miembro de perforación huevo conectado rígidamente al adaptador para perforar el tapón de caucho al ajustarse a presión sobre el adaptador sobre el frasco, caracterizado porque el dispositivo presenta una tubería de elastómeros en comunicación de flujo con el miembro de perforación y que tiene un extremo distal con un diámetro interno nominal S1<D2 y cuando menso 3 mm para ser estirado de forma sellante sobre el labio que se proyecta lateralmente de la jeringa para ejecutar la comunicación de fluido entre la jeringa y el frasco medicina.|FREDDY ZINGER; IGOR DENENBURG; 29 Kazan Street, 43611, Ra'anana, , ISRAEL|MEDIMOP MEDICAL PROJECTS LTD.*; 4 Ha'yezira Street, POB2499, 43000, Ra'anana, , ISRAEL|
276803|Patente|PA/a/2006/001800|14/02/2006|21/06/2010|<i>B01J27/22</i> <b>(2006-01)</b>; <i>B01J21/18</i> <b>(2006-01)</b>; <i>B01J27/24</i> <b>(2006-01)</b>; <i>B01J35/02</i> <b>(2006-01)</b>; <i>B01J37/08</i> <b>(2006-01)</b>; <i>C07F9/38</i> <b>(2006-01)</b>|CATALIZADORES CON METALES DE TRANSICION DE CARBURO Y NITRURO, SU PREPARACION Y USO COMO CATALIZADORES DE OXIDACION Y DESHIDROGENACION.|Se preparan catalizadores que incluyen soportes de carbón que tienen formadas sobre éstos composiciones que comprenden un carburo-metal de transición, nitruro o carburo-nitruro; los catalizadores son útiles para reacciones de oxidación y deshidrogenación catalíticas, incluyendo la preparación de aminas secundarias a través de la oxidación catalítica de aminas terciarias y la preparación de ácidos carboxílicos a través de la deshidrogenación catalítica de los alcoholes.|ARHANCET, JUAN; MORGENSTERN, DAVID A.; LIU, FUCHEN; MCCALL, ROBERT; WAN, KAM-TO; 800 North Lindbergh Boulevard, 63167, St. Louis, Missouri, E.U.A.|MONSANTO TECHNOLOGY, LLC.*; 800 North Lindbergh Boulevard, 63167, St. Louis, Missouri, E.U.A.|
276804|Patente|MX/a/2007/015371|05/12/2007|22/06/2010|<i>G03B11/04</i> <b>(2006-01)</b>|PAÑO PARA MICROSCOPIO QUIRURGICO CON ENSAMBLE DE LENTE REMOVIBLE.|La presente invención se refiere a un ensamble de paño para mantener un campo estéril alrededor de un microscopio quirúrgico que tiene por lo menos una lumbrera para ocultar y un tubo portalente del objetivo que tiene una pared periférica interna que define una cavidad, el ensamble ésta caracterizado porque comprende: una caja hueca alargada de material en forma de lámina que tiene un primer extremo que define una abertura de acceso y un segundo extremo que define un orificio; un armazón cilíndrico ubicado en el segundo extremo de la caja, el armazón cilíndrico tiene una superficie interna y una superficie externa, la superficie externa del armazón puede acoplarse con la pared periférica interna del tubo portalente del objetivo para montar el armazón sobre el tubo dentro de la cavidad; un soporte de ventana que puede montase en forma removible dentro del armazón cilíndrico, el soporte de ventana comprende una banda circunferencial elástica y una pluralidad de lengüetas integrales separadas, el soporte de ventana además tiene un diámetro externo que es sustancialmente el mismo que el diámetro interno del armazón cilíndrico y una superficie extrema que puede acoplarse en forma removible con la superficie interna del armazón cilíndrico; y una ventana acoplada de manera coincidente con el soporte de ventana, el armazón, soporte de ventana sellado el orifico en la caja cuando el soporte de ventana se monta en forma removible dentro del armazón cilíndrico.|ANDREW J. BALA; 48 Golf Avenue, 60514, Claredon Hills, Illinois, E.U.A.|ANDREW J. BALA; 48 Golf Avenue, Claredon Hills, 60514, Illinois, E.U.A.|
276805|Patente|MX/a/2007/007278|15/06/2007|13/04/2010|<i>A61H7/00</i> <b>(2006-01)</b>|APARATO Y METODO PARA DESINTEGRAR GRASA EN EL CUERPO HUMANO|La presente invención describe un aparato para desintegrar grasa en el cuerpo humano, que se construye de un marco semi-rectangular, el cual en uno de sus extremos tiene un mango y en el otro una agarradera ; una serie de dientes con perfil redondeado, se localiza de manera perpendicular y alternadamente, a lo largo de la cara superior del marco; y una serie de dientes con perfil afilado, se localiza de manera perpendicular y alternadamente, a lo largo de la cara superior del marco; y una serie de dientes con perfil afilado, se localiza de igual manera, en la cara inferior; de dicho marco.La invención también se refiere a un método para eliminar grasa del cuerpo humano, el cual consiste en sujetar el aparato para desintegrar grasa del cuerpo humano, descrito en las reivindicaciones anteriores, por medio del mango y la agarradera; después se posiciona en cualquier superficie dentada del aparato, sobre el área requerida, aplicando un grado de presión tal, que no llegue a lastimar al usuario; y Deslizar o arrastrar el aparato sobre el área requerida, en un movimiento de vaivén, en sentido longitudinal del aparato durante 10 a 15 s, alternado el masaje en diferentes zonas del cuerpo, según se requiera.|MANUEL JESUS RIOS GARCIA; Osa mayor 4050, Col. La calma, 45070, Zapopan, Jalisco, MEXICO|MANUEL JESUS RIOS GARCIA; Osa mayor 4050, Col. La calma, 45070, Zapopan, Jalisco, MEXICO|
276806|Patente|PA/a/2006/005326|11/05/2006|23/04/2010|<i>F21V21/03</i> <b>(2006-01)</b>; <i>F21V21/112</i> <b>(2006-01)</b>|LUMINARIA CON DISPOSITIVO DE CONEXION EN SOCKETS CONVENCIONALES.|La presente invención se refiere a una luminaria con dispositivos de conexión en sockets convencionales, del tipo que se conforma por una estructura donde se montan elementos de soporte de medios de iluminación, elementos de conexión eléctrica con sockets convencionales conectados con dichos elementos de soporte de los medios de iluminación, caracterizada por comprender un conector macho roscado adaptado para roscarse en sockets convencionales; dicho conector macho roscado estando conectado mecánicamente en la parte superior de la estructura de la luminaria y estando conectado eléctricamente a través de conductores eléctricos con medios de recepción y alojamiento adaptados para recibir medios de iluminación fijos en la cara interior de dicha estructura de la luminaria; pudiendo comprender medios de aseguramiento de cubiertas translúcidas y/o pantallas de cobertura de dichos medios de iluminación.|SAMUEL PADILLA SALINAS; Calle Primera No. 1421, Col. Col. Ciudad Deportiva, 25750, Monclova, Coahuila, MEXICO|SAMUEL PADILLA SALINAS; Calle Primera No. 1421, Col. Col. Ciudad Deportiva, 25750, Monclova, Coahuila, MEXICO|
276807|Patente|JL/a/2006/000032|30/06/2006|13/04/2010|<i>F04B13/00</i> <b>(2006-01)</b>|SISTEMA INTEGRADO DE BOMBA CENTRÍFUGA A PRESIÓN CONSTANTE CON FLUJO VARIABLE, MEDIANTE CONTROL ELECTRÓNICO VARIADOR DE VELOCIDAD|La presente invención se refiere a un sistema de bomba centrífuga para suministrar agua limpia a una red de distribución, manteniendo el agua bombeada a presión constante con flujo variable, mediante control electrónico variador de velocidad de los que está formado por un motor eléctrico, una bomba centrífuga, una tarjeta electrónica de control de velocidad del motor eléctrico y un cabezal de descarga caracterizado porque: a. un motor eléctrico trifásico de 220 VAC, que está acoplado a través de su eje con una bomba centrífuga, formando una motobomba. b. la descarga de agua de la motobomba, está acoplada, a través de una brida, a un cabezal de descarga multipropósito, el cual, a su vez, integra las siguientes partes: i: una base de una caja de instrumentación, la cual contiene una tarjeta electrónica de control. La base de la caja de instrumentación, la cual contiene una tarjeta electrónica de control. La base de la caja de instrumentación cierra de manera hermética con una tapa, por medio de un sello; ii: un manómetro tipo bourdon, colocado al frente en la parte superior del cabezal de descarga multipropósito, que permite al operador verificar que el sistema mantenga una presión constante de agua bombeada; iv: un primer puerto roscado, colocado en la parte trasera inferior del cabezal de descarga multipropósito, para el cebado o carga de la motobomba; v. un segundo puerto roscado, colocado en la parte trasera, al centro del cabezal de descarga multipropósito, utilizando para conectarse al tanque hidroneumático precargado; vi. Un sensor piezoeléctrico, colocado a un costado del segundo puerto roscado del cabezal de descarga multipropósito, el cual sensa la presión de descarga de agua de la motobomba, y envía una señal con el valor de esta presión a la tarjeta de control.|LUIS MEJORADA GONZALEZ; Calle 4 No. 2368, Col. Zona Industrial, 44960, Guadalajara, Jalisco, MEXICO|BOMBAS MEJORADA, S.A. DE C.V.; Calle 4 No. 2368, Col. Zona Industrial, 44960, Guadalajara, Jalisco, MEXICO|
276808|Patente|NL/a/2004/000098|22/11/2004|21/04/2010|<i>C01B31/02</i> <b>(2006-01)</b>; <i>C22C49/00</i> <b>(2006-01)</b>; <i>C22C49/06</i> <b>(2006-01)</b>; <i>C22C49/14</i> <b>(2006-01)</b>; <i>D06M101/40</i> <b>(2006-01)</b>|MATERIALES COMPUESTOS A BASE ALUMINIO-NANO TUBOS DE CARBONO Y SU PROCESO DE FABRICACION.|Se ha desarrollado un método para obtener un Material Compuesto Base Aluminio reforzado con NTC, en el que los NTC son dispersados en la matriz de aluminio a través de aleado mecánico o molienda mecánica. El material compuesto que resulta presenta elevada resistencia mecánica, mayor esfuerzo de cedencia, mayor resistencia máxima a la tensión, manteniendo mínimas modificaciones en la densidad y en la ductilidad con respecto al Aluminio o aleación de aluminio utilizada como base.|ALFREDO AGUILAR ELGUEZABAL; DAVID RIOS JARA.; ROBERTO MARTINEZ SANCHEZ; IVANOVICH ESTRADA GUEL; MARIO MIKI YOSHIDA; WILBER ANTUNEZ FLORES; Rinconada San Carlos No. 6911, Col. Fracc. Chihuahua, 31130, Chihuahua, Chih., MEXICO|CENTRO DE INVESTIGACION EN MATERIALES AVANZADOS, S.C.; Miguel de Cervantes No. 120 Complejo Industrial Chihuahua, 31109, Chihuahua, Chihuahua, MEXICO|
