Número de concesión|Tipo de documento|Número de solicitud|Fecha de presentación|Fecha de concesión|Clasificación CIP|Título|Resumen|Inventor(es)|Titular
276619|Patente|PA/a/2006/010781|20/09/2006|15/06/2010|<i>C07D207/12</i> <b>(2006-01)</b>; <i>C07D307/20</i> <b>(2006-01)</b>; <i>C07D491/10</i> <b>(2006-01)</b>; <i>C07C235/10</i> <b>(2006-01)</b>; <i>C07C235/12</i> <b>(2006-01)</b>; <i>C07C69/612</i> <b>(2006-01)</b>; <i>C07C69/74</i> <b>(2006-01)</b>; <i>C07D207/36</i> <b>(2006-01)</b>; <i>C07D209/54</i> <b>(2006-01)</b>; <i>C07D307/94</i> <b>(2006-01)</b>; <i>C07D309/14</i> <b>(2006-01)</b>|CETOENOLES CICLICOS 2,4,6-FENILSUBSTITUIDOS.|La presente invención se refiere a nuevos cetoenoles cíclicos 2,4,6-fenilsubstituidos de la fórmula (I) (ver fórmula (I)) en la que CKE, W, X e Y tienen el significado anteriormente indicado, a varios procedimientos y a productos intermedios para su obtención y a su empleo como agentes pesticidas y/o herbicidas, así como a agentes herbicidas selectivos, que contienen, por un lado, cetoenoles cíclicos, 2,4,6-fenilsubstituidos y, por otro lado, al menos un compuesto mejorador de la compatibilidad con las plantas de cultivo.|REINER FISCHER; HEINZ KEHNE; PETER LÖSEL; THOMAS BRETSCHNEIDER; STEFAN LEHR; THOMAS AULER; DIETER FEUCHT; OLGA MALSAM; GUIDO BOJACK; CHRIS ROSINGER; CHRISTIAN ARNOLD; KLAUS KUNZ; MARTIN JEFFREY HILLS; OLIVER GAERTZEN; Nelly-Sachs-Str. 23, 40789, Monheim, ALEMANIA|BAYER CROPSCIENCE AG.*; Alfred-Nobel-Str. 50, 40789, Monheim, ALEMANIA|
276620|Patente|PA/a/2005/000364|06/01/2005|15/06/2010|<i>A01N43/38</i> <b>(2006-01)</b>; <i>A01N47/06</i> <b>(2006-01)</b>; <i>C07D209/54</i> <b>(2006-01)</b>|DERIVADOS ESPIROCICLICOS DE LA 1-H-PIRROLIDIN-2,4-DIONA, CIS-ALCOXISUBSTITUIDOS COMO AGENTES PESTICIDAS.|La invención se refiere a nuevos derivados espirocíclicos de la 1-H-pirrolidin-2,4-diona, cis-alcoxisubstituidos, de la fórmula (I) en la que A,G;X e Y tienen el significado indicado en la descripción, a varios procedimientos para su obtención y para su uso como agentes pesticidas.|FISCHER, REINER; ERDELEN, CHRISTOPH; HIMMLER, THOMAS; NAUEN, RALF; KNOPS, HANS-JOACHIM; GALLENKAMP, BERND; MULDER, LUBBERTUS; LANTZSCH, REINHARD; KONZE, JÖRG; MALSAM, OLGA; ARNOLD, CHRISTIAN; Nelly-Sachs-Str. 23, D-40789, Monheim., , ALEMANIA|BAYER CROPSCIENCE AKTIENGESELLSCHAFT; Alfred-Nobel-Str. 50, D-40789, Monheim., , ALEMANIA|
276621|Patente|PA/a/2005/008168|29/07/2005|15/06/2010|<i>C07K14/475</i> <b>(2006-01)</b>|CONJUGADOS DE POLIMERO DE NEUBLASTINA MUTADA.|Se describe un dímero que comprende un polipéptido de neublastina mutada acoplado a un polímero. Estos dímeros exhiben biodisponibilidad prolongada y en modalidades preferidas, la actividad biológica prolongada con relación a las formas tipo silvestre de la neublastina.|R. BLAKE PEPINSKY; STEPHAN S. MILLER; ANTHONY ROSSOMANDO; DINAH WEN-YEE SAH; PAULA ANN BORIACK-SJODIN; LAURA SILVIAN; 30 Falmouth Road, 02474, Arlington, Massachusetts, E.U.A.|BIOGEN IDEC MA INC.; 14 Cambridge Center, 02142, Cambridge, Massachusetts, E.U.A.|
276622|Patente|PA/a/2006/008475|27/07/2006|15/06/2010|<i>B60C23/00</i> <b>(2006-01)</b>; <i>G01G19/08</i> <b>(2006-01)</b>; <i>G07C5/00</i> <b>(2006-01)</b>|PROCEDIMIENTO DE DETERMINACION DE UN INDICADOR DE UN INDICADOR DE LOS ESFURZOS SOPORTADOS POR UN NEUMATICO DE VOLQUETE.|La presente invención se refiere a un método para determinar un indicador de esfuerzos a los cuales es sometido el neumático de un vehículo durante un período, el método se caracteriza porque comprende las etapas de: determinar un carga transportada por el vehículo durante el período; determinar una distancia recorrida por el vehículo durante el período; determinar un producto de la carga transportada por el vehículo y la distancia recorrida por el vehículo durante el período; determinar al menos un parámetro de uso del vehículo; y ajustar el producto de la carga y la distancia por un factor de ajuste con base en el por lo menos un parámetro de uso del vehículo.|MARCOS CONTRERAS; JOSE ANGEL MORENO; Michelin Chile Ltda., Avenida Presidente Eduardo Frei Montalva 9950, - modulo D1, Quilicura, Santiago, CHILE|MICHELIN RECHERCHE ET TECHNIQUE S. A. *; Route Louis-Braille 10 et 12, CH-1763, Granges-Paccot, SUIZA|
276623|Patente|MX/a/2007/001546|07/02/2007|15/06/2010|<i>B32B7/06</i> <b>(2006-01)</b>; <i>B41M3/14</i> <b>(2006-01)</b>; <i>B42D15/00</i> <b>(2006-01)</b>; <i>B44F1/12</i> <b>(2006-01)</b>; <i>C09K19/00</i> <b>(2006-01)</b>; <i>G06K19/18</i> <b>(2006-01)</b>|ELEMENTO DE SEGURIDAD Y METODO PARA SU FABRICACION.|La presente invención se refiere a un elemento de seguridad, para asegurar artículo valioso, que comprende: una primera capa, compuesta por material de cristal líquido colestérico, que está presente por lo menos en algunas áreas; una segunda capa, compuesta por material de cristal líquido, que está presente por lo menos en algunas áreas; y forma una capa desfasadora, y una capa adicional, que tiene una característica legible por máquina, que está presente por lo menos en algunas áreas y que está cubierta por lo menos en algunas áreas por la primera capa y la segunda capa compuestas por material de cristal líquido.|JÜRGEN RUCK; THEODOR BURCHARD; WINFRIED HOFFMÜLLER; THORSTEN PILLO; MANFRED MAIN; FRIEDRICH KRETSCHMAR; Risseckstrasse 5a, 83727, Schliersee, , ALEMANIA|GIESECKE & DEVRIENT GMBH.*; Prinzregentenstrasse 159, 81677, München, ALEMANIA|
276624|Patente|PA/a/2004/008783|10/09/2004|15/06/2010|<i>A61J15/00</i> <b>(2006-01)</b>; <i>A61M25/00</i> <b>(2006-01)</b>; <i>A61M25/01</i> <b>(2006-01)</b>; <i>A61M29/00</i> <b>(2006-01)</b>; <i>A61M5/32</i> <b>(2006-01)</b>|SONDA MEJORADA PARA ALIMENTACION POR GASTROSTOMIA CON SISTEMA DE FIJACION INTERNA, FIJO, Y EXTERNA, MOVIL|La presente invención se refiere a una sonda para alimentación por gastronomía que comprende un sistema fijo para fijación interna, que consiste de un globo integrado a la pared externa de la sonda, un sistema de inflado con válvula de material plástico, para introducir agua al globo de retención interna y un cuerpo de sonda; dicha sonda incluye además un sistema de alimentación que conecta con un cornete por medio del cual se puede suministrar alimento o medicamento al usuario, dicho sistema de alimentación comprende un conector de alimentación tipo luer hembra o similar que permite la conexión directa de jeringas o similares; la sonda incluye también un tapón para tapar o sellar el sistema de alimentación unido al sistema de alimentación por medio de un elemento o cinta de plástico que mantendrá siempre unido el tapón al conector de alimentación y que asegura una mayor higiene del sistema; dicha sonda comprende además un botón móvil, integrado a la pared externa de la sonda, para fijar la sonda en la parte externa del cuerpo de un usuario; la sonda está caracterizada porque el botón móvil está configurado de manera que puede fijarse inicialmente al cuerpo de la sonda en forma de campana y es capaz de invertirse adoptando la forma de campana invertida para darle una mayor fijación cuando sea utilizado; y en que en la parte interior del diámetro del botón, que está en contacto con el cuerpo de la sonda es lisa o tiene anillos y estrías para la fijación a dicho cuerpo de la sonda.|MARIO SAENZ ECHAVE; Cincinati No. 39, Col. Noche Buena Napoles, 03710, Distrito Federal, MEXICO|MARIO SAENZ ECHAVE; Cincinati No. 39, Col. Noche Buena Napoles, 03710, Distrito Federal, MEXICO|
276625|Patente|MX/a/2007/008596|13/07/2007|15/06/2010|<i>A23B4/005</i> <b>(2006-01)</b>|SISTEMA DE PRODUCCION DE PRODUCTO ALIMENTICIO ASEPTICO ESTERILIZADO POR CALENTAMIENTO OHMICO CON ADICION POSTERIOR DE AGUA SALADA.|La presente invención se refiere a un procedimiento para la esterilización de una composición alimenticia formada de una mezcla heterogénea de al menos una fase líquida y de partículas sólidas que comprende cuatro etapas - una primera etapa de preparación de una fase concentrada líquida/ con partículas con una cantidad reducida de sal, - una segunda etapa de esterilización compuesta de una fase de calentamiento óhmico y de una fase de retención de la fase concentrada, - una tercera etapa de enfriamiento de la fase concentrada estéril, - una cuarta etapa de acondicionamiento la fase concentrada es mezclada después de la fase de calentamiento con una fase acuosa que comprende agua estéril salada necesaria para la formulación final de dicha mezcla heterogénea de al menos una fase líquida y de partículas sólidas.|GUILLAUME DOCK; 16 Chemin Saint Roch, F-84510, Caumont Sur Durance, FRANCIA|CAMPBELL SOUP COMPANY.*; One Campbell Place, Camden, 08103-1799, New Jersey, E.U.A.|
276626|Patente|MX/a/2007/000738|16/04/2003|15/06/2010|<i>H01H83/04</i> <b>(2006-01)</b>; <i>H01H71/72</i> <b>(2006-01)</b>; <i>H02H1/00</i> <b>(2006-01)</b>; <i>H02H3/33</i> <b>(2006-01)</b>|DISPOSITIVO INTERRUPTOR DE CIRCUITO.|La presente invención se refiere a un interruptor de circuito que comprende: un primer conductor eléctrico; un segundo conductor eléctrico; un tercer conductor eléctrico en donde los primer, segundo y tercer conductores eléctricos están eléctricamente aislados entre sí y por lo menos uno de los conductores es capaz de conectarse eléctricamente con los otros dos conductores de manera que los primer, segundo y tercer conductores eléctricos están eléctricamente conectados entre sí; y una porción interruptora de circuito colocada para desconectar eléctricamente los primer, segundo y tercer conductores eléctricos unos de otros tras la presencia de una condición predeterminada.|JAMES RICHTER; EUGENE SHAFIR; FRANTZ GERMAIN; DAVID HERZFELD; ARMANDO CALIXTO; STEPHEN STEWART; WILLIAM R. ZIEGLER; NICHOLAS L. DISALVO; ROGER M. BRADLEY; DAVID Y. CHAN; GERALD N. KING; RICHARD BERNSTEIN; RICHARD J. ULRICH; STEPHEN CAMPOLO; 61 Primrose Lane, 11756, Levittown, New York, E.U.A.|LEVITON MANUFACTURING CO., INC.; 59-25 Little Neck Parkway, 11756, Little Neck, New York, E.U.A.|
276627|Patente|MX/a/2008/006330|15/05/2008|15/06/2010|<i>C04B41/63</i> <b>(2006-01)</b>; <i>C04B41/70</i> <b>(2006-01)</b>; <i>E04C2/04</i> <b>(2006-01)</b>|COMPOSICION DE PINTURA DE ACABADO DE LATEX RESISTENTE AL AGRIETAMIENTO PARA FIBROCEMENTO SUSTRATOS.|Se describe un artículo recubierto de fibracemento en la forma de un sustrato de panel de fibracemento sin unir que tiene una primera superficie principal de por lo menos una porción la cual está cubierta con una composición de pintura de acabado final resistente al agrietamiento que comprende un polímero de látex multifase, y un método para hacer un artículo recubierto de fibracemento resistente al agrietamiento recubriendo un panel de fibracemento sustrato con tal composición y apilación de los paneles revestidos.|T. HOWARD KILLILEA; CARL LEWIS CAVALLIN; SHANE WESLEY CARTER; JOHN WILLIAM MITTELSTEADT; GLEN OTTOVETTER; 70 Deer Hills Court, 55127, North Oaks, Minnesota, E.U.A.|VALSPAR SOURCING, INC.; 1101 South Third Street, 55415., Minneapolis, Minnesota, E.U.A.|
276628|Patente|PA/a/2004/007314|28/07/2004|11/06/2010|<i>G06F21/24</i> <b>(2006-01)</b>; <i>G11B20/10</i> <b>(2006-01)</b>; <i>H04N5/91</i> <b>(2006-01)</b>|CONTENEDOR DE ARCHIVOS DE IMAGENES.|La presente invención se refiere a un medio legible por computadora codificado con una estructura de datos para usarse en un archivo de imagen para almacenar datos, la estructura de datos que comprende: una porción de datos que comprende: primeros datos de imagen fija relacionados con una primera corriente multimedia de datos multimedia, en donde los primeros datos de imagen fija representan por lo menos un primer formato de píxel, primeros datos arbitrarios relacionados con una segunda corriente multimedia de datos multimedia, en donde la segunda corriente multimedia comprende segundos datos de imagen fija, y en donde los segundos datos de imagen fija representan por lo menos un segundos formato de píxel; y una porción de encabezado que comprende: un primer objeto de encabezado que comprende la información relacionada con la primera corriente multimedia; y un segundo objeto de encabezado que comprende la información relacionada con la segunda corriente de datos multimedia, en donde los primeros y segundos datos de imagen proporcionan diferentes representaciones de una única imagen.|GEOFFREY T. DUNBAR; JOSEPH D. TERNASKY; KIRT A. DEBIQUE; WILLIAM M. CROW; 318 8th Avenue, 98033, Kirkland, Washington, E.U.A.|MICROSOFT CORPORATION; One Microsoft Way, 98052-6399, Redmond, Washington, E.U.A.|
276629|Patente|MX/a/2008/008170|20/06/2008|15/06/2010|<i>B01D53/54</i> <b>(2006-01)</b>; <i>B01D53/56</i> <b>(2006-01)</b>; <i>C10G11/18</i> <b>(2006-01)</b>|REDUCCION DE CO Y NOX EN GAS DE SALIDADEL REGENERADOR.|Una corriente de oxigeno caliente es alimentada en una corriente de gas de combustión regenerador de catalizador que contiene monóxido de carbono para remover el monóxido de carbono. Los precursores Nox son convertidos en N2 si No esta presente en la corriente de gas de combustión, la adición de corriente de oxigeno caliente disminuye la cantidad de Nox presente.|M. MUSHTAQ AHMED; LEE ROSEN; KUANG-TSAI WU; 176 Crescent Avenue, 14214, Buffalo, New York, E.U.A.|PRAXAIR TECHNOLOGY, INC.*; 39 Old Ridgebury Road, 06810-5113, Danbury, Connecticut, E.U.A.|
276630|Patente|PA/a/2006/012581|27/10/2006|15/06/2010|<i>C10G47/02</i> <b>(2006-01)</b>|METODO Y SISTEMA DE HIDROPROCESAMIENTO PARA MEJORAR EL ACEITE PESADO USANDO UN CATALIZADOR COLOIDAL O MOLECULAR.|Métodos y sistemas para el hidroprocesamiento de materiales de alimentación de aceite pesado para formar un material mejorado involucran el uso de un catalizador coloidal o molecular dispersado dentro de un material de alimentación de aceite pesado, un reactor de hidrocraqueo y un separador caliente. El catalizador coloidal o molecular promueve el hidrocraqueo y otras reacciones de hidroprocesamiento dentro del reactor de hidrocraqueo. El catalizador se asocia preferiblemente con los asfaltenos dentro del material de alimentación de aceite pesado, el cual promueve las reacciones de mejora que involucran los asfaltenos antes que la formación de los precursores de coque y sedimento. El catalizador coloidal o molecular supera los problemas asociados con los catalizadores soportados porosos en la mejora de los materiales de alimentación de aceite pesado, particularmente la inhabilidad de tales catalizadores para procesar efectivamente las moléculas de asfalteno. El resultado es uno o más del ensuciamiento el equipo reducido, nivel de conversión incrementado, y el uso más eficiente del catalizar soportado sólido si se utiliza en combinación con el catalizador coloidal o molecular.|ROGER K. LOTT; LAP-KEUNG LEE; 10819-18 Avenue, T6J 6P2, Edmonton, Alberta, CANADA|HEADWATERS HEAVY OIL, LLC.*; 10653 South, River Front Parkway, Suite 300, 84095, South Jordan, Utah, E.U.A.|
276631|Patente|PA/a/2004/008735|09/09/2004|03/06/2010|<i>C04B14/06</i> <b>(2006-01)</b>; <i>C04B28/04</i> <b>(2006-01)</b>; <i>C04B7/02</i> <b>(2006-01)</b>|COMPOSICIONES DE MORTERO MEJORADAS A BASE DE CLINKER ULTRA-FINO, ARENA REFINADA Y ADITIVOS QUÍMICOS.|La invención describe composiciones de mortero mejoradas que pueden alcanzar valores de resistencia a la compresión de hasta 6 veces más que los obtenidos por morteros convencionales en las primeras horas de fraguado, así como de hasta tres veces más a los 28 días de fraguado. Materiales cementantes, tales como cemento Pórtland y clinker de cemento Pórtland se refinaron en un molino de alta energía hasta alcanzar la mayor fineza posible (100% < 10 µm) para obtener un material con mayores resistencias mecánicas por compresión que las que se alcanzan con cemento normal. Las composiciones de la invención conteniendo el material cementante refinado así como arena refinada y distribuida adecuadamente, conducen a desarrollar resistencias a la compresión sustancialmente más altas (mayores a 100 MPa).|ARMANDO GARCÍA LUNA; Avenida Linda Vista No. 117, Col. Linda Vista, 67130, Nuevo León, MEXICO|GCC TECHNOLOGY AND PROCESSES S.A.; Avenue de Rumine 37, CH-1005, Lausanne, SUIZA|
276632|Patente|PA/a/2006/002144|24/02/2006|15/06/2010|<i>A61F2/42</i> <b>(2006-01)</b>; <i>A61F2/30</i> <b>(2006-01)</b>|ENDOPROTESIS DE ARTICULACION DEL TOBILLO.|Una endoprótesis para sustituir la articulación del tobillo, que comprende un componente (4) inferior el cual se va a conectar al astrágalo (2) un componente (3) superior el cual va a conectar a la tibia (1) y una parte (5) intermedia la cual forma una articulación deslizable tanto con el componentes inferior como también con el componente superior. Se proporciona una parte (5) intermedia la cual tiene forma de cuña en la sección sagital con el fin de compensar las irregularidades anatómicas o quirúrgicas. El componente (3) superior también puede tener forma de cuña en la sección frontal o la sección sagital.|ARNOLD KELLER; HELMUT D. LINK; HAKON KOFOED; An der Naherfurth 5, 23863, Kayhude, ALEMANIA|LINK AMERICA, INC.; 300 Roundhill Drive, Rockaway, 07866, New Jersey, E.U.A.|
276633|Patente|MX/a/2007/013507|29/10/2007|15/06/2010|<i>A61M5/315</i> <b>(2006-01)</b>|JERINGA PARA ADMINISTRAR MULTIPLES DOSIS CON DISPOSITIVO DE AGUJA DE INYECCION CON PROTECCION PARA ESTERILIDAD.|La presente invención se refiere a una jeringa para administrar múltiples dosis con dispositivo de aguja de inyección con protección para esterilidad destinada a administrar dos o más dosis de una sustancia medicinal contenida en su interior, que comprende: un tubo cilíndrico que comprende una cavidad, dicho tubo tiene un primer extremo con una emboscadura, y un extremo opuesto con una abertura de inyección sellada mediante un sello de elastómero que está adaptado para ser perforado mediante un elemento punzante, y un embolo impelente que está sujeto dentro del tubo para cerrar la embocadura, el embolo está adaptado para moverse en una dirección longitudinal; un vástago, que comprende un extremo de comando y un extremo inferior para ser conectado al embolo impelente, dicho vástago comprende una sección transversal, preferiblemente cruciforme con un tamaño más pequeño que el del diámetro interior del tubo; y un dispositivo de aguja de tipo hipodérmica para acoplarse a través de uno de sus extremos en la abertura de inyección, el dispositivo de aguja está adaptado para perforar el sello de elastómero extremo para comunicarse con el interior del tubo, y el dispositivo de aguja está provista de una aguja de inyección en su extremo opuesto, en donde el vástago comprende una pluralidad de topes de dosis previstos como miembros removibles a través de respectivos debilitamientos estructurales del vástago, los topes de dosis sobresalen del cuerpo del vástago que excede el diámetro del tubo; los topes de dosis actúan en contra de la embocadura del tubo, impidiendo el avance de dicho vástago y la carrera del émbolo impelente dentro del tubo, en una magnitud que corresponde a un dosis medicinal contenida en el tubo, dicha jeringa está caracterizada porque; unos primeros medios de tope están previstos en la embocadura del tubo, dichos medios determinan en el interior del tubo una ranura anular discontinua cuyo diámetro es mayor que el diámetro interior del tubo, y mayor que la sección transversal del vástago; primeros medios de bloqueo configurados como patillas salientes flexibles que están previstas en ambos lados del vástago, dichas patillas se extienden de forma oblicua hacia el extremo del comando y su diámetro es mayor al diámetro interior del tubo, los primeros medios de bloqueo son usados para prevenir el retroceso del vástago dentro del tubo, cuando este se rompe dentro de los primeros medios de tope; segundos medios de bloqueo están previstos en los topes de dosis, configurados en forma de una ranura, dirigida para cortar sobre un segundo medio de tope, configurado como una zona de borde exterior alrededor de la embocadura, dichos topes de dosis se extienden al menos por dos lados opuestos del vástago, de tal forma que la distancia del avance o retroceso en el movimiento del vástago de inyección es prevenido cuando la jeringa no es usada entre las administraciones de diferentes dosis o cuando la jeringa se utiliza por primera vez; el debilitamiento estructural de los topes de dosis desprendibles consiste de una serie de ranuras en el vástago, de tal forma que cuando el tope de dosis es desprendido del vástago; las salientes o protuberancias del material desprendible no sobresalen de la sección transversal de dicho vástago, de tal forma que estos no impiden el movimiento del vástago dentro del tubo; y los topes de dosis desprendibles de cada lado también son unidos de forma adyacente entre si por medios de un segundo conjunto de debilitamientos estructurales para proporcionar una estabilidad estructural adicional al acoplamiento formado mediante los topes de dosis y el vástago.|JOSE SANTIAGO ROLLA; Los Platanos 1192, 6706, Jáuregui, Buenos Aires, ARGENTINA|ELASTOMERIC SYSTEMS S.L.; Angel Muñoz 12, E-28043, Madrid, ESPAÑA|
276634|Patente|MX/a/2008/011578|10/09/2008|15/06/2010|<i>D03D13/00</i> <b>(2006-01)</b>; <i>D03D25/00</i> <b>(2006-01)</b>; <i>D03D3/04</i> <b>(2006-01)</b>; <i>D21F7/08</i> <b>(2006-01)</b>|TELA DE DOBLE CAPA PARA FABRICANTES DE PAPEL CON CAVIDADES PARA AUMENTAR EL VOLUMEN.|Se proporciona una tela de doble capa para fabricantes de papel que es particularmente adecuada para la formación o secado por aire a su través (TAD) de clorito de papel higiénico o toalla de alto volumen. La tela incluye un solo sistema de hilo de urdimbre entretejido con tres sistemas de hilo de trama de modo que: un primero de los sistemas de hilo de trama se localiza sobre la superficie del papel (PS) de la tela; un segundo de los sistemas de hilo de trama se localiza sobre la superficie del lado de la máquina (MS) de la tela; y el tercer sistema de hilo de trama se localiza intermedio entre el primer y segundo sistemas de hilo de trama. Los hilos del primer y segundo sistemas de hilo de trama se entretejen con el sistema de hilo de urdimbre de modo que se apilan verticalmente uno con respecto al otro en la tela. Los hilos del tercer sistema de hilo de trama se entretejen para localizarse en un plano central de la tela que es intermedio al primero y segundo sistemas de hilo de trama, y cada hilo del tercer sistema de hilo de trama se localiza entre los pares apilados verticalmente de los hilos de trama en el primer y segundo sistemas de hilo de trama. Los sistemas de hilo de urdimbre y trama se entretejen de acuerdo a un diseño simétrico el cual proporciona cavidades generalmente rectangulares sobre cada una de la PS y MS de la tela con los hilos del tercer sistema de hilo de trama formando el "fondo" de cada cavidad. Pueden existir aproximadamente 50 a 750 toneladas por pulgada cuadrada de tela, cada intervalo de profundidad de aproximadamente 0.1 mm hasta aproximadamente 1.0 mm de profundidad; esas cavidades imparten desuniformidades a la superficie de la tela lo cual ayuda a crear el volumen en la hoja formada transportada sobre ellas. Las telas de la invención también ofrecen un área de contacto de la hoja, baja, típicamente menor del 30% de la superficie total de la tela, generalmente en el intervalo de 15% hasta aproximadamente 20%. Las telas son también altamente permeables al aire para asegurar un buen flujo de aire y drenaje de la hoja.|REX BARRETT; RAE PATEL; 320 Bosworth Lane, 54956, Neenah, WI, E.U.A.|ASTENJOHNSON, INC.*; 4399 Corporate Road, 29405, Charleston, South Caroline, E.U.A.|
276635|Patente|MX/a/2007/002959|09/05/2003|15/06/2010|<i>H04B7/216</i> <b>(2006-01)</b>|DETECCION DE USUARIO UNICO.|La presente invención se refiere a un equipo de usuario de acceso múltiple de división de código para su uso en la recepción de una pluralidad de señales de datos recibidas sobre un espectro compartido, cada señal de datos recibida experimenta una respuesta del canal similar, el quipo de usuario comprende: medios para recibir una señal combinada de las señales de datos recibidas sobre el espectro compartido; medios para la toma de muestra de la señal combinada a un múltiplo de una velocidad de fragmento de las señales de datos recibidas; medios para estimar una respuesta del canal para la señal combinada al múltiplo de la velocidad de fragmento; medios para determinar un primer elemento de un vector de datos de dispersión utilizando las muestras de señal combinada y la respuesta del canal estimada; medios para utilizar un factor desde la determinación del primer elemento para determinar los elementos remanentes del vector de datos de dispersión; y medios para la estimación de datos de las señales de datos utilizando los elementos determinados del vector de datos de distribución.|ARIELA ZEIRA; JUNG-LIN PAN; PARTHAPRATIM DE; MANI MISRA; 239 West Neck Road, 11743, Huntington, New York, E.U.A.|INTERDIGITAL TECHNOLOGY CORPORATION; 300 Delaware Avenue, Suite 527, 19801, Wilmington, Delaware, E.U.A.|
276636|Patente|PA/a/2001/001345|06/02/2001|15/06/2010|<i>C07D301/10</i> <b>(2006-01)</b>; <i>F22B1/18</i> <b>(2006-01)</b>|PROCESO PARA PREPARAR OXIDO DE ETILENO POR OXIDACION DIRECTA DE ETILENO CON AIRE U OXIGENO.|La presente invención se refiere al descubrimiento que los inventores de farnesil-proteína transferesa son útiles para preparar una composición farmacéutica para tratar artropatía, tales como por ejemplo, artritis reumatoide, osteoartritis juvenil y gota.|THEIS, GERHARD; VANSANT, FRANS; Staufer Strasse 11, D-67133, Maxdorf., , ALEMANIA|BASF AKTIENGESELLSCHAFT*; Carl-Bosch-Strasse 38, 67056, Ludwigshafen, , ALEMANIA|
