Número de concesión|Tipo de documento|Número de solicitud|Fecha de presentación|Fecha de concesión|Clasificación CIP|Título|Resumen|Inventor(es)|Titular
273580|Patente|MX/a/2007/010288|23/08/2007|25/01/2010|<i>B31C3/00</i> <b>(2006-01)</b>|SELLO CON FORMACION DE FORMA DE PIRAMIDE.|La presente invención se refiere a un conjunto de sello que tiene un alojamiento de sello y un manguito de desgaste, en donde el alojamiento de sello comprende: una primera pestaña axial; una primera pestaña radial; una pluralidad de molduras ligadas al alojamiento de sello, colocadas sobre una porción de la primera pestaña axial del alojamiento, cada una de las molduras teniendo un cuerpo, incluyendo porciones colocadas una pared lateral colocada paralela a la primera pestaña axial del alojamiento y presentando una cara de extremo plana; un cuerpo de sello ligado y sustentado en la primera pestaña radial, el cuerpo de sello teniendo superficies de lado de aire frustoconica y de aceite que se encuentran a lo largo de una banda de sello que tiene contacto con una pestaña axial del manguito de desgaste; y una pared de defensa envolviendo la primera pestaña radial, la pared de defensa teniendo una serie de formaciones de configuración de pirámide sobre ésta, que se extiende hacia una pestaña radial del manguito de desgaste, cada una de las formaciones de configuración de pirámide teniendo un ápice radialmente alineado con las paredes de defensa, cada una de las formaciones de configuración de pirámide teniendo cuatro lados planos triangulares angularmente relacionados, dos de dichos lados adyacentes se ahúsan axialmente hacia adentro y dos lados opuestos de la formación de configuración de pirámide que se ahúsan axialmente hacia fuera y que se encuentra con la cara de extremo plano de una de la pluralidad de molduras, mediante lo cual el ápice de la formación de configuración de pirámide inicialmente hace contacto con la pestaña radial del manguito de desgaste durante la instalación, mediante lo cual el ápice inicialmente hace contacto pero rápidamente primero se desgasta y después gradualmente se ensancha con el desgaste continuado para quedar substancialmente coplanar con la pared de defensa y mediante lo cual la pared de defensa protege el conjunto de sello de acumular contaminantes en el espacio entre el lado de aire del sello y la pared de defensa.|LINAS L. MASKALIUNAS; 39W221 East Mallory Drive, 60134, Geneva, Illinois, E.U.A.|SKF USA, INC.; 900 North State Street, 60123, Elgin, IL, E.U.A.|
273581|Patente|MX/a/2007/015025|29/11/2007|25/01/2010|<i>A63H33/04</i> <b>(2006-01)</b>|JUGUETES PLEGADOS CON ESTRUCTURAS DE DESPLIEGUE INSTANTANEO.|La presente invención se refiere a un juguete, que comprende: un accesorio de juguete; una superficie de soporte; un brazo que tiene un primer extremo unido a la superficie de soporte, un segundo extremo, una porción resiliente entre el primero y el segundo extremos, la porción resiliente del brazo empuja el segundo extremo desde una posición desplazada separada de la superficie de soporte hacia una posición de descanso adyacente a la superficie de soporte; y una barrera que se proyecta de la superficie de soporte separada y frente al brazo, el brazo y la barrera forman juntos una cámara de retención para el accesorio de juguete cuando el segundo extremo del brazo está en la posición desplazada.|JAMES KNIGHT; JULIAN PAYNE; KWUN CHUNG MO; ALAN CHEUNG; PITT LAU; 385 East Green Street, #2313, 91101, Pasadena, CA, E.U.A.|MATTEL, INC.*; 333 Continental Blvd., 90245-5012, El Segundo, CA, E.U.A.|
273582|Patente|PA/a/2006/014497|13/12/2006|25/01/2010|<i>G01R11/24</i> <b>(2006-01)</b>|MEDIDOR DE CONTROL CON DESACTIVACION DE SEGURIDAD.|Medidor de control para controlar el suministro de servicios, en particular que el suministro de energía eléctrica, que tiene una base de soporte (1) , anclada con lo que es una línea de suministro de energía principal (20), y un grupo de medición (2) desmontable de la base de soporte y con un aparato de medición interpuesto entre la línea de suministro de energía principal y un bucle local. Un anclaje de seguridad se proporciona para evitar manipulaciones fraudulentas en el medidor de control y comprende medios mecánicos (30) asociados con el grupo de medición y que se pueden mover hacia una posición de bloqueo para el acoplamiento con la base de soporte cuando el grupo de medición se monta sobre la base de soporte, y un interruptor (40) para generar una señal de activación tras la activación mediante el medio mecánico, en donde el medio mecánico se dispone para activar el interruptor cuando el medio mecánico se libera de la posición de bloqueo para separar el grupo de medición de la base de soporte. La invención permite obstruir positivamente actos de fraude y de este modo proporciona un medidor de control el cual es capaz de permitir el control remoto del estado "abierto/cerrado" en situaciones de fraude o más bien tentativa de fraude y es capaz de proporcionar inequívocamente la ocurrencia de fraude o tentativa de fraude.|FABIO VERONI; Via Aldo Motta n. 24/A, I-20059, Vimercate, Milán, ITALIA|ENEL DISTRIBUZIONE S.P.A.*; Via Ombrone 2, I-00198, Roma, ITALIA|
273583|Patente|MX/a/2007/006065|21/05/2007|25/01/2010|<i>B65H16/10</i> <b>(2006-01)</b>|SURTIDOR DE TOALLA CON RODILLO IMPULSOR MEJORADO Y CONDUCTO SURTIDOR MEJORADO.|La presente invención se refiere a en un surtidor para suministrar rollos de toalla de papel que incluye medios para montar de manera giratoria el rollo, un doblez de alimentación que incluye un rodillo impulsor segmentado con una pluralidad de superficies impulsoras y un rodillo de presión adaptado para cooperar con el mismo a fin de avanzar la toalla hacia un conducto surtidor, un rodillo impulsor mejorado que tiene un eje alargado y una pluralidad de segmentos impulsores que define superficies impulsoras colocadas al lo largo de su longitud de radio generalmente idéntico con respecto al eje alargado del rodillo, así como una pluralidad de discos gula interpuestos entre segmentos impulsores adyacentes configurados para corregir el arrugado a medida que se suministra la toalla.|PAUL METCALFE; MICHAEL R. KILGORE; HAROLD J. GOEKING; 4610 W. 4th Street, 54914, Appleton, Wisconsin, E.U.A.|GEORGIA-PACIFIC CONSUMER PRODUCTS LP; Patent Group GA030-43, 133 Peachtree Street, N:E., 30303, Atlanta, Georgia, E.U.A.|
273584|Patente|PA/a/2006/004166|12/04/2006|25/01/2010|<i>B41C1/05</i> <b>(2006-01)</b>; <i>B01D53/72</i> <b>(2006-01)</b>; <i>B01D53/86</i> <b>(2006-01)</b>; <i>B08B15/04</i> <b>(2006-01)</b>|PRODUCCION DE PLACAS DE IMPRESION FLEXOGRAFICA MEDIANTE GRABADO LASER.|Proceso para la producción de placas de impresión flexográfica mediante el grabado con láser directo, en donde los productos de degradación en partículas y gaseosos formados en el curso de grabado se retiran mediante un aparato de succión, y la corriente de gases de desecho cargada con los productos de degradación se purifican mediante una combinación de al menos un filtro de sólidos y al menos una etapa de purificación que opera oxidativamente.|MARGIT HILLER; UWE STEBANI; JENS SCHADEBRODT; VOLKER JANSEN; Friedhofsweg 2, 97753, Karlstadt, ALEMANIA|XSYS PRINT SOLUTIONS DEUTSCHLAND GMBH; Sieglestr. 25, 70469, Stuttgart, ALEMANIA|
273585|Patente|MX/a/2007/011050|10/09/2007|25/01/2010|<i>B65D81/05</i> <b>(2006-01)</b>|RECIPIENTES INFLABLES.|La presente invención se refiere a un recipiente inflable, que comprende: a) un alojamiento flexible que tiene una lengüeta adaptada para ser sujetada y una cavidad interior, el alojamiento adaptado para sufrir por lo menos un cambio de forma; y b) una válvula flexible fijada al alojamiento, la válvula adaptada para fijarse adicionalmente a un objeto externo al alojamiento y para sufrir por lo menos un cambio de forma para proporcionar comunicación de fluido entre: (1) la cavidad interior, y (2) el medioambiente, en el que está colocado el recipiente, en donde la lengüeta permite que una fuerza se ejerza sobre el alojamiento para cambiar la forma del mismo, la fuerza también causa que la válvula cambie de forma como resultado de fijar la válvula al objeto externo, de modo que es atraído fluido desde el medio ambiente, a través de la válvula, y hacia la cavidad interior.|SHAWN FRAYNE; 14008 Middleton Way, 33624, Tampa, Florida, E.U.A.|SEALED AIR CORPORATION (US); Park 80 East, 07663, Saddle Brook, New Jersey, E.U.A.|
273586|Patente|MX/a/2007/011207|13/09/2007|25/01/2010|<i>H05K7/14</i> <b>(2006-01)</b>|DISPOSICIONES PARA EQUIPO DE TELECOMUNICACION.|La presente invención se relaciona con un bastidor secundario para alojar tableros impresos en un sistema de telecomunicación, en donde el bastidor secundario está adaptado para montarse en un bastidor, y las dimensiones internas del bastidor son tales que está adaptado para montar tableros impresos de un primer tipo a través de una pluralidad de bastidores secundarios convencionales. El bastidor secundario está adaptado para montar cuando menos un tablero impreso de un segundo tipo esencialmente perpendicular, cuando se monta en el bastidor, comparado con los tableros impresos del primer tipo montados en la pluralidad de bastidores secundarios convencionales cuando se montan en el bastidor, en donde el tamaño de cuando menos una dimensión del o cada tablero impreso del segundo tipo es mayor que el tamaño de cuando menos una de las dimensiones de los tableros impresos del primer tipo. Además, la invención se relaciona con un adaptador de cable para conectar un conector del bastidor que comprende el bastidor secundario de conformidad con la invención a un tablero impreso del segundo tipo montado en el bastidor secundario.|HANS KNUTSSON; Pilgårdvej 32, Nr. Nissum, DK-7620, Lemvig, DINAMARCA|TELEFONAKTIEBOLAGET L M ERICSSON (PUBL); , S-164 83, Stockholm, SUECIA|
273587|Patente|MX/a/2008/002666|25/02/2008|25/01/2010|<i>C07D211/00</i> <b>(2006-01)</b>; <i>C07D453/00</i> <b>(2006-01)</b>; <i>C07D453/02</i> <b>(2006-01)</b>; <i>C07D211/58</i> <b>(2006-01)</b>|METODOS DE SINTESIS E INTERMEDIARIOS DE COMPUESTOS ESTEREOISOMERICOS UTILES PARA EL TRATAMIENTO DE TRASTORNOS GASTROINTESTINALES Y DEL SISTEMA NERVIOSO CENTRAL.|La presente invención se refiere a métodos y/o procesos para la preparación de compuestos estereoisoméricos de la fórmula (X): endonde las variables están definidas en este documento, además de las composiciones para el tratamiento seguro y efectivo de distintos desórdenes gastrointestinales, incluyendo, entre otros, a la gastroparesía, el reflujo gastroesofágico y demás condiciones relacionadas. Los compuestos de la invención también son de utilidad para tratar una variedad de patologías que involucran al sistema nervioso central.|KOLBOT BY; PONNY PANG; JINUN-BAN YEH; 1451 Bradshawe Avenue, 91754, Monterey Park, California, E.U.A.|ARYX THERAPEUTICS, INC.; 6300 Dumbarton Circle, 94555, Fremont, California, E.U.A.|
273588|Patente|MX/a/2008/002383|19/02/2008|25/01/2010|<i>A61K31/4162</i> <b>(2006-01)</b>; <i>A61P29/00</i> <b>(2006-01)</b>; <i>C07D471/04</i> <b>(2006-01)</b>; <i>C07D487/04</i> <b>(2006-01)</b>|PIRAZOL FUSIONADO COMO INHIBIDORES DE PROTEINAS CINASAS ACTIVADAS POR MITOGENOS P38.|La presente invención se refiere a pirazoles fusionados que son efectivos como inhibidores de la MAP cinasa p38, métodos para hacer los compuestos y métodos para utilizar los compuestos para el tratamiento de enfermedades mediadas por la MAP cinasa p38.|COUNDE O'YANG; DAVID MICHAEL GOLDSTEIN; TOBIAS GABRIEL; NOLAN JAMES DEWDNEY; TERESA ALEJANDRA TREJO-MARTIN; MICHAEL SOTH; NIDHI ARORA; ROLAND JOSEPH BILLEDEAU; 1420 Bellingham Way, 94087, Sunnyvale, California, E.U.A.|F. HOFFMANN-LA ROCHE AG.*; 124 Grenzacherstrasse, CH-4070, Basilea, SUIZA|
273589|Patente|MX/a/2007/012566|10/10/2007|25/01/2010|<i>C08K5/3492</i> <b>(2006-01)</b>; <i>B32B27/08</i> <b>(2006-01)</b>; <i>B32B27/18</i> <b>(2006-01)</b>; <i>B32B27/30</i> <b>(2006-01)</b>; <i>B32B27/36</i> <b>(2006-01)</b>|MOLDES DE POLICARBONATO ESTABILIZADOS CON UV.|La presente invención se relaciona con un producto multicapa que comprende una primera y una segunda capa, en donde la segunda capa contiene policarbonato y en donde la primera capa es una capa de protección UV a base de (met)acrilato de polialquilo, que contiene una triazina sustituida con bifenilo como estabilizador UV. La invención también se relaciona con la producción de estos productos multicapa y productos, tales como, por ejemplo, productos de vidrio que contienen los productos multicapa citados.|ROBERT MALEIKA; FRANK BUCKEL; GUNTHER STOLLWERCK; Am Hackenbruch 70, 40231, Düsseldorf, ALEMANIA|BAYER MATERIALSCIENCE AG; , D-51368, Leverkusen, ALEMANIA|
273590|Patente|PA/a/2006/009946|31/08/2006|25/01/2010|<i>B65D39/12</i> <b>(2006-01)</b>; <i>B65B31/02</i> <b>(2006-01)</b>; <i>B65D41/04</i> <b>(2006-01)</b>; <i>B65D41/62</i> <b>(2006-01)</b>; <i>B65D51/18</i> <b>(2006-01)</b>; <i>B65D81/32</i> <b>(2006-01)</b>; <i>B65D85/72</i> <b>(2006-01)</b>|METODO DE SELLADO Y DE DESPLAZAMIENTO DE ESPACIO SUPERIOR PARA REMOVER PRESION DE VACIO.|La presente invención se refiere a un envase que tiene una porción superior con una abertura en ese envase y una base, la porción superior tiene una terminación de cuello que incluye un sello expansible y movible, caracterizado porque el sello está configurado para ser expansible y movible en relación al envase cuando se sella al mismo y cuando un líquido calentado se encuentra en el envase; el sello se mueve descendentemente hacia la base y dentro de la terminación de cuello para compensar las fuerzas de vacío durante el enfriamiento del líquido después de sellar el envase.|DAVID MURRAY MELROSE; 90 Balmoral Road, 1003, Mount Eden, Auckland, NUEVA ZELANDIA|DAVID MURRAY MELROSE; 90 Balmoral Road, 1003, Mount Eden, Auckland, NUEVA ZELANDIA|
273591|Patente|PA/a/2006/004543|24/04/2006|25/01/2010|<i>H04N7/16</i> <b>(2006-01)</b>; <i>H04L9/32</i> <b>(2006-01)</b>; <i>H04N5/00</i> <b>(2006-01)</b>; <i>H04N7/24</i> <b>(2006-01)</b>|METODO PARA AUTENTIFICAR Y EJECUTAR UN PROGRAMA DE APLICACION.|De acuerdo con una técnica convencional, en caso de que un programa sea almacenado en una memoria no volátil una vez y luego activado, la autentificación del programa se lleva a cabo inmediatamente antes de esta activación. Sin embargo, se requieren cálculos tales como el descifrado de valores cifrados antes de que inicie la activación del programa, lo cual causa el problema de que la capacidad de respuesta se disminuye en proporción al tiempo requerido para los cálculos. Para poder resolver este problema, la autentificación de un programa se lleva a cabo inmediatamente antes de que este programa sea almacenado, de tal manera que no se lleva a cabo una autentificación o sólo se lleve a cabo una parte de la autentificación para verificar la validez de certificados en el momento de la activación del programa.|TAKAKAZU SHIOMI; TADAO KUSUDO; Matsushita Electric Industrial Co., Ltd., 1006, Oaza Kadoma, 571-8501, Kadoma-shi, Osaka, JAPON|PANASONIC CORPORATION; 1006, Oaza Kadoma, 571-8501, Kadoma-shi, Osaka, JAPON|
273592|Patente|PA/a/2006/005144|08/05/2006|25/01/2010|<i>C07D215/20</i> <b>(2006-01)</b>; <i>A61K31/47</i> <b>(2006-01)</b>; <i>A61K31/475</i> <b>(2006-01)</b>; <i>C07D401/06</i> <b>(2006-01)</b>; <i>C07D409/06</i> <b>(2006-01)</b>; <i>C07D471/04</i> <b>(2006-01)</b>|METODOS Y COMPOSICIONES PARA INHIBICION DE SELECTINA.|La presente invención está relacionada al campo de sustancias anti-inflamatorias, de manera más particular a nuevos compuestos que actúan como antagonistas de las proteínas de adhesión de mamífero conocidas como selectinas. En algunas modalidades, se proporcionan métodos para tratar trastornos mediados por selectinas que incluyen administración del compuesto de la Fórmula (I): en donde las variables constituyentes se definen en la presente.|NEELU KAILA; SILVANO L. DEBERNARDO; KRISTIN M. JANZ; RAYMOND T. CAMPHAUSEN; PATRICIA W. BEDARD; ADRIAN HUANG; 2 Course Brook Lane, 01760, Natick, Massachusetts, E.U.A.|WYETH.*; Five Giralda Farms, 07940-0874, Madison, New Jersey, E.U.A.|
273593|Patente|MX/a/2007/011304|14/09/2007|25/01/2010|<i>B65D37/00</i> <b>(2006-01)</b>|METODOS Y APARATO PARA BOMBEO Y SURTIDO.|La presente invención se refiere a un montaje de bomba caracterizado porque comprende: una base que tiene un conector eléctrico; una carcasa del motor acoplada con la base y con el conector eléctrico, la carcasa del motor se adapta para el desacoplamiento deslizante desde ambos, de la base y del conector eléctrico con un solo movimiento deslizante en una primera dirección y el acoplamiento con la base y con el conector eléctrico con un solo movimiento deslizante en una segunda dirección opuesta a la primera dirección, la carcasa del motor proporciona un sello esencialmente hermético al agua alrededor del motor, en donde la electricidad se suministra al motor a través del conector eléctrico; y una bomba peristáltica que comprende elementos de acoplamiento de tubo, la bomba peristáltica se acopla con el motor y está adaptada para la desconexión rápida del motor.|ALFRED A. SCHROEDER; MICHAEL T. ROMANYSZYN; BASIL F. GIRJIS; 2811 Whisper Fawn, 78230, San Antonio, TX, E.U.A.|LANCER PARTNERSHIP, LTD.*; 6655 Lancer Boulevard, 78219, San Antonio, Texas, E.U.A.|
273594|Patente|MX/a/2007/012474|08/10/2007|25/01/2010|<i>H02G3/04</i> <b>(2006-01)</b>|CANALETA PARA CABLES.|El invento se refiere a una nueva canaleta para cables a tender a lo largo de paredes o techos de tubos, canales o similares de recorrido subterráneo y previstos para la conducción de aguas o desagües, para la transferencia de energía, datos e información, preferentemente para cables de fibra óptica, siendo esta canaleta para cables instalable en el tubo o similares desde la superficie a través de los pozos de acceso y fijable en la pared o el techo del canal. La canaleta para cables se caracteriza por estar formada por eslabones de canaleta para cables (10) que son alargados, idénticos entre sí, unidos entre ellos por sus extremos a través de un eje basculante vertical (as) de forma lateral y angularmente basculante y dispuestos uno detrás de otro en sentido de estiramiento longitudinal (rl). Cada uno de estos eslabones está formando por dos placas cobertoras (2, 2´) paralelas y unidas entre sí mediante un nervio (3) dispuesto de forma centrada, y por los huecos lateralmente abiertos (20, 20´) dispuestos a ambos lados del nervio (3) entre las placas cobertoras (2, 2´), previstos para el posterior alojamiento de los cables (6) que se pueden tapar lateralmente por ambos lados con una cintas cobertoras de laterales (51) de un material plástico flexible que en sus bordes laterales están dotadas de los correspondientes elementos de unión por forma (52) continuos y disponibles por ambos lados, con los correspondientes elementos de unión por contraforma (22) en los bordes longitudinales (21) de las placas cobertoras (2, 2´) de los eslabones (10) cooperables por forma. De este modo se generan dos huecos longitudinales (200, 200´) continuos, cerrados, de transmisión continua, separados entre sí por los nervios (3) de cada eslabón (10) y que atraviesan la canaleta para cables (1) formada por los eslabones (10) unidos entre sí y basculares angularmente, para el tendido de dichos cables (6).|HELMUT KADRNOSKA; GERHARD REISS; Doningasse 21, A-1220, Wien, AUSTRIA|CABLERUNNER AUSTRIA GMBH & CO. KG.*; Kolbegasse 68, Viena 1230, Austria, , AUSTRIA|
273595|Patente|MX/a/2007/011439|17/09/2007|25/01/2010|<i>F16K3/24</i> <b>(2006-01)</b>|DISPOSITIVO DE CONTROL PARA EL FLUJO DE FLUIDO.|La presente invención se refiere a un dispositivo de control de flujo de fluido, el cual comprende: un cuerpo que define una entrada, una salida y una trayectoria de flujo de fluido extendida desde la entrada hasta la salida; un anillo de asiento de válvula acoplado con el cuerpo y que define un orificio a través del cual pasa la trayectoria del flujo de fluido; una jaula acoplada con el cuerpo y que define una perforación interior, la jaula incluye un pasaje a través del cual pasa la trayectoria del flujo de fluido; un elemento de estrangulación con el tamaño para, la inserción dentro de la perforación interior de la jaula y que se puede mover a lo largo de un eje entre las posiciones abierta y cerrada, el elemento de estrangulación define una superficie sellante orientada esencialmente paralela al eje; y un sello colocado inmediatamente adyacente al anillo de asiento de válvula para acoplar la superficie sellante cuando el elemento de estrangulación está esencialmente en la posición cerrada, lo cual restringe el flujo de fluido a través del orificio del anillo de asiento de válvula; y en dónde el sello comprende un sello en C.|Raymond W. Micheel; David J. Westwater; 11698 Hwy F17 East, 50106, Gilman, Iowa, E.U.A.|FISHER CONTROLS INTERNATIONAL LLC.; K-Annex 8100 West Florissant Avenue, 63136, St. Louis, Missouri, E.U.A.|
273596|Patente|MX/a/2007/012779|12/10/2007|25/01/2010|<i>E04F15/10</i> <b>(2006-01)</b>; <i>E04F15/02</i> <b>(2006-01)</b>|METODO Y ENSAMBLE DE CONTRAPISO.|La presente invención se refiere a un ensamble de piso, el cual comprende: cuando menos tres secciones rectangulares, incluyendo cada una de estas secciones un primer mecanismo de cerrojo sobre sus extremos opuestos, y un segundo mecanismo de cerrojo sobre los lados opuestos de la misma; en donde el primer mecanismo de cerrojo comprende: un componente macho que se extiende hacia afuera desde un primer extremo de cada una de las secciones mencionadas, teniendo el componente macho un vástago unido al primer extremo, y una pestaña unida a un extremo distal del vástago, teniendo este vástago una anchura menor que una anchura de la pestaña; una cavidad alargada dispuesta en un segundo extremo de cada una de las secciones; un receptáculo formado en un extremo de la cavidad; una abertura dispuesta sobre el segundo extremo de cada una de las secciones mencionadas, extendiéndose esta abertura hacia dentro de la cavidad, pudiéndose recibir la pestaña de una de las secciones en la cavidad de otra de las secciones a través de la abertura cuando se desfasan los lados de las secciones, de tal manera que el primer extremo de una de estas secciones colinda con, y queda paralelo a, el segundo extremo de la otra de las secciones, y una punta de la pestaña se puede deslizar lateralmente desde la cavidad hacia dentro del receptáculo a medida que los extremos colindantes se deslizan lateralmente uno contra el otro hasta que quedan alineados los lados de las secciones, asegurando de este modo de manera desmontable los extremos colindantes de estas secciones; y en donde el segundo mecanismo de cerrojo comprende: una primera ranura dispuesta sobre un primer lado de cada una de las secciones mencionadas, extendiéndose esta primera ranura hacia dentro de una cámara de leva; una segunda ranura dispuesta sobre un segundo lado de cada una de las secciones mencionadas; un cerrojo de leva cilíndrico dispuesto dentro de la cámara de leva, pudiéndose mover giratoriamente una porción de este cerrojo de leva a través de la primera ranura de una de las secciones, y hacia y asegurable dentro de la segunda ranura de otra de estas secciones, cuando los lados de las secciones quedan colindando uno con el otro, asegurando de esta forma desmontablemente los lados colindantes de estas secciones.|MARK A. CERASI; DAVID KUBIC; 172 Avon Bend Road, 25414, Charlestown, West Virginia, E.U.A.|MARK A. CERASI; DAVID KUBIC; 172 Avon Bend Road, 25414, Charlestown, West Virginia, E.U.A.|
273597|Patente|MX/a/2007/005091|27/04/2007|25/01/2010|<i>C21B7/10</i> <b>(2006-01)</b>|SISTEMA Y METODO DE ENFRIAMIENTO MEJORADOS PARA HORNO.|Un sistema de enfriamiento (200) para la distribución y recolección de un fluido refrigerante en un recipiente metalúrgico utilizado en el procesamiento de materiales fundidos. El sistema de enfriamiento (200) comprende un sistema de distribución (204) que incluye un múltiple de admisión (216), una pluralidad de cabezales (212,214) unidos al múltiple de admisión, y una pluralidad de despachadores de distribución (210) colocados a lo largo de cada cabezal. Un sistema de recolección (206), incluyendo un múltiple de recolección (218), está colocado para recolectar el fluido refrigerante (202). Los despachadores de distribución (210) están colocados para dirigir el fluido refrigerante (202) hacia el múltiple de recolección (218) y utiliza la mayoría de la energía cinética contenida dentro del refrigerante para dirigir el refrigerante hacia el múltiple de recolección.|Mark Thomas ARTHUR; Michael, J. CAMPBELL; Troy, D. WARD; 725 Harrow Lane, 37064, Franklin, Tennessee, E.U.A.|SYSTEMS SPRAY-COOLED, INC.; 311 Plus Park Boulevard, 37217, Nashville, Tennessee, E.U.A.|
273598|Patente|PA/a/2006/013964|30/11/2006|26/01/2010|<i>B23K35/02</i> <b>(2006-01)</b>; <i>B23K9/18</i> <b>(2006-01)</b>; <i>B23K9/16</i> <b>(2006-01)</b>|ALAMBRE DE SOLDADURA DE ARCO ELECTRICO.|Un alambre de soldadura de arco eléctrico que tiene una superficie cilíndrica externa y una capa eléctricamente conductora sobre la superficie, donde la capa comprende una aleación de cobre con el contenido de cobre siendo de entre 60% y 90% en peso de la aleación. Además, la capa puede hacerse delgada con un espesor de menos de aproximadamente 0.50 micrómetros usando a la vez cobre esencialmente puro.|Teresa A. Melfi; Matthew J. James; 649 Thornberry Lane, 44212, Brunswick, Ohio, E.U.A.|LINCOLN GLOBAL, INC.*; 14824 Marquardt Avenue, 90670, Santa Fe Springs, California, E.U.A.|
