Número de concesión|Tipo de documento|Número de solicitud|Fecha de presentación|Fecha de concesión|Clasificación CIP|Título|Resumen|Inventor(es)|Titular
273226|Patente|MX/a/2007/011609|20/09/2007|08/01/2010|<i>F25D23/08</i> <b>(2006-01)</b>|JUNTA DE SELLO DOBLE PARA GABINETES DE REFRIGERADOR CON PROPIEDADES DE AISLAMIENTO DE CALOR ALTO.|La presente invención se refiere a una junta (10) para instalación sobre la puerta de un gabinete de refrigerador que comprende una puerta externa (30) y una puerta interna (31), del tipo que incluye una porción (11) tipo fuelle suave para sellar el área entre un gabinete (17) y la puerta del mismo, extendiéndose desde la porción de base (12) capaz de emparejar la puerta externa (30) y/o la puerta interna (31) del gabinete de refrigerador y provista con un medio de sujeción para la puerta interna (31), caracterizada en que la porción de base (12) es rígida y en que en el extremo de ella el cual enfrenta la puerta interna (31) un medio de sello (5), por consiguiente deformable, se extiende para sellar un espacio (4) localizado entre el gabinete (17) y la puerta interna (31) en un área más interna del refrigerador con respecto a aquella en la cual la porción tipo fuelle suave (11) se localiza, el medio de sello suave (5) y la porción tipo fuelle suave (11) se extienden independientemente desde la porción de base rígida (12) y están libres de coacciones una con respecto a la otra, en donde la porción de base rígida (12) incluye una sección horizontal (13) la que, en el extremo de la sección horizontal (13) que enfrenta en forma operativa la puerta interna (31), se curvea de manera vertical u oblicua de acuerdo con una sección rígida (6) que substancialmente sigue el perfil de la puerta interna (31) hacia el espacio (4), mediante lo cual el medio suave (5) se extiende desde la sección rígida (6).|Paolo Cittadini; Marco De Giorgi; Via Campo dei Fiori 16, I-21020, Luvinate, ITALIA|INDUSTRIE ILPEA S.P.A.; Viale Industria 887, I-21023, Malgesso., ITALIA|
273227|Patente|MX/a/2007/014545|21/11/2007|08/01/2010|<i>E04F15/02</i> <b>(2006-01)</b>|METODO DE COLOCACION Y UNION MECANICA DE PANELES.|La presente invención se refiere a un método para colocar y conectar mecánicamente paneles en hileras paralelas entre sí, poseyendo en esto los paneles en cada caso un primer par de bordes laterales opuestos entre sí y un segundo par de bordes laterales opuestos entre si, estando en esto asignado tanto al primer par de bordes laterales un primer par de medios de fijación como también al segundo par de bordes laterales un segundo par de medios de fijación, estando formados los pares de medios de fijación esencialmente en forma de un chavetero y una lengüeta, pudiéndose fijar entre sí dos paneles adyacentes con la ayuda de los medios de fijación tanto en un plano ortogonal con relación al plano del panel como también en una dirección paralela al plano del panel y ortogonal con relación al respectivo borde lateral y pudiéndose conectar el chavetero y la lengüeta del primer par de medios de fijación mediante pivotar la una en el otro, caracterizado porque se conectan primeramente en una primera etapa una multiplicidad de paneles de una hilera nueva de paneles por colocar por pares mediante los medios de fijación de sus respectivos segundos pares de medios de fijación para formar un súper-panel cuyo ancho es igual a la dimensión de los paneles de la hilera nueva de paneles por colocar a lo largo de su segundo par de bordes laterales y cuya longitud es igual a un múltiple de las dimensiones de los paneles de la hilera nueva de paneles por colocar correspondiente a la multiplicidad de paneles de la hilera nueva de paneles por colocar a lo largo de su primer par de bordes laterales, apoyándose en esto el súper- panel después de la primera etapa en el sustrato, y en una segunda etapa se conecta los paneles conectados entre sí de la hilera nueva de paneles por colocar con los paneles de la hilera de paneles ya colocada mediante pivotar el uno en el otro de los medios de fijación en su respectivo primer par de medios de fijación, progresándose por secciones empezando en una o varias etapas parciales de uno de los extremos de la hilera nueva de paneles por colocar aprovechando la flexibilidad de torsión de los paneles por un eje paralelo al primer par de bordes laterales al otro de sus extremos, y no moviéndose los paneles individuales del súper-panel relativamente entre sí durante esta segunda etapa a lo largo de su segundo par de bordes laterales.|Leonhard SCHITTER; Höllbacherweg 3, A-5300, Hallwang, AUSTRIA|INTERGLARION LIMITED; 2 Andrea Zakou Street, 2404, Engomi, Nicosia, CHIPRE|
273228|Patente|MX/a/2008/015342|21/10/2004|08/01/2010|<i>H04B1/707</i> <b>(2006-01)</b>|CIRCUITO DE SEGUIMIENTO DE CODIGO DIGITAL SIMPLE Y ROBUSTO PARA SISTEMAS DE COMUNICACION INALAMBRICOS.|Un CTL (21) simple y robusto es usado para el seguimiento de sincronización de componentes multitrayectoria de una señal de espectro extendido transmitida sobre un canal de desvanecimiento multitrayectoria inalámbrico. Un circuito de seguimiento de código digital incluye las implementaciones de compensar la propagación de muestras de datos iniciales y finales mediante el uso de una secuencia de pseudorruido, una salida de señal de error generada por la compensación de propagación, y el ajuste de una pluralidad de muestras iniciales y finales en el tiempo de actividad, una velocidad de datos de una señal de control proporcionada como una proporción fraccional de una velocidad de datos de señales de error.|Bin LI; Peconic street, Apt. 25A, 11779, Ronkonkoma, NY, E.U.A.|INTERDIGITAL TECHNOLOGY CORPORATION.*; 300 Delaware Avenue, Suite 527, 19801, Wilmington, Delaware, E.U.A.|
273229|Patente|PA/a/2006/005859|24/05/2006|08/01/2010|<i>B66B11/08</i> <b>(2006-01)</b>; <i>H02K1/12</i> <b>(2006-01)</b>; <i>H02K1/22</i> <b>(2006-01)</b>; <i>H02K7/00</i> <b>(2006-01)</b>|ARREGLO DE SUSPENSION DE ELEVADOR.|La presente invención se refiere a un arreglo de suspensión para un elevador, caracterizado porque comprende una máquina de izamiento, cuerdas de izamiento, un refuerzo, un primer cojinete, y una polea; donde la máquina de izamiento incluye: un armazón de estator, y un montaje; donde el armazón de estator está adaptado para ser asegurado en un pozo de elevador; donde el montaje incluye: una roldana de tracción, y un armazón de rotor; donde la roldana de tracción está fijada al armazón de rotor; donde el montaje está adaptado para girar con respecto al armazón de estator; donde la máquina de izamiento está asegurada al refuerzo que refuerza el armazón de estator, de manera que el montaje está entre el armazón de estator y el refuerzo; donde el refuerzo incluye un primer soporte adaptado para montar el primer cojinete; donde el primer cojinete está adaptado para montar la polea; donde la polea, el primer cojinete, la máquina de izamiento, y el refuerzo están adaptados para alinear automáticamente la polea con la roldana de tracción cuando la polea está montada sobre el primer cojinete y la máquina de izamiento está asegurada al refuerzo; y donde el arreglo de suspensión está adaptado para suspender un elevador sin un contrapeso.|Jorma MUSTALAHTI; Esko AULANKO; Raivaajantie 13, FI-05620, Hyvinkää, FINLANDIA|KONE CORPORATION.*; Kartanontie 1, FI-00330, Helsinki, FINLANDIA|
273230|Patente|PA/a/2006/010577|15/09/2006|08/01/2010|<i>A61K31/538</i> <b>(2006-01)</b>; <i>A61P11/06</i> <b>(2006-01)</b>|BENZOXAZINAS PARA EL TRATAMIENTO DE ENFERMEDADES DE LAS VIAS RESPIRATORIAS.|La presente invención se refiere al uso de los compuestos de la fórmula general 1 (ver fórmula 1) en donde los radicales R1, R2 y R3 pueden tener los significados mencionados en las reivindicaciones y en la memoria descriptiva, para la preparación de un medicamento para el tratamiento de enfermedades de las vías respiratorias.|Klaus RUDOLF; Philipp LUSTENBERGER; Thierry BOUYSSOU; Christoph HOENKE; Andreas SCHNAPP; Ingo KONETZKI; Sabine PESTEL; Kurt SCHROMM; Frank BUETTNER; Claudia HEINE; Hermann SCHOLLENBERGER; Oeschweg 11, 88447, Warthausen, ALEMANIA|BOEHRINGER INGELHEIM INTERNATIONAL GMBH.*; Binger Strasse 173 , 55216, Ingelheim, ALEMANIA|
273231|Patente|MX/a/2007/009975|16/08/2007|08/01/2010|<i>B65B7/02</i> <b>(2006-01)</b>|DISPOSITIVO PARA SELLAR BOLSAS QUE CONTIENEN POLVO O MATERIALES GRANULARES.|La presente invención se refiere a un dispositivo para cerrar bolsas con válvula, que tiene una válvula de proyección, para contener polvo o materiales granulares adecuados para instalación dentro de una banda, rodillo o línea similar para transportar bolsas, que comprende por lo menos una cabeza sellante y un medio transportador para alimentar las bolsas a la cabeza sellante,, caracterizado porque la cabeza sellante del tipo de rueda dentada presenta un medio impulsor que provoca que avance, durante el procedimiento de sellado a la misma velocidad que el medio transportador para permitir sellar la válvula de proyección de la bolsa mientras se mueve el medio transportador, el medio transportador comprende una guía en la cual la cabeza sellante es deslizable la guía está inclinada a una superficie de descanso del medio de transporte.|Sergio BRIOSCHI; Via Verdi 2/F, I-20050, Sulbiate (Milán), ITALIA|VENTOMATIC S.P.A.; Via G. Marconi, 20, I-24030, Valbrembo (Bergamo), ITALIA|
273232|Patente|MX/a/2007/005151|27/04/2007|08/01/2010|<i>A61F13/49</i> <b>(2006-01)</b>|MÉTODO PARA IMPARTIR ELASTICIDAD A UN MATERIAL LAMINADO DE MATERIAL NO TEJIDO/ELASTOMERO.|La presente invención describe un método para impartir elasticidad a un material laminado que comprende al menos una película elástica que tiene una anchura y al menos una capa de un material no tejido asegurado a la película, particularmente a través de la interposición de un material de unión, particularmente adhesivo, que comprende las siguientes etapas en las cuales: el material laminado es desenrollado en forma de una red para pasarla entre dos juegos de dientes, cuyos dientes se acoplan entre sí en una dirección perpendicular al plano del material laminado para así estirar el material laminado en su anchura, caracterizado porque: se imparte una tensión a la red en la dirección longitudinal o la dirección de la máquina durante su desenrollado entre los dientes, particularmente corriente abajo de los juegos de dientes.|Jean-Pierre DUCAUCHUIS; Thierry MARCHE; 2 ter rue du Professeur Dubuisson, F-44100, Nantes, FRANCIA|APLIX; 19 avenue de Messine, 75008, Paris., FRANCIA|
273233|Patente|PA/a/2005/004549|18/03/2002|11/01/2010|<i>C10G11/05</i> <b>(2006-01)</b>; <i>C10G29/04</i> <b>(2006-01)</b>|REDUCCION DE AZUFRE EN LA GASOLINA EN LA DESINTEGRACION CATALITICA DE FLUIDO.|El contenido de azufre de productos líquidos de desintegración, especialmente la gasolina obtenida por desintegración, del proceso de desintegración catalítica es reducido a través del uso de un aditivo de reducción de azufre que comprende un soporte de tamiz no molecular que contiene un alto contenido de vanadio. De preferencia el soporte es alúmina. El catalizador de reducción de azufre es utilizando en forma de un aditivo separado en partículas en combinación con el catalizador de desintegración catalítica activa (normalmente una faujasita como, por ejemplo, zeolita Y) para procesar la alimentación de hidrocarburo en la unidad de desintegración catalítica de flujo (FFC) para producir una gasolina con bajo contenido de azufre y otros productos líquidos.|TERRY G. ROBERIE; RANJIT KUMAR; XINJIN ZHAO; MICHAEL S. ZIEBARTH; NAZEER BHORE; WU-CHENG GHENG; 2613 Liter Drive, 21042, Ellicot City, Maryland, E.U.A.|W. R. GRACE & CO.- CONN; MOBIL OIL CORPORATION.*; 1114 Avenue of the Americas, 10036, New York, NY, E.U.A.|
273234|Patente|PA/a/2004/009738|05/10/2004|11/01/2010|<i>B29C45/00</i> <b>(2006-01)</b>; <i>B29C49/06</i> <b>(2006-01)</b>; <i>B29C49/64</i> <b>(2006-01)</b>|MÉTODO Y DISPOSITIVO DE PROCESAMIENTO DE PREFORMAS.|Son descritos un método y un dispositivo para el procesamiento de preformas, que son elaboradas de un material plástico termoplástico y son moldeadas por soplado en recipientes. En un primer proceso de producción, las preformas son producidas mediante el moldeos de inyección en el área de una herramienta de moldeo de inyección. Al menos algunas áreas de las preformas son chocadas por un dispositivo de enfriamiento. Las preformas son deformadas por la aplicación de presión negativa, por lo tanto, el dispositivo de enfriamiento puede ser elaborado al menos en parte de una material poroso.|MODESTO M. PESAVENTO; Krumme Hohle 12, 98574, Schmalkalden, ALEMANIA|HUSKY INJECTION MOLDING SYSTEMS LTD.; 500 Queen Street South , L7E 5S5, Bolton, Ontario, CANADA|
273235|Patente|MX/a/2007/001380|02/02/2007|11/01/2010|<i>C09D4/00</i> <b>(2006-01)</b>; <i>C09D5/00</i> <b>(2006-01)</b>|FORMULACION DE PINTURAS PARA EXTERIORES.|La presente invención ofrece propiedades mejoradas de resistencia a las manchas, bloqueo de tanino, adherencia y varias otras propiedades mejoradas. Una composición de conformidad con los principios de al presente invención comprende al menos dos aglomerantes, pigmento en nanopartículas, y un dióxido de titanio pigmentario. En una modalidad, la presente invención se refiere a un recubrimiento en un sustrato en donde el recubrimiento tiene dos aglomerantes, pigmento de óxido de metal en nanopartículas, y dióxido de titanio pigmentario. Varios aditivos pueden estar incluidos para formular pinturas como se sabe en la técnica.|MING-REN TARNG; MARK MINAMYER; ANH PHAM; STAN BROWNELL; ANNIE PHAM; ANIL ALEXANDER; DEVEN SHAH; KIM L. NGUYEN; MY LINH PHAM; SIDNEY MAXEY; 20 Alcira, 92614, Irvine, California, E.U.A.|BEHR PROCESS CORPORATION; 3400 West Segerstrom AVenue, 92704-6405, Santa Ana, California, E.U.A.|
273236|Patente|MX/a/2008/000647|11/03/2003|11/01/2010|<i>B22F9/20</i> <b>(2006-01)</b>; <i>B22F9/22</i> <b>(2006-01)</b>; <i>C01G35/02</i> <b>(2006-01)</b>|POLVO PARA METAL DE VALVULAS Y PROCEDIMIENTO PARA SU OBTENCION.|Procedimiento para la obtención de un polvo de metal para válvulas mediante fabricación de un precursor con la morfología deseada, transformación del precursor en un óxido del metal para válvulas, estabilizado de la estructura del óxido mediante tratamiento térmico y reducción del óxido estabilizado con conservación de la morfología. Polvos de metal para válvulas obtenibles de este modo, especialmente constituidos por aglomerados esféricos con un tamaño medio del aglomerado de 10 a 80 µm, preferentemente de 20 a 40 µm, y empleo de este polvo de metal para válvulas para la fabricación de condensadores con electrolito sólido.|KARLHEINZ REICHERT.*; CHRISTOPH SCHNITTER; JOSUA LÖFFELHOLZ; HADY SEYEDA; RÜDIGER WOLF; Am Stadtfeld 43, 38304, Wolfenbüttel, ALEMANIA|H.C. STARCK GMBH; Im Schleeke 78-91, 38642, Goslar, ALEMANIA|
273237|Patente|MX/a/2007/011995|27/09/2007|11/01/2010|<i>G10L19/00</i> <b>(2006-01)</b>; <i>H04S3/00</i> <b>(2006-01)</b>|CODIFICACION Y DECODIFICACION DE AUDIO.|Un codificador de audio de múltiples canales (10) codifica una señal de audio de N canales. Una primera unidad (110) genera una primera señal de M canales codificada, por ejemplo un down-mix estéreo espacial, para la señal de N canales (N<M). Los mezcladores down-mix (115, 116, 117) generan los primeros datos de mejoramiento para la señal relativa a la señal de audio de N canales. Una segunda señal de M canales, tal como una mezcla estéreo artística, es generada para la señal de N canales. Un procesador (123) entonces genera los segundos datos de mejoramiento para la segunda señal de M canales relativa a la primera señal de M canales. Una segunda unidad (120) genera una señal de salida comprende la segunda señal de M canales, los primeros datos de mejoramiento y los segundos datos de mejoramiento. El generador (123) puede seleccionar dinámicamente entre generar los segundos datos de mejoramiento como datos de mejoramiento absolutos o como datos de mejoramiento en relación a la segunda señal de M canales codificada. Un decodificador (20) puede ejecutar la operación inversa y puede aplicar los segundos datos de mejoramiento como de mejoramiento absolutos o relativos dependiendo de un indicación en el flujo de datos recibido.|ARNOLDUS W. J. OOMEN.; GERARD H. HOTHO; FRANCOIS P. MYBURG; Prof. Holstlaan 6, NL-5656, AA Eindhoven, PAISES BAJOS|KONINKLIJKE PHILIPS ELECTRONICS N.V.; Groenewouseweg 1, NL-5621, BA Eindhoven, PAISES BAJOS|
273238|Patente|PA/a/2006/000358|09/01/2006|11/01/2010|<i>E04C2/00</i> <b>(2006-01)</b>|SISTEMA DE DIVISION.|La presente invención se refiere a un aparato caracterizado porque comprende: un primer panel de plástico moldeado por soplado que incluye un primer lado, un segundo lado generalmente opuesto y una porción interior hueca formada durante el proceso de moldeo por soplado, el primer lado, el segundo lado y la porción interior hueca forman parte de una estructura de una pieza y unitaria, el primer panel de plástico moldeado por soplado comprende: al menos una hilera que incluye una pluralidad de depresiones sobre el primer lado del primer panel de plástico moldeado por soplado; al menos una columna que incluye una pluralidad de depresiones sobre el primer lado del primer panel de plástico moldeado por soplado; al menos una hilera que incluye una pluralidad de depresiones sobre el segundo lado del primer panel de plástico moldeado por soplado y al menos una columna que incluye una pluralidad de depresiones sobre el segundo lado del primer panel de plástico moldeado por soplado y un segundo panel de plástico moldeado por soplado que incluye un primer lado, un segundo lado generalmente opuesto y una porción interior hueca formada durante el proceso de moldeo por soplado, el primer lado, el segundo lado y la porción interior hueca forman parte de una estructura de una pieza y unitaria, el segundo panel de plástico moldeado por soplado comprende: al menos una hilera que incluye una pluralidad de depresiones sobre el primer lado del segundo panel de plástico moldeado por soplado; al menos una columna que incluye una pluralidad de depresiones sobre el primer lado del segundo panel de plástico moldeado por soplado; al menos una hilera que incluye una pluralidad de depresiones sobre el segundo lado del segundo panel de plástico moldeado por soplado y al menos una columna que incluye una pluralidad de depresiones sobre el segundo lado del segundo panel de plástico moldeado por soplado.|KENT ASHBY; JAY CALKIN; BRENT STEED; 1353 Canyon Road, 84321, Logan, Utah, E.U.A.|LIFETIME PRODUCTS, INC.; Freeport Center, Building D-11, 84016, Clearfield, Utah, E.U.A.|
273239|Patente|MX/a/2007/012475|08/10/2007|11/01/2010|<i>H04N5/44</i> <b>(2006-01)</b>|METODO Y APARATO PARA ACTUALIZACION DE SOFTWARE EN UN DISPOSITIVO RECEPTOR DE TELEVISION DIGITAL.|Se describe un método y un aparato para implementar la actualización o mejoramiento de software en un dispositivo receptor de televisión digital. En el método, el software de servicio es multiplexado en una corriente de datos de transmisión específica, de acuerdo al protocolo predeterminado; el software de servicio es extraído de la corriente de transmisión por el software de la terminal de dispositivo receptor de televisión digital y es almacenada; el software de la terminal del dispositivo receptor de televisión digital es reiniciada para hacer posible que el software de la terminal del dispositivo receptor de televisión digital y el software de servicio obtengan la dirección de la función de interconexión del software de la parte opuesta, respectivamente; el software de la terminal del dispositivo receptor de televisión digital y el software de servicio actualizan la dirección por omisión de la función de interconexión del software de servicio necesario y la dirección por omisión de la función de interconexión del software de la terminal necesaria por medio de la dirección obtenida respectivamente. El software del dispositivo de recepción de televisión digital y el software de servicio pueden ser separados y pueden ser actualizados individualmente por el uso de la invención.|YAOHUI LI; YUQIN DAI; Huawei Adm. Building, Bantian, Longgang District, 518129, Shenzhen, Guangdong Province, CHINA|HUAWEI TECHNOLOGIES CO., LTD.; Huawei Adm. Building, Bantian, Longgang District, 518129, Shenzhen, Guangdong Province, CHINA|
273240|Patente|PA/a/2005/011585|27/10/2005|11/01/2010|<i>C12N9/10</i> <b>(2006-01)</b>; <i>C12N15/82</i> <b>(2006-01)</b>|GENES DE GLIFOSATO-N-ACETILTRANSFERASA (GAT) NOVEDOSOS.|La presente invención se refiere a proteínas novedosas, incluyendo proteínas capaces de catalizar la acetilación del glifosato y otras proteínas estructuralmente relacionadas. También se proporcionan polinucleótidos novedosos capaces de codificar estas proteínas, composiciones que incluyen una o más de estas proteínas novedosas y/o polinucleótidos, células recombinantes y plantas transgénicas que comprenden éstos compuestos novedosos, métodos de diversificación que implican los compuestos novedosos, y métodos de utilización de los compuestos. Algunos de los métodos y compuestos novedosos proporcionados en la presente se pueden usar para volver un organismo, tal como una planta, resistente a glifosato.|Linda A. Castle; Dan Siehl; Lorraine J. Giver; Jeremy Minshull; Christina Ivy; Yong Hong Chen; Phillip A. Patten; Rebecca Gorton; Nicholas B. Duck; Billy Fred McCutchen; Roger Kemble; 784 Hans Avenue, 94040, Mountain View, California, E.U.A.|PIONEER HI-BRED INTERNATIONAL, INC.*; E.I. DU PONT DE NEMOURS AND COMPANY*; VERDIA, INC.; 800 Capital Square, 400 Locust Street, 50309, Des Moines, Iowa, E.U.A.|
273241|Patente|PA/a/2006/015050|19/12/2006|11/01/2010|<i>B65D41/08</i> <b>(2006-01)</b>|RECIPIENTE PARA BEBIDAS.|La presente invención se refiere a un recipiente para bebidas, caracterizado porque comprende un cuerpo de recipiente que incluye una abertura, una tapa para cerrar la abertura, y un collar montable sobre el cuerpo del recipiente, el cuerpo del recipiente incluye una o más partes de retención a través de las cuales el collar puede ser retenido sobre el cuerpo del recipiente hasta la remoción de la tapa, el collar comprende una pluralidad de aletas u otras partes separadas una de la otra a largo de una extensión circunferencial del collar, y la tapa y el collar incluyen el medio de aseguramiento cooperante a través del cual la tapa se puede asegurar al collar, caracterizada porque el medio de aseguramiento cooperante comprende una pluralidad de partes roscadas circunferencialmente separadas sobre tanto la tapa como del collar, de tal manera que el collar se puede montar dentro de la tapa mediante un movimiento axial del collar con relación a la tapa seguido por un movimiento rotacional entre los mismos para acoplar las partes roscadas respectivas de la tapa y del collar, la tapa también está diseñada en una pluralidad de posiciones circunferencialmente separadas alrededor de su interior separadas para así presionar las aletas o las otras partes del collar mediante una acción deformante elíptica radialmente hacia adentro conformo la tapa se rota con relación al collar, así las aletas u otras partes del collar están aseguradamente acopladas contra una o más partes de retención del cuerpo del recipiente para de ese modo asegurar la tapa al cuerpo de recipiente, la rotación de la tapa con relación al collar mediante las partes roscadas separadas también provocan que la tapa sea atraída dentro del compartimiento sellado con la abertura del cuerpo del recipiente.|Peter Antony Farrar; John Hein; Anthony Henry Joseph Fraser; William George Dando; Glenelg, Low Barn, Burley Lane, LS29 6EX, Menston, Leeds, REINO UNIDO|DUBOIS LIMITED.*; Amaray House , Col. Arkwright Road, NN17 5AE, Corby, Northants, REINO UNIDO|
273242|Patente|PA/a/2006/007245|22/06/2006|11/01/2010|<i>C07K14/325</i> <b>(2006-01)</b>; <i>A01H5/00</i> <b>(2006-01)</b>; <i>A01H5/10</i> <b>(2006-01)</b>; <i>C12N15/32</i> <b>(2006-01)</b>; <i>C12N15/82</i> <b>(2006-01)</b>|MÉTODO PARA PROTEGER GENES CON ACTIVIDAD PESTICIDA CONTRA INACTIVACIÓN PROTEOLÍTICA|La presente invención se refiere a un método para la protección de una toxina Cry8Bb1 de Bacillus thuringiensis o una variante de la misma de la inactivación proteolítica en una planta, en donde la variante tiene actividad pesticida y por lo menos 99% de identidad de secuencia con la secuencia de aminoácidos establecida en SEQ ID NO: 22 para la toxina Cry8Bb1 de Bacillus thuringiensis, el método comprende reemplazar por lo menos un sitio proteolítico dentro de la toxina Cry8Bb1 de Bacillus thuringiensis o variante de la misma que es sensible a una cisteín proteasa de la planta para formar un sitio de protección proteolítica, en donde el sitio de protección proteolítica no es sensible a la cisteín proteasa de la planta y protege la toxina Cry8Bb1 de Bacillus thuringiensis o variante de la misma de la inactivación proteolítica en una planta y en donde el sitio de protección proteolítica es la secuencia de aminoácidos establecida en SEQ ID NO: 143 y reemplaza el sitio proteolítico establecido en SEQ ID NO: 142.|Albert Lu; André Abad; Hua Dong; Rafael Herrmann; Billy F. McCutchen; Janet A. Rice; Eric J. Schepers; James F. Wong; 1030 Belle Mar Drive, 50266, West Des Moines, Iowa, CANADA|PIONEER HI-BRED INTERNATIONAL, INC.*; E.I. DU PONT DE NEMOURS AND COMPANY*; 9550 White Oak Lane, Suite 100, P.O. Box 1014, 50131-1014, Johnston, Iowa, E.U.A.|
