Número de concesión|Tipo de documento|Número de solicitud|Fecha de presentación|Fecha de concesión|Clasificación CIP|Título|Resumen|Inventor(es)|Titular
266641|Patente|PA/a/2000/012600|15/12/2000|11/05/2009|<i>H04Q3/00</i> <b>(2006-01)</b>|NUMERO PERSONAL DE PROTOCOLO DE INTERNET SIN COBRO.|En un sistema de telefonía de internet, el servicio sin cobro y las llamadas que son aceptadas y pagadas por ello pueden especificarse por el usuario del sistema de telefonía de IP para limitarse de acuerdo a la identidad de la parte que llama, la hora del día, el día de la semana u otro criterio. Los datos que son usados para discriminar o filtrar las llamadas entrantes se programan en el gestor de llamadas por medio de la compuerta residencial de banda ancha del usuario del sistema telefónico de IP. Usando dicho sistema el usuario puede filtrar cuidadosamente las llamadas por las que se paga y controlar más cercanamente los costos del servicio de telecomunicaciones. De manera más general, el usuario posee la capacidad de almacenar criterios de manejo de llamadas predefinidas, los cuales pueden ejecutarse por medio de la compuerta residencial de banda ancha y/o el gestor de llamadas.|FEN-CHUNG KUNG; JESSE EUGENE RUSSELL; HOPETON WALKER; ANISH SANKALIA.*; SPENCER WANG.*; 215 Teneyck Road, 08807, Somerset county, New Jersey, E.U.A.|AT&T CORP.*; 32 Avenue of the Americas, New York, 10013-2412, New York, E.U.A.|
266642|Patente|PA/a/2003/008812|26/09/2003|11/05/2009|<i>A61P19/02</i> <b>(2006-01)</b>; <i>A61K31/70</i> <b>(2006-01)</b>; <i>A61K9/127</i> <b>(2006-01)</b>|FORMULACIONES QUE COMPRENDEN INGREDIENTES ACTIVOS ATRAPADOS Y USOS DE LOS MISMOS.|Se proporcionan formulaciones que comprenden ingredientes activos atrapados, tales como aminoazúcares, y usos de los mismos. En una modalidad, se proporcionan formulaciones inyectables intra-articulares.|SAN-BAO HWANG; MARTIN LOTZ; ALEXANDER R. SHIKHMAN; CHANGYONG HU; 38 Carriage Way , 01776, Sudbury, Massachusetts, E.U.A.|THE SCRIPPS RESEARCH INSTITUTE; OPTIMER PHARMACEUTICALS; 10550 North Torrey Pines Road, 92037, La Jolla, California, E.U.A.|
266643|Patente|PA/a/2002/001714|18/02/2002|11/05/2009|<i>H04L12/12</i> <b>(2006-01)</b>; <i>H04L12/24</i> (2006-01); <i>H04L12/26</i> (2006-01); <i>H04L12/56</i> (2006-01); <i>H04L29/06</i> (2006-01)|CONEXIONES PERSISTENTES EMPALMADAS.|Un método para conectar un cliente con un servidor mediante un compensador de carga asociado con una, pluralidad de servidores. El método incluye establecer una primer conexión para la transmisión de paquetes entre el compensador de carga y el cliente, seleccionar un servidor para dar servicio al cliente y empalmar la primer conexión con una segunda conexión entre el compensador de carga y el servidor seleccionado, la segunda conexión se establece antes de la primer conexión.|LIOR SHABTAY.*; EYAL AMITAI; DAN BEISER; OFIR FRIEDMAN; GUY KRONENTHAL; 58/20 Harei Yehuda Street, 55900, Ganei Tikva, ISRAEL|AVAYA COMMUNICATION ISRAEL LTD.; Atidim Technologies Park Bldg. 3, 61131, Tel Aviv, , ISRAEL|
266644|Patente|PA/a/2006/012136|20/10/2006|11/05/2009|<i>G05D7/06</i> <b>(2006-01)</b>; <i>F15B13/04</i> <b>(2006-01)</b>; <i>F15B19/00</i> <b>(2006-01)</b>; <i>G05D16/20</i> <b>(2006-01)</b>; <i>G05D7/00</i> <b>(2006-01)</b>|METODO Y APARATO PARA OPERAR UNA VALVULA DE CONTROL POR MEDIO DE UN CICLO DE CONTROL Y REALIZAR DIAGNOSTICOS DE LA MISMA.|Un ciclo de control de una válvula de control se opera utilizando presión de salida de un amplificador neumático como el parámetro de control. El ciclo de control puede operarse de manera continúa en modo de control de presión, o puede cambiarse de otro modo, tal como modo de control de paso, a modo de control de presión en respuesta a ciertas condiciones de operación tal como operación en el rango de corte, operación con el elemento de obstrucción embragando una detención de paso, o como un respaldo en el caso de falla de sensor de parámetro de control primario. La operación del ciclo de control en modo de control de presión permite además que los diagnósticos se realicen en los componentes del ciclo de control aún cuando el sistema está operando en rango de cote o ha embragado una detención de paso. Los diagnósticos pueden realizarse utilizando sensores de presión y desplazamiento normalmente proporcionados con un colocador. Un procesador puede programarse para recibir datos de los sensores y generar señales de falla de acuerdo a una subrutina lógica. La subrutina lógica puede incluir calcular flujo de masa de fluido de control a través de puertos de salida del amplificador neumático y comparar otros parámetros de operación para detectar derrames y bloqueos en los componentes de ciclo de control. Una vez que se detecta una falla, la ubicación de la causa de raíz de la falla puede identificarse al caracterizar los parámetros de operación del ciclo de control en el tiempo de falla.|Kenneth W. Junk; Annette L. Latwesen; 1402 Fairway Drive, 50158, Marshalltown, Iowa, E.U.A.|FISHER CONTROLS INTERNATIONAL LLC; K-Annex, 8100 West Florissant Avenue, 63136, St. Louis, Missouri, E.U.A.|
266645|Patente|PA/a/2006/003052|17/03/2006|11/05/2009|<i>C07D239/42</i> <b>(2006-01)</b>; <i>A61K31/505</i> <b>(2006-01)</b>; <i>A61P3/06</i> <b>(2006-01)</b>|FORMAS POLIMORFICAS DE UN AGENTE ANTI-HIPERLIPEMICO CONOCIDO.|Se describen dos nuevas formas polimórficas de la sal de tris-(hidroxi -metil)-metil- amonio del ácido (E)-7 -[4-(4-fluorofenil) -6-isopropil-2 -[metil(metilsulfonil) amino]-pirimidin -5-il]-(3R, 5S)-3, 5-dihidroxi- hept-6 -enoico (1), procesos para fabricarlas, y su uso en la producción de un producto farmacéutico útil en el tratamiento de, entre otras, hiper-colesterolemia, hiperlipoproteinemia, y ateroesclerosis.|Nigel Philip Taylor; Simon Nicholas Black; Lianne Owens; Kenneth Edwin Herbert Warren; Astrazeneca Charter Way, SK10 2NA, Mcclesfield, Cheshire, REINO UNIDO|ASTRAZENECA UK LIMITED; 15 Stanhope Gate, W1K 1LN, London, Greater London, REINO UNIDO|
266646|Patente|MX/a/2007/000526|12/01/2007|08/05/2009|<i>C07D417/12</i> <b>(2006-01)</b>|PROCESO PARA ELABORAR AZTREONAM.|Se provee un proceso simplificado para la preparación en un recipiente de aztreonam, que utiliza azetidina y TAEM como materiales iniciales, sin la separación intermedia de t-butil-aztreonam.|Domenico Fimognari; Via Pompeo Marchesi No. 13, I-20100, Milán, ITALIA|SICOR INC.*; 19 Hughes , 92618, Irvine, California, E.U.A.|
266647|Patente|PA/a/2006/006956|05/10/2001|11/05/2009|<i>C04B14/38</i> <b>(2006-01)</b>; <i>C04B16/06</i> <b>(2006-01)</b>; <i>C04B20/10</i> <b>(2006-01)</b>|FIBRAS SINTETICAS Y SISTEMAS CEMENTOSOS QUE LAS INCLUYEN.|La presente invención describe nuevas fibras novedosas para uso como materiales de refuerzo secundario en composiciones cementosas, cuyas fibras que son efectivas en la prevención de fractura mucho mejor que las fibras de la técnica anterior. También descritos están los métodos para producir la fibras y métodos para producir composiciones cementosas que contiene las fibras.|DROR SELIVANSKY; 65 Hantke Street, 34608, Haifa, , ISRAEL|DROR SELIVANSKY; 65 Hantke Street, 34608, Haifa, , ISRAEL|
266648|Patente|PA/a/1992/005047|03/09/1992|11/05/2009|<i>C12P13/08</i> <b>(2006-01)</b>; <i>C12N1/20</i> <b>(2006-01)</b>; <i>C12R1/19</i> <b>(2006-01)</b>|PROCEDIMIENTO PARA PRODUCIR L-TREONINA.|La presente invención se refiere a un procedimiento para producir L-treonina, que comprende cultivar un microorganismo productor de L-treonina que pertenece al género Escherichia y que tiene una resistencia cuando menos a uno de L-fenilalanina y L-leucina en un medio hasta que L-treonina se produce y acumula en el cultivo y recuperar de ahí L-treonina.|YOSHIYUKI KURATSU; KUNIKI KINO; JUNICHI TAKANO; KAZUYUKI OKAMOTO; , , JAPON|KYOWA HAKKO BIO CO., LTD.; 1-6-1, Ohtemachi, Chiyoda-ku, Tokio 100-8185, Japón, , JAPON|
266649|Patente|PA/a/1999/000696|18/01/1999|11/05/2009|<i>A47G27/02</i> <b>(2006-01)</b>; <i>A47G27/04</i> <b>(2006-01)</b>|MODULO DE COBERTURA Y LAMINA DE ANCLAJE.|La presente invención se refiere a un módulo de cubierta para formar una superficie de acabado decorativo que comprende: al menos una cubierta decorativa que tiene una superficie decorativa superior y una superficie inferior opuesta, una lámina de anclaje no decorativa tiene una superficie superior y una superficie inferior no decorativa, la cubierta decorativa se une de forma desprendible a través de una porción substancial de su superficie inferior a la lámina de anclaje no decorativa y la lámina de anclaje dimensionada para que, después de la unión de la cubierta decorativa a la lámina de anclaje, se proporcione una área de sobreposición de la superficie superior de la lámina de anclaje expuesta a lo largo de por lo menos un borde del módulo, cuya área de sobreposición es provista con medios para la unión desprendible de dicho módulo a un módulo contiguo por medio de la unión con una área expuesta de sobreposición de la superficie inferior de una cubierta decorativa unida a un módulo contiguo.|JOSEPH ROCCO PACIONE; RR # 2 1865 Hwy. 9, L3Y 4V9, Newmarket, Ontario, CANADA|TAC-FAST SYSTEMS S.A.; Route du Bugnon 15, Case postale 106, CH-1752, Villars-sur-Glâne 2, SUIZA|
266650|Patente|PA/a/2005/001875|16/02/2005|11/05/2009|<i>E04D13/18</i> <b>(2006-01)</b>; <i>H01L31/042</i> (2006-01)|MEMBRANA DE TECHO FOTOVOLTAICA INTEGRADA RIGIDA Y METODOS DE FABRICACION RELACIONADOS DE LA MISMA|En la presente se describen membrana de techo integrada (PV) fotovoltaica alimentada por energía solar, flexible y métodos de manufactura relacionados de dicha membrana. La membrana y métodos descritos proporcionan de manera benéfica energía solar a estructuras ya sea en conexiones fuera de rejilla o en rejilla. La membrana de techo puede comprender múltiples tiras o miembros de membrana que tienen elementos solares fotovoltaicos interconectados eléctricamente. Los miembros de membrana tienen de manera preferible distintos patrones de elementos solares ubicados en los mismos que proporcionan cobertura de secciones enteras, a la instalación, y acomodan también interconexiones entre elementos solares. Además, la membrana aumentará la importancia de los diferentes tipos de patrones para lograr dicha cobertura total y acoplamiento eléctrico propuestos.|McCASKILL, John, R.; MAYTUBBY, C., Daniel; 7912 Goldfinch Drive, 75070, McKinney, Texas, E.U.A.|ELK PREMIUM BUILDING PRODUCTS, INC.; 14911 Quorum Drive, Ste. 600, 75254, Dallas, Texas, E.U.A.|
266651|Patente|PA/a/2005/001874|16/02/2005|11/05/2009|<i>E04D13/18</i> <b>(2006-01)</b>; <i>H01L31/042</i> (2006-01)|MEMBRANA DE TECHO FOTOVOLTAICA INTEGRADA FLEXIBLE Y METODOS DE FABRICACION RELACIONADOS DE LA MISMA.|En la presente se describen membrana de techo integrada (PV) fotovoltaica alimentada por energía solar, flexible y métodos de manufactura relacionados de dicha membrana. La membrana y métodos descritos proporcionan de manera benéfica energía solar a estructuras ya sea en conexiones fuera de rejilla o en rejilla. La membrana de techo puede comprender múltiples tiras o miembros de membrana que tienen elementos solares fotovoltaicos interconectados eléctricamente. Los miembros de membrana tienen de manera preferible distintos patrones de elementos solares ubicados en los mismos que proporcionan cobertura de secciones enteras, a la instalación, y acomodan también interconexiones entre elementos solares. Además, la membrana aumentará la importancia de los diferentes tipos de patrones para lograr dicha cobertura total y acoplamiento eléctrico propuestos.|McCASKILL, John, R.; MAYTUBBY, C., Daniel; 7912 Goldfinch Drive, 75070, McKinney, Texas, E.U.A.|ELK PREMIUM BUILDING PRODUCTS, INC.; 14911 Quorum Drive, Ste. 600, 75254, Dallas, Texas, E.U.A.|
266652|Patente|PA/a/2006/014340|07/12/2006|11/05/2009|<i>H01R13/627</i> <b>(2006-01)</b>|ENSAMBLE DE CERROJO LIBERABLES.|Se describe un dispositivo de cerrojo (200) para uso en el soporte de un bloque de empalmes (202) sobre una ménsula de soporte (204). El dispositivo de cerrojo (200) incluye un soporte horizontal (230) acoplado a una articulación (232). Una primera viga voladiza (234) está acoplada a la articulación y a la estructura de reborde (240). La estructura de reborde (240) incluye rebordes superior e inferior (242, 244). La ménsula de soporte está adaptada para acoplar de manera liberable ya sea el reborde superior (242) o el reborde inferior (244), dependiendo de la posición deseada del bloque de empalmes (202) con relación a la ménsula de soporte (204.)|NORMAN R. BYRNE; 2736 Honey Creek, N.E., 49301, Ada, Michigan, E.U.A.|NORMAN R. BYRNE; 2736 Honey Creek, N.E., 49301, Ada, Michigan, E.U.A.|
266653|Patente|PA/a/2002/009859|04/10/2002|11/05/2009|<i>B32B27/20</i> <b>(2006-01)</b>; <i>B65D65/40</i> <b>(2006-01)</b>; <i>B65D81/30</i> <b>(2006-01)</b>|MATERIAL DE EMPAQUE SELLABLE CON CALOR DE VARIAS CAPAS, UN EMPAQUE DE ALIMENTO ELABORADO DEL MISM0 Y UN METODO PARA EMPACAR.|La invención se refiere a un material de empaque, sellable con calor, de varias capas especialmente para paquetes de alimento. Además, los objetos de la invención son un paquete de alimento formado del material de empaque, un método de empaque y el uso del material para empaques. El material de empaque (1) comprende una capa intermedia (3) de material de fibra, tal como cartón; al menos una capa protectora polimérica (4, 5) que protege el producto para que no se descomponga; y capas de sellado térmico poliméricas (2, 7) de manera preferente en ambos lados del material de empaque. De acuerdo con la invención, la capa de sellado térmico (7) que forma la superficie interior del paquete cerrado, se mezcla con pigmento absorbedor de luz, tal como negro de carbón, para proteger el producto de la luz visible. Al mezclar adicionalmente pigmento blanco, tal como dióxido de titanio, en la capa de sellado térmico (7), se ha logrado un tinte gris que asemeja la hoja de aluminio para la capa. El polímero de sellado térmico puede ser polietileno de baja densidad (PE-LD) y una capa (4) de sellado a prueba de oxígeno y aromas de, por ejemplo, copolímero de etileno-alcohol vinílico (EVOH) o poliamida (PA) se puede proporcionar entre éste y el cartón (3).|PENTTINEN, Tapani; JÄRVINEN, Jalliina; NEVALAINEN, Kimmo; LAIHO, Erkki; SAINIO, Markku; VÄHÄLÄ, Martti; Lökörentie 31, FIN-49210, Huutjärvi, , FINLANDIA|STORA ENSO OYJ; Kanavaranta 1, FIN-00160, Helsinki, , FINLANDIA|
266654|Patente|PA/a/2004/009754|06/10/2004|12/05/2009|<i>D21H21/02</i> <b>(2006-01)</b>; <i>D21H11/14</i> <b>(2006-01)</b>; <i>D21H17/00</i> <b>(2006-01)</b>|TRATAMIENTO DE DEPÓSITO DE RESINA BLANCA.|La presente invención se relaciona con un sistema de control de depósitos, que consiste de un coagulante inorgánico u orgánico (natural o sintético) y un material microparticulado (sintético o natural) como la arcilla de bentonita, polímero reticulado, sílice coloidal, polisilicato para pasta que contiene resina blanca/adherencias.|GORDON CHENG I CHEN.; SWINDELL ALLEN GRIMSLEY; MATTHEW ANTHONY BLAZEY; CHRISTIAN BRUCE EDMONDS; STEPHANIE CAINE WILLIAMS; 4312 Greenleaf Drive, 23321, Chesapeake, Virginia, E.U.A.|CIBA SPECIALTY CHEMICALS WATER TREATMENTS LIMITED; Cleckheaton Road, Col. Low Moor, BD12 0JZ, Bradford, West Yorkshire, REINO UNIDO|
266655|Patente|PA/a/2005/000316|05/01/2005|12/05/2009|<i>G01N29/00</i> <b>(2006-01)</b>|TRANSDUCTORES ACUSTICOS PARA TUBERIAS.|Los transductores acústicos están configurados con elementos transductores colocados sobre un arco o miembro de forma arqueada adaptado para encajar en yuxtaposición alrededor de la tubería. El miembro de forma arqueada está adaptado con conductores para proveer un voltaje a los elementos transductores. Una personificación usa un miembro metálico de forma arqueada. Las personificaciones implementadas como fuentes se usan para excitar los modos acústicos del pozo perforado. Algunas personificaciones proveen una recepción de excitación/señales de energía acústica de conjunto de fases. Los transductores se cubren con un sellador en una configuración libre de líquidos y se usan escudos para proteger los transductores.|GARCIA-OSUNA, Fernando; JEAN PIERRE MASON; 5410 Eagle Trace Ct., 77479, Sugar Lnad, Texas, MEXICO|SCHLUMBERGER TECHNOLOGY B.V.; Parkstraat 83-89, 2514, JG The Hague, PAISES BAJOS|
266656|Patente|PA/a/2006/007648|03/07/2006|12/05/2009|<i>C07D487/22</i> <b>(2006-01)</b>; <i>C10L1/00</i> <b>(2006-01)</b>; <i>G01N33/28</i> <b>(2006-01)</b>|USO DE FTALOCIANINAS COMO SUSTANCIAS MARCADORAS PARA LIQUIDOS.|La presente invención se refiere al uso de ftalocianinas especiales, que llevan sustituyentes ligados por medio de grupos metileno con el esqueleto de ftalicianina, como sustancias marcadoras para líquidos, especialmente, aceites minerales, a líquidos, especialmente, aceites minerales, que contienen por lo menos una ftalocianina de este tipo como sustancia marcadora, así como a ftalocianinas especiales, que llevan sustituyentes ligados por medio de grupos metileno con el esqueleto de ftalicianina.|RÜDIGER SENS; SOPHIA EBERT; CHRISTOS VAMVAKARIS; THOMAS GESSNER; Richard-Wagner-Str. 53, 68165, Mannheim, ALEMANIA|BASF AKTIENGESELLSCHAFT.*; Carl-Bosch-Strasse 38, 67056, Ludwigshafen, ALEMANIA|
266657|Patente|MX/a/2007/000078|08/01/2007|12/05/2009|<i>B60R22/34</i> <b>(2006-01)</b>|RETRACTOR DE CINTURON DE ASIENTO DE LIMITACION DE CARGA.|La presente invención se refiere a un retractor de cinturón de asiento que comprende: un carrete para alargamiento de cinturón de asiento y para retracción de cinturón de asiento, un mecanismo de absorción de energía para absorber energía del carrete durante el alargamiento de cinturón de asiento, el mecanismo de absorción de energía teniendo una primera parte para un régimen relativamente elevado de absorción de energía y una segunda parte para un régimen relativamente bajo de absorción de energía; y un mecanismo de desplazamiento configurado para desplazarse entre la primera parte y la segunda parte, el mecanismo de desplazamiento comprendiendo un enlace movible entre una primera posición de enlace en donde la primera parte está acoplada con el carrete y una segunda posición de enlace en donde la segunda parte está acoplada con el carrete, el enlace impulsable entre la primera posición de enlace y la segunda posición de enlace por la energía del alargamiento de cinturón de asiento.|KENNETH KOHLNDORFER; RICHARD KONING; MARK GRAY; 28720 Kaufman, 48066, Roseville, MI, E.U.A.|KEY SAFETY SYSTEMS, INC.; 7000 Nineteen Mile Road, 48314, Sterling Heights, MI, E.U.A.|
266658|Patente|PA/a/2005/000694|22/08/2001|12/05/2009|<i>B01J23/755</i> <b>(2006-01)</b>; <i>B01J23/76</i> <b>(2006-01)</b>; <i>C01G53/04</i> <b>(2006-01)</b>; <i>C07C5/48</i> <b>(2006-01)</b>|COMPOSICIONES QUE COMPRENDEN NÍQUEL Y SU USO COMO CATALIZADORES EN LA DESHIDROGENACIÓN OXIDANTE DE ALCANOS|Se divulgan catalizadores y métodos para la oxideshidrogenación de alcanos. Los catalizadores de la presente invención comprenden generalmente (i) níquel o bien un compuesto que contiene níquel y (ii) por lo menos uno o varios de los siguientes: titanio (Ti), tantalio (Ta), niobio (Nb), hafnio (Hf), tungsteno (W)1 itrio (Y), zinc (Zn), zirconio (Zr), o bien aluminio (Al), o un compuesto que contiene uno o varios de estos elementos. En modalidades preferidas, el catalizador es un catalizador soportado, el alqueno es seleccionado dentro del grupo que consiste de etano, propano, isopropano, isobutano, n-butano y cloruro de etilo, oxígeno molecular es co alimentado con el alcano a una zona de reacción mantenida a una temperatura que se encuentra dentro de un rango de aproximadamente 250ºC a aproximadamente 350° C, y el etano es deshidrogenado de manera oxidante para formar el alqueno correspondiente con una conversión de alcano de por lo menos aproximadamente 10% y una selectividad de alqueno de por lo menos aproximadamente 70%.|LIU, Yumin; 4270 Albany Drive, Col. H106, 95129., San Jose, California, CHINA|CELANESE INTERNATIONAL CORPORATION.*; 1601 West LBJ Freeway, 75234-6034, Dallas, Texas, E.U.A.|
266659|Patente|PA/a/2004/005274|02/06/2004|12/05/2009|<i>A61J1/06</i> <b>(2006-01)</b>; <i>A61M5/24</i> <b>(2006-01)</b>|MEJORAS EN Y RELACIONADAS CON UN CARTUCHO DE MEDICAMENTO.|Una persona diabética con frecuencia necesitará tomar las formas de insulina de acción lenta y de acción rápida. Es importante distinguir fácilmente entre cartuchos de medicamentos que contengan diferentes medicamentos. La presente invención permite la diferenciación más sencilla entre cartuchos de medicamentos que contengan diferentes medicamentos. Un remate adaptador para un cartucho de medicamento, el cartucho de medicamento consiste en un cilindro que tiene una porción cuerpo principal, una porción cuello en un primer extremo que tiene una porción brida dirigida radialmente hacia fuera, una porción hombro más angosta que conecta la porción cuerpo y la porción cuello, una tapa rebordeada a través del primer extremo con lo cual retiene una membrana impermeable a los fluidos, y el remate adaptador consistente en una primera porción cuerpo cilíndrica que tiene una brida dirigida radialmente hacia el interior en un extremo, para estar asentada durante el uso sobre y contra la tapa, y una segunda faldilla cilíndrica adaptada, para durante el uso estar asentada contra la porción hombro del cartucho, la segunda porción faldilla incluye una pluralidad de dedos, los extremos libres de los dedos durante el uso se adaptan para estar asentados por debajo de la brida dirigida hacia fuera del cartucho de medicamento.|ROBERT WOOLSTON; 3 Chestnut Grove, CV35 9DG, Moreton Morrell, Warwickshire, REINO UNIDO|DCA DESIGN INTERNATIONAL LIMITED.*; 19 Church Street, CV34 4AB, Warwick, REINO UNIDO|
266660|Patente|PA/a/2006/004577|25/04/2006|12/05/2009|<i>B01D53/04</i> <b>(2006-01)</b>|FILTRO DE GAS DE ESCAPE Y SISTEMA DE FILTRACION.|Se describe un cartucho de filtro de gas de escape que es adecuado para uso en un silenciador para formar un sistema de filtración de gas de escape. El cartucho de filtro incluye de manera preferible una primera pared longitudinal porosa y una segunda pared longitudinal porosa, ambas paredes longitudinales porosas que tienen aberturas que permiten un flujo de gas suficiente a través del cartucho de filtro. Un material absorbente, de preferencia en forma de pella, está alojado entre la primera pared longitudinal porosa y la segunda pared longitudinal porosa. De manera preferible, el cartucho de filtro es desechable. Se puede utilizar una cubierta protectora en conjunción con el cartucho de filtro para proporcionar un sistema de filtración de gas de escape. De preferencia, la cubierta protectora tiene dos estructuras de cierre extremas. De modo preferible, una estructura extrema de entrada del gas está asociada con una estructura de cierre extrema y una estructura extrema de salida del gas puede estar asociada con la otra estructura de cierre extrema de la cubierta protectora.|ROBERT R. SEWELL, SR.; P.O. Box 604, 83338, Jerome, Idaho, E.U.A.|AIR INSTITUTION, INC.; 1775 W. El Coyote, 85606, Cochise, Arizona, E.U.A.|
266661|Patente|PA/a/2006/003725|03/04/2006|12/05/2009|<i>A61K31/4458</i> <b>(2006-01)</b>; <i>A61K47/12</i> <b>(2006-01)</b>; <i>A61K9/08</i> <b>(2006-01)</b>; <i>A61K31/4458</i> <b>(2006-01)</b>; <i>A61K47/26</i> <b>(2006-01)</b>; <i>A61K9/08</i> <b>(2006-01)</b>|SOLUCION DE FENIDATO DE METILO Y METODOS ASOCIADOS DE ADMINISTRACION Y PRODUCCION.|La presente invención describe una solución de fenidato de metilo y métodos asociados de administración y producción, que incluye fenidato de metilo y por lo menos un ácido orgánico disuelto en un sistema de solvente, en donde el sistema de solvente incluye por lo menos un solvente no acuoso. El sistema de solvente puede incluir agua. El solvente no acuoso puede incluir, pero no se limita a polioles y glicoles y mezclas asociadas de los mismos. Los aditivos farmacéuticos, tales como saborizantes, colorantes, amortiguadores, conservadores y mezclas de los mismos pueden adicionarse opcionalmente a la solución de fenidato de metilo.|CLIFFORD J. HERMAN; 216 Portland Terrace, 63119, St. Louis, Missouri, E.U.A.|MALLINCKRODT INC.*; 675 McDonnell Boulevard, 63134, St. Louis, Missouri, E.U.A.|
266662|Patente|PA/a/2006/001284|31/01/2006|12/05/2009|<i>B01J19/00</i> <b>(2006-01)</b>; <i>F28D9/00</i> <b>(2006-01)</b>|PROCESO PARA LA ELIMINACION DE COMPUESTOS VOLATILES DE MEZCLAS DE SUSTANCIAS UTILIZANDO UN MICRO-EVAPORADOR.|La invención se relaciona con un método para eliminar al menos un compuesto volátil de una mezcla reactiva o no reactiva con la ayuda de por lo menos un micro-evaporador. El micro-evaporador comprende canales para dirigir la mezcla, los cuales tienen un diámetro hidráulico de 5 a 1000 µm y una superficie de evaporación específica mínima de 103 m2/m3.|KURT-MANFRED KÜPPER.; OSWALD WILMES; HARTMUT STEENBECK; ALMUT SANCHEN; Fritz-Reuter-Str. 2a, 18225, Kühlungsborn, ALEMANIA|BAYER MATERIALSCIENCE AG; , 51368, Leverkusen, ALEMANIA|
