Número de concesión|Tipo de documento|Número de solicitud|Fecha de presentación|Fecha de concesión|Clasificación CIP|Título|Resumen|Inventor(es)|Titular
266919|Patente|PA/a/2006/005764|19/05/2006|22/05/2009|<i>B65D1/02</i> <b>(2006-01)</b>; <i>B29C49/00</i> <b>(2006-01)</b>|UNA PREFORMA DE UN CONTENEDOR DE PLASTICO PARTICULARMENTE DISEÑADO PARA EMPACAR ALIMENTOS.|Esta invención se refiere a la preforma para producir un contenedor de plástico para empacar alimentos, y especialmente para moldear por soplado contenedores de paredes delgadas que pueden cerrarse herméticamente con una tapa de metal mediante doble costura. La preforma (1) incluye un cuerpo (4) y un fondo (6) hemisférico convexo. El cuerpo (4) tiene una forma cónica que sobresale hacia un cuello cilíndrico (2) rodeado por un reborde (3) que termina en un borde engrosado (5). Preferentemente, el ángulo (() en el cual la superficie interna del cuerpo (4) sobresale hacia el cuello cilíndrico es mayor que el ángulo (() en el cual la superficie externa del cuerpo (4) se abre hacia arriba, y el grosor (g2) del cuello cilíndrico (2) es menor que el grosor (g3) del fondo (6).|BOGUMIL MILKOWSKI; DARIUSZ LEWANDOWSKI; ANDRZEJ TOBOROWICZ; Ul. Wojskiego 28, PL-80-119, Gdansk, POLONIA|INVENTO SPOLKA Z O.O.; Ul Wilcza 50/52 Lok 706, PL-00679, Warszawa, POLONIA|
266920|Patente|PA/a/2005/006651|17/06/2005|22/05/2009|<i>A61B5/15</i> <b>(2006-01)</b>|DISPOSTIVO Y METODO PARA RECEPCION DE UN FLUIDO CORPORAL PARA ANALISIS.|La presente invención se refiere a un dispositivo para recibir un fluido corporal para análisis que comprende un recipiente (10) y al menos una unidad (14) receptora de la muestra en la que puede incidir el fluido corporal en un punto (22) de recepción y la cual se puede extraer de una cámara (12) de guía del recipiente mediante una unidad (20) de impulsión. De conformidad con la invención se proporciona un dispositivo (18) de acoplamiento para acoplar la unidad (14) receptora de la muestra a la unidad (20) de impulsión para asegurar el movimiento de vaivén entre la cámara (12) de guía y el punto (22) de recepción.|KLAUS-DIETER SACHERER; RONALD MÖNCH; MICHAEL SCHABBACH; JÖRG SCHERER; Westring 17, 67281, Kirchheim, ALEMANIA|F. HOFFMANN-LA ROCHE AG.*; Grenzacherstrasse 124, CH-4070, Basel, SUIZA|
266921|Patente|PA/a/2006/014000|30/11/2006|22/05/2009|<i>B23K9/173</i> <b>(2006-01)</b>|SOLDADURA POR ARCO ENTERRADO DE METAL GAS DE JUNTAS DE TRASLPE-PENETRACION.|Se describe un método de soldadura continua o intermitente de juntas de traslape-penetración que usa un proceso de soldadura por arco enterrado de metal de gas (GMBA). Un primer componente (22) es soldado por GMBA a un segundo componente (24) de metal subyacente, mediante formación de un arco (28) entre un electrodo (26) de metal consumible y una superficie el primer componente (22), deposición de metal del electrodo (26) al primer componente (22) y producir una acumulación de metal fundido (10) que se extiende a través del primer componente (22) y producir una acumulación de metal fundido (10) que se extiende a través del primer componente (22) y al segundo componente (24). El metal acumulado fundido se solidifica a una soldadura (30) que se extiende al segundo componente (24) en donde el ancho de la soldadura en la internase entre los componentes es por lo menos igual al espesor del mas delgado del primer componente (22) y en el segundo componente (24). El arco es enterrado por lo menos parcialmente dentro del espesor del primer componente y es movido en la dirección de la ubicación de junta deseada para producir una junta.|ISRAEL STOL; KYLE L. WILLIAMS; 639 Rock-Springs Road, 15228, Pittsburgh, Pennsylvania, E.U.A.|ALCOA INC.*; Alcoa Corporate Center, 201 Isabella Street, 15212-5858, Pittsburgh, Pennsylvania, E.U.A.|
266922|Patente|PA/a/2006/000731|19/01/2006|22/05/2009|<i>B01F13/00</i> <b>(2006-01)</b>; <i>A61K9/00</i> <b>(2006-01)</b>; <i>B01F5/04</i> <b>(2006-01)</b>|ENVASE DE COMPONENTES MULTIPLES CON MICROMEZCLADOR ESTATICO.|La presente invención se refiere a un sistema de envase que contiene un micro-mezclador estático y permite la producción de formulaciones que consisten de al menos dos componentes justo antes de la aplicación. El micro-mezclador estático comprende componentes con forma de placa, siendo que en la placa (1) se proporciona al menos una entrada (2) para suministrar al menos un flujo de fluido a un canal (3) de conexión que se localiza en el plano de la placa, y al menos una salida (4) para descargar el flujo del líquido a una zona (5) de mezclado localizada en el plano de la placa. La entrada (2) se comunica con las salidas (4) mediante el canal (3) de conexión localizado en el plano del plato, y el canal de conexión se divide en al menos dos canales (7) parciales mediante unidades (6) micro-estructuradas antes de desembocar en la zona (5) de mezclado. De acuerdo a la invención, las anchuras de los canales parciales se encuentran en el intervalo milimétrico a submilimétrico y son menores que la anchura de la zona (5) de mezclado.|GERHARD SCHANZ; GERHARD SENDELBACH; Klausenburger Str. 128, D 64295, Darmstadt, ALEMANIA|WELLA AKTIENGESELLSCHAFT; Berliner Allee 65, D-64274, Darmstadt, ALEMANIA|
266923|Patente|MX/a/2007/004546|16/04/2007|22/05/2009|<i>C09D5/44</i> <b>(2006-01)</b>; <i>C08G18/42</i> <b>(2006-01)</b>; <i>C08G18/60</i> <b>(2006-01)</b>|COMPOSICIONES DE RECUBRIMIENTO POR ELECTRODEPOSICION CATODICA QUE CONTIENEN UN AGENTE ANTI-CRATER.|Una composición de recubrimiento por electrodeposición catódica acuosa mejorada que contiene un agente anti-cráter que es una resina de poliéster reducible en agua que tiene un valor de acidez menor de 40 mg de KOH/g. El poliéster reducible en agua es el producto de reacción de (1) un carbonato cíclico de hidroxilo; (2) un anhídrido ácido policarboxílico; (3) una resina epoxi monofuncional opcional; (4) una resina epoxi polifuncional; y (5) un compuesto de poliamina que contiene una amina terciaria y ya sea una funcionalidad primaria o secundaria. El producto de reacción se neutraliza en presencia de ácido y agua para convertir los grupos amina terciarios en grupos que se pueden diluir en agua. Los grupos silanos hidrolizables también pueden incorporarse en el producto de reacción para mejorar más su propiedad de resistencia a la formación de cráteres. La composición de recubrimiento por electrodeposición produce recubrimientos que tienen una apariencia más uniforme con muy pocos cráteres sin afectar adversamente la adhesión de las capas internas de la película curada con las capas de recubrimiento posteriores aplicadas sobre esta.|ALLISA GAM; ANDREAS FIEBERG; THOMAS GRAWE; JOACHIM RUERUP; 5049 Longview Drive, 48098, Troy, Michigan, E.U.A.|E.I. DU PONT DE NEMOURS AND COMPANY. *; 1007 Market Street, 19898, Wilmington, Delaware, E.U.A.|
266924|Patente|MX/a/2007/004545|16/04/2007|22/05/2009|<i>C09D5/44</i> <b>(2006-01)</b>; <i>C08G18/42</i> <b>(2006-01)</b>; <i>C08G18/60</i> <b>(2006-01)</b>|COMPOSICIONES DE RECUBRIMIENTO POR ELECTRODEPOSICION CATODICA QUE CONTIENEN UN AGENTE ANTI-CRATER.|Una composición de recubrimiento por electrodeposición catódica acuosa mejorada que contiene un agente anti-cráter que es una resina de poliéster reducible en agua que tiene un valor de acidez menor de 40 mg de HOH/g. El poliéster reducible en agua es el producto de reacción de (1) un carbonato cíclico de hidroxilo; (2) un anhídrido de ácido policarboxílico; (3) una resina epoxi monofuncional opcional; (4) una resina de isocianato polifuncional; y (5) un compuesto de poliamina que contiene una amina terciaria y ya sea una funcionalidad primaria o secundaria. El producto de reacción se neutraliza en presencia de ácido y agua para convertir los grupos amina terciarios en grupos que se pueden diluir en agua. Los grupos silanos hidrolizables también pueden incorporarse en el producto de reacción para mejorar más su propiedad de resistencia a la formación de cráteres. La composición de recubrimiento por electrodeposición produce recubrimientos que tienen una apariencia más uniforme con muy pocos cráteres sin afectar adversamente la adhesión de las capas internas de la película curada con las capas de recubrimiento posteriores aplicadas sobre esta.|ALLISA GAM; ANDREAS FIEBERG; THOMAS GRAWE; JOACHIM RUERUP; 5049 Longview Drive, 48098, Troy, Michigan, E.U.A.|E.I. DU PONT DE NEMOURS AND COMPANY. *; 1007 Market Street, 19898, Wilmington, Delaware, E.U.A.|
266925|Patente|MX/a/2007/007256|15/06/2007|22/05/2009|<i>A01N43/40</i> <b>(2006-01)</b>; <i>C07D213/50</i> <b>(2006-01)</b>; <i>C07D213/80</i> <b>(2006-01)</b>|CETONAS DE PIRIDINA CON EFECTO HERBICIDA.|La invención se refiere a compuestos de la fórmula (I) en donde A1 es C(R1R2)p, A2 es C(R6R7)q, p es 1 ó 2; q es 1 ó 2; cada uno de R1, R2, R3, R4, R5, R6, R7 y R8 los cuales pueden ser los mismos o diferentes, representa hidrógeno, metilo o etilo y R9 es alquilo de C1-C4; R10 es hidrógeno, halógeno, alquilo de C1-C3 o haloalquilo de C1-C3 y sales/isómeros/enantiómeros/tautómeros/N-óxidos agronómicamente aceptables de estos compuestos.|CHRISTOPH LÜTHY; ANDREW EDMUNDS; RENAUD BEAUDEGNIES; JÜRGEN SCHAETZER; SEBASTIAN VOLKER WENDEBORN; Syngenta Crop Protection AG, Schwarzwaldallee 215, 4058, Basel, SUIZA|SYNGENTA PARTICIPATIONS AG; Schwarzwaldallee 215, CH-4058, Basel, SUIZA|
266926|Patente|MX/a/2007/009220|31/07/2007|22/05/2009|<i>C08L69/00</i> <b>(2006-01)</b>; <i>C08K3/26</i> <b>(2006-01)</b>|MASAS DE MOLDEO DE POLICARBONATO CON UNA MEJOR RESISTENCIA A LA HIDROLISIS.|La presente invención se refiere a composiciones de policarbonato que contienen resina vinílica modificada con caucho, en especial un copolímero de acrilonitrilo/ butadieno/ estireno (ABS), y que contienen carbonatos cálcicos del orden de nanómetros con un tamaño medio de partícula inferior a 100 nm para mejorar el comportamiento frente a la hidrólisis conservando la tenacidad.|HOLGER WARTH.*; ECKHARD WENZ.*; HERBERT EICHENAUER.*; THOMAS ECKEL; OLAF MEINCKE; Flat A, 15/F., The Harbourview, 11 Magazine Gap Road, The Peak, The Peak, Hong Kong, ALEMANIA|BAYER MATERIALSCIENCE AG; , 51368, Leverkusen, ALEMANIA|
266927|Patente|PA/a/2006/001924|17/02/2006|22/05/2009|<i>B60G11/12</i> <b>(2006-01)</b>|COJINETE ANTI-PARADA DE TUBO EXTERNO DIVIDIDO.|La presente invención se refiere a un cojinete pivote para un sistema de suspensión que tiene un metal interno y un metal externo dividido con un cojinete elastomérico colocado entre los metales. El metal externo dividido tiene un extremo que está cerrado parcialmente por una porción curva hacia adentro y un extremo del cual está abierto. El montaje del cojinete es por medio del extremo abierto. Una vez ensamblado el extremo abierto es cerrado colocando una cubierta sobre el extremo abierto y plegando la cubierta hasta una saliente formada en el extremo abierto. En otra modalidad, la cubierta es insertada en el metal externo y el metal externo dividido es doblado para asegurar la cubierta en su lugar.|RONALD J. MCLAUGHLIN; JEFF RAYMOND; 6423 Cedar Court, 43537, Maumee, Ohio, E.U.A.|THE PULLMAN COMPANY; 33 Lockwood Road, 44846, Milan, Ohio, E.U.A.|
266928|Patente|PA/a/2006/001001|25/01/2006|22/05/2009|<i>B62D21/00</i> <b>(2006-01)</b>; <i>F16F13/00</i> <b>(2006-01)</b>|MONTURA DE CARROCERIA AMORTIGUADA HIDRAULICAMENTE CON CONSTRUCCION DE PERNO PASANTE.|Una montura tiene un metal interno y un metal externo con un cojinete elastomérico dispuesto entre ellos. El cojinete elastomérico incluye un primer par de pasajes interconectados para controlar la velocidad de amortiguamiento durante el movimiento axial y un segundo par separado de pasajes interconectados para controlar la velocidad de amortiguamiento durante el movimiento ortogonal a la dirección axial.|ROBERT J. GOUDIE; 11901 Gamsey Avenue, 49414, Grand Haven, Michigan, E.U.A.|THE PULLMAN COMPANY; 33 Lockwood Road, 44846, Milan, Ohio, E.U.A.|
266929|Patente|PA/a/2004/010607|26/10/2004|22/05/2009|<i>F28D9/00</i> <b>(2006-01)</b>; <i>F28F3/02</i> <b>(2006-01)</b>|INTERCAMBIADOR DE CALOR Y MÉTODO DE MANUFACTURA DEL MISMO.|Un intercambiador de calor (1) comprende dos conjuntos de canales de flujo directo del medio (P, S), a través de los cuales pueden fluir dos medios en contacto de intercambio de calor; paredes (2) que separan los canales; aletas de conducción de calor (3-8) colocadas en ambos lados de cada pared (2), en donde una aleta en un lado de una pared se encuentra en contacto térmico con una superficie similar de contacto de una aleta en el otro lado de esta pared, en donde las paredes (2) son incluidas como la membrana y las aletas (3-8) son incluidas como tiras de transferencia de calor con una forma general de onda y son proporcionadas con superficies de contacto acopladas con las paredes y planos principales que se extienden entre las dos paredes.|JOHANNES ANTONIUS MARIA REINDERS; Oude Warkenseweg 1, NL-7231, PE Warnsveld, PAISES BAJOS|OXYCELL HOLDING B.V.; Kaagstraat 17-19, NL-8102, GZ Raalte, PAISES BAJOS|
266930|Patente|PA/a/2006/002311|28/02/2006|22/05/2009|<i>C12Q1/68</i> <b>(2006-01)</b>|EPITOPOS DE CELULAS T CD8+ DEL VIRUS DEL PAPILOMA HUMANO (VPH).|La presente invención se refiere a los medios para identificar los epitopos de células T CD8+ funcionales, en cualquier proteína de interés. La presente invención proporciona además los epitopos de células T CD8+ de diversas proteínas. En moderadores opcionales, la presente invención proporciona los epitopos adecuados para el uso en las vacunas profilácticas y/o terapéuticas. En modalidades particularmente preferidas, la presente invención proporciona los epitopos modificados adecuados para el uso en vacunas profilácticas y/o terapéuticas. En algunas modalidades preferidas, la presente invención proporciona los medios para el desarrollo de vacunas de HPV, en particular vacunas multivalentes para la prevención de infección con cepas de HPV de alto riesgo. En particular, la presente invención proporciona los medios para identificar los epitopos de células T CD8+ en cepas de HPV tales como HPV 16 y HPV 18. En modalidades adicionales, la presente invención proporciona los medios para el desarrollo de vacunas terapéuticas contra los tipos de HPV de alto riesgo que previenen el desarrollo de tumores benignos y/o malignos en individuos infectados. La presente invención proporciona además los epitopos adecuados para el uso en vacunas profilácticas y terapéuticas.|FIONA A. HARDING; JEANETTE MARIE MUCHA; 925 Page Mill Road, 94304, Palo Alto, California, E.U.A.|GENENCOR INTERNATIONAL, INC.*; 925 Page Mill Road, 94304, Palo Alto, California, E.U.A.|
266931|Patente|PA/a/2005/001355|02/02/2005|22/05/2009|<i>C12N15/11</i> <b>(2006-01)</b>; <i>A01K67/027</i> <b>(2006-01)</b>; <i>A61K31/713</i> <b>(2006-01)</b>; <i>C07H21/00</i> <b>(2006-01)</b>; <i>C12N5/10</i> <b>(2006-01)</b>; <i>C12Q1/68</i> <b>(2006-01)</b>|FORMAS NUEVAS ADICIONALES DE MOLECULAS DE ARN DE INTERFERENCIA.|La presente invención se refiere a un ácido ribonucleico que comprende una estructura de hebra doble en donde la estructura de hebra doble comprende una hebra y una segunda hebra, en donde la primera hebra comprende una primera extensión de nucleótidos contiguos y en donde la primera extensión es por lo menos parcialmente complementaria a un ácido nucleico objetivo, y la segunda hebra comprende una segunda extensión de nucleótidos contiguos en donde la segunda extensión es por lo menos parcialmente idéntica al ácido nucleico objetivo, y en donde la estructura de hebra doble tiene el extremo embotado.|GIESE, Klaus; KAUFMANN, Jörg; KLIPPEL-GIESE, Anke; Barbarossastrasse 44, 10779, Berlin, , ALEMANIA|ATUGEN AG; Robert-Rössie-Strasse 10, 13125, Berlin, , ALEMANIA|
266932|Patente|PA/a/2005/003089|18/03/2005|22/05/2009|<i>C07C271/16</i> <b>(2006-01)</b>; <i>C07C309/65</i> <b>(2006-01)</b>; <i>C07C59/01</i> <b>(2006-01)</b>; <i>C07D205/08</i> <b>(2006-01)</b>; <i>C07D207/16</i> <b>(2006-01)</b>|PROCESO PARA PREPARAR INTERMEDIARIOS.|La presente invención se dirige a un proceso para preparar intermediarios que son útiles para preparar ciertos compuestos antibacterianos de hidroxilamina N-formilo, los cuales son inhibidores de deformilasa de péptido. El proceso hace uso de un intermediario a ß-lactam. También se reclaman ciertos intermediarios ópticamente puros.|MAHAVIR PRASHAD; GEORGE TIEN-SAN LEE; PRASAD KOTESWARA KAPA; XINGLONG JIANG; ERIC M. LOESER; JOEL SLADE; 4 Faber Road, 07054, Parsippany, New Jersey, E.U.A.|NOVARTIS AG.*; Lichtstrasse 35, CH-4056, Basilea, SUIZA|
266933|Patente|PA/a/2005/009369|02/09/2005|22/05/2009|<i>G06F17/30</i> <b>(2006-01)</b>|BUSQUEDA SIMPLIFICADA DE SERVICIOS DE MEDIOS CON EL USO DE UN DISPOSITIVO DE CONTROL.|Se describen un método y aparato para buscar un contenido de medio relacionado con un servicio de medios seleccionado, el servicio de medios seleccionado según se selecciona con el indicador operable por el usuario, tiene metadatos que se utilizan como la base de un cuestionario (405) de búsqueda. Una vez que se formula (415) el cuestionario de búsqueda, el cuestionario se presenta al motor de búsqueda que regresa los resultados de búsqueda del contenido de medios relacionado con el servicio de medios seleccionado. El contenido (435) de medios se puede entonces seleccionar de los resultados de búsqueda regresados para generarse en un ambiente generador.|Rajeev Madhukar Sahasrabudhe; Barry Jay Weber; Jennifer Lynn Kolar; 12979 Camborne Court, 46033, Carmel, Indiana, INDIA|THOMSON LICENSING; 46, Quai A. Le Gallo, F-92100, Boulogne-Billancourt, , FRANCIA|
266934|Patente|PA/a/2005/010442|28/09/2005|22/05/2009|<i>A61B10/00</i> <b>(2006-01)</b>|UNIDAD GENERADORA DE PRESION.|La invención se relaciona con unidades generadoras de presión, en particular a una unidad generadora de presión arreglada en la pieza manual de un dispositivo de biopsia de vacío en la forma de una jeringa (2). En tales unidades, la entrada de aire está abierta por un pistón, cuando el pistón (5) está en la posición trasera del mismo en el espacio del cilindro vacío (11) que se cambia para generar una sobrepresión, lo cual inicia el flujo de salida del líquido de tejido por el aire introducido dentro del espacio del cilindro vacío. Para este propósito, el espacio del cilindro vacío se conecta con el espacio de un cilindro (12) de presión atmosférica arreglado detrás del pistón, por medio de una línea de conexión (15), y un elemento (14) absorbente se coloca en el eje del pistón.|Norbert F. Heske; Dorfstrasse 22a, 82288, Kottgeisering, , ALEMANIA|C.R. BARD, INC.*; 730 Central Avenue, 07974, Murray Hill, New Jersey, E.U.A.|
266935|Patente|PA/a/2006/003285|23/03/2006|22/05/2009|<i>H04N7/26</i> <b>(2006-01)</b>|TECNICA PARA SIMULAR EL GRANO DE PELICULA CON EL USO DE FILTRACION DE FRECUENCIA.|La simulación de grano de película en una imagen puede ocurrir al comprimir una imagen de video, después transmitir el video comprimido junto con un mensaje que contiene por lo menos un parámetro indicativo del grano de película original, a un decodificador, y restaurar la apariencia granulosa original de imágenes al tener al decodificador que simula el grano de película con base en el contenido del mensaje de grano de película. Para mejorar la eficiencia, uno o más parámetros de la información de grano de película experimentan el escalamiento de conformidad con un tamaño de bloque de píxel destino en la imagen. Tal escalamiento permite el uso de circuitería convencional para llevar a cabo operaciones con base en bloque en conexión con la simulación de grano de película.|Jill MacDonald Boyce; Joan Llach; Alexandros Tourapis; 25C Chestnut Court, 08540, Princeton, New Jersey, E.U.A.|THOMSON LICENSING; 46, Quai A. Le Gallo, F-92100, Boulogne-Billancourt, , FRANCIA|
266936|Patente|PA/a/2006/009127|10/08/2006|22/05/2009|<i>H04L27/00</i> <b>(2006-01)</b>; <i>H04B7/185</i> <b>(2006-01)</b>; <i>H04L27/34</i> <b>(2006-01)</b>|METODO Y APARATO PARA LA RECUPERACION DE ONDA PORTADORA EN UN SISTEMA DE COMUNICACIONES.|Un sistema de comunicaciones de satélite comprende un transmisor, un transpondedor de satélite y un receptor. El transmisor transmite una señal de modulación en capas de enlace ascendente que tiene una capa superior y una capa inferior al transpondedor de satélite, que transmite el enlace descendente de señal de modulación en capas a uno, o más receptores. El receptor recibe la señal de modulación en capas (la señal recibida) y realiza desmodulación y descodificación del componente de señal de capa inferior del mismo al utilizar una onda portadora recuperada para des-rotar la señal recibida, en donde la onda portadora recuperada se desarrolla por un procedimiento de recuperación de onda portadora por decisiones suaves con respecto al componente de señal de capa superior de la señal recibida.|Joshua Koslov; 10 Fairway Drive, 08525, Hopewell, New Jersey, E.U.A.|THOMSON LICENSING; 46, Quai A. Le Gallo, F-92100, Boulogne-Billancourt, , FRANCIA|
266937|Patente|PA/a/2006/009559|22/08/2006|22/05/2009|<i>G02B5/30</i> <b>(2006-01)</b>|SISTEMA DE RECUPERACION DE POLARIZACION SIMPLIFICADO.|Se proporciona una fuente de luz polarizada que comprende una lámpara que proporciona luz aleatoriamente polarizada, un integrador para dirigir la luz desde la lámpara generalmente a lo largo de un eje del integrador, y un polarizador de rejilla de alambre dispuesto en un extremo del integrador. Esta fuente de luz polarizada recupera una porción de la luz producida por la lámpara que tiene una polarización no deseada. También se proporciona un Cristal Líquido en una máquina de luz de Silicio (LCOS) que incluye una fuente de luz polarizada con recuperación de polarización.|Valter Drazic; Estill Thone Hall, Jr.; Jason Alan Ridenour; 9978 Niagara Drive, 46038, Fishers, Indiana, FRANCIA|THOMSON LICENSING; 46, Quai A. Le Gallo, F-92100, Boulogne-Billancourt, , FRANCIA|
266938|Patente|PA/a/2006/010660|18/09/2006|22/05/2009|<i>H02G3/08</i> <b>(2006-01)</b>|AISLANTE DE CONDUCTOR CATODICO.|Una tapa (8) protectora para adherirse a un sustrato que incluye una lámina (10) de base esencialmente plana, un domo (15) extendido hacia fuera desde el lado anverso de la lámina de base y forma una cavidad en el lado opuesto de la lámina de base con la cavidad con las dimensiones para encapsular esencialmente un conector (37). La tapa también incluye una cubierta (20) semi-tubular extendida hacia fuera desde un lado de la lámina de base, la cual define un canal en el lado opuesto de la lámina de base extendida desde la cavidad hacia la periferia de la lámina de base y una capa (30) de imprimador integrada que comprende un adhesivo sensible a la presión y acoplada con un lado invertido de la lámina de base para su aplicación con el sustrato.|Fred Fischer; Gregg Pelagio; Dave Stephens; Richard C. Reeves; DONALD H. KATHREIN; , Pittsburgh, Pennsylvania, E.U.A.|CHASE CORPORATION; Royston Laboratories Division 128 First Street (Blawnox), 15238, Pittsburgh, Pennsylvania, E.U.A.|
266939|Patente|MX/a/2007/003108|14/03/2007|22/05/2009|<i>A61K31/4188</i> <b>(2006-01)</b>; <i>A61P25/00</i> <b>(2006-01)</b>; <i>C07D471/04</i> <b>(2006-01)</b>|COMPUESTOS IMIDAZO-3-IL-AMINA SUSTITUIDOS Y BICÍCLICOS.|La presente invención se relaciona con compuestos imidazo-3-il.amina sustituidos y bicíclicos, método para su preparación, composiciones farmacéuticos que comprenden dichos compuestos y el uso de tales compuestos para la preparación de composiciones farmacéuticas.|Stefan OBERBÖRSCH; Sven KÜHNERT; Corinna SUNDERMANN; Michael HAURAND; Ruth JOSTOCK; Klaus SCHIENE; Thomas TZSCHENTKE; Thomas CHRISTOPH; Dagmar KAULARTZ; Saskia ZEMOLKA; Weidenweg 10, 52074, Aachen, ALEMANIA|GRÜNENTHAL GMBH.*; Zieglerstrasse 6, 52078, Aachen, ALEMANIA|
266940|Patente|PA/a/2004/005144|28/05/2004|22/05/2009|<i>A61K35/22</i> <b>(2006-01)</b>; <i>A61K38/22</i> <b>(2006-01)</b>; <i>C07J75/00</i> <b>(2006-01)</b>|PROCEDIMIENTO PARA OBTENER ESTROGENO DE ORINA DE YEGUAS|La presente invención se refiere a procedimiento para la obtención de extractos de una mezcla natural de estrógenos conjugados a partir de la orina de yeguas preñadas. Los extractos obtenidos conforme a la presente invención cumplen las especificaciones farmacéuticas en lo que respecta a estrógenos conjugados y la minimización de la concentración de estrógenos libres, incluso al utilizar orina envejecida y/o almacenada o transportada a temperaturas elevadas. La obtención de los extractos que contienen una mezcla de estrógenos conjugados a partir de la orina de yeguas preñadas se realiza por extracción en fase fija sobre resinas adsorbentes semipolares.|HEINZ-HELMER RASCHE.; OLAF RUPP; Zilleweg 54, D-31303, Burgdorf, Alemania, ALEMANIA|SOLVAY PHARMACEUTICALS GMBH; Hans-Böckler-Allee 20, D-30173, Hannover., , ALEMANIA|
