Número de concesión|Tipo de documento|Número de solicitud|Fecha de presentación|Fecha de concesión|Clasificación CIP|Título|Resumen|Inventor(es)|Titular
266781|Patente|PA/a/2002/006257|21/06/2002|15/05/2009|<i>C07C401/00</i> <b>(2006-01)</b>; <i>A61K31/59</i> <b>(2006-01)</b>|USO DE COMPUESTOS DE VITAMINA D BIOLOGICAMENTE ACTIVOS PARA LA PREVENCION Y TRATAMIENTO DE ENFERMEDAD INFLAMATORIA DEL INTESTINO.|La presente invención se refiere a métodos para tratar la enfermedad inflamatoria del intestino, y en particular la prevención y tratamiento de enfermedad inflamatoria del intestino en humanos así como en otros animales. Estos métodos incluyen la administración de compuestos de vitamina D biológicamente activos, y composiciones terapéuticas de los mismos, de manera que los síntomas de la Enfermedad inflamatoria del Intestino se reducen o alivian.|HAYES, Colleen, E.; NASHOLD, Faye, E.; 606 Eugenia Avenue, 53705., Madison, Wisconsin, E.U.A.|WISCONSIN ALUMNI RESEARCH FOUNDATION.*; 614 Walnut Street, Madison, Wisconsin, E.U.A.|
266782|Patente|PA/a/2002/009547|27/09/2002|15/05/2009|<i>A61K9/50</i> <b>(2006-01)</b>; <i>A23L1/302</i> <b>(2006-01)</b>; <i>A23L1/303</i> <b>(2006-01)</b>|COMPOSICION DE VITAMINA DE LIBERACION SOSTENIDA.|Una formulación terapéutica en la forma de un granito, adecuada para la administración oral y adaptada para proporcionar la liberación inmediata o sostenida del material terapéutico. Cada granito comprende un núcleo interno esferonizado extruido que contiene al menos un medicamento, por ejemplo, una vitamina de liberación lenta, una capa externa que contiene al menos un medicamento, por ejemplo, una vitamina de liberación rápida y un recubrimiento de liberación controlada entre el núcleo interno y la capa externa, en donde el recubrimiento controla la liberación del medicamento del núcleo interno|BLOCK, Jurgen; HEIM, Stefan; WESTERHEIDE, Ralf; c/o PT Pellet GmbH, Reichenbergerstrasse 43, 33605, Bielefeld., ALEMANIA|GLAXOSMITHKLINE CONSUMER HEALTHCARE GMBH & CO KG; ALLPHAMED PHARBIL ARZNEIMITTEL GMBH; Bussmatten 1, D-77815, Buehl (Baden)., , ALEMANIA|
266783|Patente|PA/a/2005/011243|19/10/2005|15/05/2009|<i>C07D311/00</i> <b>(2006-01)</b>; <i>C07D495/04</i> <b>(2006-01)</b>; <i>A61K31/352</i> <b>(2006-01)</b>; <i>A61P35/00</i> <b>(2006-01)</b>; <i>C07D311/94</i> <b>(2006-01)</b>; <i>C07D493/04</i> <b>(2006-01)</b>|BENZOPIRANOS SUBSTITUIDOS COMO AGONISTAS SELECTIVOS DEL RECEPTOR BETA DE ESTROGENO.|Esta invención se refiere a heterociclos novedosos que son antagonistas en el receptor de hormona de concentración de melanina 1 (MCHR1), también denominados como 11CBy, a composiciones farmacéuticas que los contienen, a procedimientos para su preparación, y a su uso en medicinas. Los compuestos de la invención tienen la fórmula (I).|Gregory Lee Durst; Bryan Hurst Norman; Lance Allen Pfeifer; Timothy Ivo Richardson; 8231 Kentallen Court, 46236, Indianapolis, Indiana, E.U.A.|ELI LILLY AND COMPANY.*; Lilly Corporate Center, 46285, Indianapolis, Indiana, E.U.A.|
266784|Patente|PA/a/2005/012460|18/11/2005|15/05/2009|<i>C07D413/10</i> <b>(2006-01)</b>; <i>A61K31/4725</i> <b>(2006-01)</b>; <i>A61K31/675</i> <b>(2006-01)</b>|COMPUESTOS Y COMPOSICIONES INMUNOSUPRESORAS.|La presente invención se refiere a inmunosupresores, procedimiento para su producción, sus usos y composiciones farmacéuticas que los contienen. La invención provee una clase novedosa de compuestos útiles en el tratamiento o prevención de enfermedades o trastornos mediados por interacciones del linfocito, particularmente enfermedades asociadas con la transducción de señal medida por el receptor EDG.|Shifeng Pan; Wengi Gao; Yi Fan; Nathanael S. Gray; 13880 Kerry Lane, 92130, San Diego, California, CHINA|IRM LLC.; YUAN MI; Hurst Holme, Col. 12 Trott Road, HM11, Hamilton, E.U.A.|
266785|Patente|PA/a/2004/000835|27/01/2004|15/05/2009|<i>A61K47/38</i> <b>(2006-01)</b>; <i>A61K35/74</i> <b>(2006-01)</b>; <i>A61K9/26</i> <b>(2006-01)</b>|COMPOSICIÓN QUE CONTIENE ESPORAS BACTERIANAS NO PATOGÉNICAS DEL GÉNERO BACILLUS|La presente invención se refiere a una composición de esporas bacterianas no patogénicas del género Bacillus subtilis o Bacillus clausii, adsorbidas en una matriz elaborada por al menos un compuesto absorbente insoluble en agua seleccionado entre arcillas, caolín, carbonato de calcio, sílice coloidal, silicato de magnesio y aluminio, derivados de celulosa y bentonita, así como un derivado de celulosa. La composición se obtiene mediante la técnica de cama de aire fluidizada y dicha composición es adecuada para uso en los campos farmacéutico, veterinario y nutricional.|TIZIANO PRATO; Via Catalani 15, I-21100, Varese, ITALIA|SANOFI-SYNTHELABO OTC S.P.A.; Galleria Passarella N. 2, I-20122, Milano, ITALIA|
266786|Patente|PA/a/2006/007191|22/06/2006|15/05/2009|<i>C07D403/12</i> <b>(2006-01)</b>; <i>A61K31/505</i> <b>(2006-01)</b>; <i>A61P35/00</i> <b>(2006-01)</b>|SALES DE MALEATO DE UN DERIVADO DE QUINAZOLINA UTIL COMO UN AGENTE ANTIANGIOGENICO.|La presente invención se refiere a la sal de maleato AZD2171, a formas cristalinas particulares de la sal de maleato AZD2171, a procedimientos para su preparación, a composiciones farmacéuticas que los contienen como ingrediente activo, a su uso en la fabricación de medicamentos para uso en la producción de efectos reductores de permeabilidad antiangiogénica y vascular en animales de sangre caliente tal como seres humanos, y a su uso en métodos para el tratamiento de estados de enfermedad asociados con angiogénesis y/o permeabilidad vascular aumentada.|James McCabe; AstraZeneca, Charter Way, SK10 2NA, Macclesfield, Cheshire, REINO UNIDO|ASTRAZENECA AB; , S-151 85, Södertälje, SUECIA|
266787|Patente|PA/a/2005/013720|15/12/2005|15/05/2009|<i>C07H21/04</i> <b>(2006-01)</b>; <i>C07K14/72</i> <b>(2006-01)</b>; <i>C12N5/06</i> <b>(2006-01)</b>; <i>C12N5/08</i> <b>(2006-01)</b>|LINEA DE CELULA Y SUS USOS.|La presente invención se refiere a una línea celular aislada referida como T4240213.4.2, y teniendo la designación de depósito PTA-5201 del A.T.C.C. y a los usos de esta línea celular. Por ejemplo, la línea celular se puede utilizar en la producción de proteína de receptor de hormona de concentración de melanita (MCH) y en la identificación de antagonistas, agonistas inversos y agonistas para el receptor.|Dennis G. Fry; Christine A. Collins; Brian D. Dayton; 4014 Grandview Avenue, 60031, Gurnee, Illinois, E.U.A.|ABBOTT LABORATORIES.*; Dept. 377 Bldg. AP6A-1, Col. 100 Abbott Park Road, 60064-6008, Abbott Park, Illinois, E.U.A.|
266788|Patente|PA/a/2006/003353|24/03/2006|15/05/2009|<i>A61K31/505</i> <b>(2006-01)</b>; <i>A61K31/4184</i> <b>(2006-01)</b>; <i>A61P9/00</i> <b>(2006-01)</b>|COMBINACIÓN DE CANDESARTAN Y ROSUVASTATINA, COMPOSICIÓN QUE COMPRENDE LA MISMA Y USO DE LA COMBINACIÓN|La presente invención se refiere a una combinación que comprende candesartan o una sal farmacéuticamente aceptable del mismo y rosuvastatina o una sal farmacéuticamente aceptable de la misma, para la prevención o tratamiento de aterosclerosis y para la prevención de eventos cardiovasculares. Un aspecto adicional de la presente invención se proporciona una composición farmacéutica la cual comprende candesartan o una sal farmacéuticamente aceptable de la misma, en asociación con un diluyente o vehículo farmacéuticamente aceptable para uso en la prevención o tratamiento de la aterosclerosis y para la prevención de eventos cardiovasculares. La presente invención también se refiere al uso de una combinación mencionada anteriormente en la prevención o tratamiento de la aterosclerosis.|Jay Lal Mehta; University of Arkansas for Medical Sciences 4301 W Markham Slot 532, 72205, Little Rock, Arkansas, E.U.A.|ASTRAZENECA UK LIMITED; 15 Stanhope Gate, W1K 1LN, London, Greater London, REINO UNIDO|
266789|Patente|PA/a/2005/004540|28/04/2005|15/05/2009|<i>H01B3/44</i> <b>(2006-01)</b>; <i>H01B13/00</i> <b>(2006-01)</b>; <i>H01B13/012</i> <b>(2006-01)</b>; <i>H01B13/06</i> <b>(2006-01)</b>; <i>H01B13/14</i> <b>(2006-01)</b>; <i>H01B13/34</i> <b>(2006-01)</b>|ALAMBRE Y RECEPCION DE PEDIDO DE ARNES DE ALAMBRE Y METODO DE PRODUCCION, RECEPCION DE PEDIDO Y SISTEMA DE PRODUCCION DEL MISMO ASI COMO DISPOSITIVO DE EMPALME DE ALAMBRE.|Se proporciona un alambre y un sistema de recepción de pedido de arnés de alambre y producción del mismo, capaz de reducir el costo del alambre y un producto que utiliza el alambre y el ahorro de recursos. El sistema de recepción de pedido y producción de arnés de alambre (1) incluye una sección (16) de control de producción, una sección (14) de producción de alambre y una sección (15) de ensamblado de arnés de alambre. La sección (16) de control de producción envía primeros datos (D1) de cantidad de pedido que satisfacen los datos (D) de recepción de pedido a una sección (44) de producción de resina, unos segundos datos (D2) de cantidad de pedido a una sección (45) de producción de núcleo y unos terceros datos (D3) de cantidad de pedido a una sección (46) de producción de agente que se va a mezclar. Las secciones (44, 45 y 46) de producción elaboran las cantidades necesarias de pellas, núcleo y del agente que se va a mezclar y la transportan a la sección (14) de producción de alambre. La sección (14) de producción de alambre mezcla las pellas y el agente que se va a mezclar de las secciones (44, 45 y 46) de producción y extruye la mezcla para recubrir el núcleo. La sección (14) de producción de alambre transporta el alambre producido a la sección (15) de ensamblado de arnés de alambre. La sección de ensamblado de arnés de alambre ensambla el arnés de alambre.|Kiyoshi YAGI; Makoto KATSUMATA; Hitoshi USHIJIMA; c/o Yazaki Corporation, 1500, Col. Mishuku, 410-1107, Susono-shi, Shizuoka, JAPON|YAZAKI CORPORATION.*; 4-28, Mita 1-chome, 108-8333, Minato-ku, Tokio, JAPON|
266790|Patente|PA/a/2004/010162|15/10/2004|15/05/2009|<i>C03C17/00</i> <b>(2006-01)</b>; <i>C03C17/25</i> <b>(2006-01)</b>; <i>C03C17/34</i> <b>(2006-01)</b>; <i>C03C25/42</i> <b>(2006-01)</b>; <i>C03C25/52</i> <b>(2006-01)</b>; <i>C04B41/50</i> <b>(2006-01)</b>; <i>C04B41/52</i> <b>(2006-01)</b>|SUSTRATO CON UN RECUBRIMIENTO DE AUTOLIMPIEZA.|La invención se refiere a un sustrato transparente a base de vidrio o uno o más polímeros, o un sustrato de cerámica o de vitro-cerámica, en un material arquitectónico tal como recubrimiento para fachadas, losas o pavimentos fabricados de concreto, concreto arquitectónico, tejas, materiales de cemento, terracota, pizarra, piedra, superficies metálicas o sustratos fibrosos a base de vidrio tales como lana mineral de aislamiento o hilos de vidrio de reforzamiento. El sustrato está caracterizado porque se proporciona sobre al menos una parte de su superficie con un recubrimiento que tiene una estructura mesoporosa con propiedades fotocataliticas  comprende óxido de titanio parcialmente cristalizado. La invención se refiere además a la producción del sustrato, su aplicación en un encristalado, un material arquitectónico o una lana mineral de aislamiento.|LETHICIA GUENEAU; MAURICETTE RONDET; SOPHIE BESSON; JEAN-PIERRE BOILOT; THIERRY GACOIN; CLARISSE DURAND; 60, Avenue de Paris, F-94300, Vincennes, FRANCIA|SAINT-GOBAIN GLASS FRANCE; 18, Avenue d`Alsace, F-92400, Courbevoie, FRANCIA|
266791|Patente|PA/a/2005/014178|21/12/2005|15/05/2009|<i>G09G3/32</i> <b>(2006-01)</b>|DISPOSITIVO DE VISUALIZACION Y CIRCUITO DE CONTROL PARA UN MODULADOR DE LUZ.|La invención se relaciona con un dispositivo de visualización de matriz activa que comprende una red de emisores de luz. Cada emisor de luz (Ein Eim) es controlado por un modulador de corriente (Mim) que tiene un voltaje de activación umbral especial (Vth). El dispositivo también comprende medios de compensación (Ain, Ajn, 11, 21) para el voltaje de activación de umbral (Vth) de los moduladores de corriente (Min) el cual está provisto con al menos un amplificador de operación (Ain, 11, 21) entre un electrodo de rejilla y el electrodo fuente del modulador. La retroalimentación negativa del amplificador de operación compensa el voltaje de operación de umbral (Vth) de al menos un modulador (Mim) independientemente del valor del mismo. También se describe un circuito de control para un modulador de luz a ser integrado en el dispositivo de visualización de la invención.|Christophe FERY; Philippe LE ROY; Christophe PRAT; 7 rue Jean Macé, F-35000, Rennes, FRANCIA|THOMSON LICENSING; 46 quai Alphonse Le Gallo, F-92100, Boulogne-Billancourt, FRANCIA|
266792|Patente|PA/a/2005/010267|26/09/2005|15/05/2009|<i>H04B7/005</i> <b>(2006-01)</b>; <i>H04L12/28</i> <b>(2006-01)</b>; <i>H04L12/56</i> <b>(2006-01)</b>|METODO DE COMUNICACION INALAMBRICA Y APARATO PARA PROVEER SERVICIOS DE ACCESO DE PAQUETE DE ENLACE DESCENDENTE DE ALTA VELOCIDAD.|Un método y sistema de comunicación inalámbrico multi-célula para proveer servicios de acceso de paquete de enlace descendente de alta velocidad (HSDPA). El sistema incluye un controlador de red de radio (RNC) (105) en comunicación con una pluralidad de estaciones (110,115 y 120). El RNC envía una señal (140A, 140B y 140C) de control en al menos una estación base que tiene una pluralidad de ranuras de tiempo, por ejemplo, en un sistema de dúplex por división de tiempo (TDD) y/o tramas que incluyen intervalos de tiempo de transmisión (TTIs), por ejemplo, en un sistema dúplex por división de frecuencia (FDD) asignado al mismo para el establecimiento de canales HSDPA. La señal de control indica una potencia de transmisión HSDPA máxima permitida para cada una de las ranuras de tiempo y/o TTIs. La estación (110, 115 y 120) base envía una señal (145A, 145B 145C) de realimentación al RNC que indica los resultados de mediciones de la potencia de las ranuras de tiempo HSPA transmitidas y/o TTIs durante un periodo de tiempo predeterminado.|Marian RUDOLF; James M. MILLER; 2046 Rue de la Visitation, H2L 3C7, Montreal, Québec, ALEMANIA|INTERDIGITAL TECHNOLOGY CORPORATION.*; 300 Delaware Avenue, Suite 527, 19801, Wilmington, Delaware, E.U.A.|
266793|Patente|PA/a/2003/011834|18/12/2003|18/05/2009|<i>C08K13/02</i> <b>(2006-01)</b>; <i>C08K3/00</i> <b>(2006-01)</b>; <i>C08K5/00</i> <b>(2006-01)</b>|RELLENOS A NANO-ESCALA ORGANOFILICOS FUNCIONALIZADOS CON ADITIVO.|La presente invención describe un producto que se obtiene al reaccionar un relleno o carga a nano-escala con un compuesto de la fórmula I, AD-L-RG (I), en donde AD es un aditivo seleccionado del grupo de depuradores de radicales, descomponedores o agentes de descomposición de hidroperóxido, absorbentes de UV, estabilizantes de luz, piro retardantes o fotoiniciadores, L es un espaciador, RG es un grupo reactivo y el relleno o carga a nano-escala puede ser de carácter no modificado u organofílicamente modificado. Estos productos por ejemplo son útiles como estabilizantes y/o compatibilizantes en materiales orgánicos, o como fotoiniciadores en formulaciones pre-poliméricas o de pre-entrelazamiento.|HUGO CAMENZIND; HEINZ HERST; WIEBKE WUNDERLICH; Alamendstrasse 15, CH-3014, Bern, SUIZA|CIBA SPECIALITY CHEMICALS HOLDING INC.*; Klybeckstrasse 141, 4057, Postfach, Basilea, SUIZA|
266794|Patente|PA/a/2006/005852|24/05/2006|18/05/2009|<i>B21C19/00</i> <b>(2006-01)</b>; <i>B21C47/26</i> <b>(2006-01)</b>; <i>B65H75/00</i> <b>(2006-01)</b>; <i>B21F1/04</i> <b>(2006-01)</b>; <i>B23K101/32</i> (2006-01); <i>B23K35/02</i> (2006-01); <i>B23K35/40</i> (2006-01); <i>B23K9/133</i> (2006-01)|METODO Y APARATO PARA EMPAQUETAR ALAMBRE EN UN CONTINENTE DE ALAMBRE.|Se proporcionan alambre de soldadura de diámetro grande y métodos para formar un alambre de soldadura de diámetro grande, en los cuales se forma el alambre de soldadura y se imparte una memoria de forma sinusoidal en el alambre para realzar la capacidad de alimentación y la facilidad del retiro de un carrete o continente de almacenaje.|Teresa A. Melfi; Matthew J. James; Eric Simon; Michel Jany; 9445 Amberwood Drive, 44094, Kirtland, Ohio, E.U.A.|LINCOLN GLOBAL, INC.*; 14824 Marquardt Avenue, 90670, Santa Fe Springs, California, E.U.A.|
266795|Patente|PA/a/2003/011599|15/12/2003|13/05/2009|<i>A61K39/00</i> <b>(2006-01)</b>; <i>A61K39/02</i> <b>(2006-01)</b>; <i>A61K39/02</i> <b>(2006-01)</b>; <i>A61K39/116</i> <b>(2006-01)</b>; <i>A61K39/12</i> <b>(2006-01)</b>; <i>A61K39/145</i> <b>(2006-01)</b>; <i>A61K39/295</i> <b>(2006-01)</b>; <i>A61K39/395</i> <b>(2006-01)</b>; <i>A61K48/00</i> <b>(2006-01)</b>; <i>A61K49/00</i> <b>(2006-01)</b>; <i>A61P31/00</i> <b>(2006-01)</b>; <i>A61P31/04</i> <b>(2006-01)</b>; <i>A61P43/00</i> <b>(2006-01)</b>; <i>C12N1/00</i> <b>(2006-01)</b>; <i>C12N1/20</i> <b>(2006-01)</b>|VACUNACION EN DOSIS UNICA CON MYCOPLASMA HYOPNEUMONIAE|La presente invención se refiere a uso de la bacteria micoplasma hyopneumoniae para la manufactura de una vacuna para tratar o prevenir una enfermedad o desorden causada por una infección de Micoplasma hyopneumoniae en un animal, dicha vacuna comprende además un adyuvante.|ROBIN LEE KEICH; LISA GRACE SABBADINI; Eastern Point Road, 06340, Groton, Connecticut, E.U.A.|PFIZER PRODUCTS INC.; Eastern Point Road, 06340, Groton, Connecticut, E.U.A.|
266796|Patente|PA/a/2005/009587|08/09/2005|14/05/2009|<i>B62J17/04</i> <b>(2006-01)</b>|ESTRUCTURA DE CUBIERTA DE CARROCERIA DELANTERA.|Una parte inferior de un parabrisas se traslapa con una brida provista en el lado superior de la cubierta protectora delantera. Una porción cóncava que sustituye a un orificio de ventilación se provee hacia el centro de la parte inferior del parabrisas y una porción cóncava de recepción para recibir la porción cóncava también se provee a la brida. Un trinquete se provee hacia el centro de la brida y se ajusta al extremo inferior del parabrisas. Una placa se integra con una parte sobre una abertura interior y recibe el lado superior del fanal.|IIDA, Oumi; SEKSITH, Uchchin; PORNCHAI, Joongratok; SURAKL Suwanna; C/O Kabushiki Kaisha Honda Gijutsu Kenkyusho 4-1, Chuo 1-Chome, 351-0113, Wako-shi, Saitama, JAPON|HONDA MOTOR CO., LTD.; 1-1, Minamiaoyama 2-Chome, 107-0062, Minato-Ku, Tokio, JAPON|
266797|Patente|PA/a/2004/012537|13/12/2004|14/05/2009|<i>B62K11/14</i> <b>(2006-01)</b>|VEHÍCULO.|La presente invención se refiere a un vehículo conducido por manubrio, que comprende: una palanca de operación provista en un manubrio de dirección; un interruptor de detección de operación para detectar una operación de la palanca de operación; un circuito de arranque que incluye un interruptor de arranque para conectar una batería con un motor de arranque, el interruptor de detección de la operación y el interruptor de arranque están conectados en serie con la batería, de tal manera que la batería y el motor de arranque están conectados entre sí cuando el interruptor de detección de operación y el interruptor de arranque están activados; una unidad de control para impulsar un relevador para conectar la batería a una carga de vehículo cuando una velocidad del motor alcance o exceda un valor predeterminado, una carcasa de estrangulación montada en el manubrio; una protuberancia extendida desde dicha carcasa de estrangulación; y una caja de interruptores, que soporta dicho interruptor de arranque, dicha caja de interruptores tiene dos lengüetas que forman un rebajo entre sí, y en donde dicha caja de interruptores está montada en el manubrio de tal forma que dicha protuberancia se ajusta dentro de dicho rebajo, en donde dicha palanca de operación está dispuesta en un lado del manubrio de conducción opuesto al lado en el que está provisto dicho interruptor de arranque.|TATSUYA SHIOKAWA; YOJI NAKAOKA; SHINICHI MAEDA; c/o Kabushiki Kaisha Honda Gijutsu Kenkyusho. 4-1, Chuo 1-Chome, Wako-Shi, Saitama, JAPON|HONDA MOTOR CO., LTD.; 1-1, Minamiaoyama 2-Chome, Minato-Ku, Tokio, JAPON|
266798|Patente|PA/a/2004/012538|13/12/2004|14/05/2009|<i>B60K28/14</i> <b>(2006-01)</b>|VEHÍCULO TODO TERRENO DE TIPO CARRO SOPORTE.|La presente invención se refiere a un vehículo de todo terreno de tipo silla de montar que tiene un motor y un asiento de usuarios de tipo silla de montar, dicho vehículo todo terreno de tipo silla de montar comprendiendo: un eje de dirección para soportar un manubrio de dirección del vehículo; un tanque de combustible situado en el lado trasero del eje de dirección, un primer sensor para detectar una inclinación en la dirección izquierda-derecha del vehículo; un segundo sensor para detectar una inclinación en la dirección delantera-trasera del vehículo; en donde dicho primer y el segundo sensores están dispuestos entre dicho eje de dirección y dicho tanque de combustible; un controlador que recibe las salidas desde dichos primer y segundo sensores; para determinar una condición de vuelco con base a dichas salidas, y entonces arrojar una señal de la condición de vuelco; y un elemento de interrupción de combustible para detener el suministro de combustible al motor cuando dicha señal de la condición de vuelco se recibe desde dicho controlador, y además en donde dicho tanque de combustible tiene una forma exterior provista con una ranura en una parte delantera del mismo, y en donde dichos primer y segundo sensores están dispuestos en la ranura.|YUICHIRO TSURUTA; c/o Kabushiki Kaisha Honda Gijutsu Kenkyusho. 4-1, Chuo 1-Chome, Wako-Shi, Saitama, JAPON|HONDA MOTOR CO., LTD.; 1-1, Minamiaoyama 2-Chome, Minato-Ku, Tokio, JAPON|
266799|Patente|PA/a/2006/009274|14/08/2006|18/05/2009|<i>A61K31/085</i> <b>(2006-01)</b>; <i>A61K31/045</i> <b>(2006-01)</b>; <i>A61K31/075</i> <b>(2006-01)</b>|METODO PARA MEJORAR LA BIODISPONIBILIDAD DEL OSPEMIFENO.|La presente invención se refiere a un método para mejorar la biodisponibilidad de ospemifeno o un isómero geométrico, un estereoisómero, una sal farmacéuticamente activa, un éster del mismo, un metabolito del mismo, en donde dicho compuesto se administra oralmente al individuo en conexión con la ingestión de alimentos; la invención también se refiere al tratamiento o la prevención de la osteoporosis, la atrofia de la piel, la atrofia epitelial y mucosa, así como para el tratamiento o la prevención de síntomas urinarios o vaginales.|ANTTILA, Markku; Pajulantie 2, FI-20320, Turku, FINLANDIA|HORMOS MEDICAL LTD.*; Itäinen Pitkäkatu 4 B, FI-20520, Turku, FINLANDIA|
266800|Patente|PA/a/2006/010336|11/09/2006|18/05/2009|<i>A61K47/18</i> <b>(2006-01)</b>; <i>A61K47/20</i> <b>(2006-01)</b>; <i>A61K47/40</i> <b>(2006-01)</b>; <i>A61P29/00</i> <b>(2006-01)</b>|COMPOSICIONES DE DICLOFENACO INYECTABLES ESTABLES.|Esta invención se refiere a soluciones acuosas parenterales estables que comprende (a) diclofenaco o una sal de diclofenaco farmacéuticamente aceptable y una ciclodextrina, o (b) un complejo de inclusión de diclofenaco o una sal de diclofenaco farmacéuticamente aceptable y una ciclodextrina, o una mezcla de (a) y (b), que son adecuadas para administración intramuscular e intravenosa; las soluciones contienen diclofenaco o sal de diclofenaco, ciclodextrina y un antioxidante seleccionado de monotioglicerol, o una combinación de ácido etilendiaminotetraacético y N-acetil-cisteína.|PENKLER, Lawrence John (FINADO); , , SIN PAIS|SHIMODA BIOTECH (PTY) LTD.; 152 Cape Road, 6001, Mill Park, Port Elizabeth, SUDAFRICA|
266801|Patente|PA/a/2001/010035|04/10/2001|18/05/2009|<i>B01D21/01</i> <b>(2006-01)</b>; <i>C02F1/56</i> <b>(2006-01)</b>; <i>C02F11/14</i> <b>(2006-01)</b>; <i>C08F2/44</i> <b>(2006-01)</b>; <i>C08F20/34</i> <b>(2006-01)</b>; <i>C08F20/60</i> <b>(2006-01)</b>|POLIMERO EN DISPERSION CON UNA CONCENTRACION DE ACTIVOS MAS ALTA PARA AUXILIAR EN LA CLARIFICACION, DESHIDRATACION, Y RETENCION Y DRENAJE.|La invención es un método para  clarificar, deshidratar o mejorar la retención y drenaje de aguas  residuales industriales o pastas de papel con una cantidad efectiva de por lo menos una  dispersión de un floculante de polímero catiónico soluble en agua en el que la mejora comprende  la adición del polímero que tiene  una concentración de al menos veinticinco por ciento a las  aguas  residuales o pastas de papel.  El desecho industrial es preferiblemente aguas residuales  de procesamiento  de alimentos, aguas residuales oleosas, aguas residuales fábricas de papel y  aguas residuales  contaminadas materiales inorgánicos.  La pasta de papel puede ser   suspensión celulósica acuosa.|MAURY, Elise, E.; BUELTE, Rudolf; CATHY C. JOHNSON; Nieuwstraat 12, 2312, KB Leiden, , PAISES BAJOS|NALCO COMPANY; 1601 West Diehl Road, 60563-1198, Naperville, Illinois, E.U.A.|
266802|Patente|PA/a/2005/009238|30/08/2005|18/05/2009|<i>A61F13/15</i> <b>(2006-01)</b>|COMPOSICION DE POLIMERO SUPERABSORBENTE DE COLOR ESTABLE.|Se describe un polímero superabsorbente de color estable que tiene una estabilidad de color a largo plazo, y métodos de fabricación del polímero. El polímero superabsorbente se prepara utilizando un derivado del ácido sulfínico, similar al ácido 2-hidroxi-2-sulfinatoacético, una sal de este, o una mezcla de ellos, como el agente reductor en un sistema iniciador de polimerización para la preparación de un polímero superabsorbente de monómeros. El polímero superabsorbente resultante resiste la degradación de color durante los períodos extendidos de almacenamiento, incluso a una elevada temperatura y humedad.|NORBERT HERFERT; MICHAEL M. AZAD; PETER W. CARRICO; GUY T. WOODRUM; MICHAEL A. MITCHELL; MA - IKAY KIKAMA; 3204 Trefoil Drive, 28226-7200, Charlotte, NC, ALEMANIA|BASF AKTIENGESELLSCHAFT.*; Carl-Bosch-Strasse 38, 67056, Ludwigshafen, ALEMANIA|
